,youtube_id,comment,like_num,comment_date
0,chaeny1121,"인스타그램 : www.instagram.com/chaeny_1121

제품정보 :

렌즈-오렌즈 미스티 로맨틱 초코

00:24 바닐라코 커버리셔스 얼티밋 화이트 쿠션 21 로제

01:48 봄웜픽 섀도우 팔레트 추천

데이지크 섀도우 팔레트 23 썸머코랄

페리페라 올테이크 무드 라이크 팔레트 01 프레스티지 핑크

홀리카홀리카 마이 페이브 무드 아이 팔레트 # 핑크올로지

어뮤즈 아이 컬러 팔레트 01 웜 복숭아

03:23 퍼스널 컬러별 촉촉탱글립 추천

페리페라 잉크 무드 글로이 틴트 03 맘찍로즈

페리페라 잉크 무드 글로이 틴트 04 갓기천사

페리페라 잉크 무드 글로이 틴트 05 어쩔체리

페리페라 잉크 무드 글로이 틴트 17 댕청망청

06:10 웜톤~쿨톤 블러셔 추천

클리오 에어 블러 휩 블러쉬 01 베이비 아몬드

클리오 에어 블러 휩 블러쉬 02 아임 파인트

클리오 에어 블러 휩 블러쉬 03 애프리콧 휩

클리오 에어 블러 휩 블러쉬 04 피치 크런치

클리오 에어 블러 휩 블러쉬 05 베리 스쿱

클리오 에어 블러 휩 블러쉬 06 프레쉬 베리

클리오 에어 블러 휩 블러쉬 07 체리 피스

08:16 아이소이 아크니 닥터 퍼스트 컨트롤 토닉

09:03 웰라쥬 리얼 히알루로닉 블루 앰플

09:53 폴라초이스 스킨 퍼펙팅 바하 아하 파하 엑스폴리에이팅 트리트먼트

10:32 아리얼 더 퍼펙트 클렌징 오일 패드 EX

11:18 투쿨포스쿨 아트 클래스 바이 로댕 헤어 쉐이딩 01 다크 애쉬",0.0,1개월 전
1,usereg5tt7jd2b,채니님 추천하시는 것들은 대부분 영상에서 자주자주 사용하시는 제품들이 많아서 굉장히 신뢰가 가요ㅎㅎ 저 바닐라코 쿠션도 그렇고 블러셔도 그렇고 예전 vdl 파데도 그렇구요:) 퍼스널 컬러랑 취향이 같아서 영상 매번 잘 챙겨보고 있습니다♡ 감사하구 오래오래 채니채널 해주세요♡♡,3.0,1개월 전
2,userlw2hs4tm6t,"꿀템 추천 영상 넘 도움돼요
언니가 추천해준 클리오 파레트로 쭉 메컵하고 다녔는데 어뮤즈 가을 메이크업 기대할게요🫶 데이지크 파레트도 언니 영상보고 사려고 장바구니 담아놨어요~ 영상보고 연습해야겠어요ㅎㅎㅎ 오늘도 알찬 영상 최고에요",1.0,1개월 전
3,userdb5mx6et1w,"이번 영상도 뽐뿌템들 엄청 많네요! 채니님은 역시나 넘예...
저 진짜 채니님이 추천하시는 제품 다 따라 샀는데, 전부 인생템 됐어요🫶
데이지크 피치듀+ 토니모리 핫테이스트, 페리페라 형님(?) 팔레트, 세리즈, 웨메 틴트 꿀조합, 삐아 로즈번, 토니모리 핑크빔 등등 다 너무 예뻐요 진짜.... 
어떻게 이렇게 이쁜것만 다 찾으시는거죠...
이제 채니님 없으면 메이크업 못하는 몸이 돼버렸어요ㅋㅋㅋㅋ큐ㅠ
그런 의미에서 가을맞이 메이크업도 부탁드려도 될까요?
항상 넘 잘 보고 있어요오 오래오래 함께 해주세요",0.0,3주 전(수정됨)
4,Jihyeee1026,채니님 항상 잘보고있습니다!️봄브라서 채니님 영상으로 화장품 안 날리고 항상 성공하고 있어요🥹🥹🥹앞으로도 잘 부탁드려요,0.0,3주 전
5,userqj7tq7cb6h,웰라쥬 앰플 진짜 좋더라구요 ㅎㅎ 저도 수부지인데 이번 여름에 콧물제형토너 하나만 바르고 웰라쥬 앰플만 두어번 레이어링 해주는 식으로 스킨케어 했어요 강추강추,0.0,1개월 전
6,uservh6dz9np5g,"꺄 저번에 어뮤즈 팔레트 여쭤봤는데 더 좋은템이라니.. 안사고 기다리길 잘했어요!!!! 바로 데이지크 팔레트랑 페리페라 립,웰라쥬까지 사러갑니당️ 항상 영상 잘보고있습니댜",0.0,4주 전
7,usersl2jp2xn1c,벌써 세일이라니 시간 참잘가네요  이번엔 알뜰쇼핑할수있기를  영상 감사합니당️,0.0,1개월 전
8,usertm1wc7ju8b,페리페라 댕청망청 이랑 어쩔 체리 대박 잘 어울려요 ㅠㅠ 이거 이용한  메이크업도 한번 봤으면 ㅠ,0.0,3주 전
9,isjeong,영업왕 채니 님… 클리오 블러셔 살말 고민하고 있었는데 영상 보고 지르러 갑니닷 그리고 오늘 메이크업 채니 님한테 넘 찰떡이에요 넘 예뻐,0.0,4주 전
10,my188cm,"폴라초이스 무조건 사야겠다 진쯔
오늘 헤메코 넘 예뻐요 진짜,,,항상 영상 잘 보고있어요🫶",0.0,1개월 전
11,userdm2qu8gz3t,"언니 너무 예뻐용
이 날 메콥 정보도 알고싶어용!!",0.0,1개월 전
12,userhl7iz2gs1q,채니님 혹시 웰라쥬앰플 1통은 보통 몇갤정도쓰시나요? 영상보고 구매하려는데 해외에 6갤동안 나가게되서 스킨겸해서 쓰려는데 2통을 사야할지 고민이네요 이번영상으로 알게됏는데 구독하고갑니다!!,0.0,1개월 전(수정됨)
13,userel4sy5ud1k,"언니 너무 귀여워요  
아니 어떻게  이렇게 하 귀여울 수 있지?
까악 저는 언니 한테 완전히 빠져서요 
불러서 색깔이 너무 예뻐요",0.0,1개월 전
14,userdp3dp3nr8q,오늘도 넘 이쁘세여 ㅎㅎㅎ,0.0,1개월 전
15,userei4kv3xg3s,혹시 오늘 아이메이크업은 무슨 팔레트 사용하신던지 알 수 있을까용?,0.0,1개월 전
16,nighths,"데이지크 썸머코랄이랑 에스쁘아 로지비비 영상 둘다 보고 두 팔레트 다 넘 예뽀서 둘 중 뭐 사야 할 지 고민중인데 못고르겠서요ㅠㅠㅠㅠ엉엉.. 요 영상에선 썸머코랄이 1등이라 하셨는데 혹시 로지비비 포함하면 어떤걸 더 추천하실까요,,,?",0.0,1개월 전
17,Jinny104,상의가 너무 예쁘네욥 히히 혹시 제품명 알 수 있을까요!! 봄브 생기템의 정석..️,0.0,3주 전
18,userms3es3qu6j,채니님 혹시 겨울에도 바닐라코 쿠션이 쓸수있는 정도인가요?,0.0,1개월 전
19,userky8oc1ir7x,"채니님! 바닐라코 쿠션 저한테는 코 밑 인중부분은 항상 무너지는데 기초,선크림 뭐 바르고 쿠션 바르세요? 파우더까지쓰는데 무너져서 속상해요 색깔은 엄청 화사해서 좋아요",0.0,1개월 전
20,usergy3gy9vc7j,와 이리 이쁜겨…,0.0,1개월 전
21,userme7cm1to4s,올리브영 세일 추천템이요 영상 제목이네요 ,0.0,1개월 전
22,userro1ub4oj5j,렌즈 뭐끼셨나요 너무이뻐요!!,0.0,1개월 전
23,usernm6vx8kg2f,"폴라초이스 같은 이름 제품이 없던데, 바하 리퀴드 각질제거제랑 같은건가요?",0.0,1개월 전
24,usereg5tt7jd2b,페리페라 잉크 무드 글로이 틴트 17호는 미출시 제품인가요? 찾아봐도 없어서요ㅠㅠ,0.0,3주 전
25,userkd1li7kr9s,갓 채니님만 기다렸소요..,0.0,1개월 전
26,usergw4sx4vg3j,올영 마스터 채니 🫡🫡,0.0,4주 전
27,akinuakinu2087,,0.0,1개월 전
28,userzy6kd2hj9q,채니님 영상을 잘 볼게요,0.0,1개월 전
29,SONto4ip,채니 CHAENY님 아주예쁘군요.,1.0,1개월 전
30,userme7cm1to4s,네,0.0,1개월 전
