,youtube_id,comment,like_num,comment_date
0,chaeny1121,"봄웜 보송립 추천영상은 또 따로 찍어볼게용!!

인스타그램 : www.instagram.com/chaeny_1121

제품 정보 :

00:21 LIP1 봄브라이트 형광등 백개 터지는 자몽레드빛 탱글탱글 탕후루립

바닐라코 비바이바닐라 워터리 베일 틴트 CR01 캔디코랄 (봄라이트 추천&봄브 베이스립 추천)
바닐라코 비바이바닐라 워터리 베일 틴트 RD01 포피레드 (봄브라이트 추천)
바닐라코 비바이바닐라 워터리 베일 립 플럼퍼 

01:47 LIP2 탱글탱글 탕후루광택 피치 코랄 레드립

하트퍼센트 도트 온 무드 퓨어 글로우 틴트 11 저스트 코랄 (봄라이트 추천&봄브 베이스립 추천)
릴리바이레드 앙큼 라이어 코팅 틴트 08 당당한 방토인 척 (봄브라이트 추천)

02:49 LIP3 형광등 백개 봄브라이트를 위한 오렌지레드 립

하트퍼센트 도트 온 무드 퓨어 글로우 틴트 01 피치코랄 (봄라이트 추천&봄브라이트 베이스립 추천)
홀리카홀리카 하트크러쉬 글로우 틴트 에어 05 오! (봄브라이트 추천)

03:35 LIP4 봄웜 청순 청초 물빛광택 피치 코랄 레드 립

롬앤 듀이풀 워터 틴트 09 코튼 멜바 (봄라이트 추천&봄브라이트 베이스립추천)
웨이크메이크 워터 컬러링 퓨어 틴트 01 퓨어 레드 (봄라이트&봄브라이트 추천)

04:34 LIP5 웜쿨 모두에게 추천하는 시럽광택 존예립

얼터너티브스테레오 립 포션 아쿠아 글로우 03 슈가 로즈 (웜쿨 추천)
얼터너티브스테레오 립 포션 아쿠아 글로우 04 애플 드롭 (웜쿨 추천)

05:23 LIP6 사알짝 톤다운된 칠리~코랄~레드립

웨이크메이크 듀이 젤 글로우 틴트 03 칠 업 코랄 (봄라이트 추천&봄브라이트 베이스립 추천)
웨이크메이크 듀이 젤 글로우 틴트 05 센슈얼 레드 (봄브라이트 추천)

06:15 전색상 손목발색

06:25 전색상 손목착색",13.0,3개월 전
1,creaker3,와진짜 봄웜 찐 립리뷰는 여기가 1등 이에요........ 제가 딱원하던 그런 리뷰...대박이에요진짜 ㅠㅠ 실제로 쓰고있는 제품 색상 보정없이 최대한 그대로 표현해주셔서 감사해요,10.0,3개월 전(수정됨)
2,userbz3xg4bc2t,"예상치 못한 봄브진단을 받고 유튭찾아보는데 이 분 정말... 한 줄기의 빛입니다..ㅠㅠㅠ 유튭 찾아보면 봄브라고 쓰고 봄브인 화장품이 없어요 진짜ㅠㅠ 대부분 봄라, 봄라인데 봄브도 사용 가능할 거 같다 이러는데 제가 보기엔 그냥 봄라용..ㅠㅠㅠ 봄브 화장품이랑 친해지는 중인데 참고 진짜 많이해요-! 항상 감사합니당",20.0,3개월 전
3,userdx5cc8lm7t,"색조제품사면 다 비슷한 색깔인거 왤케 공감되죠?ㅎㅎ
저도 주로 연한 코랄에 레드로 안쪽 바르는데 얼굴이 환해져서 너무 예쁘더라구요 완전 봄웜 필승조합
오늘 메이크업도 너무 잘어울려요 ㅎㅎ",4.0,3개월 전
4,userzo7hd7hd2d,언니 너무 귀여우세요 틴트 언니랑 너무 잘어울려요 진짜 하나도 안 어울리는 게 없어요  ㅎㅎ 그리고 메이크업 너무 예뻐요 ,0.0,3개월 전
5,userne7eq6zo8r,봄브에겐 그저 편안한 영상..,62.0,3개월 전
6,isjeong,채니 님 저번 영상 보고 고민하다가 결국 바닐라코 워터리 베일 틴트 조합 샀어요!! ㅎㅎ 웨이크메이크 틴트들은 말씀하신 것처럼 살짝 어두운 느낌이 있기 때문에 여름보다는 가을겨울에 손이 더 잘 갈 것 같아서 일단 킵해 두고 여름에 맞는 맑은 색상을 발라 보려고 합니닷,0.0,3개월 전
7,bababaettyaa,와 이런 걸 원해써요.. 저도 봄브인데 봄웜립 하면 죄다 코랄핑크에 연하디 연한 립 추천해서 내 입술엔 티도 안나는 것들 뿐이라 한숨만 쉬었는데 얘네는 다 내 취향이면서 나한테 어울리는 색들이라 너무 너무 조아요ㅜㅜㅜㅜ 근데 전 지속력도 중요시하는 편이라 영상 마무리에 지속력이랑 광택감을 별 같은 걸로 비교해서 표시해주면 더 도움이 될 것 같아요! 우선 얘네들로 손품 팔아서 구매해야게써요 저 진짜 기뻐효 .. ,3.0,2개월 전(수정됨)
8,wamh4004,"목소리가 넘 듣기 편해요 !!
색감도 보정 많이 안하시는 건지 진짜 선명하네용...
립들도 다 넘 예뻐서 봄브 아닌데도 사고싶어요..진짜 인간 봄브셔요",0.0,2일 전(수정됨)
9,MINGSU,채니님! 봄브 보송립(매트립) 추천 영상도 올려주세요,1.0,1개월 전
10,userqj9bl4em5x,"저도 봄브인데 채니님 따라 다샀는데 다성공했어요오 진짜 감사합니당️️ 오늘 영상도 잘봤어욤 올리브영 테스트 하러 ㄱㄱ 해야겠어요
뽀송립도 기대할게용 전 삐아 생기갑이후로 못찾고 있어유",1.0,2개월 전(수정됨)
11,userfw2pz6cu6l,"제가 좋아하는 립들이 있어서 나머지도 믿고 질러봅니다.
봄브 치크도 올려주시고 영상도 자주 올려주세요^^",0.0,3개월 전
12,userzp1bq4od1d,진짜 자몽컬러 아니면 다 홍두깨립되는 사람인데 영상 최고예용!!! 봄브 컨텐츠 자주 올려주세룜 구독하고 가용🫶,0.0,2주 전
13,uservc7pn3sp9d,"진짜 봄브에게 한줄기 빛,,𖤐 보송립 존버 중입니다ㅠㅠ 좋은 영상 감사해요🫶",0.0,1개월 전
14,usertm1wc7ju8b,1번 4번 5번이 너무 예쁜 거 같아요 특히 1번은 형광등 100만 개 ㅋㅋ 4번 5번은 청순 립으로 너무 잘 어울려요바닐라코 투명 글로스가 아프다고 들어서 살짝 걱정 중,0.0,3개월 전
15,userme7cm1to4s,색깔이요 잘 어울려요 ,0.0,3개월 전
16,uuhimyo,이번에 퍼컬 봄브 진단 받고 충격에 빠져서 유튭 뒤지다가 발견했는데 진짜 짱이에요.. 봄브 유튜버는 이 분이 체고신듯 ㅠㅠ  혹시 탁기 절대 안 받고 고채도가 잘 어울리는 봄브 타입에 하트퍼센트 저스트코랄 + 릴바 토마토 조합 잘 어울릴까요!!?,1.0,2개월 전
17,userdp3dp3nr8q,너무 이뻐요 ㅎㅎ너무 꿀템들이예요 ㅎㅎ마음의 안정이 찾아오는 ㅎㅎ,1.0,3개월 전
18,userxd2rp7wk3z,빼박 봄브인 저는 1/2 이 있는 컬러! 그만큼 진짜 찐 추천 드려용 ,1.0,3개월 전
19,ejsisnwdkd2370,요즘 오렌지레드립 찾기 너무 어려운데 채니님 영상 보면서 도움 많이 받아요. 쨍한 오렌지립 왤케 귀해졌나요. 한국에서 저만 봄브인가,0.0,3개월 전
20,userth1ql4pm8u,헐 저 이 영상 보고 바닐라코 질러버렷습니다ㅋㅋㅋㅋㅋ 봄웜 매트립도 올려주세요,0.0,1개월 전
21,bbang5407,봄브의 빛 채니님 영상 올려주셔서 너무 감사해요! 오늘두 영상 잘 참고해서 립 살게요 ㅎㅎㅎ(시작부터 바닐라코 영업 당했어용...바로 장바구니..),1.0,3개월 전
22,03chacha16,캬… 넘 예뻐요 저는 오렌지파라서 홀리카홀리카 오 너무 예쁘네요,0.0,3개월 전(수정됨)
23,usergw4sx4vg3j,와 겁나 촉촉해보이네요,0.0,3개월 전
24,userzh4sg7sm5q,웅니 색 표현도 너무 좋지만 다음 번엔 지속력도 어떤지 같이 말해주면 좋을 거 같아요 ,0.0,3개월 전
25,userzj4qh4vs4k,혹시 아이메이크업응 기존영상에 없을까요? 너무 이뻐요!! 특히 애교살 전체적으로 바른 섀도우랑 글리터요! 제품 알려주실수있나요?,0.0,3개월 전
26,oana369,봄웜 보송립.. 존버합니다....,0.0,2개월 전
27,usermi6wh3ug6n,웨메 틴트 3호 5호 진짜.. 농협은행.. 이렇게 바르다가 릴바레 요새 많이 바르는데 5호도 진짜 ㄹㅈㄷ 이뿜.. 방토인척도 이쁜데 암튼 이뻐요.,1.0,3개월 전(수정됨)
28,userhr8du7bu8j,기다려써요 웅니 ,0.0,3개월 전
29,HALIN283,"남들은 그라데이션립 할 때 안쪽에 쓰는 립을 봄웜브는 통으로 전체에 바릅니다🫶🫶🫶
인주다홍자몽",0.0,3개월 전
30,HDvt5vc,이날 눈화장 정보 궁금해요!!!,0.0,2개월 전
31,userzc2vb5qf6u,"같은 봄브지만 제 입술색은 점 탁한 붉은기 있어서 맑고 쨍한거 아니면 탁기가 조금이라두 있으면 안어울리더라구요 ㅠㅠ 심지어...핑크착색이 잘 올라오는 입술이랍니다...☆☆☆ 그래서 뮤트 쿨톤 유행인 요즘 저는 좋았던 립들만 재구매 하고있었는데 채니님 영상보면서 새로 발굴하고 있어요 ㅠㅠ 
맞다!!! 최애쁨템 다시 핑크색으로 바뀐거 아시나요...? 채니님이 백점천점보다 주황끼돈다구 하셔서 그때 바로 샀는데 쓰다가 다써서 사보니...다시 핑크끼가 강해졌더욤...☆",0.0,3개월 전
32,Shrimpcrackersgood,봄웜 ㅠㅠㅠㅠㅠㅠㅠㅠㅠㅠㅠㅠㅠㅠㅜ아 제가이걸. 왜늦게봤을까요ㅜㅜㅜㅜㅜㅜㅜ요즘 립들보면 핑쿠핑쿠해서ㅠㅠㅠㅠ속상햇는데 감사합니당,0.0,2개월 전(수정됨)
33,userzy6kd2hj9q,채니님 너무 예쁘십니다,0.0,3개월 전
34,usersl2jp2xn1c,봄브는 행복함니다,0.0,3개월 전
35,SONto4ip,채니 CHAENY님 틴트 잘 바르시네요.,1.0,3개월 전
36,annau1023,봄브만세,0.0,3개월 전
37,useryl8ie4bj8d,마자 요즘 쿨톤립 너무 마나요ㅠㅠㅠㅠㅠ헝,0.0,1일 전
38,userlw6di2mu1o,너무 예뻐요ㅠㅠㅠㅠ애교살에 뭐바르셨는지도 알려주세요 ㅎ.ㅎ,0.0,2개월 전
39,userme7cm1to4s,오늘새로운영상이요재미있어요,0.0,3개월 전
40,userme7cm1to4s,립스틱이요 있네요 ,0.0,3개월 전
41,usercd9vx3vj5c,보송립 영상 기다릴게용,0.0,3개월 전
42,userlw2hs4tm6t,최고의 영상입니다🫶🩷🫶🩷,0.0,3개월 전
43,usermumu11,애굣살제품더 궁금해욘,0.0,3주 전
44,uservd3gi6ld4n,포피레드 단독 발샛샷은 없을까요?,0.0,2개월 전
45,userme7cm1to4s,네 ,0.0,3개월 전
46,userqx4eo7gs1j,하나만 뽑자면 어떤 걸 추천하세요?!,0.0,3개월 전
47,akinuakinu2087,🩶🩶,0.0,3개월 전
48,useryt5wo3ql8m,립색 예쁘다고 칭찬하시는데 얼굴이 더 예뻐서 와닿질않아요ㅋㅋㅋ,0.0,1개월 전
49,yeon,봄웜 트루는 머 사야하지.. 그냥 레드립 암거나 사야하나,0.0,14시간 전
50,suhabbi,썸네일보구 안들어오눈사람 나와보라구래!!,3.0,3개월 전
51,usergj3tg3ft2w,봄브는 여기 눕습니다,1.0,3개월 전
