,youtube_id,comment,like_num,comment_date
0,youzln,오늘진짜 모든 착장 다 레전드... 너무 이뿨요️ 어떻게 자신한테 어울리는 옷들을 찰떡으러 구매하시는지... 어울리는건 언니인데 왜 내가 대리만족 되는거지? ㅋㅋㅋㅋㅋ 오늘 영상 잘 보구갑니당,11.0,1개월 전
1,userlf9er5rl6b,모든 코디가 다 너무 예뻐요!!! 가격도 영상에 같이 써주시는 거 감사할따름️️,9.0,1개월 전
2,cchanlee,모든 코디 하나하나 너무 잘어울리시는거 같아요!! 영상미도 너무 좋으심니다..!!,0.0,1개월 전
3,userhv6ln4ek7l,우린님 패션하울 너무 사랑해서 5년전꺼까지 보는 사람 여기있어요.... 더더많이많이 만들어주세요ㅠㅠ!!!,5.0,1개월 전
4,useree2zm9co4v,이번 영상 헤메코가 우린님 퍼컬에 찰떡이라 그런지 유난히 아름다우셔요,7.0,1개월 전
5,userwp6wr6ig9v,요새 디자이너 브랜드 옷값 비싼거 인정입니다ㅜ.. 슬슬 가을 자켓 사려고 찾아보니까 몇십만원^.^ ;; 오늘 하울 영상도 재밌게 잘 봤습니당!!,8.0,1개월 전
6,sys9078,아니이 오늘 착장 너무너무 이쁘신거 아닌가요??🫢 완전 여름 쿨톤의 정석 같아유 ㅎㅎ!!,3.0,1개월 전
7,userli2ct5kk2h,우린님 파란색 완전 잘어울려요 인간 포카리 느낌! 완전 시원하구 환해보여요,7.0,1개월 전
8,usercm9fs8wh2z,꺅 믿고 보는 우린님 패션하울입니당 호주 조심히 다녀오세용🫶🫶,3.0,1개월 전
9,usersw2ek9ty9x,우린님 영상 보면 가성비 좋은곳들 많이 알게되서 좋아요 ️,0.0,1개월 전
10,userkb7lx6ug9g,늘 좋은 영상 고마워요!! 착장 다 찰떡같이 잘어울려요! 참고해서 몇개 구매해 보려구요 ㅎㅎ,1.0,1개월 전
11,userdr7xt1hr3u,블루 컬러도 너무 잘 어울려여!!!!!! 우린님 덕분에 보웬에 빠졌어요!! 질 너무 좋아여!!! 오늘두 영상 잘 볼게요 우린님도 항상 건강 조심하세요,4.0,1개월 전
12,userhw5qh6ti9x,패션 하울 최고된다...,0.0,1개월 전
13,userue1sw7ss1b,"진짜 우린님 의견에 공감해요
옷값이 너무 비싸요
사이즈도 다양하지않고 
작기만 하고 색상도 다양하지않고 ㅜㅜ",10.0,1개월 전
14,tndus65,우린엉니의 패션 하울 사랑햐....,99.0,1개월 전
15,iminapril,예전엔 마시모두띠도 비싼 감이 있었는데 디브에 비하면 저렴하더라구요 정말 ㅠㅠ 킨더살몬 바지 진ㅉㅏ 편해 보여요 ,2.0,1개월 전
16,writtenby556,진짜 처음부터 예뻐서 장바구니 채우러 들어갑니다️️️,1.0,1개월 전
17,useree7fn3hh8l,우린님 리즈 등극.. 파란색이 이렇게 잘 어울리다뇨..,1.0,1개월 전
18,lydia2744,자라 베스트 첫번째 너무 이뻐요! 흰 티에 입으니까 진짜 시원해보여요,2.0,1개월 전
19,GYEOM11,믿고 보는 우린언니 하울 보웬 바지 사러 갑니다 총총총,1.0,1개월 전
20,userpy7cq1sq7s,우린님 패션영상 넘 재밌고 유익해요 히히,1.0,1개월 전
21,yoonsae,우린님 덕분에 보웬빠진사람 나야나 ㅠㅠ 오늘 영상도 감사해요!! ,0.0,1개월 전
22,useryi7nc7wr6z,악 패션하울 넘 좋아요 기다리고 있었어요🩵,3.0,1개월 전
23,sooyummy3005,진짜 기다렸어용 언니.... 진짜 요새 옷 다 작게나와서 ㅠ ㅠ 저두 슬퍼용 .. 맨날 pvcs만 기웃거리는중 ..  가을패션도 기다릴게요오오오 ㅎㅎㅎ,1.0,1개월 전
24,kylin630,언니보다 키는 훨씬 작지만 좋아하는 스타일이 비슷해서 항상 손민수해용.... 패션하울 만히 들고 와주세용🩵,0.0,1개월 전
25,userrl9iz3gj3w,우린님 쿨톤이라 너무 다행이고 넘 좋아요 잘봤습니당 ,0.0,1개월 전
26,stacyggong,"오늘 넘예뻐요오,,,",2.0,1개월 전
27,usergc8es9zw8w,언니 영상 기다렸어요~~~ 언니 여름 속옷 추천도 부탁드려요,0.0,1개월 전
28,jamongunni,멜빵존이 있다는게 왤케 귀엽죠오~~~패션쇼 한번해요~~,0.0,1개월 전
29,jellyfish686,綺麗な瞳です(⁠◍⁠•⁠ᴗ⁠•⁠◍⁠)⁠,0.0,1개월 전
30,leeju3ow,"우린님과 비슷한 생각을 가지고 있는 1인.아무리 물가가 오른다지만 오르는 물가도 정상은 아닌데...옷값은...사장님들 배만 불려주는거 같은 ㅎㅎㅎ
저도 그래서 차라리 브랜드 사는 경우가 많아졌어요...백화점은...유지비용이라도 많이 나가니 그 금액이 되려 이해가 갈 정도...",1.0,1개월 전
31,pandayaa,주말에 보는 우린님 영상🫶🫶 시드니 잘 다녀오세욥️,0.0,1개월 전(수정됨)
32,cc486cc,역시 우린님의 안목 최고🫶,0.0,1개월 전
33,userps4fh3vk2s,헤리티지 없는 브랜드임에도 턱없는 가격인곳 너무 많은거.. 제일 큰 사이즈가 허리 35.5인거 황당... 공감 투성이입니다 ㅋㅋ,1.0,1개월 전
34,userwg5lo1px3o,이제 여름옷 그만사려햇는데!! 우린웅니 추천은 믿고 사요 나 또.. 여름옷 사네...,0.0,1개월 전
35,manduminn,우린님!! 입고 계신 앤아더스토리즈 반팔티 사이즈도 궁금해요 영상 잘 볼게요! 영상 속 바르고 계신 립정보도 궁금해요,1.0,1개월 전(수정됨)
36,liveboldly,늘 더보기 감동이에오 언니..🩷,1.0,1개월 전
37,userpk7sn2yr6q,우린님 살이 엄청 많이 빠지신 것 같아요..! 분홍색 가디건 작다고 말씀하셨지만 화면으로 보기에는 넘 잘 어울려요! 춤 잘추는 여자 아이돌 느낌.. 오늘 영상도 잘 봤습니다!!,1.0,1개월 전(수정됨)
38,ruby5473,저도 립 정보 궁금합니당,1.0,1개월 전
39,userwh7dc3xu4h,"옷이 하나같이 다 예뽀요,, 3번 자라 자수린넨에 착용한 샤넬가방 사이즈가 뭘까요!!가방정보도 궁금해요!!",0.0,1개월 전
40,userse6mg5uo9r,꺅 우린님 영상 볼때마다 점점 슬림해져요!!!!!!!!!! ,5.0,1개월 전
41,hungryyyyyyyyyyyyyy,헤헿해헤헤ㅔ헤 드디어 여름 쇼핑할 수 있댜~~,0.0,1개월 전
42,userlw4ti6lp3g,3:34 에 입고나오신 검은 바지는 어디껀가요ㅠㅠ 옷에 관심많이없었는디 덕분에 브랜드 많이 알아가서 좋아요잘봤습니다,1.0,1개월 전
43,eungsssse,언니 보넨 리넨 바지랑 매치한 티 정보 알려주세요!!,0.0,1개월 전
44,useron1xe6gs5m,너므좋다 ,0.0,1개월 전
45,usermj4nq4gz7n,징짜 쿨톤 미텨써요 넘이뽀요 우린님,0.0,1개월 전
46,userur9ke9wl9s,반바지 하울 보고파요,0.0,1개월 전
47,het7689,"역시 키가 커야하나보여 ㅜㅜ!!
언니 옷 핏 첵오…",0.0,1개월 전
48,siinyx1sv,우린님 ㅠㅠ 보웬 필립니트 너무 예뻐서 사려고 했는데 전체 다 품절 ㅠㅠ 재입고예정도 없대요 흑..아쉬워라,0.0,1개월 전
49,userqh4jk3qx1w,같이 코디하고 조금씩 나오는 바이커팬츠도 정보알고싶어용!,0.0,1개월 전
50,usertg1qb7ey4q,꺄아아 오늘 공항에서 봤던 우린님 구독자에여  원래 아는척 하면 안되는데 조용히 아는척 해봤어여 ....,0.0,1개월 전
51,one6440,넘 예뻐요! 하트 목걸이 정보도 알 수 있을까요? ,0.0,1개월 전
52,luii3032,13:19 아워코모스 블랙티셔츠랑 코디한 바지 어떤 제품인가여!!?,2.0,1개월 전
53,Pingororoo,"미쳐따… 분명 8월쇼핑 그만이라구 했는데,,, 철회하겠습니다,,,🩵",1.0,1개월 전
54,dyoongX2,오늘 립!!! 궁금해여 라이트톤에 잘 맞을거 같아요,2.0,1개월 전
55,SYDdr8wk,4번 자수크롭 베스트 착용 사이즈뭘까요?,0.0,1개월 전
56,userye1yg3wj8h,언니 0:11 분에 착용하신 앤아더리즈 블루 티셔츠 사이즈 어떤거 착용 하셨을까요??,0.0,1개월 전
57,xaheum,10:20 ㅠㅠ진짜공감 그래서 요즘은 디브 안사고 브랜드를 사게되여,0.0,1개월 전
58,lazyliz,엉니...미모 머선일이에요.......?어이쿠야 깜짝아ㅠㅠㅠㅠ!!!!!,0.0,1개월 전
59,userwd9tc3zp4y,"우린쓰 영상은 와이리 좋노,,",0.0,1개월 전
60,userjm7kt7ku4k,우린님 코모스324 같은거 입을때 브라는 어떤거 입으시나요? 오프숄더 입을때 좋은 브라 추천도 부탁드려요ㅜ,0.0,1개월 전
61,userme7cm1to4s,패션하울이요 영상제목이네요 ,0.0,1개월 전
62,0osl236,헐 립정보.. 시급 .. 뭘까요 ,1.0,1개월 전
63,userqv8pz2th6y,우린님..앤아더스토리 티셔츠 사이즈 어떤거 착용하셨으까용...넘 예뻐서 따라사고싶은데 사이즈 젤작은거 하나남앗네요ㅠㅠ,0.0,1개월 전
64,userjw8dx5nn7b,보웬 니트랑 같이 입으신 바지는 어디껀가요???,0.0,1개월 전
65,userwx1hj2ks6t,아 넘 재밌당 ㅎㅎ,0.0,1개월 전
66,TheStella1119,ㅋㅋㅋ나?도?에?스?닉? ㅋㅋㅋ 자막 너무 웃겨요 ㅋㅋㅋㅋㅋ,1.0,1개월 전
67,chlrhyun91,우린님 오늘은 일찍 오셨네용🫶 시드니 잘 다녀오세요🩵🩵 항상 조심합시디아ㅠ_ㅠ,0.0,1개월 전
68,userln3xz2mw3l,우린님 블루티셔츠 사이즈 몇 구매하셨나용,0.0,1개월 전
69,rururu8220,오늘 립  넘 예뻐요 모 바르셨나요?,0.0,1개월 전
70,userol9my7ss3y,자라 조끼 사이즈 물어봐도 될까요?,1.0,1개월 전
71,usersn4ot4ht4s,마시모두띠 니트는 입으면 부해보이진 않나용 ?-?,0.0,1개월 전
72,useril7qq4vb2m,웅냐 더 이뽀졌다,0.0,1개월 전
73,userqv8pz2th6y,보웬 필립니트 어깨넓은사람이 입으면 넘 부각될까요??????,0.0,1개월 전
74,useruq8ie3yq9l,엉니 앤아더스토리즈 파란티 사이즈 어떤거에용?!,0.0,1개월 전
75,zachary138,우린님 12:18  멜빵성애자를 특이하게 발음하시네요 ㅋㅋㅋㅋ 처음에 못알아들었어요,2.0,1개월 전
76,usermr4io4eq7d,같이 코디한 바이커팬츠 어디껀가용??,0.0,1개월 전
77,lazyliz,16초전이라니...럭키걸 ㅜㅜㅜㅜ,1.0,1개월 전
78,usertg4es5od6w,5번 마시무시띠? 니트랑 입은 바지는 몬가요?,0.0,1개월 전
79,malife4luv,어우 살이 쫙 빠지셨네,3.0,1개월 전
80,uservo1ih8ue7x,"큰게 왇다,,",0.0,1개월 전
81,southkorea3257,"하울이 아니고 홀 [hɔːl] 이예요. 
한국에선 왜 자꾸 하울 하울 하는지 이해불가.   하울은 늑대가 울부짓는다는 뜻이예요",0.0,1개월 전
82,userrp5bl7qc2u,17:11 ㄱㅇㅇ,0.0,1개월 전
