,youtube_id,comment,like_num,comment_date
77,samo0819,"제가 이주 안되서 4-5키로 빠졌는데 .. 진짜 다이어트는 두끼(저녁을 안 먹는 게 중요합니다..) 식사, 간식 왠만하면 자제하기, 유제품(요거트, 우유, 라떼 등등) 안먹고 대신 저녁으로 과일식을 했습니다. 그냥 이거만 지켜도 .. 건강해지면서 살 빠집니다ㅜㅜ 다이어트 간식도 다 페이크고 정말 먹고 싶으면 다이어트 간식 살 빠에 횟수 정해서 먹고 싶은 간식 조금씩 먹으면 폭식도 줄여줘요.. 말씀하신 거 다 공감되는 말이에요. 지금 유지기를 하고 있긴 한데 혹시 세끼 드시는 분들은 일주일에 몇번만이라도 저녁에 과일식이나 금식 해보세요. 삶의ㅜ질이 달라집니다 ㅠㅠㅠ",7.0,3개월 전(수정됨)
78,userbh5ol6fy1m,"매일드시는 콜라겐제품 궁금해요!! 공복시간 얼마나 유지했는지 식사시간이
언제인지도 궁금합니다ㅜㅜ",1.0,3개월 전
79,userkh9nx4pt5p,와 진짜 젤 필요한 영상이다... 🫶,4.0,5개월 전
80,userrs3yw9kx6h,공복시간 몇시간 지키셨나용!! 좋은 꿀팁 감사해여,6.0,5개월 전
81,userzo3op9bc3t,영상 유용해요>< 일반식을 저녁에 드셨나요? 식사 시간대도 궁금해요~!,4.0,5개월 전
82,yPcj7yp,엄청 공감가요 키 163인데 48까지는 하루 두끼 조금 신경쓰면 겨우겨우 빠지는데 그 이하는 정말 어려운듯요 라떼 요거트 배달음식 다 끊고 해야 될까 말까인듯요 ㅜ ㅜ,2.0,3개월 전
83,gg2272,언니 영상 상의가 넘 궁금해요ㅜㅜ 청 오프숄더 진짜 예쁜 것 같아요 좋은 정보들도 넘 감사합니다ㅏ,0.0,5개월 전
84,Minoc4bd,배달 끊는 방법 진짜..쿨팁이에요 ㅋㅋㅋㅋㅋ다른 곳에소비를 많이 하면 확실히 배달을 끊게 되요,0.0,13일 전
85,johnkrain6853,다이어트 52일차 - 10.2킬로 감량... 힘내서 40킬로만 더 가보자... 근대 역시 다이어트는 급하게 마음 먹으면 유지를 못함. 몇일 또는 1-2주만에 엄청난 변화를 기대하고 달리면 꼭 실패하고 요요 맛보게 되는것 같네요. 느긋하게 최소 3-4달 이상잡고 영양소 맞춰서 적게 먹고 하루 30분에서 1시간 정도씩 운동하면 살 다 빠짐. 20대 때는 하루 2000칼로리 먹고 운동 3시간씩 조져서 두달에 30킬로 뺀적도 있었는데 지금은 그럴 체력도 시간도 없어서 느긋하게 가고 있음. 느긋하게 한달 5-6킬로 목표로 가니까 크게 부담 안가고 유지 가능.. 대신 하루하루가 너무 천천히가고 아무 변화가 없는거 같네요. 지난 7년간 너무 끈놓고 막먹으면서 살아서 인생 최고 몸무게 찍고 초고도비만 되니 이젠 예전처럼 마음껏 달릴수도 없는 몸이 되어 가지고 힘드네요. 편하게 아무때나 먹고 싶은거 배부르게 먹고 산 대가를 치르는중.. 지금은 맛있는거 먹고 싶다는 욕구보다는 그냥 다이어트 식단이라도 하루 1끼만 더 먹고 싶다는 생각밖에 없네요. 3시간에 1번씩 하루 4번 먹는데 이거라도 6번 먹었으면 소원이 없겠음. ㅋㅋ,1.0,3개월 전(수정됨)
86,haneul124,"혹시 콜라겐, 식이섬유는 어떤 영양제로 드시는 건가요???",0.0,2개월 전
87,userns8ny6pi5i,이 분 찐이네요 진짜 피같은 경험을 이렇게 짧은 영상으로 알려주시네요 진짜 복 많이 받으셨으면은.......,3.0,5개월 전
88,userpp3vg7hn2t,탄단지로 식단도 하고 제가 좋아하는 춤 추면서 유산소 하는 건 괜찮을까여?? 홈트 하는 것도 관심 있어서 집에서 운동 하려고 하는데.. 운동 하는게 안 좋은 건 아니게쬬???,0.0,3개월 전
89,yjy3250,현실적인  방법이네요!!!!  운동은 식욕상승만 되고 살은 먼지만큼 빠지더라구요,2.0,5개월 전
90,userjh5yg6em8h,진짜 너무예뻐서 우울할때마다 눈정화하러보러와야겠다,2.0,5개월 전
91,userbq5px2yl7f,공복시간 유지하실때 물 이외에 아무것도 안드신건지 궁금해요!!,3.0,5개월 전
92,userqg6or4lv5f,제가 보통-마름으로 가는 다이어트를 한다고 줄넘기를 매일 2천개씩 하는데 왜 똑같은 양을 먹어도 줄넘기하는날이 운동안하는때보다 살이 덜빠질까요??ㅠㅠ 오히려 칼로리를 더 쓰고있는데 왜 살은 잘 안빠지는지.....ㅠㅠㅠ,2.0,5개월 전
93,useroguogu00,체지방량 골격근량이 어떻게 되시는지 알 수 있을까요?!?!,5.0,3개월 전
94,usercf7mw2of2d,"아침 저녁 먹고 점심을 곤약젤리나 초코송이,쉐이크,안먹거나 해도 효과 있을까요??아침 저녁 둘다 일반식인데 최대한 양을 줄여서 먹고 있어요!",0.0,5개월 전
95,usersw4ep7vp2h,강박으로 가기 쉬운 방법이니 자신한테 알맞게 적용해서 쓰시길...,24.0,5개월 전
96,userww9vt6uo6s,다예님 어깨라인 넘넘 이뻐요...어깨관리방법도 궁금합니당️ 두끼 드셨다고 했는데 몇시몇시에 드셨는지 알수있ㄴ을까여...!!,6.0,5개월 전
97,lbmss1206,"다예님 갈수록 리즈시네여...유툽킬때마다 생각니서 용안보러 3번째 보는중🫢
제발 먹는 콜라겐 영양제들 소개도 시켜쥬세용..",3.0,5개월 전
98,userbm2py9qc9e,와 진짜 50키로에서 47키로 만들려고 pt를 받았는데 넘 강도가 쌨는지 배가 너무 고파서 식단실패함. pt받고 53키로가 찜 ㅎ,3.0,3개월 전
99,userfr8sn3og4e,진짜 맞는말 투성이... 이게 찐다이어트 비법입니다,1.0,5개월 전
100,userim6fb2iz9k,언니 옛날 영상 다 사라졌네요 흑 ㅠㅠ 제 최애 영상들이었는데.. 그때도 진짜 너무 여신이었는데 지금 더 예뻐지신게 너무 신기해용,5.0,5개월 전
101,dday7791,"다이어트 영상중 가장 찐정보
스마트한 베스트영상임",2.0,4개월 전
102,uservt1mh8zi3d,원하는 몸무게까지 말린다음 운동한다니... 진짜 근육량 박살나는 지름길인데..ㅠㅠㅠ 그래도 배달음식 끊기같은건 좋은 꿀팁이네요!!! 그릭요거트도ㅋㅋㅋㅋㅋ 그래놀라랑 꿀 진심 당 지방 투성이...,50.0,5개월 전(수정됨)
103,useree7eq4ft6j,"요즘 운동만하면, 이상하게 발바닥이 아프더라구요 ㅠ
병원갔더니 족저근막염이라고 하는데, 병원 치료비 아까워서 저는 릴렉싱볼로 집에서 마사지해요~",0.0,3개월 전
104,wineluvin,휴 넘 공감되요ㅠㅠ저도 마의 몸무게 깰수있길 ..너무 좋은 영상 김시합니다🫶,1.0,5개월 전
105,userbg3np6yl4d,"다예님 영상이라면 정독 할 정도로,,, 다예님 영상 사랑하는 1인,, 진짜 언니가 소개하는 찐템은 믿고 산다구,,기분전환,탱글이,블루워터,,무드립팬슬까징 ><ㅋㅋ할인또 안할까요ㅠ",0.0,5개월 전
106,userne7xf8cb2d,소비 믾이 해버리는 거.. 저게 무슨 방법이야 하겠지만 정말 도움 많이 됐어요. 옷 사는 재미에 빠져서 계속 식비를 거기에 쓰고 저녁에 매일 외식하던 걸 줄이니까 간식이나 먹고 싶은 걸 종종 먹는데도 불구하고 한달만에 거의 체지방만 5키로가 빠지더라고요..? 옷사이즈도 두사이즈 줄어서 원래 L사이즈 입다가 지금은 S사이즈 입어요. 나는 의지가 부족해서 뭘해도 결국 못참고 먹게 된다 하시는 분들은 정말 효과 직빵인 거 같아요 ㅋㅋㅋㅋㅋ,4.0,5개월 전
107,habibaa8847,This is literally my first time to watch u but I'm already in love with you,0.0,3개월 전
108,userth6mx5xc3m,오늘 레전드로 예뻐요 ㅜㅜ 메이크업 완전 존예,2.0,5개월 전
109,useruc7qm4zr7r,"진짜 찐으로 도움되는 영상 ,,, 근데 미모 무슨일이에요 ㅠ️️ 너무이뻐요 ㅎㅎㅎ 꿀팁 공유해주셔서 정말 감사해요 정성 그자체,,️️",1.0,5개월 전
110,comesoonjin,"Donts :- 
Dont eat diet snacks. 2:00
No delivery food 5:11",0.0,3주 전(수정됨)
111,Nana96Chan,"저는 남친이랑 같이 사는데 남친이 다이어트에 관심이 없고 살 빠지고 싶지 않아서 자꾸 피자, 파스타, 술 등 먹자고 해요 ㅠㅠ 저는 낮에 혼자 있어서 별로 안 먹고 헬스장에서 1시간30분동안 운동 빡세게 하는데 저녁 8시에 남친 올때 저녁 먹어서 살 안빠져요 ㅠㅠ 어떻게 할 수 있을까요 ㅠㅠ",1.0,5개월 전
112,usergv5bl5bb3l,"이 날 헤어, 메컵 꼭!!!!!!! 올려주세요!! ㅠㅠ 예뻐요~!!",2.0,3개월 전(수정됨)
113,ericayoo5101,도움되요! 살 다 빠질때까지 물단식 고고!!!,0.0,2개월 전
114,monicornk1638,혹시 다이어트 쉐이크 어떤걸로 드셨나요 ? 다이어트 영상중 단연 탑어브 탑이네요… 맨 마지막 멘트부분은   진짜  최고!!!!,4.0,5개월 전(수정됨)
115,userhs4oi8uk1s,"항상 잘보고 있어요 다예님 오늘도 미모 대박🫶
다예님은 하루 두끼드신다고 하시는데
쉐이크는 어떤 제품드시나요??!
저도 바쁘디바쁜 현대사회에서 간편식이 너무 좋은데 입에 안맞아서 단백질 쉐이크 점점 멀리하게되더라구요ㅠㅠ",0.0,5개월 전(수정됨)
116,heejean9490,56-46키로 감량 루틴도 알고 싶어요 ㅠㅠ,7.0,5개월 전
117,milkkurumi,"とてもわかりやすい
頑張って字幕を読んで良かった！",0.0,1개월 전
118,cwlb5tx,"언니, 한국어가 제 모국어가 아니어서 알아들을 수 없다면 미안해요. 나는 몇 달 동안 엄격한 다이어트를 해왔지만 지난달에 통제할 수 없는 식욕을 느꼈습니다. 눈에 띄게 살이 쪘고 통제 불능 상태입니다. 나는 가족과 함께 집에서 살기 때문에 집에 있는 음식을 통제할 수 없고 내 갈망을 억누를 수 없습니다. 내가 무엇을 제안합니까?",3.0,5개월 전
119,userpg6tk3vb4y,"어쩐지 항상 운동하며 다이어트할땐 그래도살이빠졌는데
요즘 운동해도 잘안빠지고 허벅지에살이붙어서
왜이러지했는데 그릭요거트때문인가봐요 ㅜ ㅜ
영상감사해요 정말루",0.0,3개월 전
120,hyeonmi8768,저는 잠을 많이자면 엄청빠지던데 지금46kg 43kg까지 빠지니까 걱정되네요 요즘 야식이든 못먹는 술도먹고하는데 이것두 보통일이아니네요 예전 몸무게36kg갈까봐 걱정입니다 ㅜㅜ,1.0,3개월 전(수정됨)
121,userld1zt5yc6k,공복시간을 어느정도 둬야할까요? ㅜㅜ,2.0,5개월 전
122,userxc4vw1gx5m,"초반 다이어트때 나는 안먹는데 왜이렇게 안빠지지????? 이러면서 자책했는데
알고보니 0칼로리 음료수 마시고,, 그랬거든요 
대체당이나 당알콜 이지만 당은 당인거같아요,, 
그리고는 배고플때 슈가프리 캔디 한알정도 먹거나 초콜릿 반조각 먹으니까 그게 더 낫더라구요
다이어트 식품 끊고나서 살빠지는게 보여서 사둿던거 묵혀놓고 있네요ㅠ ㅠ
아! 그리고 저는 밥먹기전 방울토마토10알정도 먹고 밥먹어요
밥양이 3분의1로 줄어들어서 놀랬어요ㅋㅋ이러면서 다이어트가 되니까 너무 기분이 좋아요,, 언제 입터짐이 올지 모르겠지만
끝까지 천천히 포기하지않고 달려볼게용!!!",4.0,5개월 전(수정됨)
123,useroc7eq2kn9d,단백질 쉐이크도 우유가 들어가는데 쉐이크를 못 먹으면 어떻게 하죠?,0.0,2개월 전
124,userkd4yp8rw6b,영양제 정보 알려주실 수 있나요오,0.0,2개월 전
125,userru6fl9nl1z,"진짜 그릭 요거트 너무 공감 ㅠㅠ 다이어트 할려고 샀다가 오히려 더 먹어서 살만 쪘어요,,, ㅠㅠ",0.0,1개월 전
126,useryw9mx6vr8k,너무 저한테 딱맞는 다이어트 방법이에요…!!! 혹시 쉐이크는 어떤 제품을 어떻게 드셧는지 알수잇을까요? 우유를 안드싱다고 하셔서 궁금합니다ㅠ,1.0,5개월 전
127,userel4rx7pb5y,"めちゃめちゃ参考になります
美女がこのように言ってくれるとやる気が入りますどれだけ自分が甘えていたか、、🥹",0.0,5개월 전
128,userfs3pz5gj9m,"단백질 쉐이크는 뭐랑 타먹는게 가장 좋나요?
물, 우유, 두유, 아몬드 브리즈 등",3.0,5개월 전(수정됨)
129,usernf7bs6ev6w,당신..처음 보는데 내 심장을 잡았어……구독 갈겨…,0.0,5개월 전
130,usermumu11,챙겨드시는 영양제도 알려주세요 ㅠㅠㅠㅠ ️️,0.0,3개월 전
131,userqm1zw1tt2s,돈도 많이 쓸 수 있어야 되며 약속도 많이 잡을 수 있는 인싸만 가능한 다이어트 법이네여......,1.0,2개월 전
132,userfz1nx1dx6r,다혜님 단백질 쉐이크는 어떤 제품 드시나용??,0.0,3개월 전
133,userdy3vw3ve3z,안녕하세여!! 영상 너무 잘봤습니다 혹시 콜라겐 중에 BB콜라켄은 가루형인데 효과가 있을까요??,0.0,3개월 전
134,habibaa8847,I'm deeply in love with the way she talks,0.0,3개월 전
135,usernk4ue5lf8n,10대인대 키도커야되는데 너무 뚱뚱해요 ㅠㅠ 키도 너무 짝고ㅠㅜㅠ   그래서 영양도 맞고 살도 빠지는 다이어트가 있나요?,0.0,4개월 전
136,peacheddiary,You already had a good weight of 48kgs so why did you want to go lower. Even 56 kgs is good for your height! ,0.0,3개월 전
137,mumumumumumumu6952,"ㄹㅇ 다 맞말 ...........
이런 영상 짱...... 🩷...",0.0,2개월 전
138,jinwife,ㄹㅇ 살 빼는거는 식단이고 유지하는거는 운동인 것 같음,0.0,3개월 전
139,0123hm,다예님이 드시는 영양제도 궁금해요 ..🫠 괜찮으신 제품 알려주실수 있으실까요? ️️,2.0,5개월 전
140,Darameezb8mb,목걸이 너무 잘어울려용..!! 어디서 사셨는지 알려주실 수 있나용,0.0,7일 전
141,dainphantom,다이어트 찾아보다가 우연히 들어왔는데 너무너무너무 예쁘신걸요ㅠㅠㅠㅠ 대박 연예인 하셔야되는거 아니에요?? 공주님 같아요 ㅠㅠㅠ,0.0,5개월 전
142,yy7859,"이 영상 레전드다... 얼굴도 정보도...
맨날 보러올래용",1.0,5개월 전
143,userzk7ey9qj9q,그릭요거트 아무것도 안뿌리고 오로지 요거트만 먹어도 안되나요..?,1.0,2주 전
144,useref5jo1il3b,거의 공부하는 것처럼 적으면서 봤어영 언니 넘 예뻐여…,0.0,4개월 전
145,wooanggg,와.. 다 맞는 말…,0.0,5개월 전
146,userwi6tp6ux9p,운동 안하고 빼며ㄴ 잘 빠지지만.. 정말 볼품없이 빠지더라구용 ㅠㅠ,1.0,3개월 전
147,lovelyyoung8456,단백질 쉐이크는 어떤거 드셨나요?!!,0.0,5개월 전
148,usergg8fe4zy8e,공감ㅋㅋㅋ돈이 없어야 안사먹지ㅋㅋ운동 안하기. 신박하다. 지금도 헬스장 가려고 준비하는 내모습이..도살장 끌려가는 모습. 스트레스로 살찌고 먹고,0.0,3개월 전
149,userfb3zy5nu9n,"여행가서는 어떻게 드시나요?
저도 평소 유지는 잘하는데
여행가서 먹는게 힘들더라고요 
노하우 있으시면 알려주세요!",0.0,5개월 전
150,usernl5ed9eb4t,다예님 단백질셰이크에 우유 대두 함유되어 있는건 먹으면 안될까요 그럼?? 한박스나 집에 있네요ㅠ,1.0,5개월 전
151,happydays2,"아니 혹시..엘프 천사세요....?
너무 예뻐서 눈 다시 한번 크게떴어요..",1.0,5개월 전
152,leeyh3gs,귀걸이도 너무예뽀요ㅜㅜ 귀걸이 정보도 얻고싶습니당 ,0.0,10일 전
153,userwl4qu8ue9l,넘 예뻐서 깜짝 놀랬어요 바로 구독뉴름,2.0,5개월 전
154,2inggee,잘 보고 갑니다 🥹 아자아자 !!!,0.0,5개월 전
155,kaydkaydkayd,u telling us to stop eating dairy kinda hurt my feelings but i cant deny that u have got a point ,0.0,3개월 전
156,userqv5up2re9k,언니 요즘 진짜 십....리즈요...,3.0,5개월 전
157,usernu2rp1gx7f,립 샤넬 루즈 63을 풀로 깔고 란제리로 그라데이션 하신걸까요? 요 영상 립 메이크업 자세히 알려주시면 넘 감사하겠습니당!!,0.0,5개월 전
158,jungtee,7:14 저 우유를 하루에 1L를 강요적 말고 즐겨 먹는데 조금은 줄여야겠죠..?ㅠㅜ 일주일에 가족들과 함께 먹으면 6통은 기본인데 ㅠㅜㅠ 조금은 줄여야겠어요!,0.0,3개월 전
159,or1118or,악세사리 정보 궁금해요오!!!,1.0,5개월 전
160,SaturneG,Merci pour les sous-titres ma star,0.0,1개월 전
161,userco9mq6ce5j,자주 해드셨던 집밥 메뉴들 궁금해요오,1.0,5개월 전
162,userzf4uy2ii4b,다예님 단백질 쉐이크 뭐드시는지 궁금해요!,6.0,5개월 전
163,userse6en9hm7v,와 다이어트 영상 중 젤 공감....,0.0,4개월 전
164,useryf2zi1vu4b,멋있습니다,0.0,5개월 전
165,usergn5ki9fo5l,우유때문에 찐다기 보다는 설탕이 많이 들어가서 찌는거 아닐까요 ?.. 진짜 궁금해서 그런데 아무나 의견좀 ..,0.0,3개월 전
166,Ariad077,영양제는 어떤 제품 드시나용 ?!???,0.0,5개월 전
167,userjdk51719,운동을 하지말라고요...? 다이어트 전문가도 아니신데 이렇게 잘못된 정보 막 말하셔도 되는건가요,7.0,9일 전
168,useryw8dv8hu2j,콜라겐 제품 어떤걸로 먹으시나요!!!,1.0,5개월 전
169,uservi6vy8pj2t,진쩌 와우 밖에 안나옴 ㅋㅋ 어떻게 이렇게 뼈가되고 살이되는 꿀팁만 주죠? ㅋㅋㅋ 흔해 빠진 다이어트 비법이 아니라 무슨 전설 속 전해 내려오는 그만의 비기를 듣는 기분 ㅋㅋㅋㅋㅋㅋㅋㅋ 아 다이어트 의지 불탄다,1.0,5개월 전
170,userxf4ds3dg1l,"이날 헤어랑 메이크업도 올려주세여 특히
헤어 !!ㅠㅠ",1.0,5개월 전
171,userxc6fw1lx5n,렌즈 하파크리스틴 에이투지 브라운 중에 어떤 직경인가요 ??,1.0,5개월 전
172,usersp6zb4ku8p,감사합니다…..이번에 이 방법으로 해봐야지,0.0,2개월 전
173,userto8ih8fo1e,"다이어트 꿀팁 감사합니다
혹시 통밀또띠아나 통밀 베이글 샌드위치 같은거 먹어두 괜찮을까요?",0.0,1개월 전
174,userlz3cb2eh6r,이런식이면 금방 요요오고 강박생기고 살쪄요 평소 양에 조금씩 줄이면서 먹고 운동하는게 답임 다들 왜 힘들게 운동을 하겠어요.. 진짜 단기간 살빼고 싶은 분들 아니면 장기적으로 비추,7.0,1개월 전
175,userxm4cj9ky2f,아침으로 릭요거트 먹으면서 보고잇엇는뎈ㅋㅋㅋㅋㅋㅋㅋㅋㅋㅋㅋ 뼈맞고갑니다 흑흑,0.0,1개월 전
176,thfxe2te,어떻게 젤리아이셔초콜렛을 한두개먹고 공복감이 해결된단 말입니까... 더 속쓰릴듯여ㅠㅠ힝,1.0,2개월 전
177,userms9xw9jv4p,진짜 찐팁이다!!,0.0,2개월 전
178,userpp9im6yp6o,언니~! 드셨던 단백질 셰이크 추천해 주실수 있으실까용 ...?!,1.0,5개월 전
179,uservu3wg7qf5b,"혹시 저녁에 당 0%인 그릭요거트, 그래놀라 먹는 것도 안되나요??",0.0,5개월 전
180,Kimtkdgml,오늘 메이크업이랑 헤어 영상 부탁드려요ㅜㅜ 너무너무 이뻐요,1.0,5개월 전
181,nis9950,"menurut aku salah banget point pertama dia, aku tau itu bedasarkan pengalaman dan perasaan dia, tapi kalo kita diet yang sehat dan mengukur sesuai TDEE yang tepat, dalam artian penurunan kalori yang sewajarnya, maka olahraga ga bakal ngaruh ke lapernya. TDEE gampang banget kok cara ngitungnya di online kalkulator. Jadi fungsi olahraga itu apa? ya buat menaikkan masa otot dan ngeburn kalori lebih banyak, istilahnya pengencangan. Tapi kalo emang gausah olahraga ya gapapa, tapi inget kalo harus defisit kalori dengan batas kalori sewajarnya, kalo ga gitu, itu bakal ga sehat dan bikin fungsi kerja tubuh maupun otak turun. Ketahuin aja resikonya ges.",0.0,2개월 전
182,usermg9us1zw5n,다예님이랑 저랑 키 20센치는 차이날 것 같은데 몸무게는 같네요 ㅠㅠ 저 이제부터 다른 건 모르겠고 열시부터 다음날 아침까지 아무것도 안 먹겠습니다. 야식과 이별 선언하겠습니다.,0.0,2개월 전
183,miseon5107,언니 콜라겐 어떤 거 드세요?,1.0,5개월 전
184,usergv9sz6nc1w,많이 와닿아서 구독,0.0,5개월 전
185,ahffkahffks,립 몬가요 ?? 넘 예뽀요 다요트 꿀팁두 감사해요 ️️,3.0,5개월 전
186,usergm1se6if9u,이렇게 살바에야 난 먹고 살찔련다....,0.0,5개월 전
187,userpp3vg7hn2t,와 안그래도 저 그릭요거트 안 좋아하는데 너무 잘됬어요요 ㅎㅎㅎㅎ,0.0,3개월 전
188,userdi6ff6wv6z,콜라겐은 뭐드시나요!!,1.0,2개월 전
189,userkf6py1bl1h,학생인데요 키 크기 위해 마시는 우유는 괜찮나요?,1.0,5개월 전
190,solila6072,여러분 옷사지말고 주식하세요 그래프 볼때마다 심장이 떨려서 식욕이 안들어요ㅎ,0.0,4개월 전
191,userod8ze4xr4t,다혜님 봄옷 하울 찍어주세요!!!! 다혜님의 핑쿠핑쿠 데님데님 너무 조아하는 사람입니닷...손민수 하고 싶어요 !!!,1.0,5개월 전
192,usercf9lk6re8g,그 날일때도 똑같이 쉐이크랑 일반식만 드셨을까요 ㅠㅠ?!,1.0,5개월 전
193,uservo1km5kc7d,너무 이뽀요.. ㅎㅎ,0.0,12일 전
194,useruh9iu3yk6b,이거 보고 마시는 보조제 바로 시켜써요ㅠ,0.0,5개월 전
195,userlj5iv9ib6w,아이브 같아요 존예,0.0,3개월 전
196,userdz6hk8ly1l,ㅠㅠㅠㅜㅠㅠㅠㅠㅠ,0.0,4개월 전
197,userdh7yy6uu2u,지금은 등운동 복근운동 매일한다고 하셨는데 헬스하시나요? 홈트하시나요?,1.0,5개월 전
198,userwj3ep2wy7l,"저는저런거다먹고 과자.짬뽕.파스타.오레오초코라떼 .아이스크림 그냥 구내식당있는음식  다먹었어요 
일주일만에 4키로뺐습니다
평생저렇게먹고살거아니잖아요,,,,;; 이방법 진심 오래못가요 제한하는 다이어트는 나중에 입터지면 끝입니다",13.0,4개월 전(수정됨)
199,Sihoontp,"진짜 이쁘시네요
처음보는건데 구독좋아요알람설정까지하고갈게용
자주올게용~",1.0,5개월 전
200,doo7936,영상 보면서 느꼈던 느낌이 맞았숴...️다예님 쉐이크 뭐드시는지 궁금합니돠️,0.0,5개월 전
201,yuji0320,식단 조절을 하고 싶지만.. 기숙사를 이용하고 있어서 삼시세끼 급식을 먹는다는거.. ㅠㅜ 삼시세끼 급식을 먹어도 조절을 잘 해가면서 먹으면 되겠죠?,0.0,5개월 전
202,usermx7wk1ko6t,그릭요거트에 견과류만 넣어먹눙데 그리고작은사이즈양정도는 괜찮지않을까여,0.0,3개월 전
203,adorabletteokbokki2104,쉐이크는 어떤 제품 드셨나용?,1.0,5개월 전
204,userid1ny8xu4e,언니 너무 예뽀용....🫶,0.0,5개월 전
205,iamjustvvovvo,언니 단백질 쉐이크 추천해주세용..!!ㅠㅠ,3.0,5개월 전
206,rahma7046,"Can't relate with half of your advices. I really need to go to the gym or home workout at least 3-4  times a week. Need to gain some muscle, so I can go diet happily, eat whatever I want, and keep my weight stable. I don't want to get some yo-yo effects. I've been doing a lots of diet, and I think the most important thing to do is working out. Just simple work out, 20-30 mins and we'll be okay.",1.0,3개월 전
207,velykim2761,단백질쉐이크는 어떤제품 드시나용?.?,0.0,5개월 전
208,userzv3vq9uq7j,식이섬유 어떤거 드시는지 알수있을까요?!?!,2.0,5개월 전
209,lgkqryd757,혈액순환개선제 어떤 거 드시나용~~??,2.0,5개월 전
210,useron7ir5so8f,다예님 단백질 쉐이크 괜찮은 거 추천해주실 만한 제품 있을까요? ,1.0,5개월 전
211,userfv1ru8cb4h,쉐이크 물로 타드셨나요 우유에 타드샸나요 ??,0.0,4개월 전
212,salanghae486,혹시 퍼스널컬러가 어떻게 되시나여ㅜㅜ?,2.0,5개월 전
213,paulek9zg,든든합니다^^,0.0,5개월 전
214,userqf5ti6ut4t,단백질쉐이크 어떤거 드시나용??,0.0,2개월 전
215,userx90Zbki2wek1,요즘 진짜 왜이렇게 이쁘세요 구독자는 아니지만 요즘 제 알고리즘에 뜨세요 ….근데 너무 이뻐서 영상 보게돼요…..뷰티풀,0.0,5개월 전
216,yuji0320,립 정보 알 수 있을까요?,0.0,5개월 전
217,ribbon9649,메이크업 빨리요 언니 제발 빨리요 와 죽겟어요 진짜 너무예뻐 숨참을게요... 아니 어케 사람이 맨날 더 예뻐져요ㅠㅠㅠㅠㅠㅠㅠㅠㅠㅠ,2.0,5개월 전
218,hannalee5299,구독바로 갈겼어요 겅벅시간 몇시간 유지하셨나요??,0.0,5개월 전
219,usersj2bj7jl3x,아니 언니... 저 지금 그릭요거트 먹으면서 보고있는데ㅎㅎ후ㅜㅜㅋㅋㅋㅋㅋ🥹... 사랑에 빠졌는데..노력해볼게요..,0.0,5개월 전
220,SsAaxv7kq,チェリンちゃん今日も超絶可愛くて女の子らしいです　いつも超絶可愛いチェリンちゃんにいつまでもメロメロが止まりませんでした,0.0,5개월 전
221,userts7rw9tl4y,언니 립 뭐 쓰셧어요??,2.0,5개월 전
222,uservb1nn1oy4x,아몬드브리즈도 꾸준히 드시나용?!,1.0,5개월 전
223,userth6bk6uv3l,온니 !! 저 이 날 헤어가 넘 궁금해용🥹 완전 디즈니 공주 같아요오ㅠㅠㅠ,0.0,5개월 전
224,useril7sq7bt1w,단백질쉐이크는 어떤거 드셨너용?,0.0,4개월 전
225,Dreamy258,"언니 ai처럼 생겼어요 너무 싱기해,, 프로그램이 다이어트방법 알려주는거같아용",0.0,5개월 전
226,userno2vj5pv4n,다예님 다이어트 쉐이크추천해주세용~~,0.0,5개월 전
227,userkl7vs3sl6w,와 그릭요거트 공감되요 . . 저 그걸로 살쪘어요 ㅜ ㅜ 입맛돋구용,0.0,3개월 전
228,jns9262,혹시 키가 어떻게 되세요??,0.0,1개월 전
229,Youtubepremium,낼부터 다이어트 하려구 했는데 어떻게 아시구..,0.0,5개월 전
230,userxx7zn3gg8v,아 매우 공감되요 아ㅜㅜㅜㅜ 전엔됫는데 왜 안되지 햇는데 이거엿네요 하.. 그놈의 이삼키로,0.0,3개월 전(수정됨)
