,youtube_id,comment,like_num,comment_date
0,URISHOP,"[유리숍X구달 댓글 이벤트 당첨자 명단]

구달 맑은 어성초 진정 수분 크림 댓글 이벤트 당첨자를 발표합니다! 축하드립니다

당첨자 분들께는 브랜드에서 경품 발송드릴 예정입니다!

참여해주신 율둥이들 감사합니다


이*애	0**8
김*연	9**0
신*진	7**7
이*진	8**7
문*혜	4**3",6.0,4개월 전
1,userrd3hd5tw9r,"율언니 추천템 말해모해,,지금까지 안맞은적이 없어서 맨날 손민수 한다구요! 특헤 언니가 하나하나 꼼꼼히 설명해줘서 더 신뢰감 상승!!! 최근에 이마랑 미간 사이를 다친 상처에, 야근까지 겹쳐서 피부 트러블까지.. 총체적 난국 상태라 피부관리가 시급한데 또 민감성이라 아무거나 쓰기 어려운 제피부타입 ㅠㅠ 이번 구달 신상은 진정성분 가득! 특히 저랑 잘맞는 어성초라 더욱 기대가되네요~! 언니한테 꼭 크림 선물받고 제돈제산으로 패드까지 사서 얼른 율언냐루틴으로 피부 복구하구 파요 크림팩방법은 꼭 따라해보겟어요!!🥹",3.0,4개월 전(수정됨)
2,kcherish,"진짜 언니 영상 보면 새롭게 얻는 게 너무 많아요
전에 센텔라 파우더를 얼굴에 국소부위만 쓰는 게 아니고 전체적으로 쓴다든가
이번처럼 크림을 워시오프팩으로 쓰는 것들.. 천재인가요ˀ͙!ˀ͙ 
역시 언니는 제 넘버원 뷰티멘토️
피부 안 좋아진 날에 따라 해봐야겠어요ㅠ",2.0,4개월 전
3,userqx9od7hh5g,"요즘 안그래도 피부가 갑자기 뒤집어져서 진짜 
엄청 예민한 상태라 진정케어에 힘 쓰고 있는데 
이렇게 꿀팁들이랑 좋은 제품들 소개해주셔서 
너무 감사드려요!ㅎㅎㅎ 구달 어성초 라인 
제품들 워낙 유명하다 보니 너무 잘 알고 있었는데 
역시 너무 좋네요! 어성초 수분크림,토너패드 
두 제품 다 피부 진정에 너무 효과적인것 같아서 
너무 마음에 들고 기대되는것 같아요!ㅎㅎㅎ 
특히 어성초 수분크림을 워시오프팩 처럼 
사용하는 방법 진짜 너무 좋은 팁인것 같아서 
저도 한번 해봐야 겠어요!️️ 구달 어성초 라인 
제품들로 피부케어 해주면 뒤집어진 피부에 보다 
효과적인 진정케어 해줄 수 있을것 같아서 
한번 사용해 보고 싶네요!!ㅎㅎㅎ️️",0.0,4개월 전(수정됨)
4,userkf4nj3df9t,요새 피부가 너무 예민해서 뭘 발라도 붉게 올라왔었는데 진정 관리 영상으로 찍어주셔서 감사합니당 특히 다가오는 여름에 유익한 영상이에요 어성초 좋다고 얘기만 들었지 성분 안 맞을까봐 사용해본 적 없었는데 언니 믿고 이번 기회에 사용 해보면 좋을 것 같아요 ㅎㅎ 어성초 수분크림은 정말 딱 수분 진정 느낌이라 두툼히 팩처럼 올려두면 진정이 안될래야 안될 수가 없을 것 같구 패드는 피부 예민해서 자극적인 패드 쓸 수 없는 사람들이 사용하면 너무 좋을 거 가타유 ㅠㅠ 당첨돼서 언니가 하신 루트 그대로 따라해볼래요🫠,0.0,4개월 전
5,k1rakirakyun,"태어나 처음 피부가 뒤집어진다는 걸 몸소 경험한 요즘.. 하루가 멀다하고 수포랑 트러블이 마구 올라오는 요즘..! 마침 이런 단비같은 영상을 올려주시다니요 언니...🫶 대충 바디로션만 얼굴에 펴바르고 살아도 항상 피부 좋다는 얘기만 듣다가 이런 경험은 처음이라 어떻게 관리해야 할 지 감도 안 잡혔는데 넘나 시의적절한 것🥹

며칠 전에 이제 나도 관리란 걸 해봐야겠다...! 싶어서 트러블성 피부에 좋은 기초도 이것저것 찾아보다가 구달 어성초 라인이 올영 장바구니에 담겼었는데요🥹🥹 생활비도 쪼달리는데 피부 관리는 무슨... 하고 그냥 바르던 바디로션이나 대충 얼굴에도 펴바르고 있었어요 근데 거울 볼 때마다 너무 스트레스 받고 또 이 영상 보니 원래대로 돌아가려면 이대로는 안되겠구나 싶네요 ㅜㅜ 힝 노력하고 투자한 만큼 돌아오는 거니까요

이벤트 당첨 안 돼도 패드는 꼭 구매할 거예요! 어성초가 염증에 좋은 건 미리 알고 있었구 또 몇 달 전부터 언니 영상 눈팅으로 잘 봐오고 있는데요 말씀도 넘 똑순이처럼ㅋㅋㅋ 하시구 또 언니 영상 보고 세안법에 신경 쓰면서 진전이 조금 있었어요!! 엄청 오래 뵌 건 아니지만 늘 무지 신뢰가 가용 항상 좋은 정보 고맙습니다️",4.0,4개월 전(수정됨)
6,skdud1593,"환절기에 일하면서 하루종일 화장하고 있으면 피부가 쉴 날이 정말 없어서인지 주기적으로 뒤집어지더라구요ㅠㅠ 요즘 붉은기도 잘안가라앉구요,, 언니는 타고난 피부라고만 생각했는데 구달 제품들로 언니가 알려준 회복, 진정루틴 꿀팁들 꼭 따라해봐야겠어요 !! 효과가 넘넘 기대됩니당..",0.0,4개월 전
7,Ezzzl,최근 환절기+스트레스로 피부가 뒤집어진 한 대학생입니다..  언니가 추천해주신 제품이다보니 신뢰 뿜뿜이네요 !!  그동안 언니 따라 샀던 제품들 모두 성공했던 1인으로서 이번 구달 제품도 넘넘 기대돼용 워시오프팩도 넘 신박하구 꼭 사용해보고 싶습니당,0.0,4개월 전
8,chaer030,크림으로 워시오프팩을 한다는건 생각도 못해봤는데....🫢 정말 생각도 못한 꿀팁 마구마구 퍼주는 우리 언니 최고다악!! 평소에 어성초 성분 잘 맞아서 팩도 자주 해줬는데 구달 어성초 라인 크림이랑 토너팩은 사용해본 적 없어서 효과가 어느정도일지 궁금해요 유리웅니 진정템은 워낙 믿고 쓰는지라.. 어성초 성분 추천템은 처음인 것 같은데 ..!,2.0,4개월 전
9,usernu3cs1cr7p,"챱토 진짜 너무너무 좋아요 단순히 좋은 제품뿐만 아니라 바르는 방법부터, 응용하는 방법까지 자세하고 꼼꼼하게 알려주셔서 행복합니당 피부가 얇고 예민한 편이라 특히 구달 수분크림 너무 기대돼요 언니처럼 피부 좋아지는 그날까지..!! 화이팅",1.0,4개월 전
10,lhs198,언니처럼 관리하는 방법은 처음봐서 더 따라하고 싶어져요 어성초 자체가 피부에 좋다는건 많이 들어왔고 요즘 같은 날씨에 좋을 것 같아요 그리고 구달은 한번도 써보질 못해서 진정에 좋을지랑 어떤 마무리감일지도 궁금해요 언니가 알려주는 스킨케어 루틴은 믿고 따라할 수 있어서 이번 루틴도 따라해보고 싶어요!!,1.0,4개월 전
11,userfd1ri3ex4z,"요즘은 다들 좋았던 피부도 트러블이 나구 뒤집히구 그런가바요,, 저두 그래요ㅠㅠㅠㅠ 언니영상보고 정보 더 얻어가서 너무 좋네요!! 열감 내리기와 피부성분 줄이기!!! 꼭 꼭 기억해서 건강한 피부로 돌아갈게요!!!! 구달은 너무 유명한데 제가 또 아성초 너무 사랑하거든요,,, 꼭 써봐야겠어요!!!",0.0,4개월 전
12,userne4lc4wg2h,언니 저 정말 지금 쓰던 기초들 딱 다 써서 어떤 제품들로 정착 할 수 있을까 찾아보던 요즘이였는데 마침 언니의 영상이 올라왔어요! 꺅 너무좋아요 평소에도 어성초 너무 잘 쓰고 있던터라 더욱 기대됩니당 언니 항상 좋은 제품들과 영상 감사해요 앞으로도 언니를 마음 깊이 응원하고 기도할게요,0.0,4개월 전
13,usertr7de1zm5e,"5:45 여기서부터 ' 구달 맑은 어성초 진정 수분크림과 토너패드의 장점과 사용 꿀팁 '에 대해 자세히 알 수 있었는데, 뭐니뭐니해도 피부에 진정효과를 주는 것이 가장 큰 장점이어서 홍조가 있고, 평소에 열이 많은 저에게는 아주아주 필요한 제품인거 같습니다   물론 피부 진정효과 뿐만아니라 영상에서 확인할 수 있듯이 다양한 장점들이 가득한 구달 맑은 어성초 진정 수분크림과 토너패드!!! 깨끗하고, 촉촉한 피부를 위한 필수 아이템이라고 생각되네요^^ 항상 브이로그처럼 힐링을 주는 영상이나 이번 영상처럼 자기관리 꿀팁이 가득한 영상을 올려주셔서 감사드리고, 매번 잘챙겨보고 있어용~~ 앞으로도 잘챙겨볼테니 좋은 영상, 유익한 영상 많이많이 올려주세용",0.0,4개월 전
14,usergy1yu7wr5i,평소에도 구달 제품이 제 기초를 책임져주고 있었는데 이렇게 유리숍님이 또 추천을 해주시니까 더더 좋아요 최근에 붉은끼와 잡티가 심해지고 난리부르스가 났는데 어성초 수분 크림 바르고 피부 깨끗해지고 싶어요 항상 영상 잘 보고 있어요! 이런 좋은 이벤트 열어주셔서 넘 감사해요 유리숍님 & 구달님 ️,0.0,4개월 전
15,uservm6tu3pd5g,"환절기만 되면 왜 이렇게 피부가 뒤집어지는지 모르겠어요 ㅠㅠ 구달 옛날에 귤  세럼 너무 잘 쓴 기억이 있는데 다른 라인의 제품은 또 어떨지 너무 궁금해요!
언니가 피부 너무 좋아서, 평소에 어떤 식으로 관리를 하고 애용하시는 제품은 뭔지 늘 궁금해요. 실제로 추천해주시는 것마다 제 취향을 저격했고, 직접 내돈내산으로 손민수를 했을 때 후회가 1도 없었어요! 오히려 더 좋았죠... 진짜 언니 추천템은 항상 믿고 봅니다. 피부가 얇고 자극에 민감한 편이라 순한 제품만 써야 하는데 구달은 진짜 트러블도 안 나고 제가 썼던 제품 중 가장 순한데 효과는 미친 것 같더라고요. 요즘 피부도 막 뒤집어지고 환절기에 피부 자신감 완전 하락해서 너무 고민이었는데 이 제품으로 저도 언니처럼 틈틈히 피부 관리를 해주고 싶어요! 구달 수분 크림 너무 궁금해요  속에서부터 차오르는 수분감 보습감... 극극 악건성 김미연인 제게 너무 너무 너무 너무 필요해요...!!",0.0,4개월 전(수정됨)
16,useret2pd8fq8e,요즘 날이면 날마다 다른 날씨에 나이스했다 안 좋았다 반복되는 민감한 이 피부에 이런 추천영상 믿고 봅니당️ ㅎㅎㅎ계절감이 변하니까 제형도 좀 다르고 데일리로 슥슥 사용할 수 있을거 같아 기대되네요 ️,0.0,4개월 전
17,usereo6pm3rt5o,"뭐가 못생겼다는 건지 도통 모르겠지만,,! 피부가 또 난리라는 한숨섞인 목소리는 공감가요ㅋㅋㅋ 토닥토닥 관리해주는 모습 보니까 저도 의욕이 생겨요! 시중에 어성초 제품이 많지만 구달의 다른 라인 쓰고 대만족했던 경험이 있어서 구달의 어성초 라인은 또 어떨지 궁금하네요. 리필 출시한 것도 정말 마음에 들구요!",0.0,4개월 전
18,userzh7di8du1g,어성초 성분이 진짜 좋다는 말을 들었었는대 구달제품이 좋다는 아야기 많이 들었지만 광고 같아서 별로 안 땡겼는대 유리언니가 이렇게 밀착 리뷰해주시고  요즘 안그래도 피부가 지친타이밍이었는데 꿀팁도 감사합니당 구달 어성초 수분크림 정말 너무 궁금해요 제가 쓰는 수분크림과도 제형이 같아서 너무 궁금하네요,0.0,4개월 전
19,userkt9cz5zk2c,"지금 앰플 잘못써서 뒤집어 지고 + 환절기라 건조한게 더해져서 안나던 좁쌀, 여드름 난리가 나서 스트레스 엄청 받고 있거든요
진정 수분크림 쓰고 다시 좁쌀 없던 피부로 돌아가고 싶어요!!!!
유리숍님이 추천해주시는 제품들 효과가 너무 좋았는데 이 크림도 진정 효과 엄청날 것 같아요 꼭 써보고 싶어요🫶",0.0,4개월 전
20,usergi2oo8st6l,평소 얼굴에 열감이 많은 편인데 언니가 추천해준 크림으로 워시오프팩 하고 스킨케어 루틴으로 따라하면 피부 열감이 많이 내려갈 거 같아서 기대돼용 !! 구달 다른 제품들도 저랑 잘 맞아서 잘쓰고 있는데 어성초 라인은 어떨지 궁금해요 ,0.0,4개월 전
21,userrc6mt1fi9v,언니 요즘 피부가 ㅠㅠ 환절기 이후로 뒤집어지고 안돌아오고 있는데 화장품 줄이기를 하고 싶어도 맘처럼 안되는 것 같아요🥹 구달 어성초 성분은 한번도 써본적이 없는데 수분크림이랑 토너패드 너무 궁금해요 예민한 피부 관리 해야겠어요!!!!🥹,0.0,4개월 전
22,lulululun,"어성초 토너패드 썼는데 너무 좋아서 또 사려고 했는데 할인이라니... 너무 좋아
수분크림은 한 번도 안 써봐서 너무 궁금해여 여름이 오면 얼굴에 확실히 열이 잘 오르고 운동 끝나고 샤워해도 얼굴 빨간거 아는사람은 다 안다 진짜ㅠㅠㅠㅠㅠㅠ 진정시켜쥬는 템 너무 기대 절대지켜!!!",0.0,4개월 전
23,innisfree37,"피부가 너무 좋아보이셔서 들어왔는데 ,, 관리법까지 감사해요ㅠㅠ",0.0,4개월 전
24,somisonny,피부가 예민해지는 환절기에 진정은 필수로 해줘야하는데 부담없이 데일리로 해줄 수 있는 제품 같아 보여요! 크림이 너무 가벼워 금방 날라가지 않을까 싶었는데 수부지 피부에게 수면팩처럼 사용하는 방법 신박해서 따라해보고 싶네요 리치하면 흡수 더디고 미끌리거려서 피하게 되는데 아침저녁으로 사용하기 좋은 제형이라 맘에 쏙 듭니당ㅎㅎ,0.0,4개월 전
25,eunhyepark3223,"우선 제가 너무 좋아하는 유리숍님께서 추천해주시는 수분크림이라서 너무 믿음이가요 최근부터 구독해서 영상 올라올때마다 보고있는데 얼굴이 넘 이쁘셔서 다 따라하고 싶어요!! 저번에 추천해주시는 로벡틴 마스크도 왕창 쟁였어요ㅋㅋㅋ 이정도면 유리숍님 빠수니 아니냐며.. 제가 민감성 피부인데 구달 맑은 어성초 진정 수분크림은 민감한 피부를 촉촉하게 케어하고 여드름 피부에도 적합하다고 해서 더 기대가되요! 유리숍님 저는 초등학교 때부터 성인인 지금까지 여드름과 각종 트러블을 안고 살고 있고 지금까지도 고쳐지지 않는 가장 큰 고민이에요. 늘 컨실러로 가리기 급급하고 처음 본 사람들한테도 피부 안좋다는 얘기도 많이 듣고.. 이 여드름을 정말 정말 해결하고 싶은데 그동안 메이크업만 신경썼지, 기초케어에는 무지하다 못해 대충 걍 유명하다는 제품 구매해서 몇번 발랐던게 다예요 ㅠㅠ 이 영상 보니까 제가 얼마나 그동안 기초에 관심이 없었는지 생각이 나더라고요! 지금이라도 유리숍님이 소개해주신 구달 어성초 수분크림을 바르고 저의 안좋은 이 피부를 고치고 싶어요. 물론 완전히 고쳐지지 않는다는 거 잘 알지만 제가 믿고 애정하는 유리숍님이 추천해주신 제품이라서 꼭 발라보고 싶어요, 제 피부를 위해서라도요. 피부때문에 움츠리고 마스크 끼고 다니고 많이 울었는데, 곧 대학 졸업하니까 사회에 나갈 땐 당당한 모습으로, 깨끗한 피부를 얻고 싶어요. 자신감 찬 모습으로 사회인이 되고 싶습니다! 꼭 건강한 피부도 얻고 열심히 한번 해내고 싶어졌어요. 늘 영상 잘 보고 있어요ㅎㅎ 오늘도 좋은 영상 감사드리고 항상 화이팅입니다 유리숍님 오늘도 화이팅하시고 이런 소소한 이벤트 마련해주셔서 너무 감사해요 ",0.0,4개월 전
26,eunbly7462,"꾸준히 사용하지 않으면 모를법한 꿀템과 제품 관련 설명을 자세히 해주셔서 다른 뷰티 유튜버분들보다 더욱 신뢰가 가요!
특히 구달은 전에 미백라인 토너패드가 잘 맞아서 이번 어성초라인 크림과 토너패드도 기본 이상은 하겠지라는 생각이 있어요!
또한 요즘들어 드는 생각인대 제품이 아무리 좋더라도 리필이 없으면 계속 써도 되나? 리필 나오면 참 좋을텐대 라는 아쉬움을 안은채 제품을 구매하는대 구달은 리필용까지 판매를 해서 맘에 듭니다..️
곧 더운 여름이 다가오는대 안그래도 예민한 피부 열 받으면 홍조에 피지까지 난리부르스라 벌써부터 걱정인대 구달 어성초라인으로 잘 관리하고싶어요ㅜㅜ",0.0,4개월 전
27,euujinq,원래 구달 어성초 크림 쓰고 있는데 용기가 좀 달라서 찾아보니 지속 가능한 용기로 패키지가 리뉴얼 됐네요! 구달 칭찬해  뭘 발라도 푸석한 민감성 피부인데 구달 정말 잘 쓰고 있어요 다 떨어져가는데 새로 바뀐 디자인이 더 깔끔하고 구달스럽네요 ㅎㅎ 갖고싶어요 ,2.0,4개월 전
28,AinJung109,피부 뒤집어졌을때 괜히 좋다는 성분 와다닥 발랐었는데 한가지 성분만 사용하는거 정말  꿀팁인거 같아요! 어성초가 피부 진정에 좋은거 알고 있었는데 토너 앰플만 사용했었는데 어성초 크림도 사용해야겠어요!!,0.0,4개월 전
29,userlp4fe6nt6m,가끔씩 피부가 뒤집어져서 스트레스받는 저에게 정말 꼭 필요한 제품이네요ㅎㅎ 꼭 한번 써보고싶어용!! 너무 기대됩니다🥹 작년에 언니가 마켓 진행했던 블레미샷 앰플도 정말 만족스러웠어서 이번에도 역시 믿음이 가욤,0.0,4개월 전
30,userjz2ec8eq3b,"구달 어성초 수분 크림 원래도 알고있긴 했지만 피부가 예민해서 기초제품 잘 못바꿨었는데.. 언니 영상 보면 진짜 진심 팍팍 담겨있는거같아서 써보고싶어요 🫠 영상으로 보고있는데도 토너패드랑 수분크림이 제 얼굴 열감 낮춰주고 있는듯한 기분이 드네요...? 꼭 한번 써보고싶습니당
+보는 내내 언니 얼굴에도 감탄하면서 봤어요 너무 예쁘세요....ㅠ",0.0,4개월 전
31,userow2xy5cl5o,"더워지면 피부온도 때문에 힘들었는데 피부온도도 내려주고 수분진정 어성초니까 벌써 든든해요 

그리고 워시오프팩처럼 발라놓고 샤워한다는건 생각 못해봤는데 진짜 좋을것같아요 ",0.0,4개월 전
32,tnwls3860,와우 피부 정말 좋으세요 부럽습니다. 저도 피부 완전 민감하고 트러블 심한 피부라 조금만 잘 못 바르면 피부가 뒤집어집니다  소개해주신 제품은 이전에 한번도 안 써 본 제품인데 저도 한번 사용해보고 싶어요!!,1.0,4개월 전
33,userop6jc1oq3i,진정에 좋은 토너패드 찾고 있는데 구달 어성초라인 유명하다는 거 알고 있었는데 토너패드도 있는줄 몰랐네요?! 순하게 데일리로 쓸 수 있을 것 같아서 기대돼요! 워시오프팩처럼 크림 사용하는 꿀팁은 오늘 한 번 해보려구요~ 항상 꿀팁 알려주는 언니  순한 진정 수분크림으로 구달 어성초 수분크림이 찰떡일듯해요,0.0,4개월 전
34,usercu4xp7gn6l,"우와 정말 기초화장품처럼 촉촉하고 발림 성이 부드러워 보여요 
촉촉하다고 해서 발랐는데 유분기 때문에 얼굴 간지럽고 붉어 지고 답답한 선크림이 많은데! 진정 효과가 있는 선크림이라니 효자템이네용 ㅎㅎ
구달 청귤 세럼을 써봤었는데 순하고 향도 좋고 발림성도 좋았어서 어성초 수분크림이랑 선크림도 사고 싶어요 !
어성초 성분이 잘 맞는 피부라 기대가 됩니
당 ",1.0,4개월 전(수정됨)
35,flowernoonsee7081,언니따라산제품들 다 너무 좋아서 이번 제품도 너무 기대돼용!!!! 피부에 안그래도 요즘 울긋불긋 트러블났는데 사용해보고싶어요,0.0,4개월 전
36,usertx8iy5yy9r,저는 평소에 피부가 너무 예민해서 시카 제품도 못 쓰고 어성초는 잘 맞아서 진정할 때 어성초만 쓰는데 영상 보니까 구달 제품이 너무 궁금해지기도 하고 써보고 싶어요! 진정템으로 쓰는 방법이 너무 좋은 것 같아서 저두 따라해보려구요 !! ,0.0,4개월 전
37,uservs4sr8ud8w,진짜 여드름은 그래도 이제 나도 케어해서 주변에 안나고 몇일있으면 가라앉게 할 수 있는 정도까지 됬는데 피부가 원래 예민한 건 어쩔 수 없나바여.. 구달은 진짜 제가 여드름케어하려고 여러 영상들 많이 보면서 알게 된 브랜드인데 한 번도 시도는 안해봤어요 그래서 여러 영상에서 언급됐는데 한번도 안써봐서 더 궁금한 것 같아요! 어성초는 특히 저 같은 예민하고 홍조끼 있는 사람한테 너무나도 좋은 성분으로 많이 알려져있어서 한 번쯤 경험해보고 싶었어요! 그래서 이번 영상이 뭔가 정말로 저와 비슷한 상황이라 더욱 와닿았고 이 상황에서 어떻게 하는지 꿀팁!도 알려주셔서 앞으로 기초할 때 화장품도 좀 줄여보는 것도 실천해봐야겠어요 암튼 정말 제 상황과 맞는 좋은 정보 얻어가요~~,0.0,4개월 전
38,userkg8og4ho3f,"얼굴에 열이 많고 자주 좁쌀도 올라오는데 너무 궁금해서 밤에 토너랑 크림 질렀습니다..
환절기라 자주 뒤집어져서 스트레스 너무 받아요.. 저도 받으면 관리 얼른 해야겠어요!! 제품 추천 감사합니당 구리궁 로벡틴 팩 진짜.. 너뮤 잘맞고 잘사용하고있어여🫶 추천템들다 잘맞아서 너무 좋습니당",0.0,4개월 전(수정됨)
39,userwo4jw1ub1k,우와 크림으로 워시오프팩이라니️상상도 못한 방법…진짜 언니 진정에 좋은 제품도 추천해주고 꿀팁이랑 케어 방법까지 너무 짱이에요요즘 피부 완전 뒤집어져서 고민 많았는데 오늘 당장 집에 있는 크림으로 해봐야지!!!구달 어성초 크림 어떨지도 너무 궁금하고 기대되네요,0.0,4개월 전
40,hh777,"어성초 제품이 제 피부에 맞다는거 너무 잘 알기때문에 구달에서 나온 어성초 크림이랑 토너패드 너무 기대되네요️ 저는 어성초 성분을 쓰고 
트러블을 달고 사는 사람이였는데
6개월동안 작은 여드름 조차 안나더라구요 근데 안쓰니깐 그 기간에 다시 나는것을보고 효과가 진짜 있었구나 느꼈었어요 어성초 제품을 기초에 꼭 넣어야겠다고 생각했는데
저는 구달에 토너패드를 마지막에 팩 하듯이 트러블이 잘 나는 부분에 올려놓으면 너무 좋을거같아요!!️️",0.0,4개월 전
41,userrd2xn9vu5o,헐 대박이다 저 피부 엄청 민감해서 피부 진정시켜주고 싶어요 그리고 지금 트러블이랑 뾰루지가 엄청 많이 나있고 턱주변에 뾰루지 엄청 큰 거 있어서 빨리 없애버리고 싶어요 진짜 언니처럼 피부가 엄청 깨끗해지고 애기피부가 되고 싶어요,0.0,4개월 전
42,userzs9of8ee1x,"좋은제품 소개 해주셔서 감사해요
계절이 여름으로 바뀌면서 피부가 건조하고 
트러블이 생겨서 고민입니다ㅠㅠ
혹시나 기회가 된다면 꼭 사용해보고 싶어요~",0.0,4개월 전
43,dahid012,"언니 저 진짜 거짓말안하고 구달 어성초 제 인생기초제품이예요ㅠㅠ
진짜 어성초가 한때 진짜 붐이 일어나서 엄청 유명했던 시기가 있었잔아요! 그때 많은 제품 사용해봤지만 가격도 저렴하고 제 얼굴에 딱 들어맞는게 구달 어성초 에센스였어요ㅎㅎ
병원가서 압출도 받고,약국에서 약도 처방받아서 발라보고 했을때도 안없어지고, 붉은기에 예민함 끝판왕이였던 제 피부가 조금씩 돌아오더라구요
저도 언니가 어성초 이렇게 좋아하시는지 몰랐는데 이렇게 잘 알고설명해주시니까 완전 더더더 믿음직스러워요!!요즘 진짜 피부에 유분이 엄청나서 그런지 좁쌀부터 붉은기가 없어지지 않아서 고민이였는데 수분크림이 있는걸 보니까 저도 지금 화난 제피부 진정시킬 수 있을것같아서 크림도 사용해보고싶네요",1.0,4개월 전
44,hsuk71190825,얼굴에 열 잘오르고 악건성에 요증 송화가루때문에 피부가 정말 벌겋벌겋한데 어성초 구달 기획세트를 소개해주니 넘 좋은팁 감사해요♡유리숍님의 꿀팁으로 오늘 세안과 반신욕 해보려고해요~~기대되요 구달~♡,0.0,4개월 전
45,userzy4yf2zu3n,와.. 크림으로 워시오브팩.. 따로 팩 안 사도 되고 진짜 좋은 것 같아요!!! 완전 대꿀팁…!!!!!! 크림이 리필 있는 것도 신기하고.. 저도 오늘 관리의 날로 정해서 진정루틴 해봐야겠어요ㅜㅜ 진짜 항상 유용한 정보 주시는 유리솝님 너무 감사해요🩷🩷🩷,0.0,4개월 전
46,daenggi83,"구달 맑은 어성초 진정 수분크림 어린 어성초가 들어서 더 피부를 진정시켜 준다니 마음에 드네요. 피부가 속건조가 심해서 갖가지 수분템 쓰는데 구달 맑은 어성초 진정크림도 써보고 싶네요^^ 저는 속건조가 심하다 보니 파데가 늘 뜨는데 화장전에 어성초 진정크림을 팩처럼 해봐야겠네요 ㅎㅎ 
맑은 어성초 진정 토너패드도 에센스가 듬뿍 들어가서 뚝뚝 떨어질 정도의 수분감이 좋네요. 피부 예민한 날은 닦토가 따가웠는데 찹토하니 좋아요^^",0.0,4개월 전
