,youtube_id,comment,like_num,comment_date
0,kwakyoongy,마지막 기우쌤 뭐야,328.0,9개월 전
1,userxe3wr7qk2i,장발만 보고 와 미친 개이쁘다 이러고있는데 마지막에 짧은머리 사진 보니까 주변에서 왜 자르라는지 알겠음.. 진짜 미친듯이 잘생겼다... 역시 머리카락은 거들기만 하는구나.. 너무 예쁘고 잘생겼다.. 와..와.. 그치만 핑크장발포니테일공주님 포기못함 머리길러주세요. 핑크포니테일하고 그거 흩날리면서 스케이트 타는거 홈마한테 찍혀주라..,29.0,9개월 전
2,DKwife0218,"라방도 열심히 챙겨보고 방송도 많이 챙겨보는 꽉진데요,,! 장발 진짜 미치도록 잘 어울려요ㅜㅜㅜㅜ 길면 길수록 더 예쁜.. 빠져든다 빠져들어..",284.0,9개월 전
3,tricotco89,"슬쩍 놀러온 꽉지입미다ㅏ
근데 정말 거짓말 안 하구 긴 것도 잘 어울리셔요....
레골라스 재질......곽골라스.....
패션을 넘어 헤어도 결국 얼굴이 중요한건가요.....
기우쌤 워낙 금손이신 거 정말 잘 아는데 우리 윤기선수님 헤어두 예쁘게(!!) 해주셔서 감사합니다",570.0,9개월 전(수정됨)
4,elivile,I'd love to see him with longer hair than he has now. It looks fantastic on him.,22.0,5개월 전
5,lattegreentea,"꽉지 놀러왔서여~~~ 곽골라스 만들어주셔서 감사해요 기우쌤!!! 
포니테일 날리면서 스켓팅하는것도 보고싶지만!! 혹시 언젠가 핑크가 지루해진다면 짧은 흑머 간절히...바랍니다..♡ 평창윤기 못잃어",142.0,9개월 전
6,mccnbinnie9840,"I absolutely love this episode, his pink long hair looks so beautiful ",124.0,9개월 전
7,doodod0,윤기님은 물론 핑크머리도 정말 잘어울리시지만 흑발  짧머는 포기할 수 없습니다ㅠㅜ 아니 흑발 짧머하면 10살은 어려보이신다구요ㅠㅜ 진짜 흑발 짧머진짜 개존잘이에요 거의 아이돌급,172.0,9개월 전
8,KyoungA0514,우와  기우쌤 채널 재밌게 봤었는데 여기에 윤기님이 나오실줄이야!!! 완전 대박이에요!!! 윤기님 머리 계속 길러주세요 어차피 인생은 지금이 중요하다구요!!! 너무 멋지고 포니테일 휘날리며 스케이트 타는 모습도 보고 싶어요~^^ 기우쌤 윤기님 머리 예쁘게 해주셔서 감사합니다 ,103.0,9개월 전
9,lovelykwak1226,긴머리가 이정도로 잘 어울리다니!!! 계속 길러주세요,80.0,9개월 전
10,userbe6pk1zm6f,이 합방을 정말 기다렸어요 핑크장발킹받고예뻐 벌칙느낌아니고 찐으로 예뻐ㅋㅋㅋㅋㅋㅋㅋㅋㅋ,17.0,9개월 전
11,userti6jj2up4x,"와 핑크 머리 익숙해져서 머리 계속 유지 하시라고 적으려 했는데 짧은머리 보고  이표정으로 놀랐어요.. 짧머 검은머리 진짜 역대급 으로 잘생겼어요 
짧머 핑크머리 갑시다",142.0,9개월 전
12,SUDAL0928,더 늙어서는 핑크장발하기 어려우니ㅋㅋㅋ 지금 할 수 있을 때 해보세요!!! 진짜 잘 어울려요ㅋㅋㅋㅋㅋ (짧머가 깔끔 핸섬 잘 어울리고 제 스타일이지만.. ㅋㅋ),41.0,9개월 전
13,nereida116,He is so full of energy!!! ,0.0,4개월 전
14,dosenoffneralice,"어음.. 장발도 진짜 잘어울리시는데요
머릿결 보니까 얼른 자르고 시간 날 때마다 트리트먼트 들이부으셔야 할 것 같은데요🫣 탈모윤기.... 괜찮아요?🥹",2.0,8개월 전
15,gyu5020,"언니 머리 기르자!!!! 너무 예쁘고 잘어울려🩷
와...!!!진짜 개 예쁘다...🩷잘생쁨이다...잘생겼는데 예쁘기 까지 해 ㅎㅎㅎ>.<
7:10 역시 기우쌤 센스... 귀걸이 까지 완벽 그 자체!!!!🩷
8:12 진짜 미치겠다!!!!!!!!!! 너무 예뻐 어떻게...🩷🩷🩷",26.0,9개월 전(수정됨)
16,userdb8xy5ql9k,어떻게 다 잘어울리세요...,1.0,5개월 전
17,silverb,윤기님 핑크장발 너무 예쁘고 잘어울리셔요~~ 기우쌤과의 콜라보 너무 좋네요!! ㅋㅋㅋㅋㅋ 최고최고!!,17.0,9개월 전
18,overgrownghost,"He is very handsome with short hair but he looks so very lovely with long hair, I hope he tries it and grows it out!! It fits him beautifully!! ㅠㅠ ",67.0,9개월 전
19,Stellaaaaa,이왕 이렇게 된거 포니테일 휘날리며 스케이팅 해보시죠 선수님 (이유:예쁘니까) 두 분 케미 너무 좋아요 그리고 핑키 곽윤지의 탄생 잘봤습니다 예쁜데...긴머리 늘어뜨리고 늠름하게 앉아 있는 모습이 킬포  마지막 핑크버전 기우쌤 마저도 킬포네욥 ,14.0,9개월 전(수정됨)
20,marvinraphaelmonfort8289,he looks great with short hair but pink long hair is so fun either are lovely! he should switch from short to long depending on the seasons hehe,1.0,3개월 전
21,gayathriscoups,i was smiling and controlling my laugh the whole video,4.0,9개월 전
22,sierrall801,He looks like he could be in an historical drama! I like the two tone color! Please keep growing!,41.0,9개월 전
23,deanaskinner127,Pink hair and all his masculinity is intact. He comes across across as confident in himself.,6.0,9개월 전
24,gyp01210,긴머리 잘 어울리셔서 '와~ 이렇게까지 잘 어울려?' 했는데 순간순간 나온 짧은 머리 사진보고 '왘 겁나 멋있네!!!' 했어요ㅎㅎㅎ,53.0,9개월 전
25,b0o0dlesn0o0dles,ohhhh long hair TOTALLY suits him!! He looks like elven royalty ,122.0,9개월 전
26,waaa2816,I’m jealous he looks good in both ,4.0,8개월 전
27,useryu5ty5gj5y,곽골라스 긴머리 너무 이쁘고 잘 어울리는데 검은머리 숏컷 진짜 너무 사기에요ㅠㅜ 잘생김을 10배는 더 잘 보여주는 스타일이라고 저는 감히 생각합니다....,39.0,9개월 전
28,munlight,"뭐야!! 이쁘잖아.. 
역시 중요한 건 꺾이지 않는 얼굴
계속 길러줘요🥹 진심 잘 어울림",30.0,9개월 전(수정됨)
29,userjl9pd5rs5q,제발 머리 계속 길러주세요... 핑크장발 너무 잘어울리시고 계속 보고싶어요 제발요 손바닥 싹싹싹싹 비비기권법,20.0,9개월 전
30,yooeep,와.... 와......... 저 오늘 한국왔는데 스케이트 타러 갈래요 끄읍 🥹 선수분들 다 넘 존경합니다🫶,185.0,9개월 전
31,ursulatorres401,"He looks great with both, short and long hair ",3.0,6개월 전
32,nonamell,세상에 이게..이쁘네요?! 잘 어울리기 쉽지 않은데..!!,10.0,9개월 전
33,dpsdldldlel,ㅋㅋㅋㅋㅋㅋㅋㅋㅋㅋㅋ 친절하게 짚어주시는 킹받 포인트 ㅋㅋㅋㅋㅋ 그치만 이뻐요,10.0,9개월 전
34,silvanirc6458,"Amei, tenho atualmente um cabelo com cor igual",4.0,9개월 전
35,useret3tm2bq5d,저도 기르고 있는데 진짜 잘 어울리세요!!,0.0,8개월 전
36,kangkang0625,크 역시 기우쌤은 안되는게 없군요 우리 핑키 예쁘게 만들어 주셔서 감사합니다️,19.0,9개월 전
37,biah9568,He actually looks good with long hair haha,25.0,9개월 전
38,shinegloss,헐 완전 잘어울려요 곽공주님,17.0,9개월 전
39,sinyo,"핑골라스 탄생,,
삔 응용ㅋㅋㅋㅋㅋㅋㅋ
역시 금손쌤,, 이런 모습 냄겨주셔서 감삼다🥹",19.0,9개월 전
40,gprud554,긴머리도 진짜 이쁘고 짧은머리는 넘 잘생겼어요 ><,3.0,9개월 전(수정됨)
41,dazim31,기른 것도 예쁘다고 생각했지만... 까만 숏컷 보니까 진짜 잘 생기셨네요. 잘라라!!,23.0,9개월 전
42,elle0321,"뭐야 초창기부터 응원하고 구독하던 선수 채널들끼리 언제 콜라보를
좋아요 누른거 보면 분명 올라왔을때 본걸텐데 왜 기억에 없어 뭐야
흑발시절 부터 좋아했지만... 이제는 핑크에 익숙해져버린",0.0,6개월 전(수정됨)
43,yonidaaa,"짧은 핑크머리 보고 싶어요^^
긴머리도 솔직히 잘어울리셔요~
마지막 기우쌤 핑크머리가 킹받네요 ㅋㅋㅋㅋㅋㅋ
빵터짐요~",1.0,9개월 전
44,AnizK,"곽윤기님 흑발 긴 생머리 하면 무슨 백제 귀족같을 것 같아요....... 진짜 너무 잘어울리시구ㅠㅠ
짧은머리도 긴머리도 너무 좋지만 긴머리 특히 좋네요 ♡",0.0,5개월 전
45,chaitealatte,"그냥 뒤에 사진 없었으면 기르시라고 할 뻔 했는데 왤케 잘 생기신거예요 짧은 머리 
짧은 머리 추천이요!!!",7.0,9개월 전
46,TheEscapistDreamer,"Guys that look feminine aren't really my thing, but this guy looks absolutely adorable. He looks pretty. Loved it!",1.0,9개월 전(수정됨)
47,userkj2nn3yw8b,"흑발짧머 보기 전엔 긴머리 미쳐따..라고 생각했는데 흑발짧머 보니까 그전에 본 핑머가 머릿속에서 사라져버렸습니다…
대존잘이셨군요…",19.0,9개월 전
48,uservk2lr8vj2v,아니 진짜 보면서 대박 대박..이러면서 보는데 진짜 잘어울리셔서 킹받는다고 했을때 에?!어째서요???이러고 있었잖아요ㅋㅋㅋㅋ,1.0,9개월 전
49,phoebelough9027,"He should grow his hair out exactly like that, except he should leave it his natural hair color. It looks SO good on him!",1.0,7개월 전
50,useryo9zg9rq8s,짧은건 존잘긴 건 잘어울려서 킹받는데 귀여운거 같으면서도 킹받아요!!!ㅋㅋㅋㅋㅋㅋㅋㅋ관리하기 힘드실테니!기르지마세요!!!머리말리는데 1시간 넘게 걸릴지도...,1.0,9개월 전
51,nueosp,"긴머리 너무 예쁜데..???ㅋㅋㅋㅋㅋ
이왕 기르는거 시원하게 길러보는거 어때요 ㅋㅋ
내년 여름에 확 짧게 치시고 ",4.0,9개월 전
52,bettyberi,The long pink hair suits him really well ,1.0,9개월 전
53,userez2pc2rm3l,장발도 너무 예쁘시지만... 8:37 이 사진 보고 입틀막.. 진짜 너무너무 잘생겼다.......,6.0,9개월 전
54,uservq2xb7gs9r,와 진짜 예쁨과 잘생김은 한끗차이구나.... 미친 본판 넘 예쁘다,0.0,9개월 전
55,ellipiganbarimasu2641,"The long hair looks amazing, but yoongy in short, black hair just screams handsome oppa that came out from a manhwa!!",15.0,9개월 전
56,Kamecula,"I love the long hair, honestly. He looks like a fairytale prince with it or some historical drama actor, but that's my bias for long hair too.",2.0,9개월 전
57,userwi1zt9cy9k,"와 진심  핑크장발 개이쁘시다!!!
입 헤~~벌리고있는데
중간에 검은숏컷 사진보니 이건 또 왤케 잘생김 뿜뿜이시죠????
숏컷대박..ㅠㅠ 짧은머리너무 잘 어울려요!
전 숏컷에 한표",5.0,9개월 전
58,nyong,"뭐야 뭐지????
긴머리 왜케 위화감없이 잘 어울려??ㅋㅋㅋ
진짜 공주다 공주",4.0,9개월 전
59,daviniakeller4181,He looks handsome with both long and short hair.,1.0,8개월 전
60,userit8mh9ih3d,어정쩡한 거지존은 진짜 별론데 아예 길거나 짧으니까 찰떡쿵떡이네요 완전 잘 어울림!!!! 긴 머리 반 묶음한 거 너무 잘 어울려요 ㅎㅎㅎ 함 길라보즈아!!!,1.0,9개월 전
61,useror6sk3oy1z,핑키 융기가 좋긴하지만 평창 윤기를 아직 못잃은 사람으로써 흑발짧은 윤기는 잊지못해요ㅠㅠ1년넘게 흑발 존버 중입니다ㅠㅠㅠㅠㅠ,3.0,9개월 전
62,imemoasfrick,It actually looks so so pretty long!!,2.0,9개월 전
63,ARMYrv1nj,"긴머리도 잘 어울리지만 짧은머리 윤기님이 최애스타일이에요 ㅠㅠ 중간중간 머리 묶을때, 맨 마지막에 자료사진 올라올때 몇번을 심쿵 당했는지ㅠ",1.0,9개월 전
64,eungdi89,우리공주님잘부탁드려요,307.0,9개월 전
65,eungdi89,긴머리넘잘어울리신데~계속길러주세요  사실어떤머리던 잘어울리세요,11.0,9개월 전
66,userxd9hg5vt8y,"영상 속 긴머리야 기우쌤이 어느정도 스타일링 해주셔서 잘 어울리지만 선수님 평소에는 그냥 꽉 묶고 다니실거잖아효,,,,ㅋㅋㅋㅋ큐ㅠㅠㅠㅠ
젭알 흑발 짧머 곽윤기 돌아와아아아앙아아아앙",2.0,9개월 전
67,Sachiihero,I love his long pink hair,1.0,8개월 전
68,usernq1vr2fv9l,완전 잘어울려요 핑크핑크 긴머리 가봅시다 ,0.0,8개월 전
69,shogunkayooo,He looks wayyy prettier with long hair ,1.0,9개월 전
70,userwx3ff1qd4c,짧은 머리 완전 너무 진짜 잘어울려요…긴머리도 어울리지만 짧은 머리는 완전 넘사벽,0.0,8개월 전
71,xxxcxxx2253,He looks great in long hair :),3.0,9개월 전
72,usernf7qu7eu4f,뭐야뭐야... 소설 속 주인공같아요 겁나 멋있음..,2.0,9개월 전
73,kwakshine1226,완전 잘 어울려요 ...  진짜 그리스 로마 신화에 나오는 신 같아요  거짓말 뻥 아니고 진짜로,6.0,9개월 전
74,isunlion,장발 진짜 잘 어울리십니다...!,0.0,8개월 전
75,pjy980325,"진짜 핑크긴머리 너무 잘 어울린다고 생각해서 기르시면 진짜 잘 어울릴거같다고 생각했는데 오우,, 짧은머리+흑발 보자마자  왜 다들 자르라고 하는지 알겠는걸요··?짧은머리흑발쵝오🫶",0.0,9개월 전
76,userbu6yw2yr2z,긴머리도 예쁘지만 짧은머리 정말 잘생기심~~  윤기님 팬~~♡♡,0.0,9개월 전
77,rigelr5345,"I thought he was kinda goofy and silly (in a good way), but then at the end I find out he's an Olympic skater like WTF xD",15.0,9개월 전(수정됨)
78,usergf9oi7sj7n,아니 진짜로 너무 예뻐요..!!!!!,1.0,9개월 전
79,userfd1nw9se7e,Чудно ! ,0.0,9개월 전
80,userri8oi6vx3o,긴머리진짜 잘어울려요 !!!,2.0,9개월 전
81,lamborjinni,핑크가 세상에서 제일 잘 어울리는 남자..,23.0,9개월 전
82,Ririroa,"4:46 엄청 이쁜데....?? ㄹㅇ로 잘 어울리는...

이유 쓰래서 쓰려는데 막상 쓰려니가 뭘 써야할지 모르겠네
진짜 진짜 완전 거짓말 하나도 안 하고 진짜 잘 어울려요 이목구비가 워낙 강해서 긴머리 완전 잘 어울림요 기우쌤 말마따나 제가 살면서 긴 머리 남자들은 다들 이목구비가 강하더라고요 특히 외국 남자들이 잘 어울리는 이유가 눈코입이 뙇! 해서 그런게 아닌가 싶음 게다그 핑크라니 이렇게 이쁠수가 없음!! 기르는 김에 확 기르시고 그다음에 확 자르는것도 나쁘지 않을것 같네요 홍홍홍
뭘 쓸지 모른다고 했는데 꽤 많이 뭐라 했네요 이만 줄이겠습니다 ㅎㅎ",1.0,9개월 전(수정됨)
83,omgyislsy,예전엔 제발 숏컷 흑발! 이랬는데 이 영상을 보니 확 길러보는것도 나쁘지 않을거 같아요!,1.0,9개월 전
84,giovanninasuluh,Long hair is so attractive! I love it!,1.0,8개월 전
85,userun2wz9ki7y,어머.. 언니….🫢오늘 왜캐 이뻐!!,0.0,9개월 전
86,joanne9350,우아...너무 잘어울리셔...반함...,0.0,9개월 전
87,6d3c32,本当に可愛くてお綺麗で素敵,1.0,9개월 전
88,yunkinaneunsongwol,"9:07 기우쌤은 이게 왜 잘어울리는거지...?
ㅋㅋㅋㅋㅋㅋㅋㅋㅋㅋㅋㅋㅋㅋ
아니 윤기님 진심 긴머리도 잘어울리시는데요..?
근데 짧머도 미쳤다....",0.0,9개월 전
89,Tbuun,"와,, 근데 진짜 사극드라마 나올거같이 생기셨다",1.0,9개월 전
90,jungdalcom,"ㅋㅋㅋㅋㅋㅋ 이걸 왜 이제봤지 ㅋㅋㅋ 썸네일만 보고 터지긴 오랜만이네 ㅋㅋㅋㅋㅋ
국가대표를 보고 웃기다고 생각하는건 쉽지않은데 ㅋㅋㅋㅋㅋ 아니 긴머리 잘어울리거든요?? 근데 마지막 사진 보니까.. 잘라야될거같아옄ㅋㅋㅋㅋㅋㅋㅋㅋㅋㅋㅋㅋㅋ",0.0,8개월 전(수정됨)
91,goodday3150,흑발 혹은 갈색으로 염색해서 오래 전처럼 숏컷하시면 더 멋있으실 것 같아요! 지금머리도 이쁘고 멋있지만. 과거 짧은 머리 땐 정말 더 분위기있으시고 훨씬 더 멋있어요. 흑발에 짧은 머리때가 잘생긴 얼굴이 더 잘 드러나셔서  더 좋아요! 개인적인 의견이니까 참고만 부탁드려요~ 윤기선수 언제나 응원할게요^^,1.0,9개월 전(수정됨)
92,ste1la,와 긴머리 잘어울린다고 하려고 다짐했는데 짦은머리 컷 보고 도저히 말이 안나온다,1.0,9개월 전
93,elainebaleia6333,Abraços do Brasil 🇧🇷🇧🇷🇧🇷,0.0,9개월 전
94,usermg2oc1bx5f,긴머리 진짜잘어울린다ㅋㅋ,1.0,9개월 전
95,useref7lr9hm3p,과감히 자르시길~!! 짧은어리  너무 잘생기셨어요~와~,0.0,9개월 전
96,blueribbon44,"곽윤기 선수님, 반지의 제왕에 나오는 레골라스 같으세요.  긴머리 잘 어울리시는데... 기록에는 안좋을까요? ㅎㅎ;;   오늘도 즐거운 영상 만들어주셔서 감사합니다~ ",1.0,8개월 전
97,shuahae3327,Long pink hair suits his vibe ,1.0,8개월 전
98,tessketo5387,Your hair is beautiful keep it the way you want it. You look good with long hair and short hair.,2.0,9개월 전
99,raftrainydayz3163,I think you should do what is right for you. Short or a little length is my vote!  화이팅! ,0.0,9개월 전
100,useryc2pu8rl3n,"ㅋㅋㅋㅋㅋㅋㅋㅋㅋ긴머리 진짜 잘 어울린다 생각했는데 짧머 왤케 잘생겼냐,,,",0.0,9개월 전
101,baakojernigan7095,"He looks good with both but I prefer short hair personally, it gives Gong Yoo vibes",2.0,9개월 전
102,gimongiskz,"썸네일ㅋㅋㅋㅋㅋㅋ
그나저나 너무 예쁜데요...?
꼭 기릅시다..",16.0,9개월 전(수정됨)
103,sibagyeon,이것도 잘 어울리신다..,0.0,9개월 전
104,userrs3pi9no9w,진심... 잘 어울리심.... 근데 또 짧은 머리 왤케 잘생겼.... ㅠㅠ  아.... 그래도 기릅시다!!!! ㅋㅋ,1.0,9개월 전
105,bluedy9uk,핑크 롱헤어도 넘 이쁘고 잘 어울려서 킹받..ㅋㅋㅋ하지만 평창올림픽때 흑발 존잘 사진 잊을수가 없어요..머리도 너무 상했고 이제 돌아올때 됐으ㅎㅎ,7.0,9개월 전
106,killjoy8372,i love men with long hair  i wish more men would have hair this long it always looks so good~~,1.0,8개월 전
107,930209JY,진쟈르 장발도 존잘이야... 하고시픈 머리면 뭐든 다 좋지만,1.0,9개월 전
108,hayl3762,까만 머리로 길면 사극 느낌나서 멋있을 것 같아요,0.0,7개월 전
109,userlc8cu9th5q,오!꽉윤 업로드랑 바로바로! 완전장발로 가도 될것같은데요?! 헬멧쓰고 달리면 진짜 이쁘게 날리겠는데요 ,3.0,9개월 전
110,wonder3747,위쳐인줄알았어여 장발도 멋지네요 얼굴도 국가대표~,0.0,8개월 전
111,bombomd,공주님 너무 잘 어울리세요,0.0,9개월 전
112,anya2732,Pink long hair suits him but omg he’s so handsome and more charismatic with short dark hair,1.0,9개월 전
113,Annaxn7zc,레골라스같은 분위기 나서 잘어울려욬ㅋㅋㅋㅋㅋㅋ 무협지같기도하고 ㅋㅋㅋ 소매통 큰 옷까지입고 스케이트 타면 진짜 무협지같겠네요,3.0,9개월 전
114,uservi4ql1wb8z,"후 뭔가 킹받는데 이뻐요️️ㅋㅋㅋㅋㅋ기우쌤 덕분일까요….???
어차피 꽉지들은 존잘 짧은 흑발 실컷 봤으니 하고싶은거 실컷 해요~~~!! 언제 길러보겠어요오오
어차피 나중엔 저 존잘머리로 돌아오게 돼있으니까…..",1.0,9개월 전(수정됨)
115,userbk6mc4ol7b,근데 장발 괜찮아서 놀랬어요ㅋㅋㅋㅋ 검은색이라고 생각하면 사극드라마 나오는 무사같기도 하고 멋져요,2.0,9개월 전
116,useruh6te1iv5f,짧은 머리는 멋있고 긴 머리는 예쁘다. ,1.0,9개월 전
117,haejinan8253,아니 제발 길러주세요 제발....잘생쁨의 정석이야ㅠㅠㅠㅠㅠ,1.0,9개월 전
118,yeeseo,곽윤기 is 뭔들.. 긴 머리 짧은 머리 다 좋아요!!!,1.0,9개월 전
119,lqqqo3z323,너무 예뻐서 사구라인줄....,0.0,9개월 전
120,usermb8ps9ok2e,윤기 언니 너무 예뻐요ㅎㅎ,2.0,9개월 전
121,usercs5ck9bc5i,윤기언니 미모 열일하네,3.0,9개월 전
122,namitagunwant,Omg i loveeeee it like lovvveee it i didn't know who this person was but fr tho thiss hair suits him sooo goood,1.0,8개월 전
123,userod6le9mg6j,짧머 흑발만을 기다리고 있어요...ㅠㅠㅠㅠㅠ 윤기가 행복하면 그걸로 됐다... 하 ... ㅠ,1.0,9개월 전
124,kadiykay7746,cut it and make it healthier then let it be long as you want either way you look great,2.0,9개월 전
125,BabyRoseNim,얼굴천재라 긴머리도 예뻐요️,1.0,9개월 전
126,knowwin10,너무 이쁜거아니예요 ㅎㅎ 역시 완성은 얼굴인가봐요 흑발짤머파인데 핑크장머도 너무 잘어울림..,0.0,9개월 전
127,Theherbalempress,Keep it! It makes you look hip and unique  I also like skating although I haven’t gone since I got pregnant last year ):,0.0,9개월 전
128,icyfrost1226,제발 길러주세요 제발 진짜 너무 잘 어울려서 눈물 나거든요 꼭 길러주시기예오,1.0,9개월 전
129,sjhan1133,자릅시다!! 긴머리 정말 잘 어울리고 예쁜데 짧은 머리 사진보니 짧은 머리가 윈!!!! 검은짧은머리 곽선수님도 보고싶어요!!!,0.0,9개월 전(수정됨)
130,Sia0221,핑크 롱헤어도 예쁘긴 예쁜데...윤기님 흑발에 짧은머리 너~~~~~~~~무 잘생겼어요!!! 제발 흑발에 짧은머리 해주세요!!!,0.0,9개월 전
131,userwieudhd,곽윤기 오랜만이다ㅠㅠㅠㅠ,0.0,8개월 전
132,roxisawolf,"OMg you look so good in pink !!!  I think you should grow your hair, it suits you so well ! Would you have yhe patience for it though, that's another question !",0.0,9개월 전
133,userqf7xf3dw9s,뭐야 짧은머리 개잘생겼잖아,0.0,9개월 전
134,usermh7cq8lm5v,와 드럽게 잘생겼네. 형 둘 다 잘 어울리니까 형 끌리는대로 가시죠,0.0,7개월 전
135,yejini,우리 곽공주.... 핑크머리 찰떡이지만 흑발 짧머 존버합니다....ㅎㅎㅎ,1.0,9개월 전
136,Winteriz1ub,"장발도 예쁜데, 짧은건 개잘생겼어",0.0,9개월 전(수정됨)
137,userzh3in1fn8y,흑발 숏컷 윤기님 비주얼보고 깜놀ㄷㄷㄷ 하지만 흑발 숏컷은 언제든지 맘만 먹음 가능하니까 앞머리없는 깔끔한 장발의 레골라스 스타일 지금 추진해보시는것도 좋은것 같아요.,1.0,9개월 전
138,usereg3dq1vd2z,"길러야 되는 이유 vs 잘라야 하는 이유 하는데, 잘라야하는 이유 하면서 띄운 사진 보고 누가 길러야한다고 하겠어요 ㅋㅋㅋㅋㅋㅋㅋㅋㅋ 윤기오빠 당장 자르세요",1.0,9개월 전
139,userze5mg6eb2q,차분한 말투 목소리 좋음 머리만지는 고운 손짓.. 거울 볼때마다 멍하니 꼭 오른쪽 옆으로 기우는데 왤케 예쁜지ㅋ 이쁜짓 해달라고하더니 전 하고싶은거 다했대ㅋㅋㅋ 매력이 넘치시네요 ㅋ,0.0,9개월 전
140,catladynikki2024, Pink man made me laughing. Adorable man!,2.0,9개월 전
141,userzu5jf5cv7v,짧은 머리가 대박 잘어울려요,0.0,7개월 전
142,userwh7rd2jh7u,ㅋㅋㅋㅋㅋㅋㅋㅋㅋㅋㅋㅋㅋㅋㅋㅋㅋㅋ아 잘어울려 개열받앜ㅋㅋㅋㅋㅋㅋㅋㅋㅋㅋㅋㅋㅋㅋㅋㅋㅋㅋㅋㅋㅋㅋㅋㅋㅋ 무협같은거 찍을거같아요 너무 잘어울렼ㅋㅋㅋㅋㅋㅋㅋㅋㅋㅋㅋㅋㅋㅋㅋㅋㅋㅋㅋㅋㅋㅋㅋㅋㅋ,0.0,8개월 전
143,uservp2po9tr9x,아 진짜 기르란거 자기 아니라고 기르라고 하는거에요!!!! 다 거짓말이야!! 짧은 머리가 100배 1000배 잘생겼는데!! 긴머리도 긴머리지만 오빤 무조건 짧은머리라고요ㅠㅠㅠㅠ,1.0,9개월 전
144,usermb8ud5eq7p,젊을 때 하고싶은 거 다 해봐야 후회가 없어요~~~~~ !!!!!!!,0.0,9개월 전
145,LeSiA,"짧머 흑발 진심 존잘,,, 핑크장발은 가끔 가발로 즐기고 짧머로 갑시다...!!",0.0,9개월 전
146,alexach,You need to grow your hair and keep it pink. You look so handsome ️️️,0.0,9개월 전
147,YoonGyKwak,"장발 이정도로 어울리기 힘들지, ! 기를수 있을때까지 가보자! ㅎㅎ",1.0,9개월 전
148,userwd9he5kt6h,"귀걸이없어섴ㅋㅋㅋㅋㅋ집게핀으롴ㅋㅋㅋㅋㅋㅋ
매력뿜뿌다 증말",0.0,8개월 전
149,sejinroom,"️: 혹시 토닝샴푸 쓰시나요?
️: 추천 받았는데 좋아서 계속쓰고있어요
️:어라 혹시 어떤거에요?
️:이거 어네이즈 토닝샴푸라고 좋더라구여
️: 그거 제가 만든거에여
️️: …
첫만남 썰의 주인공들이 만났습니다",4.0,9개월 전
150,jeeyoonsung1326,사극드라마 배우한번 갑시다… 잘생긴 장발남캐 가자아아,0.0,9개월 전
151,usermr8ll2ov6l,이쁘시면서 잘생기셨어요~!,0.0,9개월 전
152,uservm8lk8fq2u,장발 괜찮은데 하고 보다가 마지막에 검은숏컷보고 순간 놀래서 본체 랙걸림 ㄷㄷ 댕멋짐..,0.0,4개월 전
153,uservd1mi9om1k,"머리 기른거 너무 잘어울리는데
핑크로는 아닌거 같아요 ㅋㅋ
검은색 장발로 상상했는데 존잘",3.0,9개월 전
154,yrchen713,"머리 기르세요! 의외로 매력에 빠졌어요ㅋㅋㅋ
짧게 자르면 그냥 보통 남자.
번역기로 했는데 잘못 번역된 부분이 없었으면 좋겠어요.",0.0,9개월 전
155,uservl9jh2zv2x,"와~~ 짧은 머리 진짜 멋지다!
제발 짧게 해주세요",0.0,6개월 전
156,ssoo0815,진짜 예뻐서 킹받는다,0.0,9개월 전
157,amlkfnew,I vote short But it's impressive how you can do both.,0.0,8개월 전
158,userkt5ts5ly6t,너무 잘 어울리는데 장발 가즈아~,0.0,4개월 전
159,BaeKyeongJin,긴머리도 잘 어울리는데 그래도 윤기선수님 짧은 머리가 너무너무너무 더 찰떡이에요!!,0.0,9개월 전
160,usermo3sd4cx1x,머리가 그리스로마신화에 나올법한 느낌인데 생각보다 잘 어울리는거같아요,5.0,9개월 전
161,userjj8ns8ep8k,판타지물에 나올법한 언니에요..,4.0,9개월 전
162,try9749,both long and short looks amazing but bestie you better keep the pink color,0.0,9개월 전
163,userms3np8rs3m,하 기른것도이쁘신데… 짦머 보고  놀랐어요 아니ㅠㅠㅠ 하아 핑짧머 어떠세요…,0.0,9개월 전
