,youtube_id,comment,like_num,comment_date
225,christinadessl6212,처음에는 그 긴 머리를 가진 여자인 줄 알았다. 두 헤어 스타일 모두 멋지게 보입니다. 헤어 스타일리스트는 훌륭한 일을했습니다,1.0,3개월 전
226,userpz2ep6bn2h,진짜 둘다 머리를 가만히 못두는거 보다가 개터짐 ㅋㅋㅋㅋㅋㅋㅋㅋㅋ 뒤로 넘기면 앞으로 넘기고 뒤로 넘기면 앞으로 넘기고 뒤로 넘기면 앞으로 넘기고 ㅋㅋㅋㅋㅋㅋㅋㅋㅋㅋㅋㅋㅋㅋㅋㅋ,1.0,3개월 전
227,alisaalicx7528,thank you for your donation .....he has beautiful hair and soul,1.0,3개월 전
228,yasuo03YouTube,와...진짜 변화가 너무 많네요..가족분들 눈 마주치면 못 알아보실 정도로 스타일 변화가 되었네요 역시 스타일링은 기우쌤!,87.0,4개월 전
229,twentysevenand,Not just a cool guy but a great man.,2.0,4개월 전
230,mjsong4220,"짧은 머리 잘어울려요^^ ///
마음도 멋지시고~앞날에 꽃길밀 펼쳐지길~~~~~~~",2.0,2개월 전
231,DDiv9po,"맘도 잘생기고 얼굴도 잘생기고 완벽하네,,,",1.0,1개월 전
232,goblinrights,his hair is so fucking pretty dude. i hope he grows it out again,1.0,3개월 전
233,userdm4kb4we7o,심지어 잘생겼어!!! 바른학생 앞날이 더 빛나길 바래요,1.0,1개월 전
234,usermc8fp3yv2q,"처음으로 기우쌤이 아닌 출연자 분께 눈길이 뺏긴 순간.. 마음도 얼굴도 너무 훈훈한 영상이었어요! 
너무 마음이 예쁘셔서 좋은 일 많이 생기실 것 같아요~! 머리 자르신 모습도 너무 멋있으세요!",61.0,4개월 전
235,108revathy3,This is so wholesome ,0.0,4개월 전
236,kimeunjeong896,엇 저도 기부하려고 기르고 잇는데 쉽지않아요 대단하신 분이시네요   게다가 앞머리까지 ㅎ,0.0,4개월 전
237,michelleh1464,"I love his long hair, it looks beautiful on him :)",0.0,1일 전
238,soony0610,오우근데매력있엌ㅋㄱ아니너무잘어울렼ㅋㅋㅋㅋㄱㅋㅋㄱㅋㄱㅋㅋ머리짜른거아까워요ㅠ진짜잘어울렼ㅋ앞머리까지있으니까 뭔가되게 특이하고 매력있어 와심지어 양갈래도잘어울렼ㅋㅋ모델같아요!!! 오근데짜른것도 멋져...페이스가 엄청 매력있어요! 오우 앞에머리짜르고 뒷머리긴것도 잘어울려ㅋㅋㄲㅋ머리짜르고 완전인기많아졌겠닼ㅋㅋㄱㅋㅋㄱㅋㅋ,0.0,1개월 전(수정됨)
239,Nicole91,"세상에,...  머리 자르기전 모습은 귀여운 소녀같으세요!!",0.0,1개월 전
240,userql2pd5vo1n,진짜 너무 멋지시네요. 전 여자인데도 저정도로 길러본적 없는데 관리하기도 힘들었을거같고 더우셨을텐데 좋은일을 위해 참으셨겠네요. 군대 건강히 잘 다녀오시길,72.0,4개월 전
241,userkr4by3om4t,와근데 진짜 머리 자르니까 너무 잘생겼다…….,1.0,1개월 전
242,userpu4ti2dz4g,"옆머리 넘기는 모습이 왜이렇게 자연스러우신가. ㅎㅎ
큰 결심하셨네요.",1.0,4개월 전(수정됨)
243,mozoltov1014,기우쌤 이번편이 최고 좋아요,0.0,3개월 전
244,SLio9cn,"정말 헤어스타일의
중요성 !!!!",1.0,3개월 전
245,JHcf4qb,와.. 제가 본 사람중에 머리 기른이유가 가장 고결하시네요. 멋있습니다,1.0,4개월 전
246,milk0107,딱 봐도 너무 사람 좋으신 분  잘 어울려요!! 멋진  짧은 머리 찐하게 잘 즐기시고 군대도 잘다녀오세요!!!! 파이팅️‍,38.0,4개월 전
247,userpr2yd6yi2x,다 이쁜데 마지막에 짧은 머리에 긴 머리 대신거 진짜 잘 어울리신다..  뭔가 나중에 붙임머리하셔도 이쁘실꺼 같아요 모델같아요!!,0.0,2개월 전
248,diaphonis,Pero que chico tan adorable!!! Eso si.... Es más femenino que yo xD es super adorable,0.0,2개월 전
249,userec2uq6dg9q,세상엔 아직 선한 사람들이 남아있구나..,1.0,3개월 전
250,park3097,기부하시는 모습 너무 멋지네요.,0.0,4개월 전
251,LimeyKat,"He was sad to see it go, but also loved his new haircut. ",0.0,3개월 전
252,Carambolases,"장한 친구네요~~~ 저도 14년에 3년 반가량 기른 머리를 이발 후 한국백혈병소아암협회에 기증한 기억이 있는데, 뿌듯하면서도 협회 2층에 아이들 웃는 소리가 들려서 마음이 뭔가 애뜻했어요.. 훤칠한 친구가 참 멋있다는 생각 듭니다!! 굿잡!!",770.0,4개월 전
253,userfu5ql2yd9c,멋지십니다 복받으실거에요~~~~,1.0,4개월 전
254,LanaejaB,He’s awesome  he would’ve looked cool with a mullet too ,0.0,3개월 전
255,khalessi19,"Muy bonito gesto, y buena desicion se ve muuuy guapo con el pelo corto ",0.0,2개월 전
256,userof4ne6fn6g,"멋진 청년이네요~^^
군복무 잘 하구 오세요~~",1.0,4개월 전
257,userfj1ge6zg6r,머리길으면 예쁘고~자르니 멋있어요~~그리고 소아암 환자들한테도 도와주고 마음이 따뜻하네요~~,0.0,4개월 전
258,userpj1xh2ly4x,정말 멋진 친구네요. 남자분이어서 머리기르는데 어려운 일이 더 많았을텐데...  건강히 군대도 잘 다녀오고 모든 날들에 축복 가득하길 기도합니다.,45.0,4개월 전
259,beelzemobabbity,"The long hair suits him so well, the bangs especially",0.0,3개월 전
260,userhh1eo3lf1s,와 잘생기셨다. 어떤 머리도 소화 가능하시네요. 마인드도 멋있으심.,0.0,4개월 전
261,gsilveroak,"He is very handsome with either style, and he also has a wonderful heart.",1.0,4개월 전
262,userye8zc4rn1c,와..근데 머리 장발일때 남자분 진짜 청순하시다..ㄷㄷㄷ 혹시 머릿결관리는 대체 어떻게 하신거에요?!! 비법 좀 알려주세요ㅠㅜㅜㅜ 저 중단발인데 머리 다시 안상하게 기르고싶네여 저도ㅠㅜㅜ 맨날 상해가지고 계속 단발..ㅠㅜ..푸..,1.0,4개월 전
263,holycow8743,"He looks really handsome with a short haircut~~^^ is it just me, but I feel like his voice changed after his haircut shorterㅋㅋ",2.0,3개월 전(수정됨)
264,Rebeccack8fn,"That's really wonderful and so kind, I bet whoever receives your hair as a gift will make them really happy.",15.0,4개월 전
265,noah1502,aw he looked so good with that long hair style! super cute,1.0,3개월 전
266,Nalixv,His hair is literally so pretty and silkier than mine ,0.0,4개월 전
267,BlueRabbit87,막연하게 기른게 아니라 좀 즐긴거같은데ㅋㅋㅋㅋㅋㅋㅋ ㅋㅋㅋㅋㅋㅋㅋㅋㅋㅋ,26.0,2개월 전
268,asami5060,彼の優しさにとても感動しました,1.0,4개월 전
269,userxx4zf6pb7q,너무 착하세요. 누구나 할수 있어도 하지않는 일이잖아요. 너무 멋있어요,0.0,2주 전
270,userfl5lx3ku5c,"너무 멋있는 분이세요!
신념도 확고하시고 정말 본받고
싶네요^^
군복무 건강하고 안전히 하시고
언제나 행복하셨으면 합니다.",107.0,4개월 전
271,elizarayuputri5638,I know I shouldn't. But I envy him. He got such nice hair I dream to have ,0.0,4개월 전
272,srnovianti5990,What a great story behind that long hair ️,1.0,3개월 전
273,perrydisecabin5947,Happy Day!! Looks way better now with short hair. Details of your face shine through now !,0.0,2개월 전
274,lornastudd9969,What a stunning transformation. Such a handsome gentleman emerged.,0.0,1개월 전
275,kiimGeena63,já era lindo e ficou mais bonito Ainda ,1.0,3개월 전
276,ESTHER77,"진짜 저보다 머릿결 좋으셔서 놀라서 보다가 
머리카락 잘리는 순간에 제가 울컥해써요 
이만큼 길러오신 시간동안 수많은 노력과 용기가 필요하셨을 텐데 
마음이 너무 이쁘고 대단하세요ㅠㅠ",63.0,4개월 전
277,userbx2cz8sp8s,외모도 마음도 훈훈한분!,0.0,2개월 전
278,Nani0613,"His hair is gorgeous, and it's nice when people cut off their hair to donate it",0.0,4개월 전
279,GOLDENRING,이채널 보면서 오늘이 가장 가장 흐뭇하게 봤네요 멋져요 청년,1.0,1개월 전
280,sugarapplepie,His hair looked so pretty when it was long! Not even many girls get nice long hair like that. He looks good in both styles.. I initially thought he was a girl with the long hair because he looks so pretty ,1.0,4개월 전
281,thwlssla00,"와 진짜 멋지고..
얼굴도 잘생기셨네요..",0.0,3개월 전
282,seo0h,"숏컷 실물로 보고 깜짝 놀랐어요... 정말 금손이셔요...!
저도 못 기르는 머리를,,, 좋은 목적을 위해 열심히 기른 멋진 정민이에게 좋은 댓글만 부탁드립니다!! ",289.0,4개월 전
283,ilive4anime,Yoon (from StayC ) has amazing bangs. I have crowned her #1 in rank of idols with blunt bangs,0.0,3개월 전
284,flaviaLeitte1,Muito melhor de cabelo curto!,0.0,4개월 전
285,shikha103,My god his hair was so dreamy. He just looked so handsome with that long hair,1.0,3개월 전
286,Lily0bigday,뉴진슼ㅋㅋㅋㅋㅋㅋㅋㅋ 아 너무 유쾌하고 멋진 청년이네요!! ,0.0,3개월 전
287,sohyun1980,멋진청년이다. 얼굴이 참 잘생겼어요. 마음도 이쁘네요 ,2.0,1개월 전
288,meho3164,눈팅만 내내 하다가 댓글을 다네요. 마인드가 너무 멋있으세요. 성격이나 인상도 마음 만큼이나 밝고 선하셔서 보는 내내 기분이 참 좋았습니다. 저 긴 머리를 싹뚝 자르는데 기분이 되게 묘하셨을것 같아요 개운하기도 하고ㅋㅋ 군대 사고 없이 잘 다녀오시길 바랄게요. 늘 건강하고 행복하세요,27.0,4개월 전
289,userpr7jx7de8s,"마음도 멋지고 예쁜
진짜  잘생긴 청년이네요",0.0,2개월 전
290,leeyx1ve,"축복합니다.
울 딸도  대학생될때 까지  2번  길러  소아암 어린이들에게  머리 기부하는 '어머나'에  기부하려고  2번  길렀는데  관리가  쉽지않죠.",0.0,3개월 전(수정됨)
291,userns1pp2lb1c,"훌륭한 청년이네요~
짧은머리하니 넘 잘 어울리고
잘생겨진것같아요",0.0,2주 전
292,juyeonglee1605,전체적으로 풍귀는 분위기가 뭔가 중성적이셔서 진짜 오해 많이 받으셨을 것 같아요~ 선한 영향력을 위해 그런 오해를 다 견뎌내셨다니 대단합니다!,0.0,2개월 전
293,luziaangelodeoliveirasouza2247,Ficou muito lindo,1.0,3개월 전
294,userxt6jj5of8g,"정말 뜻깊은마음가짐을갖고 실천하는 선한청년이네요~~기부하려면 염색과 펌을하면 안돼는데 한창 멋부릴나이에 참고기부하겠다는 의지가강한 건강하고참된  한인간으로써 칭찬하고싶네요~
너무 멋있고 잘생기셨어요~자신에대한 자부심과 긍지를가지고 좋은삶과 결과들이 넘치길바래요~^^",242.0,4개월 전
295,userge4uf5we9b,"머리 어깨라인 밑까지 기르고 바로 잘랐는데 이유가
1.밥 먹을때
2.더울때
3.바람불때
4.머리 감을때
5.머리 말릴때
6.화장실 갈때
7.사람 많은곳 갈때
8.부모님 집에 있을때
9.운동할때
하지만 길러 보는거 추천함",0.0,2주 전
296,w9936,우리 딸도 초등학교와 중학교 고등학교까지 잘 기른 머칼을 저렇게 기부를 하더군요. 공부하는데 방해가 될것 같았는데 몰랐습니다. 지금은 의사선생님이 되었습니다. 좋은일을 많이 할꺼라 생각하니 기쁨입니다.,1.0,3개월 전(수정됨)
297,userqk1ng4wv3f,마음도 예쁘고 얼굴도 잘생겼다,1.0,3개월 전
298,nochu,He is so handsome with and without long hair! Master at work!,0.0,4개월 전
299,userrb8hi8fz4r,"개인적으로 배우 이신영님 닮으셨다.....!
긴머리도 완전 잘 어울리셨고, 짧은 머리도 완전 찰떡이심",1.0,2개월 전
300,userbj7pm1or2j,"정말 멋있는 청년이네요!!! 암환자들을 위해 머리카락 잘 관리하면서 길러줘서 고마워요~~~~~
건강하게 몸 관리 잘하고 군대생활도 성실히 잘하길 바래요~~",66.0,4개월 전
301,BiiiYUME,"내 주위엔 장발 남사친들은 없어서잘 모르겠는데 저런 친구 있다면 새삼 대단하다고 생각할 거 같음 와,,,, 저도 긴머리로 사는 거 여름엔 너무너무 덥구 거슬려서 단발로 잘랐는데,,,",0.0,1개월 전
302,userwx1ug7rz2v,외모만큼이나 심성도 고운 청년이네요^^,0.0,3개월 전
303,deborahoftheholyspirit2285,He looks so handsome with short hair. Commend him on his effort to donate his hair.,1.0,4개월 전
304,EKln3ii,정민님 머리자르니까 완전 상남자.....진짜 잘생겼어요!!!,0.0,3개월 전
305,usermb5ye7km5j,내면과 외면이 모두 아름다운 청년이네요,2.0,3개월 전
306,galaxysky5293,"짝짝짝~박수를 쳐주고 싶네요~^^ 나 아닌 불우한 타인들을 위한 마인드가 정말 너무 훌륭합니다!
본연의 짧게 자른 머리가 저리 잘 생기고 멋진데.. 4년 넘는 기간 동안 나름 즐겁게 롱머리를 즐기며 보냈을 기억만으로도
인생에서 아주 좋은 추억이 되겠네요!
입대를 앞두고 있는데 건강하게 군생활도 잘 하시길 바랍니다~ 화이팅!!",23.0,4개월 전
307,karenv525,"He looks good in both long & short hair.  He could do modelling, he has the height & face for it.",0.0,2주 전
308,childearth4039,What a humane young man. Wish him the best o everything.,0.0,3개월 전
309,userso2mk4kc5y,짧은머리 완벽합니다!! 기부도 좋지만 본인에 잘생김을 기부하기엔 너무 안타까워요!!!,0.0,2주 전
310,tishellefrancois7840,His hair is luxurious. I'd buy a shampoo line from him,0.0,3개월 전
311,userkw3ow8fu4z,와 대단하다 군대잘다녀와요!,0.0,1개월 전
312,shalinisen,So sweet of him to donate all his lovely hair. Sending him love ,14.0,4개월 전
313,userxw3bz6ge1e,얼굴도 잘생기고 마음도 착하네요,0.0,4개월 전
314,doraaaa0613,wow. he was so pretty with long hair and hes so handsome with short hair. such a lovely soul ️,0.0,1개월 전
315,usermy8rx6bz7p,생각이 바른친구네. 군대 건강히 잘다녀와,0.0,3개월 전
316,juyeon196,부럽네요~ 전 부스스곱슬이라 좀 길러서 미용실 갔더니 이런 머린 가발로 못쓴다고 해서 그 자리에서 잘랐었어요 ㅜ,0.0,3개월 전
317,inseonghwang4864,롹에 빠져서 머리카락 기르고있는데 이참에 기부에 도전 해봐야겠네요. 이제 겨우 어깨 넘겼는데... 와꾸가 하자라 앞머리 짜르는건 생각만 하네요. 30먹고 뭐하는건가 싶었는데 기부라는 명분이 생겼네요 ㅋ,0.0,3개월 전
318,userto8dj3nj2t,"와, 정말 잘생겼고 머리가 짧든 길든 예쁘네요. 그리고 긴머리 유지하기 힘드셨을텐데 4년동안 기르셨다니 대단하십니다!그리고 커트한 머리도 너무 멋져요",196.0,4개월 전
319,uservd9nh8cv3q,웬만큼 외모가 받쳐주지 않으면 어려운 스타일인데 넘 이뻐요. 마음이 예뻐서 그런가? (+사진관짤 보고 기절 그냥 겁나 잘생긴거였다…),0.0,1개월 전(수정됨)
320,usersu5fw4ri9q,와 남자다잉!! 길어도 이쁘고 짧아도 훈남이네여!! 좋은 곳으로 머리카락이 갈거에요 :-) ,1.0,2개월 전
321,mystorytime398,저희아들 초딩 1학년때 사과 머리 하고 등교했다가 남자가 머리 묶는다고 담임샘께 혼났었어요 아이가 제가 기부한다고 머리 기는거 보고 자기도 하고 싶다하는데 그렇지 않아도 학교에서 혼 많이 나는 아이라 머리 기르란 말을 못하겠더라구요 세상의 편견들이 없어졌음 좋겠네요,1.0,3개월 전
322,userkg1em8hx4l,"어우 세상에 외모도 검나잘생겼는데
마음도 잘생김 ",0.0,4개월 전
323,Ilues,천우희 씨 넘멋져요 군대잘다녀오세요 ,0.0,1개월 전
324,userzj1tb6oy6g,머리 기르는거 쉽지 않으셨을텐데 대단해요! 머리결도 너무 좋으시고 긴머리 짧은머리 다 잘어울리세요,82.0,4개월 전
325,userot3xf5hq8f,신념이 너무 멋있네 얼굴도 잘생김,2.0,4개월 전
326,useriq9pf8pc6y,와 자른 머리 짱신기해요! 두상이 예쁜 거 같고!,0.0,4개월 전
327,reviewedbyraven,He was so cute! The after style suited him well.,0.0,4개월 전
328,userer3sw7vi7u,근데 진심 풀뱅 개잘어울림,2.0,4주 전
329,sonic66646," He looks so sad
What a pure guy",0.0,4개월 전
330,4eyesinthecorner399,I think the long hair really suited him and those photos he took in the studio looked really good - he could’ve been a model or something,441.0,4개월 전
331,uservk5dt3qi8q,너무 잘생기고 마음도 너무 멋져요,0.0,4개월 전
332,hobbyholicLoveLive,마음이 단단한 청년이네요.   ,1.0,2개월 전
333,linnsaneain1933,"Same for me, one time i had my hair cut too short and girls would look at me with creepy eyes when i go into the school toilet ",0.0,3개월 전
334,61crispy,He looked so handsome with short hair!  Amazing,1.0,4개월 전
335,luzyann1120,Damn he looks so handsome with or without long hairs,0.0,2개월 전
336,userno7vt3qd6q,"겉모습도 속마음도 이쁘고 멋지네요!
둘 다 이미지가 확 다르지만 개인적으로 역시 짧은 머리가 깔끔하고 인물이 더 사는 거 같아요ㅋㅋㅋㅋ
군대도 조심히 잘 다녀오시고 앞으로도 행복한 일들만 가득하시길 바랍니다",13.0,4개월 전
337,usernr4hx6my1i,"와 정말 마음이 멋있는 사람이네요  진짜 존경합니다   
2023년 마음이 멋진사람
역대 최고다 ",0.0,1개월 전(수정됨)
338,useroo3xb5dm7t,머리긴 모습보다 짧은 머리가 더 멋있어요...완전 짱!!!,0.0,1개월 전
339,eamluv,"7:46 omg he looks so good

Both hairstyles suit him",0.0,2개월 전(수정됨)
340,userpy2pz6mo5g,저두 두번째 기부를 위해 기르고 있습니다 소아암으로 고생하는 환아들을 위해 이런 천사들이 많아야 할텐데......,0.0,2개월 전
341,userkx3qw2fv6s,아니 근데 진심 머리자르니까 ㅈㄴ 잘생겨지네 ㅋㅋㅋㅋ 인상 확확바뀐다,0.0,3일 전
342,userkj5ue1tc6b,"와우야~  대단해요 누구나 다 하겠지만 
누구나는 아닌거같아요  쉽지않으시고 가끔 긴머리라 오해도 발생했을때 
상처두 많이 받으셨을텐데  대단해요 ",162.0,4개월 전
343,mishumali,TVXQ🥹 They had some very iconic hairstyles,0.0,3개월 전
344,bomandknitting,그리고 넘  잘생겼고 기우쌤 헤어 진짜 짱짱맨...,0.0,4개월 전
345,parkjongseong3283,He looked so good with long hair!!!,0.0,4개월 전
346,Tfran2917,"Wow, he’s so handsome. Either way he has great style, but I love that we can easily see his piercings now. Beautiful job. ",0.0,4개월 전
347,galexie,He's so pretty! Like waaay prettier than me. The long hair is such a nice look for him. Happy some one with cancer will get to rock those locks and feel as pretty as he looked,0.0,3개월 전
348,Zizonzito,정민님 좋은 취지로 기르신 장발도 너무 잘 어울리셨는데 자른 대로 또 너무 멋지세요!!!! 저도 머리 기르는 중인데 꼭 일정길이까지 길러서 기부하고 숏컷하고 싶네요. 잘 봤습니다,9.0,4개월 전
349,nothing611,I love him. That’s all I have to say.,0.0,4개월 전
350,zuamu,머리 저렇게 많이 길렀는데.. 잘생긴분 처음이야 ,1.0,4개월 전
351,cherryblossom6445,It’s changed his face in seconds Woww he does look good with both hairstyles tho,0.0,4개월 전
352,Kistan12,He looked so much better after they chopped his hair off!,1.0,1개월 전
353,chq2252,He was so pretty with the long hair but now he's so handsome hahah,0.0,4개월 전
354,Neokellysvt,"What a great gesture sincerely, believe me that it is worth it and it is very emotional and with a lot of meaning.
By the way, you turned out very well, super cute and handsome.Thank you hairdresser Kiu, what a professional and what a good look you did to the boy. :D :3",6.0,4개월 전
355,reew1602,"Wow it was a whole 360
I love long hair but the short was just . Keep up the good work ",0.0,4개월 전
356,kokichinnn,"Didnt it seem like he was a completely different person after the cut with that clip on? I was going from ""아 언니!!"" to ""어머 오빠!"" ",0.0,4개월 전
357,oddtrotear,"He's so cute with long hair and bangs omg. I see men with long hair often but never with blunt bangs like that, I love it!",0.0,4개월 전
358,userfx2ew1tg5w,"와..저렇게 잘생기셨는데
머리가 인물을 가리고 있었네요
좋은뜻을가지신 선한마음을
가지신분 같아요
이제 밖에 나가시면
오해는 커녕 인기 많으시겠어요
ㅎㅎㅎ",0.0,4개월 전
359,userlc4qo3iu1q,"썸네일만보고 천우희님인줄…
선한 영향력 너무보기좋네요 
좋은일만 가득하시길 바랄께요.",3.0,1개월 전
