,youtube_id,comment,like_num,comment_date
99,clbert7460,He looks wonderful! So sweet to grow and donate his hair. ,0.0,3개월 전
100,userkd3fc8us5o,너무 잘어울리셔.. 와우 넋놓고봄 ㅠㅠ 진짜 어린나이에 저런 대단한 생각을 하고 또 실천으로 옮긴게 너무 대단해요!!!!,283.0,4개월 전
101,uservk4tn7mf3k,"저희 아들도 5살에 소아암 진단받고 지금은 고등2학년이에요.. 항암 막바지에 약이 쎄다보니 머리카락이 웅큼씩 빠지기에 박박이로 밀어줬는데.. 아이가 그걸 엄청 싫어했어요
지금도 머리카락을 짧게 자르는걸 질색합니다.
여자아이들은 더하겠지요..  아이들을 위해서 곱게 길러 기부해주셔서 고맙습니다..",31.0,4개월 전
102,a77a85,진짜 너무 멋있다 이런 사람이있구나 사람자체가 빛난다,1.0,1개월 전
103,kongal,저도 군대가기전에 기부한다고 길러서 기부했었는데 진짜 건강하게 잘 기르셨네요 bb,3.0,2개월 전
104,heykarm,"I love this episode! Such a warm, kind and cheerful man! ",0.0,2주 전
105,idaliz7292,"the west needs hairdressers like you, excellent job",0.0,2개월 전
106,PurpleFlowerwork,"I don't know why, but him having this unexpected hairstyle and that deep voice is charming. I agree with the stylist, the bangs actually compliment his face and his ear piercings just add to his unique look. More importantly, the fact that he's donating to cancer patients is amazing.",202.0,4개월 전
107,userkc6us1qt7h,머리 기르셨을때 너무 예쁘고 잘 어울리셔서 머리 자르면 너무너무 아깝곘다 했는데 자르자마자 잘생김이 분출해서 너무 놀랐어요 마음도 너무 예쁘시고 감동동동동동동동동.........,1.0,2개월 전
108,JAMoorezz3ki,He's handsome either way. But he's also inspirational for wanting to grow then donate his hair for cancer patients. Good luck with your military service! ,0.0,12일 전
109,supercjh,"저희회사에도 정기적으로 머리를 길러서 기부하는 직원잉ㅆ었서요. 100% 리얼 금발이었는데, 미국에서는 리얼 금발이 드물어서, 암환자분들을 위해서 기부를 하곤했서요. 고마웠죠. 제 엄마가 키모떼라피를 받으셨는데 그때 온몸의 털이 다빠지는데, 가발을 쓸수가없었서요, 왜냐면 두피가 너무 예민해져서어지간히 부드러운거아니면 아파서 가발을 못쓰거든요, 그래서 제가 그당시에 캐숴미어로 암환자들 비니를 엄마한테 보낸준 기억이나네요. 청년 고마워요, 4년동안 기른머리., 고통받는 분들한테 도움이되게해줘서",3.0,3개월 전(수정됨)
110,userkt9mq6fn4u,마음이 너무 예뻐요! 그리고 멋집니다! 군대 건강히 잘 다녀오시고 하시는 일마다 잘 되시길 기원할께요!,1.0,2개월 전(수정됨)
111,andreas9871,Props to him for donating his hair to a great cause! He is handsome either way!! ,2.0,3개월 전
112,iranioliveira,"Que atitude linda!!! Parabéns pela doação dos cabelos, não deve ter sido fácil. ",75.0,4개월 전
113,clarab325,"he seems like such a sweet guy, loved both the long hair and new hairstyle on him!",1.0,3개월 전
114,10dayfit88,저 머리를 관리하기가 엄청 힘들었을건데 아침마다 감고 말리는게 ...ㅠㅠ 어휴  대단하다 앞으로 좋은일만 있길. 군대에서도 아프지말고 건강하게 제대하길빕니다,1.0,3개월 전
115,usergr4xc9ez5t,마음이 너무 따뜻해서 보는 내내 눈물이 났어요 감동이에요!!,0.0,2주 전
116,wildsoul0212,제 남자친구도 전에 등까지 오는 장발이었는데 그때 화장실 갈때 오해 많이 받아서 후드집업 입고 그 안에 머리카락 말아 넣고 다녔었드라구요 ㅋㅋㅋㅋ 지금은 숏컷인데 완전 귀여워요 ,1.0,2개월 전
117,userqm8hw9pn4x,"와 앞머리 풀뱅 때문에도 그렇고 머릿결도 좋고
피지컬도 좋으셔서 그런지 너무 예쁘게 잘어울려요!
남자 장발 안 좋아 하는데 이분은 인정
머릿결 진짜 좋으시네요...
남자분들 보통 장발 하면 도인 처럼 힘이 없고
곱슬기가 있어서 깔끔해 보이질 않는데.. 다르네요.
저두 기부 2번인가? 해봤지만 여잔데도 자르라는 소리 들었는데
남자분인데 어린나이에 멋져요ㅎㅎ
자른 모습도 진짜 훈남이고 멋지십니다",1.0,2개월 전(수정됨)
118,anel4380,Honestly I think Jungmin seems to be a very nice person ! Very open minded and easygoing ! Thank you for donating your hair I hope the person who’ll receive your hair will be lucky ,236.0,4개월 전
119,lauraalmeida3602,Ficou muito lindo ,0.0,4일 전
120,userut7en2ik8f,진짜 멋있어요...진짜!!!!! 사람도 머리도 얼굴도 스타일도 모두모두,2.0,4개월 전
121,laurenhong6861,대박 ! 멋져요. 멋져요.  님의 앞날을 응원합니다 !!  잘되실거예요.  제 아이도  2.6-3년마다  길러서  자르고  기부한게  3번인데.  머리말려주기  엄청 귀찮아서 올해가  마지막 기부였어요ㅠ,0.0,4개월 전
122,arlenadietz4344,Two of my daughter's have donated hair multiple times.  It is an awesome thing to do for another.,1.0,4개월 전(수정됨)
123,caiiii3512,HE LOOKS SO GOOD BEFORE AND AFTER OMG,0.0,1개월 전
124,greenbean09,"He really went from looking like STAYC's Yoon to slaying like TEMPEST's Eunchan...

STAYC Yoon really owned such a look for full bangs in black...btw i love that he has a deeper aim in growing hair, and very sympathetic to the people who have cancer. Hope he serves well in the military!",325.0,4개월 전(수정됨)
125,NaDakt2qz,와~대단하시네여~진심 영상보면서 존경스럽다 느꼈어요.,0.0,2개월 전
126,1953lili,God bless this young man! Thank you for your sacrifice; hair and service! Please be safe!,0.0,4개월 전
127,userxu2ul2yb2m,"보통 머리를 애지중지 기르고 짧게 자르면
눈물이 나기도 하는데
이 분은 기부목적이였어서 그런지 기쁘게 좋은곳에 가렴! 하면서 인사하는게 인상깊네요",2.0,3개월 전
128,k32,진짜 여자들도 불편해서 저렇게까지 못 기르는데 주변의 편견어린 시선까지 받아가며 저만큼 기른 게 대단하다,1.0,4개월 전
129,unicornpoop5999,I was literally thinking about this this morning. Imagine growing such beautiful hair and then having to cut it all off for compulsory military service ,1.0,4개월 전
130,Alysagain,"Well done to him for taking good care of his hair for 4 years in order to donate it . His long hair was really nice, but the short style with some volume on top and a gap in his fringe was gorgeous. He looks so much better now imo.",625.0,4개월 전
131,userie7rs2tv6e,머리자르고 귀가 보이니까 인상이 달라보이네요 머리결 너무 좋아 보여서 깜짝 놀랐어요 순간 부러웠.. 군대 가실때 잘 가셨음 좋겠네요,0.0,4개월 전
132,sarahbear19931,He's so cute and both hair styles suited him so well,2.0,4개월 전
133,userdj1yq7cs8i,"참 젊은청년이 건실한생각을 하고계셨군요 실천하기는 쉽지않는데요 감사합니다 처음에는 뭐지 오해했네요
자르고나니 인물이훨씬좋습니다
아주 잘어울리세요
군대도 잘다녀오세요 필승!!!",0.0,4일 전
134,cocoj7496,"초등학교 6학년때까지 열심히 길렀던 머리카락을 어느날 큰 결심을 한듯이
자르겠다고 하더라구요. 그렇게 저희딸도 작년에 엉덩이까지 길었던 머리카락 기부했어요.
좋은곳에 쓰였길 바라며..아이도 뿌듯해하더라구요. 
멋지세요^^",0.0,2주 전
135,Ruru923,나보다 머리가 기시네.. 여자들도 긴머리 진짜 관리 못하는 사람 많은데 에센스까지 바르시고 대단하시네요.. 군대 조심해서 잘 다녀오세요,0.0,4개월 전
136,andriakang2804,"우와.. 여자인 저도 소아암 환우를 위해 머리카락 기증한 적 있는데 저 분보다 짧았는데도 기르는 동안
너무 관리하기 힘들었거든요
펌, 염색 못하고 숱이 많아서 두피가 아플 정도ㅠ
그래서 그 이후론 절대 그렇게 기르지 않았는데 저 분은 정말 대단하시네요
저도 다시 한번 기증 해보고 싶어졌어요",531.0,4개월 전
137,userxh9bh9ib4d,와 너무 멋있는 청년이시네요 긴머리 너무잘어울리는데 짧은머리도 너무멋있으세요! 좋은 일만 가득하시길 바랄게요 ,0.0,1개월 전
138,sweetlove1357,"아니 머리카락이 어떻게 저렇게 차분하고 청순하게 자라지...
포니테일 했어도 잘 어울렸을 듯!",0.0,2개월 전
139,kimsohee0607,저희딸 둘도 초등때1번 중딩때1번  기증 2번씩 했어요~~ 학교땐 염색도 안하고 펌도 안하니까 ~~영상에 남자분 짧은머리로 변신!! 넘 멋져요,0.0,1개월 전(수정됨)
140,chochosan1981,"I keep viewing this video because the guest is so handsome! Your long hair rocks! From Hawaii where we have a lot of guys with long hair, but this is the 1st time i've seen long hair with bangs on a guy. Also his studio pixs were so beautiful. Stay safe when you enlist.",1.0,3개월 전(수정됨)
141,megzbacon8910,"wow he could pull of any hairstyle, literally looks so good with both!!!!! does anyone knows his instagram lol??",0.0,3개월 전
142,bronzepistachio,"I can't think of any other word except ️beautiful️, to describe this whole video. Beautiful intentions in growing his hair long, beautiful process in caring for it throughout those 4 long years, beautiful outlook the way he deals with how people react to his long hair and how he has fun with his hairstyle, beautiful transformation to get a short haircut to prepare for his mandatory military service. What an outstanding personality. I wish him lots of happiness in life and may he continue to shine and bring joy wherever he goes.",117.0,4개월 전
143,wji0616,저 멋진 얼굴이 기부에 가려져 있었네요!! 마음도!! 얼굴도!!! 머리도!!  멋진 청년입니다!!! 응원합니다♡,0.0,3주 전(수정됨)
144,m1l1,"Le quedaba muy lindo el pelo largo,incluso con el cabello corto sigue siendo muy visual. Con el corte tiene un aire a EJ de &Team",0.0,4개월 전
145,miclecha,기우쌤 안녕하세요 !! 우와  머리 기네요.    그리고  기부도 하시고   멋진 변신  잘 보고 갑니다.,0.0,1개월 전
146,userel2cy9uk6w,마음이 이쁘고 얼굴도 이쁘고 두상도 이쁘고.. 앞으로도 이쁜 길만 걸으세요~~^^,3.0,4개월 전
147,userkw7kv9ie5e,세상보면 철없고 생각없어보이는 애들뿐인 것 같은데 소신있고 이런 맘으로 살아가는 분들 계시는구나..  나는 나대로 아프고 외로운 분들 도울 수 있도록 찾아보고 노력해볼께요,1.0,2개월 전
148,hyency93,머리기르기 진짜 쉽지 않은데 ㅠㅠㅠㅠ 진짜 대단하세요!!!!! 응원합니다  그리고 군대 몸 조심히 잘 다녀오세요1! 응원합니다!!!!,128.0,4개월 전(수정됨)
149,essie2732,He looks so sharp with the new style! Very sweet of him to support his friend too!,0.0,3개월 전
150,usergs4dd9pw1v,자른것도 잘어울리고 장발때도 진짜 잘어울린다.. 사람은 성별이 아니라 잘 어울리는거 하고 다닐때 자도로 빛나는 것 같음,1.0,3개월 전
151,userug8sm3cv1t,"잘생겼다!!!
군대 건강하게
잘 다녀오세요",1.0,1개월 전
152,eunhyekim281,젊은 친구(?) 가 신념 가지고 기른 머리를 자르는 의미있는 시간이엇군요! 애프터도 정말 잘 어울려요~ 나중에 군대 잘 다녀오세요 ~~,0.0,3개월 전
153,maryamsafiyyah904,Hes such a beauty and hes a good person too. He can definitely fit for modelling .,3.0,3개월 전(수정됨)
154,mememm2148,아기둘 엄마인데 마음이 너무 고운 청년이네요~ 우리아이들도 건강한 마음과 소신을 가지고 멋지게 살아갔음 좋겠네요 응원합니다^^,905.0,4개월 전
155,useryq5vv6zk6b,이마 다 덮는게 진짜 이쁜거 같아요!!ㅠㅠ진짜 마음씨도 이쁘시고 최고..,1.0,1개월 전
156,poeticproduct,Loved that they asked him questions without judgement,0.0,1개월 전
157,onewlove,머리 자른게 천만배 어울려요. 긴머리 좋은 의미로 기르시고 진짜 외모만큼 멋지셔요,0.0,2개월 전
158,Seolisa,He looks amazing with both long and short hair!!,3.0,3개월 전
159,CassandraL666,His masculine and feminine are in such a perfect balance. Wow. Absolutely stunning individual. His energy is so calming.,3.0,3개월 전
160,usercy7do8tf1n,제가 항암치료받게되면서 머리카락 한올도 빠짐없이 팔이며 모든털이 다 빠지게되는데 그때 머리카락이 보온효과도 있는걸 알게되고 소중함도 알게됐죠 가발이란 가발은 종류별로 많이 샀는데...이렇게 좋은일을 위해 머리를 길러주시다니 너무 감사합니다 ! 꼭 필요로 하는 아이들에게 소중한 나눔을 해주시네요  천사세요,454.0,4개월 전
161,RobbyL,His hair is gorgeous. I know he will make someone feel very lucky to have a wig mad from his hair. What a sweetie.,1.0,4개월 전
162,userhq1mq8hd5i,진짜 멋지시네요...여자여도 저리 기르기 쉽지 않아요....진심으로!!,0.0,2개월 전
163,youbin9819,"와 머리 저렇게 기른것도 진짜 대단한데 머리 자르니까 진짜 개잘생기셨는데..!! 
여러모로 ㄹㅈㄷ네요",4.0,4개월 전
164,gnm4rejkhfi,진심 멋지십니다. 저희 아이도 기부한다고 벌써 4년째 기르고 있네요~^^,0.0,4개월 전
165,storage3371,진짜 잘생기고 예쁨... 착하고 멋지기까지... 다가졌네! 몸 건강하시길!,0.0,2개월 전
166,sabrinafortalejo,"it is so nice to listen to him telling his stories, he seems someone who is a lot of fun and genuine. the hairstyle suits him well too!",89.0,4개월 전
167,unknownmotherkoose8868,But I seriously could mistaken him for a NewJeans member if I saw him walking on the street. His hair is very well maintained :),0.0,3개월 전
168,uservs3jy5nw2s,좋은목적을위해꿋꿋이길러오신모습ㅡ멋집니다~~,0.0,1개월 전
169,t3hsis324,"Awwww bless his heart for growing out his hair and donating it. I think I may do the same but it must be promised as a donation, not a way for profit. If they have cancer, they have suffered enough...  So the wig must be donated to the person, with love.",0.0,4개월 전
170,usermw8mg6yb6i,"beforeもafterもどっちも似合ってる
小児がんの子供達にヘアドネーションするのは本当に優しいです",0.0,4개월 전
171,zxcvlittle4279,와  대박 잘생겼네. 좋은일에 앞장 서고 너무너무  착하고   존경스럽다. 앞날에 행운과  복 복 복  마니 받으시길요,0.0,1개월 전
172,userqb1xu8oy4h,당황스럽다. 진짜 헤어스타일이 중요하구나 긴머리였을때 손으로 입 가리고 웃는 모습은 귀엽고 풋풋한 대학교 새내기 모습이었는데 머리 자르고 자켓만 걸쳤을뿐인데 존잘남 됐네고등학생때부터 머리 기부할 생각도 하고 마음씨까지 고운분이네요. 대학교에서 춤춘 영상 보니까 성격도 좋은거 같고 군대 입대해서 전역할때까지 조금도 다치지 마시고 건강하시길 바랄게요 5년.... 말이 쉽지 머리 기르는게 보통일이 아닌건데.. 긴머리 가발 받은 환우가 정말 기뻐할 것 같아요,168.0,4개월 전
173,userzs5xx2xh9e,진짜 대단하다...존경스럽네요,0.0,3개월 전
174,warriorqueenb7641,That really an awesome deed..So thoughtful and caring!! I know it was hard for him to do that but so many patients will benefit from his beautiful hair !! Personally I like him better with short hair.. so handsome & sexy looking ,0.0,3개월 전
175,ErrorY,멋있다 진짜 여자인 나도 머리 길러서 기부하기 쉽지 않았는데,0.0,3개월 전
176,loeeehke3066,얼굴도 잘생겼는데 마음까지 착하니까 와 ,0.0,2개월 전
177,magdalenalucia1683,"He has awesome motivation and good energy.
I think he looks better now.Of course, that's a personal thing.",0.0,4개월 전
178,junne2000,어머 머리 자르고 나니까 세상 잘생기셨잖아 ㅠㅠㅠㅠㅠㅠㅠㅠㅠㅠㅠ,1.0,4개월 전
179,LeopardMint,"고등학교 단발로 입학해서 졸업 때 허리까지 왔었는데 학부생 때 겨울에 애들이 춥다고 제 머리카락으로 자기 목에 두르고 막 그랬던 기억이 나네요. 
그땐 소아암환자에게 머리카락 기부도 몰랐고 염색이 유행이라 탈색, 염색하다 잘랐는데 참 좋은 일하고 입대하시니 좋은 영향이 될 것 같아요. 군대 건강하게 잘 다녀오세요!!",157.0,4개월 전
180,anasan1224,"Он выглядит как совершенно другой человек! Кажется, я в любви ",1.0,1개월 전
181,olivia5642,정말 대단하시고 멋있는 분이네요 그리고 감사합니다 소아암 환자였기에 더욱 머리카락이 신경쓰이고 가발이  반드시 필요하다는걸 느낄수 있어요,1.0,4개월 전
182,gong,"저도 모발 기부하려고 고2 때부터 길러서 대1 되자마자 머리카락 숏컷 길이로 자르고 기부했는데, 4년..대단하네요…",0.0,4개월 전
183,userdm1gk2zj4x,와 진짜ㅜ이래서 머리스타일이 중요하구나 인상이 확 바뀜.. 긴머리일땐 진짜 좀 이쁘고 소녀한 이미지였는데 자르니까 훈남미 겁나풍김,1.0,4개월 전
184,sonic66646,"9:21 finally I realized why short hair is popular for guys and long for girls

His face looks so different.
The long hair highlights his cheeks and the features that make his face look soft

And the short hair highlights his eyes and nose, and the features that make his face look sharp

It looks so different even though it’s the same person.. it really changes from a softer visual to a stronger visual, and historically girls sought to give a softer image and guys a stronger image",0.0,4개월 전
185,bluejeans5125,"My son and I donated our hair two years ago, he had 12 years old and he was so mature to let his hair grow to donate......... I´m so proud, This young man is impresive too. I´m so glad to see how many people  are willing to help.",133.0,4개월 전
186,userqm3ie8sz7c,아니 미소녀에서 미소년으로 급변 ㄷ ㄷ ㄷ풀뱅 긴머리 넘 하고싶던머리인데 넘 예쁘네효...부럽ㅋㅋ 자른머리도 완전 잘어울려요,2.0,3개월 전
187,lilianJ,"As soon as I saw him Ithought he looked like the most beautiful guy I seen, ️ and also because he was handsome and then he gave an even more beautiful reason for growing his hair - the hair gives a hint of angelic kind of vibe for some reason",2.0,3개월 전(수정됨)
188,userqc8wk6pt2h,와~~ 머리 길었을때랑 커트했을때랑 이미지가 확~!! 바뀌어 버리네요 정말 멋지세요,0.0,4주 전
189,kunaiflicker,"wow. respect. what a good cause but also, the hair is so lovely!

gorgeous person with a great heart",0.0,3개월 전(수정됨)
190,ItsKaiOpinion,"i like that he actually had a chic hairstyle with bangs and actually took care of his hair. i see guys with long hair all the time but its usually fuzzy and unkept without any shape to it. This was intentional, framed his face and beautiful",0.0,3개월 전
191,2so265,와 긴머리 유지 힘들었을텐데 4년이나 기르셨다니 대단해요! 저도 저만한 긴머리 오래 유지하다 숏컷으로 잘랐거든요. 비록 탈색을 너무 많이해서 기부가 가능한 길이가 됐어도 기부는 못했지만...ㅎ 자른 머리도 잘 어울리셔요! 예쁜 머리 즐기시다 건강히 전역하시길 바라요!,197.0,4개월 전(수정됨)
192,venussuna,"훈녀에서 훈남탄생ㅎㅎㅎㅎ
소신있게 4년머리기르신 모습이 대단해요",0.0,2개월 전
193,britz7165,What a sweet and generous thing to do. Well done. He looks gorgeous.,0.0,3개월 전
194,yeoyoo,와우 4년 기르셨다니 대박.. 머릿결 겁나 좋으시네요,1.0,4개월 전
195,erinj2611,"남자분이 아예 머리가 기니까 조선이나 고려, 삼국시대 우리 조상분들이 저런 모습이 아니었을까 하는 생각도 들며 자연스럽게 느껴졌어요
머리를 기르게 된 계기도 멋지시고!",1.0,3개월 전
196,spammusubi1607,Wow his hair is BEAUTIFUL and he looks absolutely amazing with it,1.0,4개월 전
197,huangrenjunism,"he seems like such a kind and easygoing person!! those studio photos were gorgeous, something you’d see out of a magazine definitely! and his piercings are wonderful as well",93.0,4개월 전
198,emianawuzzhere5121,The bangs suit him so well with long hair. Im going to donated my hair tomorrow. I am so excited for my new hair style!,0.0,3개월 전
199,DeijiPlays,Growing your hair for years and donating it is a noble act. ,1.0,3개월 전
200,etanol,"look at this bro’s hair. it’s literally perfect, so much better than mine",0.0,3개월 전
201,yiyip7901,저도 작년에 4번째로 모발 기부하고 또 기르고 있어요^^ 돈도 안 들면서 약간의 인내심만으로 좋은 일을 할 수 있습니다^^,1.0,3개월 전
202,aalekhya,Bro looks beautiful before and after. Its the personality that shines above the looks :),1.0,4개월 전
203,Kjv8sv,"와, 진짜 선한 에너지 뿜뿜이시네요 ㅎㅎ",0.0,5일 전
204,shione,겉옷 입기 전에 와 잘생겼다는 생각을 했는데 겉옷까지 입으니까 또다른 느낌이네요 진짜 좋은 일에 기부하신다니 대단하시네여 저도 우연히 미용실 가는 거 미루다 미루다 갔는데 원장님과 다른 손님의 말씀 듣고 홀리듯이 했는데 저와 다르게 처음부터와씨 진짜 잘 생기셨다 초면...아니 영상으로 처음 뵙는 건데 진짜 잘 생기셨는데 만나뵈면 진짜 더 잘 생기셨을 듯,181.0,4개월 전
205,userxe3wr7qk2i,양갈래했을때 미모 미쳤다 양갈래가 이렇개 잘 어울리는건 처음이야 미친 양갈래 하니까 인물이 확 산다 군대 갔다오면 다시 길어서 양갈래 해주세요..,0.0,4개월 전
206,tracyy8091,He’s too sweet to even be real I love ,1.0,3개월 전
207,danica3907,"When I read the title of this vid, the first thing that came into my mind was, ""Wow! This girl's amazing. Choosing to go to the military is such a brave act."" But when I heard the voice, I was like, ""Huh? What? She's a he?"" Hahahaha",1.0,3개월 전
208,lesliebrucker,This teacher is amazing having long hair like you’re hair ,0.0,3개월 전
209,roseannerandoy1840,He looks handsome and a has a pure heart. Kudos to you! Long live your hair ,1.0,3개월 전
210,youbyulnanbyul,좋은 일을 위해 기르신것도 대단하고... 머리 자르고 살아난 잘생긴 외모도 빛나네요...,19.0,4개월 전
211,SugaKookieMon,"What a noble and loving gesture. You're a great man. Thank you for your service. Return safely, and God bless.l",1.0,4개월 전
212,usercn2yq6dl5z,"우리 아들에게 이런 좋은 친구가 있었으면 좋겠네요~
어떻게 키우면  저리 착한아들 이 될까요 ~ 최고입니다 ",3.0,3개월 전
213,charissagabrielle6810,Wishing this kind and wonderful soul a safe and healthy future ahead of him ,1.0,4개월 전
214,mujeoklgtwins,"염색머리 파마머리도 요즘엔 기부 가능해요!
저도 일년전에 생머리 댕강잘라서 기부했습니다. 
요즘엔 소아암협회에서만 기부받는것같더라구요",0.0,1개월 전
215,romanticscents,He looks nice with his hair cut short. I was too confused when he had extremely long hair. Now I love the new look. ,1.0,3개월 전
216,mythdongwan,여자인 저도 머리 기르고 관리하기가 힘들었는데..4년 반을..진짜 대단하셔요~~ 게다가..머릿결이 너무 좋아요~~~ 전 악성곱슬이라 매직필수인데 다행이 요즘은 매직이나 염색모도 다 받는다해서 저도 머리기부한지 1년이 넘었어요^^,70.0,4개월 전
217,userhw9lw2cm1w,"머리컷트하니까 인물이 사네요
그동안 기부하려고 긴머리 유지하느라 고생 많았어요~",0.0,1개월 전
218,userzd1fv4kk2i,"아름다운 생각을 갖은 청년이있기에 아직 살맛나는 세상인것같아요~
뭉클한 맘으로 영상보았네요~^^~",0.0,2개월 전
219,student00,헐 썸네일보고 여자신줄 진짜 남자신데 저렇게 완전 긴 장발 어울리시는분 처음봐요 와 근데 진짜 잘생겼다 머리자르니깐,1.0,2개월 전(수정됨)
220,lsls596,저도 지금 초등학생인데 요즘엔 친구들도 많이 기르더라구요 머리 기부를 여러번 해서 상을 받았던 친구도 있었고 유치원때는 한 반에 머리 기부할려고 머리 기르는 친구들이 3~4명은 되더라구요 사람들이 기부 한 가발 받고 소아암 친구들이 행복햇으면 좋겠어요!,0.0,3개월 전(수정됨)
221,userkf2yn5rs1p,와 대단... 난 성인암이었어서 가발 필요없었는데 병원가면 어린환자들 다 두건으로 멋부리고 나름 패셔니스타...::ㅜㅜ 인모가발이 있으면 도움은 될듯...,0.0,2개월 전
222,awang4036,"Such a beautiful person inside and out!!  I salute his reason for growing his hair, not everyone at the young age  he was when he started growing it, would have been that thoughtful.  I wish him all the very best and good health when he goes into the military.",33.0,4개월 전
223,haibok,心も顔も髪も綺麗な人だ。,3.0,3개월 전
224,P0SHED,This is a guy who is both stunning with and without long hair! He’s so sweet!!,1.0,3개월 전
