,youtube_id,comment,like_num,comment_date
0,officialhyeonjm,"안녕하세요! 머리카락 커트한 현정민이라고 합니다! 기부를 목표로 2019년부터 장장 4년 6개월 가량을 길러온 머리였는데, 기우쌤 덕분에 멋지게 스타일 변신을 하게 되어서 너무나 행복합니다 나름 긴머리가 인생헤어라고 생각했는데, 아무래도 제 인생 마지막 장발이 될 것 같습니다…^^

   그간 머리카락 기르느라 번거로움도 많았지만, 정말로 필요한 곳에 기부가 될 수 있어서 정말로 뿌듯합니다. 다들 고민하지 말고! 머리카락 기부에 도전하세요

   그리고! 기우쌤이랑 세진님 실물이 정말 대박이고, 커트도 너무 섬세하게 해주셔서 감동이었습니다… 제 평생 최고의 스타일링입니다(진심 100%)

  다시 한 번 스타일 변신에 도움을 주신 기우쌤 감사드립니다",17.0,4개월 전
1,usernn7xq6gh8g,"실제 친구인데 엄청 오해 많이 받고 ,, 남자가 머리 기른다고 욕도 엄청 많이 먹었어요 그래도 맨날 좋은 곳에 기부할거라고  꿋꿋하게 신념을 지켜 간 제 친구가 너무 너무 자랑스럽네오 !!! 앞으로 너의 모든 앞날을 응원한다. 일단 군대가자.",24.0,4개월 전
2,rigelr5345,"Damn this guy is amazing. Growing and donating his hair because his friend had/has cancer. Not being phased by anyone's words but just having fun with his long hair. Going against the norm, being unique, and just rocking it. He's a good person, and now he looks like a celebrity too lol. This is what a real man is. Not a ripped gym bro who wants ""bitches"", no. Someone who has the courage to do good in the world, and to be bold enough to not care what people think, to be himself. Much respect yo",56.0,4개월 전
3,kkimkkim6714,초3  아들이  이 영상보고 머리 길러 기부하겠다고 컷트 거부합니다. 주변의 시선이나 놀림에 꿋꿋할 자신이 있는지 다짐도 받았습니다.    아이의 뜻을 존중해주기로 했습니다. 아이가 기부가 가능한 길이만큼 기르게 되면 기우쌤께 갈께요~ 그때 멋지게 부탁드려요~  ,19.0,3개월 전(수정됨)
4,bluekimchiandrea4476,"My son grew his hair starting in 3rd grade and cut it when he entered high school. He also donated it for kids going through Cancer for wigs, because he saw his friend go through Leukemia. He went with her for her treatments and saw her lose her hair. It effected hom enough that he withstood the teasing. Now in the U.S. we see man all the time with long hair and wearing the ""man bun"" thank you for showing this ",15.0,4개월 전
5,usertk9ml4ib5o,"성인 돼서도 기부하기 위해 머리 기르기 자체가 정말 쉽지않은데

한창 멋 부리고싶고 외모에 신경쓰일 사춘기의 나이 때부터 꿋꿋하게 좋은 마음으로 기르셨다니 진짜 대단하시다

주변시선에 위축되실법도 한데 학교에서도 장기자랑도 나가고 잘 지내시는 모습보면 그런거에 굴하지 않는게 진짜 대단하심

군대가셔서도 무조건 잘 하실거라 생각합니다",915.0,4개월 전(수정됨)
6,soo8198,"마음이 너무 예쁜 청년이네요
저도 숏컷에서 머리 길러봐서 아는데 진짜 힘들거든요 ㅠㅋㅋ 주변 눈총도 좋진 않았을텐데 그걸 남자 분이 불편함을 감수하면서 까지 하셨다는게 정말 대단하네요 나중에 다녀오실 군대도 몸 조심히 잘 다녀오시길 바랍니다",502.0,4개월 전
7,userjs5ul7fd8z,외모도 너무 잘생기셨는데 소아암 환자들 위해서 머리까지 기르고 기부 하신다는 마음이 넘 존경스러워요!! 군대 건강히 조심해서 다녀오세요!!,33.0,4개월 전
8,kbias8950,"Man I love this, it’s so awesome! You know it’s crazy how much people will judge others just based on appearance and think things that are totally different from the truth. If I’m being honest I probably would have done the same thing but it’s just another lesson that you should never judge people before you meet them. You had a beautiful and amazing reason for growing out your hair and I’m very proud that you were able to go through with it for four years. I applaud you and I will work to be a better person like you ",136.0,3개월 전
9,oiaios3484,소아암 환자를 위해 4년 동안 머리를 기르셨다는 게 정말 대단하고 멋진 것 같습니다. 기르는 동안 불편하고 자르고 싶었을 텐데 참을성도 있고 마인드가 멋진 것 같아요. 군대 잘 갔다 오세요,225.0,2개월 전
10,TheCyanidekandy,"From a cancer patient who lost her hair 2 years ago to chemo, thank you so much!! You’ll make someone so happy ️",677.0,4개월 전
11,rickmarr8784,"I give props to the guy for growing his hair for donation. It's not easy, I've tried it once. Grew it out for over 2 years and the whole time, it drove me nuts. It kept getting in my face or my food while eating. It was hot during the summers. But when I made the minimum length needed I was like, I don't think I can do another year.",287.0,4개월 전
12,dlarri,"He looked great both with long and short hair! He is a really inspiring person, to let his hair grow and donating it :)!! Hope he has a great semester and good time once he enlists!",488.0,4개월 전
13,moochinryun,"저와 같은맘을 가지고 계신분이 있으셨군요!! 저도 소아암 환자들을 위한 가발만드는 단체에 기부할려고 고2때부터 지금까지 기르고 있습니다.
 지금20살인데 21살 군대가기 전까지 기르다가 기부할려고 생각중이거든요 머리자르란 소리도 많이 듣고 중간에 포기할까 생각도 많이 했지만, 이 영상 보고 끝까지 맘 다잡고 꼭 기부하도록 하겠습니다! 사연자분 정말 너무 멋지십니다! 앞으로도 모든 일 잘 되시길!!",29.0,4개월 전
14,lisarupert689,"Thank you for doing this, you are really helping someone.

My mom had cancer recently and lost her hair. She was very nervous about losing it. Getting a wig makes a huge impact on self esteem during rough times like that, or even for people that have alopecia or any condition where they lose hair on their head.

Thank you for being so kind, and caring.",92.0,3개월 전
15,userfs4xt8hh5r,부모가되어보니 이런 멋진 분들은 어떤 교육을 받았을지 너무 궁금해요!! 제 아이들이 이렇게 멋지게 커준다면 더할 나위 없겠어요 대단하고 존경합니다,378.0,3개월 전
16,iamJKOD,"I totally resonate with him. I grew my hair & donated it to a cancer-awareness organization a few years back. Giving someone a smile that he/she probably lost to cancer, truly is a wonderful feeling. We can share a bit of ourselves to others despite the differences & distance. ",51.0,4개월 전
17,qqqqppppdddd,"와 진심 감탄함 ㅋㅋㅋㅋ
귀엽고 인성도 바르고 ㅋㅋㅋㅋ 머리 자른 것도 잘어울리시네요 ㅋㅋㅋㅋㅋㅋㅋ
군대 건강하게 무탈하게 잘 다녀오시길",189.0,3개월 전
18,Takillama,"Props to this gentleman for sticking with it and not letting others get to him! I've cut my hair before to donate it, a very long time ago. I'd always had long hair as a kid, but after surviving cancer myself, the longer it got, I started getting migraines, so I finally cut it off and donated it. I decided a few years ago to do it again, and now my hair is down to my hips. I've had my hair cut down to only a few inches for so long that it's still difficult to get used to the growing hair! LOL I still want to wait a few more years, if I can, then I'll donate it again.",16.0,3개월 전
19,userhr7yp8qs9p,"와 인간적으로 ㅈㄴ 멋있다
비슷한 나이대인데 학교다닐때 머리 장발하는 친구들은 많았는데 다 여름에 더워서 자르던데 그런 불편한거 다 참고 주변 시선도 안좋았을텐데 기부하겠다는 마인드로 버티고 기르신거 진짜 리스펙…",33.0,4개월 전
20,fatalblue,He didn't look bad at all with the long hair (those studio shots were amazing) but the new cut definitely suits him better! He got a very handsome face. Very celebrity. He did an excellent job not only growing his hair but taking care of it. Its gonna make a really great wig. He seems a beautiful soul inside and out. I hope his service goes by without trouble and he finds good sucess after.,181.0,4개월 전
21,dpahfl,"It's very admirable that he grew his hair out, especially for donation. I cut my hair off to a pixie style in my senior year of university and donated my hair to an organization that makes wigs for children cancer patients. People are very attached to their hair but knowing that my hair was going to help someone in need made me feel better about my choice.",21.0,3개월 전
22,dmorales1064,It is an honorable thing to donate his hair for such a good cause! He looks very handsome with the new cut and perm. Looks like a completely different person and I'm sure a lot of people will give him lots of compliments ,93.0,4개월 전
23,mariachristinasabatinicris6898,Ficou lindo de cabelo curto  parabéns por abençoar quem precisa ,0.0,2시간 전
24,gineric1007,Just imagine the joy a patient who will have that hair. He earned major heaven points. You both did an awesome job cutting and styling his hair. It's like a totally different person....with a big heart,66.0,4개월 전
25,rdl3441,"의뢰인 잘되셨으면 좋겠다. 
말씀하시는 것도, 신념도 멋있고.. 점점 이런 분 찾기 어려워지는 세상이라 너무 귀한 느낌
대학생활도 군대도 모두 즐겁고 의미있게 보내시길 :)",22.0,4개월 전
26,chloechoe8528,신청자분 마음이 너무 이쁘시다...군대 무사히 다녀오세요,73.0,3개월 전
27,lachimolalala23,The world would be a better place if there were more people like u thank you for being so kind and having a huge heart...your mom truly gave birth to a gem,26.0,3개월 전(수정됨)
28,userpq3qz6uf2o,몇개월전에 영상보고 저도 기부해야겠다고 마음 먹고 어제 자르고 왔어요 ! 주말 지나고 내일 우체국 가서 어머나 운동본부에 보내려구요  좋은 영상 덕분에 기부할 수 있게되어서 너무 너무 감사합니다 ! 영상속의 남성분께도 감사드려요 ,17.0,2개월 전
29,raceliable,"He took care of his hair with the intent of donating it, his dedication is surreal! Humanity is restored",18.0,3개월 전
30,ieroine,"I donated my hair too during the pandemic, it feels great to know someone will have something that will ease their everyday life, i really hope more people do that, at least once in their lives",13.0,4개월 전
31,sampanhd7559,So proud of you hun! Well done :3,6.0,3개월 전
32,criseastman6503,"You are an awesome person. I love that you chose to donate your hair, after having long for so long. I wish you great time in the military and the very best in life .",11.0,4개월 전
33,sky8099,"저는 초등학교 2, 4학년 때 머리카락을 잘라 기부한 적이 있었어요. 그 때는 머리카락을 잘라 기부하는 사람이 이렇게 많은 줄 몰랐는데 생각보다 많아 놀랍고 세상에 이런 좋은 사람들이 많다는 게 느껴져요. 머리를 4년동안 기르는 것은 너무나도 힘들고 스트레스 받는 일인데 정말 꾸준히 머리를 기르신 것이 너무 대단하세요!",11.0,2개월 전
34,Lifeoo2tr,"I’ve never seen a man with straight bangs like he did before his haircut, but it looked quite good on him and it accentuates his angular face and his style. He looked very high fashion and it changed my perspective of what men’s hairstyles should be. I’m really inspired by his courage!",19.0,3개월 전
35,badtanline,"This was such an engaging interview. Mr. Hyun, you look so good in that new hair cut! May the cancer patient who benefits from your donation become healthy and happy.",12.0,3개월 전
36,djdjxuzbxh8264,진짜 좋으신 분이다. 우리나라 특유의 오지랖 때메 힘들었을 텐데 꿋꿋이 기르신게 대단하십니다,9.0,1개월 전
37,jikoos,what an incredible guy. probs to him for growing out his hair to donate so people with cancer can feel good too !,4.0,3개월 전
38,useruc7ur6bn7l,"신념있는 중학생,  고등학생 시절을 보냈네요. 이런 마음으로 세상을 바라보는 눈이라면 뭘 하든지 주변에 선한 영향력을 미치는 좋은 사람이 될거예요. 늘 응원합니다. 어리지만 존경스럽네요~^^",33.0,1개월 전
39,citash9998,"My daughter did the same thing..donating her hair way back 2014  to cancer society here in Canada not knowing that I, her mother would be diagnosed with cancer in 2015....i applaud this guy for his generosity.",18.0,4개월 전(수정됨)
40,,"I clicked on the video because I thought you look so attractive. I watched till the end to see the transformation and also because of your personality. You give a chill and fun vibe. You're awesome. Also, good work donating the hair!",25.0,3개월 전
41,franzabala7447,"This man is so cool, I love how he was so secure in his masculinity that he even did a new jeans cover with his hair that long. What a wonderful person he is",17.0,4개월 전
42,ratgirl669,"Holy cow, this man is so confident. I love how he pulls off both Long hair and short hair. He is so beautiful!!!!!! And I love that he donated his hair ",76.0,4개월 전
43,LeeAnneGomes,"I love how his parents wanted him to cut his hair - but when it finally came to him deciding to cut it, they asked him if he was sure he really wanted to. ",21.0,3개월 전
44,usernm8vy8yr9v,우와 잘생겼다... 페이커 이미지가 좀 있으면서 잘생겼어요. 우리 막내가 군복무 중인데 군대 간다니 더 마음이 가네요. 건강히 잘 다녀 오길 바랍니다. 4년 넘게 기른 소중한 머리카락이 정말 필요한 사람에게 쓰이간 바랄게요,13.0,1개월 전
45,uservp9gj4jn7l,"여자인 정도 장발이지만 기부를 위하여 장장 4년이나긴 생머리로 머릿결 좋게 기르셨다는게 정말 대단하고 고생많으셨네요.
정말 유용하게 쓰일 것 같아요. 그리고 마음씨만큼이나 외모도 미남이시네요^^",8.0,1개월 전
46,userny1qc7hm6u,소아암 환자를 위해서 기부하기위해 4년동안 기르면서 불편한점이 많았을텐데 참고 길러온게 대단하신것같아요!! 좋은데 기부하셧기를!! 너무 멋잇네요 마음도 스타일도!!,37.0,4개월 전
47,hellotwinsify,"I love this concept! Have also donated my hair, thought it would be such a waste for people that are not able to grow out their hair bc of cancer <3",2.0,3개월 전
48,hazel819,머리 자르기 전은 진짜 여성 분같이 예뻤는데 자르고 다니 와 진짜 대박...너무 멋지세요,31.0,3개월 전
49,userky6uh2bg9i,기부한다고 염색도 파마도 안했대 ㅠㅠ 진짜 착하다♡♡♡ 아가야 머리 자른거 정말 잘 어울린다~ 군대 건강히 잘다녀오고 좋은 일만 많이 생기길 빌게~!,3.0,1개월 전
50,iamcrying1914,너무 멋진 분을 이 영상을 통해서 저와 많은 분들이 알게 돼서 기쁘네요!! 그리고 장발도 숏컷도 다 너무 잘 어울리시는 듯,11.0,4개월 전
51,userzv6nr5gp8w,너무 멋지신 분이네요 쉽지 않았을 과정을 신념으로 감동으로 만드셨군요 항상 힘찬 앞날을 응원합니다 ,11.0,3개월 전
52,hitsugiluva,"I love how many people are growing their hair for cancer! So nice that you're sharing their story, hopefully more people will donate their hair for wigs too.",768.0,4개월 전
53,userlz9pb5ht2k,아니 긴머리 왜 이렇게 잘 어울리세요...? 기르신 취지도 너무 좋네요 ㅠㅠ,25.0,4개월 전
54,Ungnyam,너무 트렌디한 외모셔서 장발도 커트도 원래 갖고 태어나신 것 같아요 하나도 이질감이 없네,48.0,4개월 전
55,KEICHUCOLATE,"Never been this invested in a hair cutting video. I was so touched by his words that it made me give what if's as a man also. What's more is that he looks so pretty with the long hair and looks so handsome when cut it. Salute to you bro, serve well in the military ",20.0,4개월 전
56,lauraconnor408,So much respect for him!! He looked great with long hair & the haircut looks fabulous too!! I wish he was my friend. What a great guy!!!,3.0,3개월 전
57,nunkiyeux6474,i have a huge respect for this guy,10.0,4개월 전
58,haylz4000,"both styles suit him so well in different ways, with the longer hair the bangs made him shine so I'm glad they were kept and permed with the shorter style to suit his face! Whoever gets the hair will be over the moon, it looked so pretty",764.0,4개월 전
59,ericteddycartman,I'd like to see the reaction video of him showing off his new haircut to his friends and family.  He looks great and it was nice to donate the hair.,10.0,4개월 전
60,dadaqi9vu,기우쌤은 누구와도 대화를 참 부드럽게 이질감없이 하시네요.  세분 캐미가 좋아요^^,4.0,3개월 전
61,Pongpon,긴머리 너무 잘 어울리고 양갈래도 잘 어울리네요! 기르는 이유도 너무 좋고ㅠㅠㅠ 대단해요!! 자른 머리도 엄청 잘 어울려요ㅎㅎㅎ,7.0,3개월 전(수정됨)
62,Lutzifalilia,"Wow, they look SO SO SO good with that long hair and the bangs. I wish I could grow out my hair like that. ",3.0,3개월 전
63,junjun5102,짧은 머리가 저렇게 잘어울리는 분인데 기부를 위해 기르셨다니ㅠ 마음이 참 이쁜 분이네요 응원합니다^^,10.0,3개월 전
64,needyverse,How absolutely lovely that he has grown it for so many years after learning about the way wigs can be so helpful to people undergoing treatment for cancer ,15.0,4개월 전
65,userwf6vs3nk3f,저도 머리 기부하려고 기르고 있었어요~ 그런데 머리결이 너무 나빠져서 결국 포기했지만ㅠ.ㅠ 기를수록 더 관리하기가 어렵더라구요 염색이나 펌만 안하면 되지하고 생각했는데 아니더라구여 ㅠㅠ 이런분들 보면 너무 멋지시고 감동이네요 대단하세요~~,2.0,1개월 전
66,msbutler2625,"I have so much respect for this young man. He’s amazing ! 

He looks great with short or long hair ",6.0,3개월 전
67,useriz7gn4wd3d,저도 머리카락 기부하려고 기른후 잘라서 보냈습니다 전 그나마 머리카락도 원래 빨리 잘자라는 편이었고 여자이지만 아들도 있는 아줌마라 더운 여름날 머리카락 치렁치렁 다닌다고 양가에서 좀 입을 댔었는데 한창 멋부리고 남들 시선 예민할때인 이십대초반 꿋꿋이 견뎌내신거 정말 대단하고 존경스러운거 같아요,11.0,3개월 전
68,peaceblossomvalentin667,That's so sweet he decided to donate his hair to help people with cancer. He was gorgeous with the long hair. Even more so with short hair and a beautiful heart.,9.0,4개월 전
69,openkey3,멋집니다. 저도 오래전 머리 기부 해봤는데 저게 정말 쉽진 않거든요. 4~5년 정말 퍼머도 못하며 기르는게 큰 결심이었는데 남자분이라 더 대단하다 칭찬하고 싶어요.,4.0,4개월 전
70,userme1kw5ip8z,와 진짜 길어도 짧아도 잘생기고 예쁜데요..? 근데 머리기부까지.. 완벽하다.. 합격..,66.0,4개월 전
71,userdw9il9mn6s,여자인 저도..반곱슬이라 그런것도 있지만 저렇게 관리 잘하면서 고운 머리결 기르기 힘든데 진짜 대단하세요 ..멋져요ㅠㅠ,6.0,4개월 전
72,sabrinamelo2405,"MEU DEUS QUE FOFO!  
E ele ficou LINDO ",6.0,4개월 전
73,joshhale9355,That man is absolutely beautiful! I was able to donate my hair a few years ago and I’m going to do it soon again. What an awesome thing to do. Fantastic stuff,2.0,3개월 전
74,serapina333,모야 시작부터 눈물났어 ㅠㅠ 세상에 이런 마음씨좋은 멋진 청년이 있다니 너무감동.... 세상은 아직 살만하구나 ㅠㅠ,4.0,2개월 전
75,constellation3696,Mad respect to this man!,2.0,3개월 전
76,Shinelj5fn,"wow! the thought that he grew his hair to donate it is so heartwarming and the way he cared for his hair for the cause made it even more special  I will care for my hair just like you and one day, donate too. This is such a great content.",956.0,4개월 전(수정됨)
77,Sia0221,세상에 여자도 저렇게 관리잘되게 기르기 힘든데 주변 시선에도 소신을 지키기 위해서 이렇게 기르셨다는게 너무 멋있습니다! 몸건강히 군대 잘 다녀오시길 바랍니다,1.0,4개월 전
78,risesun1505,눈매가 굉장히 매력적이라 긴 머리도 짧은 머리도 잘 어울리시는 것 같아요~ 특히 영상 초반에 긴 머리이실 때 고스트 펑크? 스타일 미인으로 sns에서 유명하다고 하면 당연하게 납득할 것 같고ㅋㅋ 그러면서 동시에  짧은 머리도 되게 잘 어울리시네요~ 주관적 감상이지만 눈이 정말 독보적이고 하이라이트 매력포인트인 것 같아요ㅎㅎ,2.0,2개월 전
79,roshelle1003,세상에....쉽지 않은일인데... 남자분이라 해명을 매번하셔야 했을텐데... 대단하시네요~  정말 복 많이 받으세요~,1.0,3주 전
80,chemii,"맘도 너무 예쁘시구 애프터도 너무 멋있으신데아니 다떠나서 풀뱅 긴 생머리 너무 잘 어울리셔서 그저 부럽,,,",9.0,4개월 전(수정됨)
81,usersq1xi7mx6p,출연자분 마음이 너무 예쁘네요 앞으로 모든 일 잘 되고 원하는 바 이루길 응원합니다!,0.0,5일 전(수정됨)
82,monayang123,WOW..................he's so handsome!! Before and after the cut! It's so awesome that he grew his hair out because of what his friend went through. It's very inspiring!! That's what you call friend goals! Thank you for sharing his hair story. :),1.0,2개월 전(수정됨)
83,sexypancake1,"This is really amazing. I imagine it can't have been easy to grow his hair this length for so many years. Many strangers may have commented on it or been unfriendly because they had prejudiced thoughts about men with long hair. In reality, his intentions are PURE. If strangers knew, they'd be ashamed.

I had a friend in college who grew his hair to this length. It was so beautiful and healthy. Then one day POOF, the long hair was gone, and his style was short and close to the skull. He'd donated it all to make a wig for those with cancer. Such a beautiful person.

I have also grown and donated my hair many times over the years, but I can never grown my hair to this length. It's very impressive.",264.0,4개월 전
84,zacca857,"나이를 먹으면서 느끼는거지만 주위 부정적시선을 견디게 하는 신념과 목표의식을 갖고 사는 사람들이 종종 보이는데, 그런분들과 영상속 분도 나이를 떠나서 리스펙합니다",2.0,1개월 전(수정됨)
85,userro3qh4ow3x,저의 둘째 아들도 소아암 환자였어요. 초등 저학년 때 항암치료하느라 거의 학교를 못 다녔었죠.항암치료로 인해 몇 가닥 안 남은 머리카락을 자를 때 울건 아들 모습이 아른거립니다. 그렇게 사경을 헤맸던 아들이 지금은 건강한 중학생입니다~~ 사연자님께서 소아암 아아를 위해 머리카락을 기르면서 불편함을 감수하셨다니. 대단하십니다.,30.0,4개월 전
86,manjinam3424,와.. 진짜 너무나 멋지고 훌륭하십니다. 존경스럽고.. 대단하다는 말 밖에 안나오네욬,0.0,12일 전
87,eligaret3666,As someone who also donates their hair.. it is such a rewarding and freeing experience. ,1.0,2개월 전
88,sejinroom,"다시봐도 비포 애프터 대박..
기부 목적으로 4년 넘게 기른 머리 잘라내고 또 다른 멋진 머리 찾아가신거에 조금이라두 도움이 되어 영광이었습니다  군대 건강히 잘 다녀오세요!!!",469.0,4개월 전
89,soyeon117,진짜 너무 멋있으십니다 군대 건강히 다녀오세요,3.0,4개월 전
90,lenhathi,I smiles throughout the whole vid  lovely boy and lovely convo from the three of you ,0.0,1개월 전
91,Anonymouskp3jf,Asian hair grows so fast I've noticed y'all always surprise me with just how fast you can avoid regretting a haircut ,3.0,4개월 전
92,gearysp,"I don't know how in the YouTube algorithm I stumbled across this.... but I'm so happy I did 

This is so wholesome  what an amazing person ️",1.0,3개월 전
93,userwn9jm7sk2k,우울증도있고 집에있는걸좋아해서 머리를정수리에똥처럼 묶고 뒹굴거리는데 너무무거워서 집에서 기안84빙의해서 싹뚝싹뚝자른지 2년이넘어가네요  염색도 안하니까 다시 길려서 기부해봐야겠어요..,1.0,1개월 전
94,buzzlegends452,"와,, 머리 기른다는게 진짜 쉽지 않은게 주변에서 온갖 삿대질, 비난 등 견뎌내야해요
저도 그런거 다 견뎌내면서 장발하고 다니다가 군대가기 한달전에 짧은머리 했었던 기억이나네요,, 다시 장발로 기르는중인데 한세월이에요 ㅠ",373.0,4개월 전
95,ZianaSue,"I donated my hair twice to Locks of Love (they make wigs for cancer patients (US-based organization)).
From one kind hearted person to another thank you.",1.0,3개월 전
96,userkp4tf7fr4b,마음과 외모가 아주 멋진분이시네요 이런분들이 있어서 세상은 아직 살만하죠,3.0,3개월 전
97,sarang3506,"마인드도 멋있고 진짜 머리 스타일듀 둘 다 멋있지만, 머리 자르고 나니 넘 잘 생겨서 심장이  ",1.0,3개월 전
98,lilianJ,"The last words before letting his hair go 'i had all the fun i wanted' so great that he could go on with a last positive memory instead of saying something like ""I was tired off what people thought about me""",7.0,3개월 전
