,youtube_id,comment,like_num,comment_date
0,0oxoO,이미 전문의가 됐더라도 끊임없이 공부하시고 그걸 토대로 문제점과 해결방안까지 말씀해주시는 분은 선생님밖에 없는것 같아요..미세먼지 요즘 너무 심해서 걱정이었는데 도움이 많이 됐어요!!,6.0,6개월 전
1,usernv6sk2wn7y,원장님 진짜 도움되는 내용 알차고 이해쉽게 설명해 주셔서 감사해요! 미먼 청정국 아닌 한국에서 자외선 차단제와 항산화 케어가 얼마나 중요한지 다시 한번 되짚고 갑니당!!!! ,0.0,5개월 전
2,deendeen3954,"미세먼지 나쁘다나쁘다 얘기만들었지...이렇게 과학적으로 근거를 딱 말씀해주시니 너무 유익합니다
멋지다 피알남",4.0,6개월 전
3,heojunnn,썸네일 너무 현재 트렌드에 맞게 잘 만드신거 같아요?ㅎㅎㅎ 그에 맞는 유용한 정보 ! 요즘 안 그래도 날씨 풀리면서 미세먼지 심각해서 마스크 해제 되었지만 계속 쓰고 다니고 있어요 ㅠㅠ 원장님 말씀대로 항산화제 꼭 챙겨먹고 자외선 차단제 더욱 더 잘발라야겠어요!,3.0,6개월 전
4,useryd1wl2cj7t,"지금까지 올려주신 영상들 모두 잘 챙겨보고 있습니다.

원리를 설명해주시는 덕분에 마케팅에 속지 않고 필요한 소비만 하고 있습니다. 한때 비싸다는 거 다 써봤는데 원리에 맞게 제품을 사용하고 생활습관을 개선하는 게 가장 효과적이더라고요. 피알남님 영상 덕분에 피부가 건강하게 맑아졌고 또 그덕에 자신감이 생겼고, 돈 아껴서 다른 좋은 경험을 살 수 있게 됐습니다. 고맙습니다. 앞으로도 기대할게요.

피부가 개선되고 나서, 타인으로부터 오는 건강한 피드백이 나 자신을 또 얼마나 건강하게 만들어주는 것인지를 깨달았습니다. 그래서 갑작스럽지만(?) 저의 이 작은 피드백이 피알남 채널 제작진 분들께 하루에 작은 동기부여나마 될 수 있기를 바라며 그동안 채널을 통해 느꼈던 점을 댓글로 달아봅니다. 오늘은 왜인지 댓글을 남기고 싶었어요ㅎㅎ",3.0,6개월 전
5,userwb2nq8dr3u,우와!  화학공부를 이렇게 재밌게 이해시켜주시네요. 항산화 비타민! 자외선차단제! 로 미세먼지로부터 자유하겠습니다,2.0,6개월 전
6,userjk6fb2ck4v,"썸네일에 시선을 뺏기고, 내용에 마음을 뺏겼어요  역시 원장님 영상엔 배울게 가득해서 영상 세번 돌려보는건 필수예요 :) 오늘도 감사해요 :)",1.0,6개월 전
7,young1148,"와~~~!! 
썸네일 보고 뭔가(?)이끌리듯 들어왔는데.. 미세먼지에 대한 이렇게나 중요한 내용들이 있었네요!! 
특히 가솔린과 디젤에 비교해서 설명해주시니 더 이해가 땋!!
오늘도 잘 보고 좋은 정보 얻고 갑니다! 
멋지다!!!",2.0,6개월 전
8,usercz8vc6ve5o,"오~~ 피부 관리 좋아 하는 독거 노총각입니다. 안그래도 봄 되면서 황사다 뭐다 해서 신경이 쓰였는데... 역시, 때에 맞춘 유익한 정보 던지기~~!! ㅋㅋㅋ  감사합니다~",2.0,6개월 전
9,userzx8rx2lt5p,미세먼지가 이렇게 안좋았군요 ㅠㅠㅠ 늘 좋은 정보 감사해요!!,1.0,6개월 전
10,userbf3jp8xt5j,썸네일이 안들어올 수가 없잖아요 ㅋㅋㅋㅋ 미세먼지 안그래도 극혐이었는데 꿀정보 감사해요 ,2.0,6개월 전
11,userth1ns5oz1p,원장님 짱!!!,2.0,6개월 전
12,useruz2fs6rf1e,김홍석 의사님 혹시 일렉트로포레이션에 대해 한번 다뤄주실 수 있나요? 스킨부스터급 효과라고 하는데 부작용이나 정확한 정보같은게 많이 나와있지않네요 ㅜㅜ 한번 다뤄주시면 감사하겠습니다,1.0,5개월 전
13,userrn6rn3um2y,피부지키기 어려우면서도 꼭 해야겧네요 꾸준함이 답이네요 좋은정보 잘보고갑니다,2.0,6개월 전
14,Sympathyplease,"아  원장님. 썸네일을 후덜덜 하게 해놓으셔서 안볼 수가 없네요. 홀린듯 클릭해서 10분 순삭. 
오늘도 잘 배우고 갑니다. 비타민으로 일상을 진심으로 지켜내야죠. 비타민 파우더 너무 잘 쓰고 있어요. 
썸네일 꿈에 나올것 같아요 꺄악~",4.0,6개월 전
15,supsmi6123,저 번주에 미세먼지 장난 아니었는데... 좋은 정보 ~~ 멋지다 피알남~,1.0,6개월 전
16,userjh8vp8ui6u,늘 좋은정보 알찬정보 깨알같은 재미 넘 넘 잘 보고 있습니다 특히 저희 삼촌같은 피알남님  외모가 너무 맘에 들어요ㅎㅎㅎ,1.0,6개월 전(수정됨)
17,useriq4kh4ze3b,아ㅋㅋㅋㅋ썸넬땜에 홀린듯 들어왔어요ㅋㅋㅋㅋㅋ멋지다 김홍석!ㄲㅋㅋㅋㅋㅋㅋㅋㅋㅋㅋ지긋지긋한 미세먼지네요ㅜㅜㅜㅜ지갸와지갸와ㅜㅜㅜㅜㅜ,5.0,6개월 전(수정됨)
18,userbz5od5fo1s,노화도 환경도 영향을 받으니 관리만이 길이네요,2.0,6개월 전
19,usersu1ll3cf2v,유익한 정보 고맙습니다.,1.0,6개월 전
20,personastudio9915,브라보 김홍석,18.0,6개월 전
21,userqv4kp9vk6d,"ㅎㅎㅎㅎㅎ단발머리도 너무 어울리시는데요? 그나저나 미세먼지 죽겠네요.ㅜㅠ 요새 목도 칼칼한게...
코로나도 끝났으니 미세먼지도 없어지는 세상이..오겠죠?^^;;;",4.0,6개월 전
22,worklifedoc,미세먼지가 이렇게 피부에 나쁜줄 몰랐어요ㄷㄷ새로운 정보 알고 갑니다!! 항산화 화장품 어떤게 좋은지 추천받고싶네요!!,1.0,6개월 전
23,drhong3cosmetic,"* 영상 순서입니다
00:00 그냥 참고 살아야하나…? (아니죠!)
00:35 봄철 불청객 '미세먼지'가 피부에 끼치는 악영향
01:23 PAH (다환방향족탄화수소) - 자외선 (UVA1)과 만나 피부에 악영향
03:21 철(Fe)성분 - 매우 강한 공격성의 활성산소
07:28 근본적인 미세먼지 피부관리법 5가지
09:02 총정리!",8.0,6개월 전
24,userqe2ih8my1l,완전 깔끔요약이네요,1.0,6개월 전
25,usergn3yh3ct6p,썸네일 대박이네요 ㅋㅋㅋㅋㅋㅋㅋㅋㅋㅋㅋ 덕분에 좋은 정보 얻어갑니다 ㅎ,1.0,6개월 전
26,jamtingahn6825,미세먼지 안좋은건 알고 있었지만 정말 무시무시하네요!!!,1.0,6개월 전
27,userbs6if3yg4o,ㅋㅋㅋㅋ원장님 넘 웃겨요 오늘도 잘 듣고 갑니다:) 멋지다 보스 원장님!,1.0,6개월 전
28,useril4vw5tq1t,미세먼지 때문에 늘 걱정이었는데 희소식 이네요,1.0,6개월 전
29,Hannahst2ll,너무 재밌고 유익해요....!!!!!!!!!,0.0,5개월 전
30,bluecouple,미세먼지에 대한 정보 알려주셔서 감사해요,1.0,6개월 전
31,userjg9di9tm6g,원장님 그런데 선크림은 몇시까지는 꼭 덧발라야할까요? 오후6시 넘어가면 괜찮은가요?,1.0,6개월 전
32,useryk9ph5zy3t,미세먼지때문에 피부 고민이였는데 감사합니다,1.0,6개월 전
33,broniccc,ㅋㅋㅋㅋㅋㅋ썸네일때문에 안볼수가없네요ㅋㅋㅋㅋ,9.0,6개월 전
34,usertg6si3sh2v,미세먼지 각종 병의 주범이네요 마스크 씻기 기본부터 철저히 해야겠네요,1.0,6개월 전
35,silyly4071,썸네일만 봐도 들리네요 그 대사 ㅋㅋㅋㅋㅋㅋㅋ 멋지다 원장님!,1.0,6개월 전
36,userxc7eh6fv7d,좋은직업에도 끊임없이 자기개발과의 싸움이군요,1.0,6개월 전
37,userok1hg1dr5i,와 해결방법 넘적절하셔요,1.0,6개월 전
38,usermz6si7bp3s,영상 잘 보고갑니다~,0.0,5개월 전
39,userik5ou7zt4o,요새 미세먼지가 넘 많아서 피부가 안좋아여 ㅠㅠㅠ,1.0,6개월 전
40,snipersr4011,"안녕하세요, 과거 히알루론산을 다루신 영상을 보고 알아보다가, 미국 과학저널 developmental cell에 히알루론산의 분자가 큰 경우에는 암을 억제하지만, 염증 등으로 작게 분해되면 발암을 촉진하는 사실을 확인했다는 일본 도쿄대 연구팀의 연구 결과가 있는데, 그러면 저분자 형태의 히알루론산 화장품을 쓰면 안되는게 아닌지 궁금하여 여쭤봅니다.",0.0,6개월 전
41,ain4182,썸넬 ㅋㅋㅋㅋㅋㅋㅋㅋㅋㅋㅋㅋㅋㅋㅋ미치겠네요 진짜 ㅋㅋㅋㅋㅋㅋㅋㅋㅋㅋㅋ,2.0,6개월 전
42,usermj9md5sd4b,진짜 미세먼지 극혐입니다ㅜㅠ,1.0,6개월 전
43,userir6yl2pu5j,미세먼지가 정말 피부에 안좋은것 같아요~,0.0,6개월 전
44,useryi6pi3tg3f,"미세먼지가 건강에 안좋다는건 알고 있었지만
.. 이렇게 자세히는 몰랐어요",1.0,6개월 전
45,hytv7733,미세먼지에 대한 세세한정보에요 !,1.0,6개월 전
46,userni8ei7fl7i,전문의샘들중 젤똑똑해요,0.0,4개월 전
47,annycho4581,다 그 서쪽나라때문이잖아요...우리가 아무리 노오력 하면 뭐하나요....그나라가 바뀌지를 않고 더하는데....,3.0,6개월 전
48,useryx9dd4qu5d,썸네일 최고 ㅋㅋㅋ,1.0,6개월 전
49,PPPPPoke,피부정보도 정보인데 옷 뭐입고 나올지 궁금해서 보기도 하는 그런 채널,0.0,5개월 전
50,mjk2544,아 안들어올래야 안들어올수가 없는 썸넬이었다,2.0,6개월 전
51,yadlleyadlle,썸넬 진짜 도른자 ㅋㅋㅋㅋ 이걸 어떻게 안들어오냐구요....,0.0,6개월 전
52,rockingrocking,ㅋㅋㅋㅋㅋㅋㅋㅋ썸넬ㅋㅋㅋㅋㅋㅋㅋ흉흉하네요,8.0,6개월 전
53,userel7qr7bn1e,썸네일 뭐죠 ㅋㅋㅋㅋㅋㅋㅋㅋㅋㅋㅋ 진짜 이끌리듯 들어옴..,1.0,6개월 전
54,usermo9qr2gc7j,썸네일 보고 안눌러볼수가 없었다,0.0,6개월 전
55,LiftingPS,아놔 멋지다홍석아 썸네일 지금봤어여ㅋㅋㅋㄱㅋㅋㅋㅋ,0.0,5개월 전
56,useryx4xf3rt8w,"나의 브링핑에 온 걸 환영해, 연진아.",1.0,6개월 전
57,userjl9qs5ev2m,썸네일 어케 참아 ㅋㅋㅋㅋ,2.0,6개월 전
