,youtube_id,comment,like_num,comment_date
0,shyhy7,재림님 영상은 항상 꾸밈없고 솔직한 재림님의 매력이 느껴져요~~ 스킵안하고 보는 몇 안되는 유투버세요~~ 택배 개봉기도 얼른얼른 무브무브 ^^,1.0,8개월 전(수정됨)
1,userrc2pg2du7c,"재림님 새해복 많이 받으세요~
오늘도 영상 즐겁게 잘 봤습니다 ㅎㅎ 
피부염 이후 관리 영상도 기다려집니다 ㅎㅎ",0.0,8개월 전
2,userjz9rh5ky9j,오! 패션컨텐츠! 너무 기다렸습니다 ㅠㅠ 저렴버전으로도 부탁드려요 ㅎㅎ에이블리나 지그재그 하울!! 정신적인 불안함이나 약점들을 잘 아는게 너무 중요하죠 내면적으로는 점점 더 단단해지는 듯한 모습이 보여서 무척 보기좋아요 응원합니다!!,0.0,8개월 전
3,rangada7671,"재림님 피부 엄청 좋아지셨네요 !!!! 
피부영상 기다리고 있을게용 ㅠㅠㅠㅠ~~",2.0,8개월 전
4,usergf7to4gq6l,재림님 아버지랑 닮으셨네용~ 올해에도 행복하고 즐겁게 보내시길바라요,0.0,8개월 전
5,1852,재림님도 새해복많이받으세요:),0.0,8개월 전
6,enwod7608,"재림님 피부 많이 좋아지셨네요!
항상 응원합니다:)",0.0,8개월 전
7,Alinaro3og,저는 재림님의 일상 브이로그가 좋은데 패션영상 집중하면서 일상영상이 적어질가바  아쉬워여 ㅠ 특히 집꾸미 택배 개봉하는거 젤 좋아해요.다른 사람들  브이로그는 보다보면 질리는데  재림님의  브이로그는 보면서 힐링하는 느낌이랄까요 스킵도 안하게 되고 .왜 그럴까 생각해보면 너무 인위적이지 않고 뭔가 솔직하고 자연스러워서 편한 느낌을 주는것 같아요 .아무튼 그래도 새해에는 재림님이 원하는 방향으로 재밌게 하시고 새해 복 많이 받길 바랍니다 .,1.0,8개월 전
8,aeonianhoney318,"언니 악세사리 하울이나, 소개 해주시면 좋을 것 같아용 >< 그리고 제일 잘 입는 옷들 한 번씩 입으면서 소개해주는 것도 좋을 것 같아용️",1.0,8개월 전
9,gtdhello,재림님 새해 복 많이 받으세요,1.0,8개월 전
10,userxw1yc6id7u,"회색 맨투맨 코디 넘 이뻐요
또다시 독립 기대 되네요 ~~",0.0,8개월 전
11,useryu6sh3tz2p,재림쓰 화이팅,0.0,8개월 전
12,userqz354,안녕하세요.ㅎㅎ.브이로그영상잘봤습니다.올해도.브이로그영상기대합니다.새해복많히받으세요~^^,0.0,8개월 전
13,userdk6cc9ti1w,브이로그가 제일 좋아요 전 ㅠㅠ브이로그 많이 찍어주세요 놀러다니는거 그냥 뭐먹는거 등등 ㅠ,0.0,8개월 전
14,userdk6cc9ti1w,30대 중반~?! 재림님 몇년생이세여?,0.0,8개월 전
15,useryu6sh3tz2p,네일 추천해주세열~,0.0,8개월 전
16,nmdt9re,네??? 30대 중반요???,0.0,8개월 전
