,youtube_id,comment,like_num,comment_date
63,userlo2tj8sr1h,집에 비슷한 제품의 옷이 있는데 어떻게 입어야할지 고민이라 옷장에 쳐박아두기만 했는데 많은 도움이 되었어요. 이런 코디로 입고 싶다는 생각을 가지게하는 코디였어요!,0.0,5개월 전
64,chhhhh8387,"블라우스 너무 예뻐요,, 제 스타일  여리여리 한 느낌이 넘 여성스럽고 예뻐요 베이직하고 심플하게 입는거 좋아하는데 코튼 셔링 블라우스 있으면 유행 타지않고 두루두루 유용하게 잘 입게 될거 같아서 갖고싶네용🥹🫶 앞으로 영상 잘 챙겨볼게요! 응원해요 ㅎㅎ 감기 조심하시고 예쁜 봄 보내시길 바라요 !",0.0,5개월 전
65,userkm8cj4qb5w,"으악 스트랩 니트탑 너무 예뻐요 심플한 듯 포인트 있는 착장 취향저격,,
블라우스도 넘예인데여?!!?!!!?!?!?!? 완전 봄 그 자체",0.0,5개월 전
66,wlskwlsk8434,"이벤트 참여완료  봄 룩북 찾아보다가 목소리랑 영상 분위기가 너무좋으셔서 바로 구독했어여,,,행복🫠 코튼 셔링 블라우스는 셔링 디테일이 있어서 너무 평범하지않아 맘에들어요,,하객룩 뿐만아니라 면접룩으로도 딱인것같아요! 정우님 따라입고 앞으로 남은 면접보러가고싶어요~?!!ㅎㅎ",0.0,5개월 전
67,donnaaaaaa,"오늘도 잘봐써요,, 영상 자주 올라오니까 넘모 좋아요,,",0.0,5개월 전
68,userej7em1ll4d,퇴근하면서 보는 영상입니당. 사회초년생이라직장에 다니면서 입고다닐 옷이 없어 고민하던 와중 단비같은 영상 발견..,0.0,5개월 전
69,oboq3773,셔링 블라우스 진짜 여기저기 잘 입을 수 있을 거 같아요ㅠㅠ 좋은 이벤트 감사합니당🫶,0.0,5개월 전
70,userqn1ch8cj1m,항상 보기만 했는데 수줍게.. 참여해봅니다🫣 블라우스 너무 찰떡이시네요 손민수 하고싶습니다 ㅎㅎ히히,0.0,5개월 전
71,userhx7kr9tn9s,빨리 시험끝나구 꼭 입고싶어욥,0.0,5개월 전
72,qkdwlals123,"아늬 핏 무슨일이에요,,, 마네킹인줄 알았어요…
셔링블라우스는 많지만 대부분 너무 부해보이거나 밋밋하거나 소재가 수술복같아 보이는 그런 옷들이 많아 구매가 선뜻 꺼려지더라고요 근데 아티드 제품은 부드러운 소재에 은은한 셔링이 과하지 않게 분위기를 사랑스럽게 만들어주는거 같아요 아티드 제품들은 하의가 이쁜게 많네요 핏이 깔끔하고 소재는 뭐.. 정우님이 픽하신거라면 그 가격대에 맞는 소재를 썼으리라 믿습니다",0.0,5개월 전(수정됨)
73,jiyoonmin8711,ㅠㅠ 스트랩 니트탑 이뻐요 ... 오늘 소개해주신 제품들 다 예뻐서 들어가봤는데 차정원님이 모델하셨더라구용..?넘 이뻐요 다 ㅠㅠ,0.0,5개월 전
74,ivoryk2690,Look1 슬랙스… 정보 제발….,0.0,5개월 전
75,everyeah,"무채색 러버인데 영상 너무 좋아여
어떻게 무채색으로 이런 룩을 연출할 수 있는지 놀라웠어요!!
저는 Look3가 젤 맘에 들었습니당!!
하얀색 블라우스와 검정 롱치마의 조합은 기본 중에 기본이잖아요!! 요즘 롱치마가 그렇게 유행이더라구요!!! 
그리구 블라우스..🫢🫢🫢 이 블라우스는 진짜 활용도 갑!일것 같아요!! 뷔스티에 원피스랑 입으신것도 너무 이쁘고 단독으로도 입어도 이쁜 그런 아이템!! 진주단추로 인해 흔하지 않은 디자인을 벗어나 고급스러운 느낌이 들어서 더 맘에 들어요
진짜 이거 입구 나가면 뭐든지 잘 될것 같은 아이템이네요!!",1.0,5개월 전(수정됨)
