,youtube_id,comment,like_num,comment_date
0,userfr3kg5do7e,"mlbb를 사랑하는 봄 스트롱,, 항상 쨍한 컬러가 베스트라 딜레마에 빠졌었는데 
mlbb하면서도 봄웜에 어울리는 컬러 추천해주셔서 넘넘 유익해요",9.0,8개월 전
1,yummydanmuji,"확신의 봄클리언데 주황끼 도는 립 말고 분홍끼 도는 립들도 잘 어울려요! 영상에서는 주황끼 도는 것들만 추천하셨길래.. 영상에서 언급되지 않은 것들로만 추천해보자면

어뮤즈 듀틴트 라비앙코랄, 하트퍼센트 피치코랄, 피그로즈, 릴리바이레드 치키피치, 비바이바닐라 로지쉘 -> 데일리 휘뚜루마뚜루템. 민낯에 발라도 됨

하트퍼센트 누디오렌지, 무드베이지 -> 누드립이 땡길 때, 아이 메이크업을 더 강조하고 싶을때

릴리바이레드 베리키치, 하트퍼센트 퓨어레드, 페리페라 봄방사수, 토니모리 로즈타르트 -> 쨍한 립 바르고 싶을 때

릴리바이레드 킬미플럼 -> 발라본 보라색 립 중에 가장 잘 어울렸음

보송한 마무리감보다 촉촉 반짝한 게 더 잘 어울려서 대부분이 촉촉제품들입니당",19.0,5개월 전
2,useros4cu9uh5l,겨울 클리어 제품 추천해주시는 분이 거의 없으셔서 언니만 기다리는 사람입니당.. 겨울 클리어 영상 오조오억개 만들어주세용🥹🥹,25.0,8개월 전
3,annau1023,"봄브인데 이쁜색상들이 많네요
백화점템들도 고루고루 섞여서 보여주심 좋겠어욪^^",6.0,8개월 전
4,malaxianguoandbeer,헉 진단당시 베이스는 라이트톤 포인트로 비비드하게 하는 봄 브라이트라고 하셔서 약간 혼돈이 왔었는데 여기선 클리어라고 하시네요.. 어쩐지 봄 브라이트 메이크업 보면 손이 안가더군요 ㅠㅠ 요즘 올리브영에 가면 살만한 립이 잘 없다고 느껴졌는데 제생각이 맞았네요 ㅠㅠㅜ,2.0,8개월 전
5,userle4co7tb4e,"봄 비비드로 퍼스널컬러 진단받고
립 찾아다니는데 은근 없더라구요!
생기갑으로 매일 연명하고 있었는데~
(생기갑 너무 이쁜데 좀 건조해서 ㅜㅜ)
예영님 추천 참고해서
탱글탱글 립 사볼께요^^",7.0,7개월 전
6,Shrimpcrackersgood,웨이크메이크…3통썻엇는데ㅋㅋㅋㅋ진짜 세상 너무 건조해서 사실분들은 꼭 립글로즈나 립밤 필수 !가뭄날수도있어요,0.0,2개월 전
7,somin00,가을 뮤트로 살다가 봄 비비드 결과 받고 뭐 사야할지 멘탈이 나가있었는데 정리 너무 좋게 해주셔서 바로 사러 갑니당!! 감사해요ㅠㅠ,3.0,7개월 전
8,def4247,"ㅠㅠㅠㅠ설명 들으면 들을수록 저는 봄웜이네요!!
립스틱 보다도 틴트를 사용하는 저도 레이디데인저는 2통이나 구매해서 사용하고 있는 립스틱 최애템이에요!! 얼마 전에 맹그로브도 샀는데 이것도 봄웜템으로 적극 추천입니다!! ◡̈ 
웨메 자몽워터 같은 틴트들 정말 애정하는데 요즘 예영님 말씀대로 mlbb립들이나, 매트한 립들이 많아서 쬐금 슬프네요... 좀 차분한 립들은 안어울리고 바로 나이들어 보이더라구요.. 
여기 있는 립들 하나씩 다 써봐야겠어요 감사해요",1.0,7개월 전(수정됨)
9,britt355,Appreciate your content and the English subs! ,1.0,1개월 전
10,S2,우왕 저 페리페라 07호 심장폭격 넘 잘 쓰고 있는데 나와서 반가웠어요! 다른 립들도 예영님 픽 믿고 구입해봐야겠어요!🫶,0.0,3개월 전
11,userbx4rf3br3m,저 봄웜 브라이트인데 제가 애용했던 템 나와서 깜짝놀랬어요 ㅋㅋㅋㅋㅋ 추천해주시는거 믿도 그대로 사도 될거같아여,3.0,7개월 전
12,Euiooy5pj,여름라이트도 보고싶어용,6.0,8개월 전
13,ammj2476,"생기갑, 로즈틱만 몇통을 비웠는지 모르겠어요..ㅋㅋㅋㅋㅋ 발품찾기도 귀찮아서 같은거만 썼는데 영상덕에 편하게 다른제품도 써봐야겠어요️️",2.0,7개월 전(수정됨)
14,vela7882,질문드릴게 있는데요 봄 비비드랑 봄 스트롱이랑 서로 다른가요? 혹시 봄 스트롱에 어울리는 스타일링 색상조합같은 영상은 없을까요?,1.0,2개월 전
15,userkn9rp4et6c,와 제가 쓰는 제품 3개나 있네용!! 진짜 믿음 뿜뿜🫶,4.0,6개월 전(수정됨)
16,alwayshappily1,예영님 제가 노란 피부를 가지고 있는데(실제로 기계로 측정했을 때에도 노란기가 평균보다 아주 살짝 높은 정도로 나왔어요!) 그래서 여태껏 가을 웜톤인 줄 알았어요… 그런데 겨울딥 진단받고 충격 ㅠ 근데 또 예영이예영님 영상 보면 겨울딥/다크 피부는 노란끼가 없다고 하던데 뭐가 맞는건지 모르겠네요…,0.0,7개월 전
17,selee1446,여태 가을웜으로 살았는데 이번에 첫 퍼스널에서 봄웜 스트롱 받았어요 ㅎㅎㅎㅎ 옷이고 화장품이고 다 버렷….. 다시 사야하는데 너무 감사해요 어흑흑,1.0,3개월 전
18,usergj3tg3ft2w,여태 본 추천템중에 찐인거같아요 제가 진짜 자주쓰는 립이네요 (봄브타입),5.0,7개월 전
19,nanacon1662,감사합니다 여름브라이트인데 봄브라이트도 잘 어울려서 이거보고 윀멬 틴트샀어요!,0.0,2개월 전
20,usernp9dt4px1s,여쿨브라이트 찰떡립 궁금합니다,1.0,8개월 전
21,userqe7du1it5x,봄 브라이트인데 웨이크메에크 젠틀브릭 어울릴까요?,1.0,7개월 전
22,usertf2db3nr6s,예영님 저 궁금한거 있어요..! 저는 겨울고프트 진단받았는데…회끼 돌거나 플럼빛 도는 섀도우는 진짜 안어울려요 그리고 플럼빛 립보다 지금 영상속 봄웜톤 립들이 더 잘어울려요..! 왜일까욥..? 참고로 피부는 22호 타입 노란끼 도는 피부톤입니당!,1.0,8개월 전
23,sunnyday303,가을 뮤트? 딥도 ㅠ 해주시면  안 될까요..? ㅠ 그리고 유투브 잘 보고 있습니다,1.0,8개월 전
24,uservf4ck4pb6f,여쿨뮤트 존버존버...,2.0,8개월 전
25,userqi6ig5jw1n,"전 가을스트롱이에요 근데 봄스트롱이랑 겹치는립 많은거같아요
왜냐하면 맥 칠리 안어울림 가을웜인데도
이거보고 사야겠어요 쨍한거 어울림
핑크는 안어울리거든요…. ㅠ",0.0,3개월 전
26,asuijj,"제가 23호 인데 찐한색이 잘 안어울려요
봄웜인줄 알았는데 립 보니깐 제가 다 안어울리는 컬러더라구요! 제 파스널컬러가 뭔지 모르겠어요 너무 주황도 안어울ㄹ리고 너무 쿨도 안어울려요",2.0,7개월 전
27,Cozy,립추천 시리즈 퍼컬별로 나오는건가용?!?? 퍼컬 정보계의 사막 ... 겨울 클리어 존버합니다 🥹🥹🥹🥹,1.0,8개월 전
