,youtube_id,comment,like_num,comment_date
0,uservm6tu3pd5g,2:26 바람막이 같은 느낌인데 엄청 저렴한 가격에 비해 퀄리티도 좋게 뽑혀서 새내기들이 겨울에서 봄으로 가는 간절기 시기에 가볍게 걸치기 너무 좋은 아우터인 것 같아요! 깔끔하고 깨끗한 이미지를 만들 수도 있고요 제가 낼 대학에 입학한다면 입학길에 이 자켓을 입고 싶다는 생각이 영상을 보면서 언뜻 들더라고요! LOOK1이 전 가장 예쁘게 느껴졌어요,3.0,7개월 전(수정됨)
1,jyc9975,"6번 레더자켓
대학생 새내기 코디 너무 예뻐요!
무엇보다 남령님께서 가성비 너무 좋고 클래식 하면서도 포인트는 톡톡히 되는 아이템들로만 추천을 해주셔서 모든 룩 다 보면서 어떻게 코디하고 싶은지 상상해보게 되었어요
그중에서도 마지막 아우터 레더자켓에 딱 꽂혀버렸는데요!
제 기준에선 간절기에 레더만큼 활용도 좋은 제품은 드물고 클래식하면서도 트렌디한 느낌을 굉장히 좋아하는 저로서는 디테일마저도 딱 마음에 드는 정말 소장하고픈 제품을 만난것 같아요
아직 금액대  있는 제품 장만은 너무 부담스러운 상황이고 레더라서 너무 저렴하면 또 제가 원하는 느낌이 나지 않을까 늘 고민만 하다 구매까지 이어지지 않았는데 너무 좋은 기회를 주셔서 이벤트도 참여해보아요 
남령님 오늘 영상도 잘봤고 멋진 이벤트까지 열어주셔서 감사드립니다 ",0.0,7개월 전
2,usernp5gm4vw7b,"1번 배색 바시티 코튼 집업
무난한듯 보이지만 포인트로 활용 가능하게 데님으로 나온 센스에 무릎탁.ᐟ 
거기에 남령님스럽게 해석한 스타일링까지 완벽 
데일리하게 휘뚜루마뜌루 입기도 졸고 포인트줘서 힙하게 꾸안꾸 느낌으로 입기도 좋아보여서 활용도도 굳굳.ᐟ 
이번 영상도 잘봤습니다 저는 항상 어떻게 입어야 할지 고민이 많았는데 나령님 영상 보고 조각조각들을 새로 모아 합쳐주는 과정에 접어들었답니다~ 항상 건강하세요",0.0,7개월 전
3,userkb1ur7kd8x,"2번코튼자켓이요
화이트 컬러가 정말 잘 뽑혔고 디자인이 깔끔하면서도 힙 한스푼  넣은 느낌이라서 너무 마음에 들어요  평소에 툭 걸치는 느낌의 꾸안꾸나
꾸꾸룩에 입어도 어떤 코디에도 다 잘 어울리것 같아요 
지퍼도 투웨이라서 코디하기두 편하구 다양한 연출이 가능해서 좋아요!! 특히 소매랑 밑단이 밴딩처리가 되어있어서 흘러낼림 걱정도 없고 핏을 더 이쁘게 만들어주는것 같아요 디자인도 완전 러블리하면서도 센슈얼하고 소재도 적당히 두툼해서 봄 초여름 가을 초겨울 사계절 동안 데일리로 잘 입고 다닐것 같아요 이벤트 열어주셔서 넘 감사드립니다 ㅎㅎ ️덕분에 여러 가성비 좋은 옷들 또 이쁜옷들 알게되어서 넘 감사드립니다 요즘 넘 추운데 감기 조심하시구 항상 영상 잘 보구 있어요 ",0.0,7개월 전
4,usersy1cf4xi1p,"6:30 6번 레더 자켓이요!  
이런 영상이 꼬옥 필요했는데 너무 예쁘고 질 좋은 옷들을 애정 담아 하나하나 포인트를 찝어 설명해주셔서 너무너무 감사합니다! 
이번에 새내기가 돼서 이 옷입고 멋진 캠퍼스 라이프를 즐기고 싶어요! 항상 옷에 관심이 없다가 언니 영상보고 옷을 사고싶다는 생각이 들었어요! 앞으로도 언니 영상 많이 찾아올게요",0.0,7개월 전
5,jiiihyun5156,2번룩이요! 화사해서 봄여름에 입으면 너무 잘 어울릴 것 같아요ㅎㅎ 그리고 투웨이라서 다양한 코디하기에도 편할 것 같다는!!! 평소에 남령님 룩북영상 보고 코디하는 거 많이 참고하고 있는데 덕분에 옷 코디하기 훨 쉬워졌어요! 감사합니당  만약에 옷을 받는다면 남령님처럼 올화이트로 입어보고 싶습니당,0.0,7개월 전
6,userms3kr3bk8o,"3번이요
언니 코디법덕분에 많은 도움받았어요! 특히 레이어드할때요! 늘 하고싶었는데 부담돼서 못하고있었는데 덕분에 할수있었어요 너무감사해요.. 진짜 구세주..앞으로도 꾸준히해주세요!!!
3번 고른이유는 제가 검정옷밖에 없는데 흰색은 조금 부담스럽고 예쁜디자인에 포인트가 있어서 지금 있는 옷이랑 같이 입으면 너무 예쁠꺼같아서요!",0.0,7개월 전(수정됨)
7,Junjunjun27,"항상 느끼는 건데 아이템 매치가 너무 맛깔나요 언니,,, 특히 레이어드 하는 팁들 많이많이 알려주시면 좋게써요 3번 자켓 너무 이뻐요ㅠㅠ 부담스럽지 않은 채도 낮은 카키에 화이트로 포인트도 있고 심지어 투웨이다,,,? 사랑할 수 밖에 없는 조합 아닙니까 이거🫢🫢",1.0,7개월 전
8,userri3ro6on8m,"2번째 2:32  오버사이즈 코튼밴딩 집업 자켓이 참 예뻐요
요즘 블루종이 대세이긴한가봐요!
오늘 남령님이 소개해 주신 옷들듀 블루종을 기본으로 소개해 주셔서인지 더욱 돌아올 봄에 유행이 될 것만 같은 느낌! 사실 제가 상체가 조금 통통해서 ㅎㅎ 딱 맞는 자켓은 등이 불편하더라구요 그래서인지 봄에도 편한 바람막이나 점퍼같은 것을 즐겨입는 편이예요
항상 블랙 바람막이로만 입구 다녔는데
화이트 블루종을 보니 오!!! 이런 점퍼도 있구나 라는 발견에 무릎 탁 치구 갑니다!!!
2:35 가격두 실화인가요..?
3:13 이렇게 화이트 원피스에 화이트 점 퍼 매치라니 뭔가 부담 스럽나? 싶었는데 전혀요!!! 더 날씬해 보이고 유니크해 보이고 예쁘고 다해요!!

항상 계절이 바뀔때마다 남령님 룩북 보는 것 같아요 저번 무신사 편두 전 아주 도움이 되었다구요 키도 조금 큰편이도 조금은 덩치두 있기에 편하면서 멋스러운 코디를 연출하고 싶을때 도움 많이 받아가요 남령님

겨울에 항상 롱패딩으로 알바다녀서 이제 겨울이 지겹다~~라고 생각될때쯤 역시나 하고 봄옷을 가지고오신 남령님의 센스에 치얼스

봄에는 블랙 점퍼보다는 화이트 블루종으로 저도 남령님 코디대루 화이트 원피스에 매치 하구 콧바람 쐬러 놀러가구 싶네요
이번에ㅡ소개해ㅡ주신 #블랙모먼트 블루종으로 봄맞이 기분전환을 해보고 싶은 마음담아 ..  영상 끝까지 예쁘게 잘 시청하구 가요

점점 더 리뷰해 주시는것두 자연스러워지시구 편해보이시는 것 같아 2023년 계묘년에두 토끼처럼 껑충 도약하는 한해가 되시길 바랄게요!!",2.0,7개월 전(수정됨)
9,uservq6fr4jr2f,룩 6번이요  언니 룩들보면 옷들을 센스있게 입으시는데 꾸안꾸 스타일까지 있어서 코디 참고하기 너무 좋아요 ㅠㅜ  이제 갓 20살 된 제가 휘뚜루마뚜루 입을 수 있는 코디가 아닐까 싶어 지원해봅니당 !!,0.0,7개월 전
10,useroq4pv1jp8e,"4번 
일단 레이어드한 옷들 자체가 너무 예쁘더라고요 코디들을 보니까 봄이 떠오르네요  남령님 코디 영상 보고 옷들을 더 예쁘고 힙하게 꾸밀 수 있을 거 같아요!! 감사합니다:)",2.0,7개월 전(수정됨)
11,usercc5zk8sw4y,"••2번 look••
화이트 색상으로 코디하신 것 보고 바로 이거다 싶었어욧!! 뭐든 잘 어울리시지만 2번코디가 언니 얼굴을 더 화사하게 만들어주고 분위기가 장난아니에여️ 코디할 때도 마지막으로 탁️걸쳐주면 바로 꾸민느낌 낭낭할 것 같아용 화이트 자켓은 정말 한 번도 시도해본 적이 없었는데 룩북 보고 바로 꽂혀버려써효🥹 곧 봄이기도 하니까 예뿌게 코디해서 나들이도 가고싶구 전시회 같은 곳에도 찰떡쿵 어울리는 옷이에용 꼭꼭 당첨되어서 예뿌게 입고다니고 싶어요 영상 감사합니다️",0.0,7개월 전(수정됨)
12,jj4228,"이번 영상에서 look2의 코튼 벤딩 집업 자켓이 가장 제 눈에 들어왔어요!! 
3월이 되고 개강을 하면 날씨가 따뜻해지면 좀 더 밝은 코디를 많이 입을거같기도하고 23학번 새내기다 보니 조금 더 풋풋하면서 깔끔한 느낌을 내고싶어요! 그리고 이번 방학에 살을 많이 빼서 고등학교 땐 찾아입지 못했던 밝은 옷도 도전해보고싶어서인지 이 옷이 저에겐 가장 예뻐보였어요!! 정말 꼭 이 옷을 입고 개강하러 가고싶습니다!!",0.0,7개월 전
13,userij1hr7fh5m,"3번 아우터 정말 예쁘네요 ㅠㅠ ️ 통통녀 아우터를 찾아헤메다 이번 영상을 알고리즘 타서 남령님을 알게 되었어요! 남령님 룩북이 정말 하나같이 제 취향만 그대로 모은것 같더라구요!!  이렇게 취향이 비슷한 유튜버를 만나게 되서 너무 기뻐요   
항상 검은색 아우터만 샀는데 카키배색 아우터가 이렇게 힙하고 매력있을수 있다니!! 정말 힙하고 귀엽게 코디를 잘 하시는 것 같아용 한 수 배워가겠습니다! 앞으로도 좋은영상 잘 챙겨보겠습니당 !! 🩶🩶",1.0,7개월 전
14,Aehhea,3번이요!! 항상 느끼는 거지만 옷 매치를 너무 잘하세요 진짜!! 저라면 같이 입을 거라고 생각도 못했을 옷들을 착착 코디하시는 데 그게 또 너무 잘 어울리고 찰떡이세요🫶이번 아우터들도 뭔가 티셔츠 청바지에 걸치기 좋은 캐주얼한 느낌인데 치마랑 또 입으니 되게 잘 어울려요!! 믹스매치 진짜 잘 하심..저는 취준생이라 맨날 위아래 츄리닝 입고 도서관만 가서…원피스에 예쁘게 입을 순 없지만 그래도 티셔츠 위에 캐주얼하게 무심한 듯 툭 걸치고 싶어요!!,0.0,7개월 전
15,userfi6cr6bf6b,LOOK 2 완전 새하얀 색상은 관리가 힘든 탓에 선뜻 도전해보기 어려워서 기피하고 있었는데 두번째 룩을 보자마자 완전히 뽐뿌왔어요!! 흑청에 매치해줘도 예쁠 것 같고 살랑이는 원피스에 얹어줘도 너무 예쁠 것 같더라구요 밴딩처리까지 되어있어서 더할나위 없이 완벽한 아우터라고 생각합니당 사실 스무살 딱 되면 하고 싶은 거 다 하고 사고 싶은 거 다 살 수 있을 줄 알았는데 지금이 되려 제일 지출 규모가 커서 마음에 드는 옷도 선뜻 사기가 어렵더라구요 ㅠㅠ 이런 시기에 딱 가성비템 추천해주셔서 너무너무 감사해요! 앞으로도 응원할게요 ^@^,0.0,7개월 전
16,usersk7zo5qw2m,"6번 룩이요!!
언니 저랑 체형이 비슷하셔서 옷 코디하거나 옷 살때마다 언니보고 계속 참고했어요!️️ 코디가 너무 과하지도않고 완전 제스탈이에용 언니의 밝은 에너지때문에 영상볼때마다 저도 같이 기분 조아져요🫶🫶 이제 봄이라 아우터 필요한데 6번룩이 너무 예뻐요!!!!",0.0,7개월 전
17,soowo,"Look3번이 너무 마음에 들어어요!
남령님을 이번 영상을 통해 처음 알게 되었는데 옷 정보를 상세히 이야기해주시고, 옷 핏도 친절하게 보여주셔서 옷을 어디에  매치해서 입을지도 저절로 상상하게 되더라고요. 
남령님 영상을 이 영상 이후로 저절로 더 찾아보게 되요! 예쁜 영상 올려주셔서 감사합니다ㅠㅠ
사실 20살인 올해 곧 대학 들어가는 새내기인데, 옷을 다양하게 도전해서 입고 싶기도 하고 학생때 교복만 입었던 시절과 반대로 옷을 더 좋아하게 되는 시기인 것 같아요. 더 다양한 추억이 생길 만큼 저를 많이 꾸미고 싶다는 생각이 영상을 통해 들어서 너무 좋았어요!
Look3 옷이 색감이 뚜렷해서 스트릿하게 매치해서 입으면 너무 이쁠 것 같다는 생각이 들고 대학때 편하게 입고 다닐 수 있을 것 같아서 너~~~무 눈에 띄더라고요!",0.0,7개월 전(수정됨)
18,userku6bq4zn7s,저는 6번 비건 레더 자켓이 제일 예뻐요 가죽 제품이 잘못 고르면 재질이 별로인 경우가 많은데 이건 밴딩이나 광택 처리가 진짜 잘 되어있어서 디테일들을 잘 살린 것 같아 마음에 들어요! 저랑 키가 비슷하셔서 지난 겨울시즌 코디들이랑 무채색 코디 많이 참고했는데 이번에도 딱 새내기 코디 필요할 때 올려주셔서 감사해요 나중에 진짜 화사한 봄 데이트룩도 올려주시면 좋을 것 같아요 앞으로도 좋은 영상 기대할게요,0.0,7개월 전(수정됨)
19,6BOP6,너무 예뻐요ㅠㅠㅠ 헤메코도 찰떡이구 인스타 릴스에서 보다가 옷 정보 궁금해서 유튜브까지 보러왔어요~~ 코디 하는 옷들마다 어쩜 이렇게 찰떡인지ㅠㅠ 따라입고 싶을 정도예요 ㅎㅎ 비건레더 블루종 자켓 저도 언니처럼 코디해서 예쁘게 입고 싶어영 ️️,0.0,7개월 전
20,dokioki9129,"세상에진짜 제가 본 코디들중에 가장 시크하고 세련되고 트렌디한 매력쩌는 룩들 대잔치라서 곧 올 봄  모두 남령언니와 블랙 모먼트의 간지 매력 시크 뿜뿜인 코디들을 볼 수 있게되어 얼마나 좋은지 몰라요. 남령언니는 어떤 아우터든지 아우터에 찰떡으로 잘 어울리게 코디해주셔서 진짜 소개해주신 룩 그대로 입고 나가고 싶어요
이번 영상은 너무 마음에 든 룩들 제품들이 많아서 손민수 보물창고 1위 영상으로 등극했어요. 남령언니 룩들을, 또 여러종류의 추천템들을 입어본 결과 남령언니께서 추천해주신 제품들 다 너무너무 좋아서 이번 영상에서 소개해주신 블랙모먼트의 트렌디 간지뿜뿜 옷들도 너무 좋을 것 같아 기대되어요.이번 봄에도 남령언니의 영상듵 참고해서 덕분에 득템하고 멋지고 힙하고 세련된 멋쟁이인간 될 수 있을 것 같아요.
저는 개인적으로 레더 자켓을 정말 너무 좋아하는 시크 분위기의 묘미는 레더에서 나온다고 생각하는 사람 중 하나인데 남령언니께서 이번 영상에서 진짜 완벽한 오버핏 레더자켓을  무심한듯 시크하게 툭툭 걸쳐주신 룩7번에서 정말 취향저격 제대로 당한 룩을 영접하게 되었어요.
이 룩 보자마자 헉...했어요. 이 레더자켓과 흰 셔츠 원피스와 청바지의 조합이 너무너무 보자마자 마음에 들어서 꿈속에서도 나올것 같아요. 평소에도 레더자켓룩 정말 좋아하고 자주 입는데 블랙 모먼트의 오버핏 레더 자켓은 제가 살면서 지금까지 본 자켓중에 가장 멋져요!재질에서 나오는 고급스러움과 부들부들하면서 소매부분은 짱짱하게 잡아주고 제가 너무너무 좋아하는 카라 디테일과 또 정말 세련되고 시크하고 트렌디하게 긴 셔츠 원피스와 청바지와함께 코디하니 매력이 철철 넘치는 이 룩을 입으면진짜 멋쟁이이 될것 같아요
유니크하고 매력넘치는 자켓인 것 같아요
이번에 재수하고 그토록 되고싶었던 대학생이 되었는데 고3 재수 시간에 살이 많이 많이 쪄서 이전 옷들 안맞고 진짜어떤 옷을 입어야하지 고민이 많아지고 괜히 나가지도 않고  그랬는데 남령언니를 만나고 진짜 스타일도 너무 멋지시고 예쁘고 사랑스러우셔서 저도 언니 코디 룩북들 보고하루 하루 추천템들 입고 예쁘게 다니는 중이에요. 너무 감사드려요
이번영상에 나온 룩들도 너무 예뻐서 다 그대로 입고 나가고 싶어요
남령언니와 만나게 되면서 이런제품은 이렇게 코디하면 되는구나도 알게되고 마음에 드는 옷들은 직접 사서 사용해보게 되고 마음에 쏙드는 브랜드들도 알게되면서 제 스타일을 찾게 된 것 같아요. 제가 좋아하는 알면알수록 매력과 분위기가 넘치시는 사랑스러운 또 저의 삶의 활력소가 되어주신 남령언니께 항상 너무 감사드려요♡♡",0.0,7개월 전(수정됨)
21,Bobbbbbbbbbbbbbbbb,저는 개인적으로 look1의 오버사이즈 배색 바시티 코튼 집업 자켓 점퍼가 가장 예쁘다고 생각했어요️ 남령님께서 선택하신 진청이 진짜 은은한 데님 패턴이 보여서 완전 힙해보이고 봄하면 또 데님 자켓인데 저처럼 불편해서 잘 못 입던 사람들에게 정말 좋을 것 같았거든요ㅎㅎ 그리고 데님 자켓을 입은 느낌과 요즘 유행인 바시티 자켓의 느낌을 한번에 줄 수 있어서 실용성도 엄청 좋아보였고 데님 자켓과 바시티 자켓의 장점이 어우러져 캐주얼한 캠퍼스룩으로 정말 찰떡일 것 같았어요! 남령님께서 코디하신 것처럼 이너를 화이트로 입어서 깔끔하게 연출하기에도 정말 좋아보여서 저또한 남령님처럼 입어보고 싶다고 생각했네요! 남령님께서 소개해주신 다른 옷들도 정말 귀엽고 봄 느낌이 물씬 났는데 저는 그 중에서도 이 제품이 딱 처음에 보자마자 마음에 쏙 들었어요! 이런 좋은 브랜드 소개해주심에 정말 감사드리고 이러한 이벤트를 열어주신 것에 대해서도 정말 감사드립니다! 앞으로도 이번 영상처럼 좋은 영상 많이 만들어주신다면 이 채널이 쑥쑥 자라날 것을 믿어 의심치 않습니다 항상 감사드려요!!,1.0,7개월 전(수정됨)
22,cherrymoon0111,"블랙모먼트 옷은 오늘 언니영상으로 처음봤는데 너무 이쁜 것 같아요 
저 같은 체형도 입었을 때 핏이 이쁜 옷들을 항상 너무 잘 설명해주셔서 오느도 보는내내 너무 도움되었어요!
 
언니가 소개해준 제품중에서 '오버사이즈 코튼 밴딩 집업 자켓 점퍼 블루종'이 너무 마음에들었어요! 요즘 바람막이같은 느낌의 옷을 찾고있었는데, 가격도 그렇고 마음에 딱! 드는 제품이 없더라고요ㅜㅜ
근데 이 제품은 보자마자 내꺼다! 라는 생각이 든 것 같아요 
오버사이즈라서 체형보완도 될 것 같고, 아이보리 색상도 새하얀 느낌으로 예뻐서 봄에 잘 입고 다닐 것 같다는 생각이 들었어요!
그리고 무엇보다도 지퍼가 투웨이라는 점에서 저의 마음에 쏘옥 들었어요!",0.0,7개월 전
23,usereb6ov6xb9z,"5번 룩
안녕하세요. 언니! 영상 잘봤어요!
이런 통통이들에게 한줄의 빛같은 룩북 코디영상을  올려주셔서 감사한 와중에 이렇게 또 이벤트라니.. 정말 감사합니다
예전에는 통통하면 그냥 무조건 무채색, 크고 안예쁜 옷들만 입었다면 언니 영상 보고나서는 여러 77-88 쇼핑몰도 알게되고 예쁜옷도 사 입으면서 자신감이 생긴 것 같아요!!
그리고 5번 룩을 고르게 된 이유이자 가지고 싶은 이유는 제가 간호학과 3학년이라서 이제 예쁜옷 보다는 실습복을 많이 입는데 위에 가볍게 휘뚜루 마뚜루 걸치거나 편하고 이쁘게 다니고 싶어서 고르게 되었습니닷! 
저에게 자신감과 용기를 줘서 정말 감사합니다 언니 앞으로도 영상 보면서 예쁜 옷 많이많이 입을게요!! ️️🫶🫶",0.0,7개월 전(수정됨)
24,jaeheeo3o,"어쩜 하나하나 코디까지 완벽할수있는지ㅜㅠ
넘 다 이뿐거 아닌가요!!",0.0,7개월 전
25,userkz6id1rn6p,"6번 왜케 이뿌요… 온니랑 스펙이 비슷한 편이라 항상 웅니 영상 보면서  코디 참고 많이 하는데 이렇게 제춤추천과 이벤트까지 갖고오시다니 증말루다가 러블리의 정석..️ 패딩,후리스 이외에 아우터가 너무 없어서 매번 고민하다 홀로서기 대딩이라 가격에 주춤해서 못사곤 했었거든요…이번 기회에 삐까번쩍 새삥 아우터 받을 수 있으면 넘 좋을 것 가타요",0.0,7개월 전
26,userpy8ym4sg5u,1번째 착장 진짜ㅜ너무 이뻐요 제가 젤 좋아하는 너낌 데님인데 너무 밝지 않고 진청으로 어디에나 걸쳐도 잘 소화할 수 있는 옷인거 같구 투웨이로 여러가지 연출을 해줄 수 있는것도 너무 좋아요 어깨선도 너무 내려가지 않아서 덜 부해보이고 너무 짧지도 않고 바지에도 너무 잘 어울릴거고 할인하는 가격 보고 놀랐어요 안에 롱 원피스랑도 너무 찰떡이네요 진짜 블랙 모먼트 앞으로 제가 많이 애용할것 같아요 ㅠㅠㅜㅜ하 ㅠ퉁퉁이로서 맞는 옷은 없을거라며 후드티에 트레이닝만 입던 제가 언니 채널 구독하면서부터 많이 찾아보고 개강까지 이제 한달 좀 안남았는데 장바구니 와장창 담아야겠습니다 이런 좋은 쇼핑몰 알려주셔서 감사해요!,1.0,7개월 전
27,userbv5yq2vy4c,"6번 코디가 짱️️
평소 샤랄라한 스타일을 좋아했는데 너무 오랫동안 샤랄라 스타일을 고집한 거 같아서 스트릿+시크갬성으로 가고 싶었는데 마침 언니 영상이 똭...! 이건 정말 스타일을 바꾸라는 거겠죠? 코디가 너무 센스있고 예뻐서 침 흘리면서 봤는데 이벤트까지라니 너무 감동 언니 영상 참고해서 많이 손민수하고 있어욤,,ㅎㅎ 앞으로도 이런 영상 많이 찍어주세용
당첨되면 착샷도 보내드릴게용",1.0,7개월 전
28,userjm6jt2zm4w,6번이용 엄마보러 정말 오랜만에 고향에 내려가는데 10키로 찐걸 들키지않게 최대한 날씬이인척 해야하거든요! 언제나 새롭고 힙한 코디조합 알려주셔서 감사합니다🩷,2.0,7개월 전
29,userxx7iz2uc1p,"6 볼캡 야상 집업자켓 / 언니! 새해 복 많이 받으셨나용!ㅎㅎ 한동안 취준한다고 속세와 단절했더니 언니 얼굴 너무 오랜만에 봐서 반갑다뉸..ㅜㅜㅜ 오늘도 이뿐 옷들 한가득 가져와주셔서 정말 감사해용!!ㅎㅎ 항상 잘 보고 있고 응원하고 있답니댱♡♡ 올해 좋은 일만 가득하시고 10만, 50만 100만까지 쭉쭉 달려보아용!!>< / 최근에 취뽀해서 이번 봄엔 홀가분한 마음으로 나들이 가고 싶은데  호옥시나 당첨된다면 언니가 추천해준 이 자켓 입고 이뿐 추억 가득 남기고파용..ㅎㅎ",0.0,7개월 전(수정됨)
30,userke2wn7qd2h,Look2 새내기느낌나게 저도 산뜻하게 봄 맞이하고 싶어요~ 꾸안꾸룩 제대로! 남친이랑 같이 입고 싶은 커플룩이요! 늘 퉁퉁이들을 위한 코디 넘 마음에 들어요. 영역 제한 없는 듯한 눈썰미가 진짜 대박이에용... !,0.0,7개월 전
31,useryy6xg1lf1y,"look 7래더 자켓 
남령님! 이번 영상을 통해 언니의 구독자가 된 한  명입니다 ㅎㅎ 제가 올해 대학을 입학하게 되어 요즘 옷에 관심이 많아졌는데 언니의 센스있고 체형 커버까지 완벽하게 되는 코디들을 참고할 수 있어서 큰 도움이 됐어요 앞으로도 언니가 올리는 영상 꼬박 꼬박 챙겨봐서 언니처럼 세련된 대학생이 되도록 노력할게요
집에 있는 옷이라고는 학교 체육복뿐인데 레더자켓은 가격이 부담되어 사고 싶지만 계속 고민중이었어요 이 기회를 통해 추첨되어 대학 다니며 레더자켓 입고 캠퍼스 라이프 즐기면 정말 좋을것같아요 긴 글 읽어주셔서 감사해요",0.0,7개월 전(수정됨)
32,skdud1593,블랙모먼트 얼리버드 컬렉션이라니 언니 영상 빨리 본 사람이 임자다 ~!~! 다가오는 봄에 입기 좋은 아우터들만 싹 다 모아놓은 것 같아요 저는 look1의 데님 바시티 자켓이 가장 맘에 들어요  너무 유행타는 디자인도 아니고 적당한 오버핏에 꾸안꾸 데일리로 입기 완전 제격이에용! 특히 제가 데님 쳐돌이인데 데님 바시티 자켓은 처음봐서 더 소장가치가 있는 것 같아유 할인가격도 넘나 예쁜 것 언니 원피스 코디 모두 러블리하고 예뻐서 벌써 봄이 기다려지네용 예쁜 제품 소개해주셔서 감사해요 >_<,0.0,7개월 전
33,userrk3xh6ru8m,"Look7
언니 옷 볼때마다 진짜 너무 예쁘고 코디도 잘하셔서 항상 옷 사고 싶은 욕구가 엄청난데 참느라 힘들었어요ㅠㅠ
항상 캐주얼하게만 입고 다녀서 이번엔 좀 다르게 입고 다닐 옷 사려고 생각중이었는데 이렇게 이벤트 해주셔서 감사해요!!",0.0,7개월 전
