,youtube_id,comment,like_num,comment_date
0,yoommmj6752,제품 외에 정말 유용한(기초탄탄은 정말 최고) 꿀팁 알려줘서 너무 좋아요.,2.0,1개월 전
1,miokkim2603,V&A쿠션 유명하죠^^ 데님쿠션 패키지예쁘네요 퍼프도 청량감까지드는듯ㅎ 무엇보다 피부표현이 예뻐요!!! 깔끔하게무너지고...매트구션이 바르기가쉽지않은데 잘알아가요,3.0,1개월 전
2,euniceluv,저도 스펀지로바르고 개선된거 느껴져요 ㅎㅎ,2.0,1개월 전
3,ryandukhu3262,쿠션 유목민…접니다 영상보고 바로 구매요!! 믿고 씁니다,3.0,1개월 전
4,userzg1vq3en2b,사용하신 립은 어떤제품인가요? 넘이뻐오,0.0,10일 전
5,userch3zv9cx9h,힌스 글로우 쿠션썼다가 화장 다 무너져서 오늘 올영가서 라네즈 네오쿠션 샀는데요 리뉴얼 전꺼는 기초 제대로 해도 무너졌는데 수정화장한지 정확히 두시간인데  덜 무너지네요 V&A도 많이 매트한편인가요?,0.0,1개월 전(수정됨)
6,userhu7dn8nq3b,하나도 안뜨고 쏙쏙 피부에 잘 받는게 너무 좋은데요...???? 패키지 너무 존예..... ㅠㅠ 저도 목이랑 얼굴 컬러 차이나는게 싫어서 살짝 톤다운해서 쓰는 편이라 2호 사려구용!!!!,0.0,1개월 전
7,qaji,근데 2호는 안맞으시는거갗아요 얼굴이 누래지셨어요.. ㅠ 1호는 너무밝고 ...,2.0,1개월 전
