,youtube_id,comment,like_num,comment_date
0,seolki7657,"06:55 투쿨포스쿨 아트클래스 프로타주 펜슬 1+1 가격이 24,000원 이라고 해요! 여기서 더 할인된 가격으로 판매중이니 아래 링크를 통해 확인 가능합니다

https://bit.ly/3zwpOLB",1.0,9개월 전
1,jeong3222,"설기님, 겔랑 오일 광택감 대박이에요!
그리고 아멜리는 영업당해 질러버렸어요!!
오늘 영상도 유용하게 잘 봤습니당. 다음 컨설팅 영상 기대되어요:)",0.0,9개월 전
2,cookiecoo7784,언니 한쪽만 까는거 너무 예뻐요...,0.0,9개월 전
3,onimchae2284,"한쪽만 까는거 최고에여!!!!!!!!
어뮤즈 쿠션이랑 웨이크메이크 비건 둘중 멀쓸지 고밍인데 어뮤즈로 가야할까요",0.0,9개월 전(수정됨)
4,seolki7657,메이크업 정믈증맬 오랜만에 올리네요,3.0,9개월 전
5,userbj4um3ku8o,3:36 아 킹정~~~~!!!,1.0,9개월 전
