,youtube_id,comment,like_num,comment_date
0,soytube,"안녕 소신이들,
이제 내일이면 영상 속 이 집은 허물어질 거예요..ㅎ
공사 들어가기전에 비포모습 소신이들 보여드리려고
찍어봤슴당..

앞으로 재미있는 여러가지 컨테츠 많이많이 올릴테니 
기대해주세요️


인스타 www.instagram.com/soyisland_",13.0,4개월 전(수정됨)
1,userql9dn1yr1z,"힘든과정 거쳐서 이사가는것 만큼 리모델링 너무 멋지게 되셨음 좋겠어요 ~~ 이사도 넘나 축하드립니다~~~ 
아직 완성집 보지도 못했는데 이미 먼가 상상이 가요 엄청 이쁜집일것 같아요 ㅎㅎ 아파트 1층 로비가 너무 멋진데요? 
집안이 일단 넓으니까 리모델링 끝남 진짜 멋질듯요 기대하고있을게요 ",1.0,4개월 전
2,userzy6jf7mx4j,"과거에 힘든것은 잊어버리고 새로 이사가는 집에서 더 좋은 일이 생길거예요 저도 다른 유튜버 랜선이사 보다가 제가 좋아하는 소의님 이사 랜선 영상 보니 먼가더 기분이 더좋네요!! 집이 너무 넓고 부러워요!!! 리모델링만 하면 새집처럼 환해 질거 같아요!!!
이사 축하드려요!!!^^",1.0,4개월 전
3,arwen1614,"집사서  이사한다니 축하합니다 
집이 넓고 좋네요 인테리 하고 나면 더 좋아질거 같아요 
두분이 착실하고 열심히 일해서 좋은집 마련하느라 고생이 많았겠어요",9.0,4개월 전
4,userpo4fq4wt1z,축하드려요! 새 집에서 좋은 일들만 가득하세요 저도 언젠간 저런 좋은 집에서 살 수 있길..!,0.0,4개월 전
5,milee7224,맘에 꼭든는 리모델링하셔서 이사가셔서 늘 복 듬뿍 받으세요^^집이 넓어서 좋아보입니다 행복만땅하시고 집구경도 시켜주세요~~ㅎㅎㅎㅎ남집구경이 제일 재미나요 ㅎㅎ,5.0,4개월 전
6,userfn9gl3kf5k,정말 넓고 멋지네요ㅎㅎ 공사들어가고 계획하신대로 인테리어하면 더더욱 소중하고 최고의 집이될거같네요!  이런 멋진집을 얻기까지 얼마나 많은 노력과 힘든과정을 거치셨을까 그런생각이들어요ㅎㅎ 노력한자에게 반드시 보상이온다!라는 메세지를 주시는거같아요^^,0.0,4개월 전
7,userzm2tj1ul8j,"인테리어.. 이때가 진짜 스트레스 엄청 받으면서도 설레면서도 선택의 선택의 선택의 시간이라 힘들면서도 좋았던 시간인데 소의님 그 길을 가시는군요ㅋㅋㅋㅋㅋㅋ 입주하면서 내가 이렇게 선택장애였나 싶었던...
이사준비 인테리어준비 모두모두 축하해요
옆동네 계시던 소의님 이제 멀리 가신다니 넘 아쉬워요
연말에 수원에 스필 오픈하니
브이로그 찍으러 꼭 놀러오세요(는 우리동네ㅋㅋㅋㅋ)",1.0,4개월 전
8,tubejouck9896,이사간다니 정말 축하드립니당 리모델링 하기 전에도 이렇게 예쁜데 과연 리모델링을 하면 얼마나 이뻐질지 기대가 되네요 나중에 리모델링 하고나서 어떻게 바뀌어있을지 꼭 보고 싶습니다 좋은 영상 감사드립니다 :),0.0,4개월 전
9,userex6lq1ui1g,집이 진짜 넓고 좋네용 인테리어 후의 모습도 너무 기대돼요,1.0,4개월 전
10,userox8oj1ij6w,확실히 오래된 집이라 그런지 가구들이 전체적으로 다 어둡고 칙칙한 느낌이 드네요~ 뭔가 어두운 기운만 있는 느낌이라 화사하게 리모델링하면 얼마나 이쁠지 너무 기대돼요!! 그리고 큰방 공사할 디자인 저는 너무 맘에드는ㅋㅋㅋㅋ 빨리 완공된 집 보고 싶어용!!!,0.0,4개월 전
11,ny22,소의님 이사갈 집 너무 좋네용 이사 잘하시구 또다른 새출발 !!! 앞으로도 좋은일만 가득하세요,0.0,4개월 전
12,userce6ve3tk5h,로비부터 미쳤네요. 새로 이사 가는 그 마음 알죠 ㅎㅎ 창이 시원해서 더 좋네요! 새로운 곳에서 새로운 시작 응원할게요. 집 소개 콘텐츠도 기다릴게요 ,3.0,4개월 전
13,userlp1lo2oq5v,설레면서도 시원섭섭하겠어요 ㅎㅎ 그동안 정든 공간이기도 할텐데 그래도 더 좋은 모습을 보여주기 위해 새로 싹 리모델링한다고 하니 기대되네요 ㅎㅎ 완성되면 또 영상으로 남겨주세요 ㅎㅎ 구독 꾹,0.0,3개월 전
14,userfu4vs5zh8b,"대출이 많으면 걱정도 되시겠지만,
잘해 나가실 수 있으실거라 믿어요.
인테리어 잘 하면 예쁜 집이 나올거 같아
벌써부터 기대되네요.
랜선 집들이 기다리고 있을게요",0.0,4개월 전
15,useret2fr4pb5v,"소의님의 센스로 어떻게 인테리어될지
너무 너무 궁금해지네요~
아파트로비부터 지금내부도
좋은데 ~얼마나 더 아름다워지려나ㅎㅎ
이사 넘 축하드려요오~~~",0.0,4개월 전
16,userek2lh7si6u,2년 사이에 변화는 있었지만 그래도 또 다른 시작을 응원합니다! 인테리어 하는 동안 스트레스 많이 받을 수 있는데 잘 먹고 잘 자고 잘 쉬면서 몸 관리 하세요 소의님,0.0,4개월 전
17,paintingtime0214,"리모델링 잘 됬으면 좋겠네요
과거의 아픔은 있고 현재를 잘 즐기 셨으면 좋겠네요
영상 잘 시청하고 가고 이사 축하드립니다️",0.0,4개월 전
18,leeseungbeom7843,"송도로 이사를 가는군요. 한편으로는 부럽네요.
아파트가 10년이 되었다는데, 깨끗하고 괜찮은것 같아요.
현관도 넓고 거실도 넓으면서 깨끗하네요.
바깥전망도 탁트여서 너무 좋은것 같아요.
새집에서 두분의 행복한 생활을 기원합니다.",0.0,4개월 전
19,jooleeyoon,"풀대출이라 속상하시긴 하겠지만, 소신이들과 같이 보금자리를 만들어 나가는 모습이 될 것 같아서 기대되네요",0.0,4개월 전
20,userxy3er1mb5u,"짝!짝!짝! 입주를 축하드려요. 힘든 과정도 있었지만 잘 이겨내시고 이사하게된거 축하합니다. 
리모델링으로 어떻게 변할지 기대되네요. 새로운 보금자리에서 좋은추억 만드시고 행복하세요~~_",0.0,4개월 전
21,tvsd6oq,"우와, 축하드려요. 계획보다 빨리 이사도 가게 되고. 리모델링하고 가면 진짜 이쁘겠네요. 부럽당.",0.0,4개월 전
22,userjk3gw2xo1w,"집이 철거되기 전에 비포모습을 보여주는 영상을 찍으셨군요. 재미있는 컨텐츠를 기대해도 좋다는데, 기대가 됩니다! 비포모습을 보여주는 영상은 항상 흥미롭고 호기심을 자극하는 요소가 있습니다. 집이 어떤 모습이었는지, 앞으로 여러 가지 재미있는 컨텐츠를 많이 기대하고 있겠습니다.",0.0,4개월 전
23,userjq6sp6ts8o,"생활공간을 변화시키는 일은
많은 긍정적인 요소를 주지요.
그래서 사람들이 이사든, 인테리어든
변화를 위한 행위를 하는거 같습니다.
이번 변화 상당히 기대되는데,
영상 잘 보았습니다~",0.0,4개월 전
24,juwon621,"이사 축하드려요  .
집 구조가  잘 빠진것 같아요  지금도  좋은데  바뀐 모습이 기대가 되네요.
항상  열심히 하시는 모습  응원하고  새로운 보금자리 빨리 보고 싶네요.",0.0,4개월 전
25,leechanghee78,"누구나 내 집 마련의 꿈은 꾸지만 
높은 집값과 대출 금리 때문에 실현하기 어려운 경우가 많죠
여러모로 어려운 결정이었겠지만 꿈에 한발짝 더 다가가신 거 같아 부럽습니다
러브하우스 음악과 함께 현관문 열 때 저도 같이 두근두근했네요 ㅎㅎㅎ
여러가지 꼼꼼히 체크하고 계획하는게 역시 소의님답다라고 느꼈습니다
리모델링 끝나면 새로운 영상 부탁해요^^",0.0,4개월 전
26,userei9ir2op4u,"와~~ 집이 정말 넓네요 어떻게 리모델링이 될지 정말 기대 되네요 ㅎㅎ
빨리 완공된 모습이 보고 싶네요 ㅎㅎㅎ",0.0,4개월 전
27,userwm7bu3hv1r,집이 상당히 평수가 있네요  축하드려요~~  안방도  너무 구조가 좋아보이구요 리모델링 기대가 됩니다 부럽네요,0.0,4개월 전
28,userer8gj7jb6d,"이사 축하드려요.
리모델링 된 후의 모습 기대되네요.
계획하신되로 잘 진행되길 바랍니다.",0.0,4개월 전
29,userjs1tl9em3y,"집이 굉장히 크네요~이사를 정말 축하드리고,번창히시길  바랍니다~새로운 집에서 업로드 영상 많이 많이  올려주세요~",0.0,4개월 전
30,usertg1yn2ly6t,"소의님  새로운 보금자리 축하드려요^^
이 집은 멋진  공간이  될 거예요 ",0.0,4개월 전
31,hyosookim9421,"너무너무너무 좋으시겠어요^^
바뀐곳에서 더 좋은 콘텐츠가 나오길 기대합니다.
그리고 모자쓰신 모습 진짜 아름다우시네요^^",0.0,4개월 전
32,ssongkv4bd,"송도로의 이사 축하드려요~~~^^
그런데, 오래된 느낌이 전혀 나질 않는데요~~
집도 너무 넓어보이고 베란다 창문으로 보이는 뷰도 너무 시원해 보이네요..
리모델링 후에 어떤 모습일지 정말 기대가 많이됩니다.
앞으로 좋은곳에서 좋은 기분으로 좋은영상 기대할게요~~~",0.0,4개월 전
33,usernt9yg4ux2o,"집이 진심 넓고 멋져요
리모델링 후의 모습이 어떨지 궁금하고
더블어 소의튜브 채널 발전이 넘나 기대돼요
빨리 봤으면 좋겠어요 ˃ᴗ˂",0.0,4개월 전
34,119hong4,"어떤 아픔이 있는 과거는 모르지만
그래도 이사 가시는거 축하드려요~~^^
1층 현관 입구부터 고급스럽기도 하고
인테리어 안하셔도 집이 이쁘네요
인테리어후 어떻게 변할지 벌써부터 너무
기대되네요",0.0,4개월 전
35,useruh7nj4cu7t,드디어 이사갑니다. 축하드려요. 이사갈 때의 설레임이 떠오르네요. 게스트룸까지 있는 걸보니 뿌듯하느겠어요. 안방의 특징으로 엔틱하게 꾸미면 이쁠것 같네요. 영상 잘봤습니다.,0.0,4개월 전
36,userrw8zv2fy4g,"멋진 집 이사 축하드립니다 
더 멋지게 인테리어 하면 눈부신 더 멋진 집!! 기대되네요
집 구경 잘했어요",0.0,4개월 전
37,daejuju,"와따마 집 좋네요 아파트 주차장 넓어서 좋고, 들어가는 입구도 호텔인, 인테리줄, 어 진짜 호텔처럼 해서 살면 좋겠어요 저도 갠적으로 현관이 넓은걸 선호하는데 시원시원 하네요 우리 아파트가 10년 됐는데 딱 그때 월넛색깔이 넓은 평수에 유행이어서 우리집도 월넛으로 돼있거든요 좀 어둡긴 하죠 공사후 모습 기대해볼께요 언니 ^^",0.0,4개월 전
38,userec7xs6yo3s,여기 살기 너무너무 좋아여!!!!! 이사 축하드려용,0.0,4개월 전
39,userog5ep3lk5l,"피부미인 언니 성공하셨네요^^
집이 야~~~열심히 사셨네요. 좋은 집에서 좋은 기운받아
항상 건강하시고 가정에 평화가 있기를 빌겠습니다.^^
화이팅~~~♡♡",0.0,4개월 전
40,loveopalina,리모델링후의 모습이 궁금하네요 빨리 보고 싶에요 이사한 새집에서 어떤 영상을 보여주실지 기대되네요 이사를 축하드려용~^^,0.0,4개월 전
41,hakookim2223,"댓글 쓸 생각도 못하고 영상에  빠져서 보고 있었어요. 
남의 집 인테리어 보는거 좋아하는데 공사전의 모습이 인테리어한후에 어떻게 바뀔지 기대하면서 보니깐 남의 집인데도  재밌네요. 
기대감에 설레어 하시면서 촬영하시는 모습 보니깐 보는 사람도 설레고 바뀐후의 인테리어 기대되요",0.0,4개월 전
42,useref3wy2ns5s,축하드려요 새집에서 좋은일만 있으시길,0.0,3개월 전
43,star790329,안좋은일들 싹 잊으시고 깨끗한 집에서 즐겁게 지내시길 바랄께요 송도는 뷰가 끝내준다고 하니 나중에 밤에찍은 야경 영상을 올려주시길 바래요,0.0,4개월 전
44,cookie10042u,"오래된 아파트라 하지만 주차장등 엄청높고, 넓고, 1층엘리베이터가 대기업건물 로비같아요.  
집도 엄청 넓네요 .  갤러리 공간등  곳곳 활용도가  많아보여요^^  2~3년동안  부동산값이 롤러코스터 처럼 변했지만 소의튜브는 변함없이 꾸준히 구독자분들에게 많은 도움을 주실거라 생각됩니다^^
같이  밝은 미래를 꾸며요^^",0.0,4개월 전
45,liusiperr,"로비가 말도안되게 호텔같네요!집도 리모델링 하실필요없이 되게 이쁜데요?! 저기서 리모델링하면얼마나 더 이쁠지 무지궁금하네요ㅎㅎ얼른 리모델링으로싹바뀐 새집 보고싶네요
무지설레겟다!!",0.0,4개월 전
46,userbu9tr9pz2e,우아 안에 내부 엄청 넓고 좋은거같애여 ㅎㅎ 비포 에프터 벌써 기대되는 ! 리모델링하면 완전 색달라질거같아여 기분전환 ♡!!,0.0,4개월 전
47,userdb4yc7uk9d,"이사가시게 되어 축하드립니다 
영상으보는데 리모델링하면 되게멋지게
변할것같은 좋은느낌이드네요
저도 집처음샀을때  생생했던그느낌을 잊지못하는데요 ㅎㅎ
리모델링 살짝부럽기도 합니다
새로운집에서 재충전하시고 다시한번좋은에너지
기대할게요 영상잘봤습니다",0.0,4개월 전
48,uservc4ek7ux5k,"이번에 새로운 곳으로 이사 그것도 전체 리모델링하고 들어가시나 보네요!
말씀처럼 요즘 부동산시장이 영 별로여서 좀 아쉽지만 
리모델링된 새로운 아파트에서 새로운 마음으로 다시 시작하는 것도 나쁘지 않을 것 같아요.
여튼 집이 좀 손볼 곳이 있어 보이지만 
구조도 좋고 넓고 해서 리모델링 끝나면 완전 프리미엄 아파트 될 것 같네요",0.0,4개월 전
49,userpe5yu8db3r,퍼월이네요~~저도 몇년전에 퍼월이랑 지금 사는곳이랑 고민했었는데~  인테리어 예쁘게 하시고 꼭 리모델링 후 올려주세요!,0.0,4개월 전
50,oweu6126,"지하 주차장이랑 1층 로비 보마자마 이마트가 생각나네요 ㅋㅋㅋㅋㅋㅋ
 
집 내부가 좀 올드한 느낌이어도 
넓직하니 소의님 센스면 금방 다 채우고 이쁘게 꾸밀 겁니다 
 
화이팅입니다!",0.0,4개월 전
51,userru9dd1sq5v,"공사후가 더 기대 됩니다.
얼마나 멋스럽게 변햇을까... 
시기가 시기인지라. 마음 고생을 좀 하셧겟서요.
이왕 결정하신거 좋은일만 생각하시고 잘 나가면 되지 않을까 싶네요.. 
남은시간도 좋은하루 되십시요.",0.0,4개월 전
52,usernu5tc2oe3v,"이사 축하드립니다.
내가. 원하는 공간으로 인테리어를 꾸밀수있다는 생각만으로 설렘과 기대가 클것같아요. 집도 넓고 뷰도 아름다워서 저에게는 꿈같은 그런 공간인것 같아요.",0.0,4개월 전
53,userqd8yf9jo2u,크 진짜 저도 하고 싶은데 현실의 벽이 너무 높아서 못했는데 보면서 대리만족 엄청되네요 좋은 영상들 앞으로도 쭉 업로드해주세요!,0.0,4개월 전
54,useret1dl9ep6g,제가 즐겨보눈 유투버소의님이 송도 오시다닝ㅎㅎㅎㅎ 넘 반가워용ㅎㅎㅎ익숙한 풍경보니까 넘 좋네요오 앞으로 송도에서 좋은일만 있으시길 바랄게용🩷,2.0,4개월 전
55,ppassung7217,"집이  넓고  멋져요 
고생 많았어요  늘 좋은일만 있구요 더 부자되고  행복하세요",0.0,4개월 전
56,jungmk4589,우선 새로운 집으로 이사하는 것 축하하네요. 그 곳에서 해복한 가정을 만들길 바래요. 얼핏 보니 집의 넓이가 커서 리모델링 비용은 많이 나올 듯 싶네요.,0.0,4개월 전
57,lover10004,보는내내... 너무 부럽다능..리모델링하고 어떤 모습일까..많이 궁굼하네요^^,0.0,4개월 전
58,userjo1cq1tq4n,전체 리모델링 하시는군요 축하합니다!!  그런데 비포더 꽤 괜찮군요^^  리모델링 잘마치시고 원하시는 집 만드실길 바랍니다.!!,0.0,4개월 전
59,bkkim5082,"저의 집도 전체 리모델링을 하고 싶어서 관심있게 집중해서 보았습니다. 집에 예쁘게 잘 나올 것 같네요. 잠깐 조망이 보였는데 너무 좋은데요.
리모델링 비용이 매우 궁금했는데 끝까지 얘기를 안 해주셨어요. 예쁜 집에서 예쁘게 사세요. 영상 잘 보았습니다.",0.0,4개월 전
60,uservo8vk3qs8w,집값이 오르락 내리락하고 대출금리도 많이 올라서 속상한일 많으셨은텐데ㅜㅜ 그래도 이사 너무 축하드려요,17.0,4개월 전
61,userup3je4fe9c,"축하해요 이사가서
더행복하시고 돈도많이벌고 건강항상챙기세요
감사해여 넘좋아보여",0.0,3개월 전
62,userkl9nw7bz9p,"영상 잘보고갑니다 
처음 시작할때 이사배경 설명하시는걸 보고 왠지모를 공감이 되고 마음이 아팠지만..
집을 보는순간 오잉??? 너무 집도 넓고 너무 예쁜데요???ㅎㅎㅎㅎㅎㅎㅎ
이사를 하는게 더 좋아보이고 행복해보이시네요ㅎㅎㅎㅎㅎㅎ
지난일은 아쉽지만 그래도 앞으로 더 좋은일만 있을꺼같습니다! 화이팅입니다!!",0.0,4개월 전
63,userps8yo5ub6k,"진~짜 뿌듯하시겠어요^^
비포 에프터가 어떻게 바뀌게될지
기대만땅입니다",0.0,4개월 전
64,userfm7bx3uz1s,"소의님 이사하시는군요~^^축하드려요️
와 굉장히 넓네요  근데 보니 인테리어 안해도 되겠는걸요 그냥봐도. 멋있어요 제가봤을땐 그럽니당 ㅎㅎ 다시한번 축하드립니당 멋지게 다시 꾸미시고. 새로운 콘텐츠 올려주세요 기대됩니다 ",0.0,4개월 전
65,577projectoo,집이 너무 크고 앞으로 인테리어 기대가돼요. 그만큼 열심히 살아오셨으니까 좋은집에서 좋은공간으로 앞으로도 좋은영상으로 보답해주세요. (난 집 언제사지ㅜㅜ),0.0,4개월 전
66,userlv7im4bs2h,소의님 이전부터 봤는데 참 대단하셔요 정말 축하합니다 ,0.0,4개월 전
67,Lulubibilala,인테리어 후가 아주 기대가 되욧!!!!,1.0,4개월 전
68,arrrr,왁 저 리모델링 너무 좋아해서 브이로그 찾아서 보는데 소의님껄로도 보다니 좋네요ㅎㅎ 저도 올해 입주 예정이라 나중에 가구도 공유해주심 좋을거 같아요!,1.0,4개월 전
69,userxq8gy3ex4m,"소의님!!!
드뎌 이사가시는군요!!!!
이사가는거  쉽지않는데
전체리모델링까지....
금리넘 높아서...어려운시기에
암튼 이사축하드려요!!!",0.0,4개월 전
70,uservf5eq9me7n,"이사가시는거군요
그동안 집에 정이 많이 들었을텐데
큰 결심하셨네요 
이사가셔도 좋은일 생기기를
바라겠습니다",0.0,4개월 전
71,userxh6ke2my6g,드디어 송도로 이사를 가시는군요. 잔금 치루시랴 인테리어 대공사 하시랴 돈이 만만치 않게 들것같아요. 요즘 대출이자가 너무 올라서 그 고민 충분히 이해합니다. 저희도 대출이 많은 편이라 이자가 너무 올라서 고생고생하고 있어 남일 같지가 않습니다. 하지만 원하셨던 곳으로 이사가시는 그점은 축하축하드립니다. 잘 될 거에요. 그리고 이자율도 이제 안정될거에요!!,0.0,4개월 전
72,userwq8mh4im7l,"앞으로  새로운 공간에서  어떤 컨텐츠가
올라올지  궁금해 지네요
즣은곳에 이사하게 되셔서 축하드려요",0.0,4개월 전
73,userus7mr5mh5b,소의님 이사 축하드려요,0.0,4개월 전
74,userir1ox5cl8m,"2년전 송도 오신다는 영상보고 그때도 넘 반가워서 댓글 달았던 기억나네요^^
그때 분양권 계약하셨다더니 ㅍㅇ로 오시네요^^
동네에서 오며가며 뵐수있을까 기대되네요^^
환영합니다~~",1.0,4개월 전
75,usertu6hu7lz9l,랜선 집들이 좋아하는데 ㅋㅋㅋ너무 기대돼요!!!,0.0,4개월 전
76,newstar1762,금리인상때문에 집사는 사람들 많이 힘들긴합니다 기운 내세요 그래도 좋은집가셔서 좋은기운 받으시고 대성하시길 기원합니다 화이팅 집고급스럽고 엔틱느낌예뻐요 ㅎㅎ,0.0,4개월 전
77,usercz3yr2pz7x,젊으신 나이에 저 정도면 아주 성공하셨네요..부럽,0.0,3개월 전
78,usertg8kx5ek8e,"전체 리모델링은 큰 일이라서, 이것저것 신경이 많이 쓰이겠네요.
맞아요. 유튜브 촬영을 제대로 하려면, 전용 방이 있어야죠.
자신의 취향대로 꾸민 방에서, 유튜브를 촬영하면 만족감이 배가 될 듯합니다.
인테리어 업체와 잘 조율해서, 전체 리모델링을 성공적으로 마치기를 바랄게요~~",0.0,4개월 전
79,kimal2,축하드려요!! 분양받은 집 아니고 다른데 가시나봐요 인테리어 기대돼요,0.0,4개월 전
80,ollehzzz,"집이 너무좋아보여요
안방 너무 기대되네요
앤티크라니",0.0,4개월 전
81,userlm8fd4zg9q,"아파트 공동현관 로비가 정말 호텔 같아요
방도 엄청 넓어서 맘에 들어욧!!!
제집이었으면 ㅋㅋㅋ",0.0,4개월 전
82,userrp1zo7wq1e,저도 이사가고싶음~ㅋㅋ리모델링하는것도 많이 들텐데 글고 깐깐하신가봐요..저라면 그냥 이런식으로 해주세요~끝일텐데..ㅋㅋ 하나하나 디자인까지 다 뽑으시구..이사간집에서 훨씬 맘편하시구 대박나시길 바랄께요,0.0,4개월 전
83,qpte2586,송도 이사 축하드려요!,0.0,4개월 전
84,bansungguun,와우 리모델링 후 기대돼요,0.0,4개월 전
85,userid8uy6de4c,영상으로 집위치를 특정할 수 있는 영상은 안올리는게 좋습니다 스토커가 많은세상이니 주의가 필요해보입니다,29.0,4개월 전(수정됨)
86,sunbin6217,그래도 이사한다니 너무축하해요 남의 집 구경하는거 너무 좋아해서 이런영상도 좋아요!,0.0,4개월 전
87,uservi7hc3sg7x,"주차장부터 어두침침 혼자 다니실때는 무서우실듯 공사 들어가기전 비포모습이 색깔이 칙칙하긴 했었네용
그래도 바꿀려는 거가 마음에 드셔서 앞으로도 좋은날 있으시고 유튜브 콘텐츠도 다양하게 보여주셨으면 합니다 
랜선 집들이 잘 보고 갑니다",0.0,4개월 전
88,useriv9fv7gl7o,헉 온니 이 영상 입으신 옷 4:33 정보 알수있을까용???ㅠㅠ🥹🥹 옷 너무 이뻐용 언니랑 완전 찰떡,0.0,4개월 전(수정됨)
89,usereo6uv4ee8q,앗 소의님 울집바로옆아파트네요♡♡♡♡가까이오신다니 너무좋아용♡♡♡♡,0.0,4개월 전
90,userqu7hf8og8q,"오른쪽하단에 까미너무귀여운거아니에용??
댓글은 잘안쓰지만 잘보고있어용
선택하신것에 응원합니당!!!! 
꽃길만걷자용",0.0,4개월 전
91,21hello66,"청약 당첨됐다고 들었던 것 같은데, 분양권 팔아버리신거에요? 제가 다 아깝 ㅠㅠㅠㅠㅠ 그치만 송도는 터가 좋으니, 이사갈 집에서 더 좋은 일 많이많이 생기시길 바래요. (p.s. 인테리어 비포앤에프터 집들이영상 저도 참 좋아합니다 ㅋㅋㅋㅋㅋㅋㅋ 소의님맘 제맘 쌤쌤)",2.0,4개월 전
92,lovecy8nr,"ㅜㅠ 오늘이상하게 영상이 얼굴이 안좋아 보이시던데 ..그런내막이ㅜ
소의님 그래도 항상 긍정적으로 소신이들한테 많이 도움주시잖아요 언제나 잘되실꺼에요 
응원합니다",0.0,4개월 전
93,userlu9my2qc4y,헉 저 송도사는데 넘 반가워요 ㅋㅋㅋㅋㅋㅋ,0.0,4개월 전
94,mindangnamdang,ㅎㅇㅌ 그냥 다 잘될거에요. 소의님은 될사람이라,0.0,3주 전
95,sujub,소의님 엔틱감성이라니.. 너무너무궁금해여!!!!,0.0,4개월 전
96,usersn6dq9gf1e,"근데 집이 정말로 너무 넓은것 같네요.
50평이상은 되는것 같아요.
지금도 괜찮은것 같은데 리모델링을 하신다고 하니 기대가 되네요.
새로운 집에서 언제나 좋은 시간보내시기 바랍니다.",0.0,4개월 전
97,useryc8nz3fl9j,롯캐 떠나지마요 ㅜㅡㅜ,0.0,4개월 전
98,userdz7lo9lb5v,"안녕하세요 소의님 현재 소신발언방은 추가 인원 안받으시는거죠ㅠㅠ
추후에 받게되면 꼭 알려주세요><!!!
리모델링 후 집도 보여주세여 귱금",0.0,4개월 전
99,fangdu7093,"이제 저와 이웃주민이라뇨!!!!
신기합니당",0.0,4개월 전
100,page1610,송도주변인프라 진짜좋아요 스트레쓰싹 날아갈거에요,1.0,4개월 전
101,mjda112,진짜 대박 궁금...,0.0,4개월 전
102,userst3fx5kq1h,신축 분양권 사셨다고 하셨는데 잘 안되셨나보네요ㅠㅠ 그래도 이사갈 집 너무 좋은데요,0.0,4개월 전
103,esfjuser,우아 ️,0.0,4개월 전
104,1318,부럽다,1.0,4개월 전
105,userrk9gz9fj6i,기대되요,0.0,3개월 전
106,usernw5fs7ik4f,안녕하세요~^^입으신 츄리닝정보 좀 주실 수 있으실까요?,0.0,2개월 전
107,wlek5897,언니 트레이닝복 세트 정보좀주세효..,2.0,4개월 전
108,usercu6qs1zh3s,소의님 이사내용이지먀 올리지오 대받녀는 안하시나요? 리프테라2도 나왔든데 궁금해요,0.0,4개월 전
109,userdz8em4fb1e,부럽구먼요,1.0,4개월 전
110,userln7yv8wh1g,오와 넓다~~,0.0,4개월 전
111,ssossokkim3038,벌써... ㅠㅠ,0.0,4개월 전
112,aarim,대박,0.0,4개월 전
113,userxk4kc9xd5v,소의님 안녕하세요,0.0,4개월 전
114,usercl4kd8kd6i,근무중인병원좀알려주세요 바로가서 30년동안관리받을게요,0.0,4개월 전
115,userxr9te5sr3b,와  몇평이다냐,0.0,4개월 전
116,userqb3li7ef2h,부자당,0.0,4개월 전
117,userpy9mw2rp3c,1등,0.0,4개월 전
