,youtube_id,comment,like_num,comment_date
0,Yukinoelife,"알흠다우신 민서님 이 패드 넘나 신기해보여요. 성분이 고농축인게 화면으로도 느껴지네요.
 요즘에 꽃가루 날려서 피부가 민감해졌는데 이런제품 넘나 원츄입니닷 ㅠㅠ 당장 구매각입니다 ",1.0,4개월 전
1,userhy3wl6yq9g,케이스만봐도 진짜 진정효과가 있어보여용 근데 민서님 진짜피부좋아졌어요ㅎ 아임프롬 패드도써보고싶네여,1.0,4개월 전
2,soo889,저 앰플 갑자기 엄청 땡기네욬ㅋㅋㅋㅋ,1.0,4개월 전
3,jiniekim1159,"열일 넘 좋아요
.",1.0,4개월 전
4,userxk4kc9xd5v,민서님 감기 조심하세요,0.0,4개월 전
5,chloechoe868,"말투가 누구 닮았다고 계속 생각했는데 말끝맺음이랑 입모양이 약간 샤이니 태민이랑 좀 비슷한 것 같아요ㅎ 
모르시는 분들은 뭔소린가 하시겠지만 태민팬분들은 공감하실듯 ㅎ",3.0,4개월 전
6,hwaneonline,3개중에 제 픽은요… ㄹㅇ 앰플이 물건임,3.0,4개월 전
