,youtube_id,comment,like_num,comment_date
0,bola7940,영상보고 루에브르 가방 구매했어요️ 더현대 가니까 메인에 걸려있더라구요!! 진짜 너무 예뻐요ㅠㅠㅠ,16.0,10개월 전
1,userdudinie,저도 영상보고 가방 주문했어요>_< 매장에서 들어보고 다른거랑 고민해서 안샀는데 영상보고 나니 아 이건 안사면 안되겠다 싶더라구요ㅋㅋ 그리고 마뗑킴 지갑두 사려고 드릉드릉 하네용( ღ’ᴗ‘ღ ) 꿀템 짱 많으셔서 이 영상 한 5번 본거 같아요,2.0,10개월 전
2,usermg4ie3by8j,오늘도 잔망 너무 귀여우셔용 내년에도 나와주세요 평생동안 매년 나와쥬시길...️,1.0,10개월 전
3,WonSehyeon,호루라기 칭구님 반가웠어요 ㅋㅋㅋㅋ 여전히 귀염뽀짝 잔망잔망 기하학적 귀걸이 어디선가 찜콩해둔적 있는 귀걸이 같아요 다시 찾아봐야지 문샷 쿠션 사랑이 몇년째 이어지다니.. 어젠가 호루라기 시리즈 년도별로 복습해서 봤거든요.. 먼가 이어서 자꾸 아래에 떠서 강제복습당함,9.0,10개월 전
4,mika729,"호루라기만 보고 너무 설레서 들어왔습니다
오늘도 유쾌하신 후배님 덕에 웃으며 시청하고 갑니다",3.0,10개월 전
5,userow2xy5cl5o,미니백 넘 이뻐요 색깔까지 넘나 이쁘다요 ,0.0,10개월 전
6,usercr1lt5bz9d,이미스 에코백 접으면 존재감없이 가방에 쏘옥 들어가서 장바구니로도 들기 좋더라구요 그리고 가방끈이 하나인건 좋게 얘기하면 흘러내리지 않는다는 점..️️,1.0,10개월 전
7,yereumlee762,돌아온 호루라기 후배님! 역시 넘 재미있고 꿀템! 찐템ㅋㅋㅋ 악세사리 담아 다니시는 파우치도 궁금한데 알 수 있을까요? 저도 악세사리 잘 가지고 다니는데 넘 심플하고 좋아 보이는 후배님 매직!,1.0,10개월 전
8,usermd3ob5yx7y,친구분 너무 프로 같아요. 쇼호스트 보다도 더 설득력 있고 귀 기울이게 하는 재능이 있은 거 같아요 짱,0.0,6개월 전
9,jjiyeongjeon3502,"꺄! 호루라기 후배님
언제나 늘 반가워요!!
이번 영상도 역시 잔망꾸러기시네요
담에 또 나와주세요~!",1.0,10개월 전
10,pingco34,"앗 연말이 되면 또 안나오시는지 궁금해지는데 나오셨군요!!!
호루라기 진행중인 립들 너무 귀여워용 ㅎㅎ",0.0,10개월 전
11,Dearesty,ㅋㅋㅋㅋㅋㅋㅋㅋㅋㅋㅋ아 너무 재밌어요 편한데 넓은 에코백 종류 좋아하시면 쏘차밍 가방들도 추천드려요! 저 종류별로 구매해서 사계절 내내 쓰고 있읍니다,0.0,10개월 전
12,usertv9bx1ht5p,"우와 호루라기 후배님 영상들 전부 좋아했는데, 올해 영상이라니요! 갑작스런 선물 받은 기분이네요!",1.0,10개월 전
13,userws9cu3ox3x,영상 잘봤어요 가방 예쁘네요 취향저격이네요^♡^,0.0,10개월 전
14,usergq4qb3tu7o,14:09 생리통약은 이지엔 식스랑 탁센이랑 성분이 달라서 뭔가 둘 중 하나가 맞으면  한쪽은 안 듣는다고 하더라구요! 저도 그래서 탁센은 효과가 없고 이지엔 식스만 들어요!,1.0,10개월 전
15,esoooongj6374,언니 ㅋㅋㅋㅋ편집센스 자막 색이나 구성이 더 좋은 거 같아요! 초반에 큰 글씨들이요! 약간 요즘 많이 사용되는 듯한 글씨들이에영,1.0,10개월 전(수정됨)
16,eunoo,"잘 보았어요 다음 영상도 기다리고 있을게요 오늘도 좋은 하루를 보냈나요?!  플러스펜 캘리그라피 수업 갔다 왔구..목요일에도 가지만 날씨가 춥지만..감기조심 10월 안녕이다 그쵸?! 저의 생리대는 본 생리대 내츄럴코튼 생리대..네이처 생리대도 있답니다 올영 공홈으로 생리대 쇼핑해서 오늘 받았거든요..사재기 하는 편이기도 하고..디어스킨 생리대도 좋아요..귀애랑 생리대도 있는데 이 생리대는 무향  아닌 점..한약 냄새라고 해야 할까요?! 저는 예전부터 쓰던 생리대라 냄새(향) 신경 안쓰는 편이예요..
대형으로 쓰는 편이죠..29cm 아니면 안써 탐폰 경우는 제가 쓴 적이 없는 앞으로도 쓸 경우는 없을 것 같겠지만..팬티 형 오버나이트는 쓴 적이 없는데 원래 쓰던 제품이 편하니까.. 42cm 
십대  때 생리 시작 했는데 친구들 보다 일찍 했죠?! (초6) 
제가 요즘 드라마 안 보고 지내곤 있긴 한데 치얼업 드라마 있잖습니까?! 특출 장나라님 나온다는 기사를 본 관계로 나오는 장면이 5분 정도 될렸나? 그 잠시 잠깐 볼려고 기다렸죠 뭐..지금 새로운 드라마 촬영 중인디 23년에 하거든요.. 또 장혁님과 만남(세번째) 장나라님 덕후..
옷 따뜻히 입고 다니길 바래요 솔아님 잘자요 굿밤",0.0,10개월 전
17,ljls0115uv,"왕,, 넘 재미써요 ㅋㅋ 호루라기",2.0,10개월 전
18,sunn1406,기다려써요 <3,0.0,10개월 전
19,haenique,재밌게 잘봤습니다~!!ㅎㅎ,0.0,10개월 전
20,gmagmagma100,호루라기님 입으신 셔츠 정보 알 수 있을까요??,2.0,10개월 전
21,userwm8bh6ty4t,헐 저듀 애플워치 스트랩 정보 알고 싶었는데… 아숩네용,5.0,10개월 전
22,cockiri,기다렸습니다..호루라기님,0.0,10개월 전
23,userwx6hr6ul3d,셔츠 어디껀지 궁금해요,0.0,10개월 전(수정됨)
24,userjt4en3wt4d,입고있는 하얀셔츠 어디꺼에요? 넘 제 스타일이네요 꼭 알려주세요,0.0,4개월 전
25,userom8xj2fu4q,카메라 어떤거 쓰시는지 여쭤봐도되나요!?,1.0,10개월 전
26,jellykiwi1643,애플워치 스트랩 정보 알수 있을까요???,0.0,10개월 전
27,userhw1ne1vv9g,선댓~,0.0,10개월 전
