,youtube_id,comment,like_num,comment_date
0,userfv5ls3wk8p,"10분의 화려함과 멋진 옷을 보여주기 위해 오랜기간 동안 고생하신 디자이너님과 비욘드클로젠 직원분들 모든 스텝분들 정말 수고하셨습니다~
음악 연출. 옷 모두 최고였습니다",10.0,10개월 전
1,chunyoungjun,"어태용에서 소개하는 3번째 쇼인데, 이때까지 ’구리다‘라고 느껴지는 착장이 한번도 없었고 컬렉션 볼때마다 옷과 패션에 대한 새 관점이 열리는거 같읍니다… 저를 비롯한 정말 많은 사람들한테 이 10분의 쇼가 엄청난 교보재가 되지 않을까 싶어요. 최선 다해서 멋진 쇼 만들어주셔서 감사합니다 ! 오늘도 배워갑니당 🥹",4.0,10개월 전
2,ro5248,쇼 직관했는데 카모자켓 나올때는 전율이 흐르고 화이트 자켓나올땐 마지막이라서 아쉬웠고 피날레때는 눈물이 나더군요. 정말 감정적으로 패션쇼를 본 것은 오랜만이었습니다. 한로로씨의 입춘이 요즘 제 최애곡입니다 빨리 발매가 되기를 기다리면서 정말 고생하셨습니다 !,9.0,10개월 전
3,pearlk6688,"진짜므싯다,,,,, 고생해서 준비한 멋진 컬렉션도 박수를 보내지만, 복잡하고 긴박한 현장 속에서 통찰력과 꼼꼼함으로 모든 걸 통솔하고 체크하고, 마지막으로 사람들까지 챙기고 하는 건 진짜 아무나 할 수 있는게 아닌듯ㅠㅠ
손발 맞는 파트너들이 있음에 또 더욱 빛날 수 있었겠죠??! 고생하셨습니다 그리고 뭐 이미 아시겠지만 진짜 멋있슴다!! 
 오랜만에 어태용 보고 감명받고 가서 남기는 댓",1.0,10개월 전
4,userfj3sn9kf7v,패션 문외한인데 이런 세계를 이렇게 바로 옆에서 접해볼수 있다는게 유투브에 고맙네요..  이패션어태용에겐 무한히 감사,2.0,10개월 전
5,beforeanyoneelsemd5gy,미친 선곡으로 시작해서 피날레까지 완벽했습니다…,7.0,10개월 전
6,userxd5vm4ru5c,비욘드클로젯 컬렉션은 옷 은 물론이며 음악을 듣는 재미도 상당한 것 같습니다 그만큼 디자이너님의 감성을 알 수 있는 요소들이 다양한 것 같아요 최고!!,3.0,10개월 전
7,yhenrvw4eg,이렇게 백스테이지에서도 정신 없으셨을텐데 쇼는 촤고로 멋지고 완벽했습니다 고생 많으셨습니다 실장님~!!,2.0,10개월 전
8,jugang5457,현장에서는 못 봤지만 영상으로도 이런 분위기면 현장은 더 웅장했겠네요 너무 멋도리십니다!,3.0,10개월 전
9,fxxkhoon8578,이번 영상으로 한번 더 디자이너의 꿈을 더 충족시키게 해주셔서 감사합니다 너무나 재밌었고 멋있었습니다,2.0,10개월 전
10,rainbowciel4675,천재 천재!! 너무 멋지고 너무 대단하시고!! 너무 재밌고 ..정말.. 10분 이란 시간이 너무하다 란 생각만 든다.. 정말 매번느끼는거지만 다들 대단하시다,2.0,10개월 전
11,Snoopy12121,실장님을 존경합니다 진심으로요..,6.0,10개월 전
12,userfx8yz9pt4m,디자이너님 저번에 피곤할 때 봐서 두 번 보러왔어요. 지금은 스물 후반이지만 고등학생 때부터 늘 멋지세요.    +디자이너님 착장에서 바지 정보도 알 수 있을까용 ,2.0,10개월 전(수정됨)
13,idkzh6ur,패션 음악 찐 감동,2.0,10개월 전
14,usercx3kw1qu3j,마지막 피날레곡 진짜 너무 좋아요....🥹️,5.0,10개월 전
15,userkr9fe6or1t,옷들 다 너무 이뻐요~ 쇼 너무 잘 봤습니다! 늦었지만 준비하시느라 고생 많으셨습니다 ~~♧,3.0,10개월 전
16,arete822,ㅋ.ㅋ 봐도봐도 잼있어요 50살60살되서도 이렇게해주세요 실장님 오래오래,3.0,10개월 전
17,sehwankim7063,"지나가다 보고 그냥 지나쳤는데, 이렇게 보니 아쉽네요. 다음번엔 꼭 구경할게요. 멋져요~ 다들.",1.0,10개월 전
18,jaeheekim6422,진짜 최고의 컬렉션 입니다,2.0,10개월 전
19,userhc9wv5yl3r,"멋지고 부럽네요~
축하해요 ~",3.0,10개월 전
20,paulzzack,멋지네요.,2.0,10개월 전
21,jacob99,패션쇼 야무지네요. 못가본게 아쉽네요,3.0,10개월 전
22,lovelylovedj8vn,어깨패드에 진심이신 어태용ㅋㅋ,4.0,10개월 전
23,userud2te9oe9m,쇼 음악 너무 좋았어요^^,3.0,10개월 전
24,msymsy9588,이런 웅장하고 지리는 영상에도 예능은 빠지지 않네 ㅋㅋㅋㅋㅋㅋㅋㅋ,3.0,10개월 전
25,userqd4wu8yw6t,정말 항상 감사합니다! 야드 화이팅!!,2.0,10개월 전
26,quotesforyou3906,"항상 저 쇼 끝에서의 마지막 인사, 매년 보고 싶네요!",3.0,10개월 전
27,userip5uk4mf4w,지렸다..지렸다..진짜  읏된다,4.0,10개월 전
28,userez2nn4dt8x,"피날레 너무 감동적이었어요! 아직도 저 노래만 들으면, 저번주 금요일에 사는중...... 살짝 눈물 날 뻔 했다는ㅜㅠ",7.0,10개월 전(수정됨)
29,WithchungU,한번 고태용 디자이너님 패션위크 보고싶어요ㅜㅜ,0.0,6개월 전
30,userxv4bo8sh6m,크.. 역시는 역시네요,2.0,10개월 전
31,usercl3ru5le5l,피날레 음악 너무 좋네요 감동적!!,1.0,10개월 전
32,yhk973,대희형 멋있다! ㅋㅋ,2.0,10개월 전
33,boramchanlifestyle28,"수고하셨습니다
대희님은 뉴욕 다녀온 이유가 있었군요 제주는 안오나요",1.0,10개월 전
34,userum8bk8uh3r,선곡 ,3.0,10개월 전
35,usercx4je6gm5v,패션쇼 의상  감미롭고 멋진 초고 힙 음악 wonderful ️,1.0,10개월 전(수정됨)
36,official4418,"고태용 디자이너님 진솔 깊은 사랑의 맘 의상 모든이에게 희망의 피드  음악  wunder scho""n   ️",1.0,10개월 전(수정됨)
37,usermp1io9je9j,오늘도 선댓 후감상 하겠습니다,4.0,10개월 전
38,bogoskimr5451,아 ㅈㄹ 머싯다 진짜! 형 짱이에요,0.0,8개월 전
39,greatqwfd,선좋아요 후감상,3.0,10개월 전
40,sedawnn,"모델보다 실장님 바지핏이 너무 좋아서 바지 밖에 안보입니다,, 바지 어디 제품인거지🫠",8.0,10개월 전
