,youtube_id,comment,like_num,comment_date
0,userok9pp6jo4h,엽떡 중독성있죠 ~~ 일주일 정말 알차게 보내셨네요 저도 해딩님처럼 알차게 하루 하루 보내야겠어요~ ^^ 영상 잘봤습니다~~,0.0,5개월 전
1,HarrimanHikersVlog,햇살이 너무 좋은 하루네요. 나무들이 이제 모두 초록초록하네요.  등산은 처음 5분이 제일 힘들죠. 일단 5분이 지나면 몸도 더워지고 다시 내려갈 수도 없으니 그냥 오르게 돼죠.  등산 마무리는 역시 맛집 방문이죠. 등산 후에는 어느 곳이나 맛집이 되겠죠. 그리고 시원한 맥주 한잔 더하면 더 바랄 나위가 없겠죠. 오르는 내내 먹을 생각에 힘을 내는 ㅎㅎㅎ 꾹꾹 누르고 응원 드리고 갑니다. 저도 만두 좋아 하는데 이전에는 명동 입구의  취천루가 옛날 만두 맛을 느낄수 있어 한국 가면 자주 같었는데 없어진 뒤로는 한국 출장가면 혼자먹기 부담 없고 호텔에서 가까워 파미에스테이션의 천진포자 에 꼭 들리죠. 고기만두의 만두피를 입에 넣는 순간 옛날 만두의 익숙한 맛 지금도 생각이 나네요. 저희 뉴욕 주 Harriman State Park 산행 Channel도 꼭 한번 방문해 주세요  미국 산행은 어떻지 비교해 보시기 바랍니다.,0.0,5개월 전
2,userwo6ff2bb9l,열심히 몰아서 보고 있어요!! 첫날 착장 너무 짤떡이에요 ㅠㅠ 시엔느 자켓 구매하려고 보니까 5/17 이후 배송이네요  ㅎㅎ,0.0,4개월 전(수정됨)
3,suyeon91,오 부스터힐러 저도 써보고 싶네요 ㅎㅎ,1.0,5개월 전
4,userwd7tn2vy1z,제가 딱 원하는 삶이에요 ....,0.0,5개월 전
5,usertf7ty2qs8m,등산할때 입은 파타고니아 바람막이 제품명 알수있을까용??,0.0,5개월 전
