,제목,URL,조회수,업데이트 날짜,영상 길이,영상 좋아요 수
1,감각적인 여름 '최애의 아이'템 남자 반팔 니트 & 반팔 가디건 입어봤습니다!! feat.여름 옷 추천 리뷰,https://www.youtube.com/watch?v=OtQHC-I9HP4,578,2023-07-14,0:04:52,11
2,평생 신는 남친룩 코디 신발 2가지 알려드림 l 남자 스니커즈 운동화 & 블로퍼 클로그 뮬 추천!!,https://www.youtube.com/watch?v=e2PrDnYvcsY,664,2023-06-25,0:05:22,10
3,남자 여름 코디는 다 똑같다?! 하지만 진짜 이쁜 반팔과 여름 바지로 즐겨보시죠! 브랜드 추천!!,https://www.youtube.com/watch?v=ILEvGEQBPy4,901,2023-06-20,0:06:53,23
4,"예쁜게 너무 많다.. 2023 남자 반팔 브랜드 추천 & 여름 코디까지!! [아미,메종키츠네,타미힐피거,라코스테,무지 반팔티]",https://www.youtube.com/watch?v=t8IG9eG4zbc,27218,2023-05-17,0:08:47,167
5,모든 단점을 커버하는 역대급 핏과 퀄리티가 미친 저의 ✨인생 아이템✨ 남자 와이드 슬랙스 추천드립니다!!,https://www.youtube.com/watch?v=lf67qk_l0q0,2312,2023-04-26,0:07:28,56
6,역대급 패션 트렌드의 컴백!! 남자 데님 셋업 코디 & 추천 브랜드[노이어],https://www.youtube.com/watch?v=JwjxvkhWeOg,2853,2023-04-08,0:05:03,35
7,이번 시즌도 역시나 만족스럽다..!! 지금 꼭 필요한 남친룩 기본 아이템 5가지 추천&코디!!,https://www.youtube.com/watch?v=Dl_t8pLy1mQ,1124,2023-04-04,0:06:17,23
8,평생 입는 유행 안타는 남자 봄 아우터 4가지 추천과 쉬운 코디 방법까지!! (feat.데님자켓 항공점퍼 바람막이 스웨이드),https://www.youtube.com/watch?v=7Vmh7lo4594,1317,2023-03-21,0:05:17,17
9,"남자 봄 코디 고민이시면 이렇게 입어보세요! 정말 쉬운데 여자들이 좋아하는 남친룩일꺼에요! I 지플리시,블레이저,레더자켓",https://www.youtube.com/watch?v=geFq9YRemfk,1896,2023-02-17,0:05:05,19
10,340억 매출의..무신사 1위 드로우핏 코트 리뷰와 남자 봄 코트 코디까지!!,https://www.youtube.com/watch?v=EcnYfviC1Bk,7986,2023-02-08,0:05:30,39
11,와..60만 후기의 브랜드.. 2023 역대급 남자 레더 가죽 자켓들로 컴백 ! [남자 가죽자켓 코디&추천] +구독자이벤트까지!,https://www.youtube.com/watch?v=GX9F-M9CpqQ,6811,2023-02-06,0:08:31,83
12,"2023 남자 봄 코디에 필요한 기본 아이템들 추천&리뷰 옥스포드셔츠,데님셔츠,니트조끼,티셔츠까지!",https://www.youtube.com/watch?v=VM-s5zrXVq8,2083,2023-01-31,0:08:20,46
13,아미 니트 솔직한 구매 후기! 깔끔한 사이즈 팁 & 만족도,https://www.youtube.com/watch?v=pdfSMKUXfXE,3252,2023-01-28,0:04:56,14
14,코트랑 패딩이 질릴때 입기 좋은 남자 겨울 아우터 모아봤어요! 무스탕 I 울자켓 I 항공패딩점퍼 I 플리스자켓,https://www.youtube.com/watch?v=jJ23IG03X50,1011,2022-12-21,0:03:49,18
15,겨울 남친룩의 완성 남자 발마칸 코트 코디 추천,https://www.youtube.com/watch?v=YDT7L1BI-cs,1636,2022-12-14,0:05:30,13
16,퀄리티와 가성비까지 완벽한 [남자 니트] 그냥 이거 사세요!!,https://www.youtube.com/watch?v=iz5gRo8hS0s,2896,2022-12-12,0:07:32,71
17,핏과 디테일이 미친 MA-1 남자 항공점퍼 코디 추천!,https://www.youtube.com/watch?v=jTmBscc4jyA,3533,2022-11-23,0:04:50,37
18,매년 무신사 블랙프라이데이 쇼핑전에 안보면 후회하는 영상,https://www.youtube.com/watch?v=GLEoDTuoSic,3023,2022-11-16,0:07:45,35
19,"돌아온 무신사 1위 브랜드! 라퍼지스토어 패딩, 플리스 자켓 리뷰! feat.구독자 이벤트",https://www.youtube.com/watch?v=YU9CXr18muc,12169,2022-11-14,0:08:29,121
20,[월간룩북] 여자들이 좋아하는 남자 11월 가을과 겨울 사이 코디 22가지!,https://www.youtube.com/watch?v=bzvJ0z_t7Xc,1881,2022-11-01,0:07:51,27
21,남자 겨울 코트 이거면 충분합니다!!,https://www.youtube.com/watch?v=uW0AKMXSkeg,2865,2022-10-30,0:07:04,26
22,"겨울에 있으면 좋은 남자 기본 아이템!! 아미 니트,휠라 코쿤볼패딩,톰브라운,코트",https://www.youtube.com/watch?v=xW0GngYnwZY,3452,2022-10-25,0:08:43,33
23,신상 톰브라운 가디건 반값에 사는 방법 feat.오케이몰,https://www.youtube.com/watch?v=Mr3XWRmY_gw,9676,2022-10-20,0:07:24,40
24,감각적인 남자 바람막이 코디 & 추천,https://www.youtube.com/watch?v=LTCZxLbVKnA,1984,2022-10-13,0:05:28,23
25,요즘 SNS에서 가장 🔥핫 한🔥!! 유명한 면도 아이템 가져와 봤습니다,https://www.youtube.com/watch?v=6bFGWuogKEw,5512,2022-10-11,0:05:19,14
26,핏이랑 퀄리티가 미친 '남자 와이드 슬랙스' 추천해드립니다!!,https://www.youtube.com/watch?v=HSH_7Fj4gOc,15153,2022-10-03,0:06:31,142
27,리얼 가죽과 페이커레더의 차이점&장단점 남자 가죽 자켓 코디까지!,https://www.youtube.com/watch?v=9v-8IebUncI,1425,2022-09-29,0:04:42,19
28,완전 이쁨!! 남자 '니트&맨투맨&후드티' 추천 가을 코디까지!,https://www.youtube.com/watch?v=JfL4arsN34o,1665,2022-09-20,0:08:02,19
29,컬러감 너무 예쁜 신규 브랜드로 남자 가을 코디 🍁,https://www.youtube.com/watch?v=LFDBKjXGpa4,2481,2022-09-08,0:04:14,33
30,2022FW 쇼핑전에 일단 남자 가을 코디 맛만 보자!,https://www.youtube.com/watch?v=TheS7TQIJj4,1910,2022-09-01,0:04:25,25
31,데일리 활용과 가성비까지 너무 좋다! 남자 가방 추천 & 코디,https://www.youtube.com/watch?v=OqTdihzWAsI,16321,2022-08-21,0:04:43,135
32,제 바지핏의 비밀은.. 남자 와이드 슬랙스에 있습니다!,https://www.youtube.com/watch?v=YOhz8pIvv0E,7248,2022-08-02,0:05:08,137
