,youtube_id,comment,like_num,comment_date
0,userxs7cx5nf7q,"여성 게스트도 좋지만, 남성 게스트분들도 좋아요~
옐로우가 살짝 들어간 블루 ㅠ 봐도 아직 너무 어려웁네요 ㅎㅎ
웜톤 쿨톤 두분 같이 나오셔서 서로 같은 드레이프 천 대고 비교하는더 너무 신기하고 재미있네요 ㅎㅎ
원장님은 똑똑하셔서 그런가 응용도 잘하시고 뭔가 척하면 척이시네요 ㅎㅎ",0.0,5개월 전
1,userxx9br2kg9i,우와 ~~ 도움 많이되는 컨텐츠 감사합니다♡,0.0,5개월 전
2,kek8567,혼자할때보다  두 분을  비교해서 보여주시니 확실히 잘 보여지네요  잘 보았습니다,1.0,5개월 전
3,userke9bu6bi1f,"퍼스널 컬러별 ,골격 체형별로 남성,여성 가죽자켓 추천해주세요.",1.0,5개월 전
4,AntiAgingDrJung,ㅎㅎ 살을 더 빼고 갔었어야하는데..ㅠ  덕분에 좋은 퍼스널 진단 받았습니다! 감사합니다~,0.0,5개월 전
5,userhg4nd5gs7q,올~~ 진짜 남자도 퍼스널컬러 중요한거같아요!,1.0,5개월 전
6,yeoni9109,훈남 맞으시네요^^재밌는 영상입니다,0.0,5개월 전
7,userwh5cs6kp5b,와 오늘 영상 재밌네요 게스트도 멋지시공,1.0,5개월 전
8,SI2023,잘 봤습니다. 저는 솔로지옥에 나오는 출연자분들 퍼스널컬러가 궁금하네요,0.0,5개월 전
