,youtube_id,comment,like_num,comment_date
0,yunzzang39,가젤 플랫폼 귀엽네요! 구경가야겠어요ㅎㅎ 인스타로 스포하신 실버백도.. 곧 공개되겠죠??기다리고있습니닷,0.0,3개월 전(수정됨)
1,userdj7kp6yu1q,오늘 영상도 잘봤습니다! 언니분 카페에서 신으신 하늘색 샌들 어디껀지 궁금해요!!,1.0,3개월 전
2,usertn9ee2md5z,팔찌 정보도 알려주시면 감사하겠습니다~,0.0,3개월 전
3,userwf7iw5qj4n,손이 잘간다는 뉴발란스 신발 410v5입니다. 전 저거 올블랙으로 있어요ㅋㅋ,0.0,3개월 전
4,usered3hu8jz9m,가젤 플랫폼있는거 검.흰이 제일 이쁜가요???,0.0,3개월 전
5,heosseul,엄텽 긴 문장을 hello 한단어로 함축하셨네요><,0.0,3개월 전
6,usernx7yg5rv4s,마지막 하늘색 샌들은 어느브랜드제품인가요?,0.0,3개월 전
7,userxj7ur3sl9l,"뻔☆미리보내고이동못해도되는데아직나오고있는.ORI오리의소비로그님보내세요
긴급대피경보이동경로제보접수신고번호오백원등모집등소리하면서다니고있는당사자님과개통된곳에경비라며배치하고특이사항과지내는곳을빠짐없이댓글에게보낼거와보내구요문닫고정리하고이동못해도됩니다윗과이와같이개통한다며이동못해도됩니다
오늘오전오후여덟시하기에앞서지금바로보내야겠서요모두모여서정리할거하고정리하니문을닫니안닫니지내는당사자님과많이그래야겠서요",0.0,2개월 전
