,youtube_id,comment,like_num,comment_date
0,ellieveryday,"00:00 빠뤼르 골드 구 버전 설명
01:26 광채 발라보기
04:28 매트 발라보기
08:52 매트 레이어
10:04 구버전과 색상비교 (빠뤼르 골드 00호 vs 빠뤼르 골드 스킨 매트 0.5C)
11:11 광채 손으로 바르기",10.0,10개월 전
1,min1505,저도 이 제품 글로우 00C 쓰는데 지금까지 발라 본 파데 중에서 색상이 가장 마음에 들고 손으로 슥슥 잘 발리고 커버력도 있어서 가장 마음에 들었어요. 하지만 건조한 건 어쩔수가 없어서 묽은 로션 한 방울 섞어 쓰니(어느 파데를 발라도 건조하거든요) 정말 깔끔하게 발리네요. 샤넬 카멜리아도 잘 쓰는데 그거보다 색상 밝아서 마음에 쏙 들었어요  파데 바르면 언제나 얼굴색 어두워져서 좀 그랬는데 이번 겔랑 밝은색은 정말 화사하게 해 주는 느낌이여요.,11.0,10개월 전
2,userct7ep1kb9r,저도 이 제품 0.5w로 사서 잘 쓰고 있어요! 영상에서 말하신대로 n도 다른 뉴트럴톤 파데에 비해서 핑크톤이 살짝 있는 것 같더라구요 그래서 붉은 기가 많은 저에게는 w가 붉은 기도 잘 가려지고 좋았어요! 웜이라 해서 예전 00호처럼 누런 게 아니고 밝은 색상의 뉴트럴한 느낌이라 너무 만족하면서 사용중이에요!!,8.0,10개월 전
3,userti1tn7cb2f,오 마이 저 요즘 글로우파였는데 매트 피부 표현 미쳤네오  매번 제 통장 털어가는 엘리님..,3.0,10개월 전
4,userwf5rg2dn9j,"겔랑파운데이션글로우 0.5n구입해서 오늘 처음으로 메이컵했는데 완전 만족했어요~^^ 매장직원은 0n컬러를 추천했는데 저는 엘리님추천을 믿고 0.5n구입했는데  노란끼많은 21호피부가 자연스럽게 환해지면서 커버력있고 시간지나니니까 자연스런광 올라오고 좋더라구요~ 디자이너리프트는 꾸안꾸느낌이라면 겔랑은 세련되고 과하지않게 화장한느낌파데라고 느꼈어요~~ 인생파데겔랑 인도해주셔서 땡큐땡큐~♡ 
겔랑쿠션도 리뷰해주세용~수정화정엔 쿠션이 필요한데 같은브랜드가 좋더라구요",3.0,7개월 전(수정됨)
5,ashaaither9154,"아!!!!!
빠뤼르 골드 자연스럽고 고급스러운 피부 표현에 만족하면서 쓰다가 그래도 좀 더 화사했으면 좋겠다 하는 생각에 재구매 망설였거든요. 그런데 이렇게 완전 개편을 해주다니 ㅠ ㅠ!!! 코시국 파데로 아르마니 누드 비비처럼 바르고 살았는데 이제 돌아갈 때가 되었나봐요…… 엘리 님 아니었으면 모르고 살았겠어요. 완전 감사합니다!!!",3.0,10개월 전
6,urh4343,엘리님 파데 리뷰는 사랑이죠,3.0,9개월 전
7,suryunkang,겔랑 브랜드를 생각해보니 저는 한 개도 접해보지 않았던 브랜드이네요! 저는 향에 많이 민감한 편이라 겔랑 제품에 향이 나는 줄 몰랐는데 향을 언급해주셔서 어떤 향이 나는지 정말 궁금하네요 제 관심사 밖이기도 했고 가끔 백화점 오가며 봤던 화장품 매장 중에서 겔랑 매장은 못봤어서 엘리님께서 지난번 립 추천 영상에서 언급해주신 겔랑 립 너무 예뻐서 온라인으로 찾아봤는게 그 립 컬러는 품절인지 없더라구요ㅠ 온라인에서도 구매하기 힘든 브랜드인가봐요ㅠ 아! 그리고 리뉴얼 된 겔랑 파데 너무 예쁘네요 컬러도 너무 예뻐요! 나중에 집에 있는 파데 다 쓰면 겔랑 파데 도전해야 할까봐요! 오늘 영상 너무 감사합니다 ,1.0,10개월 전
8,usernizemik,평생 죽을때까지 한 파운데이션만 쓸 수 있다면 겔랑 골드를 쓰겠어요.. 색상 바뀌기전에도 최애였는데 리뉴얼되고 나서 견줄만한 파데가 없어졌어요..모든 부분에서 육각형파데,1.0,9개월 전(수정됨)
9,lunarprobe,"이거보고 주말에 00c 글로우 구매했는데 넘  만족스러워요ㅠㅠ원래는 매트사고싶었거든요 건조한 피부라 스킨케어 촉촉하게 쌓고 달바 선크림바르고 갔고, 로르얹었는데도 매트가 건조하게 느껴지더라고요..직원분이 글로우 추천해주셔서 발라봤는데 그렇게까지 글로우하지않지만 건조함도 없었고, 무엇보다 피부표현짱이더라구요.시간 지났을때도 완전 멀쩡했구요.  그래서 바로 로르랑 같이 구매해버렸습니다. 옛날부터 써보고싶었던 파데였고, 피부가 밝은 편이라 아예 포기했었는데 광명 찾았어요!! 너무 만족하는 파데입니다. 파데 색상 찾기 힘들어서 정말 속상했는데 너무 신나요",0.0,2개월 전(수정됨)
10,userxq1ji6ox4t,디올 포에버 벨벳과 겔랑 매트 비교시 각각 어떤장단점들이 있는지 비교하는 영상 보고싶어요~~!!,12.0,10개월 전
11,SLwf9di,이야.. 겔랑이 엄청 좋다길래 샀다가 쿨톤인데 아주 누렁이누렁이 해서 화장 안한게 더 나을정도라 쳐박아놨는데 드디어 핑크 베이스도 나왔네요!!,3.0,8개월 전
12,crystalchang8171,촉촉파데간의 비교 너무너무 기다리고있어요,7.0,10개월 전
13,gdg1326,와 엘리님 예전에 디올 인스타 게시물이었나? 빠뤼르 리뷰 해달라고 했었는데 ㅠㅠ 감덩이에요. 디올 999 다 써서 또 사고 디올 매트 파데 샘플 받았는데 엄청 좋더라구요!,1.0,10개월 전
14,ueong2,매트 피부표현 넘나 제 취향 ㅠ 전 리뉴얼전 노란색 좋아했는데 리뉴얼 버전 w 라인 사면 된다고 하니 다행이에요 ㅎㅎ 엘리님 영상 보고 디올 글로우 샀는데 또 다른 느낌 파데 갖고 싶으면 매트 사는 게 더 낫겠죠?!,3.0,10개월 전(수정됨)
15,Igodoo,"리뷰가 너무 꼼꼼해서 좋아요 
커버력 + 은은한 광을 원하는데
샤넬 울트라르뗑 , 디올 글로우, 겔랑 중 어떤게 좋을까요? 엘리님 추천 부탁드려요 🥹🫶",3.0,8개월 전
16,behappync3kt,"이채널을 이제야 알다니 진심 좋은채널
연달아 영상 계속 보고 있어요.
겔랑오일세럼이 넘 좋아서
파데도 궁금했는데 정보너무 좋네요",1.0,9개월 전
17,userjp8bj5up5q,"오.. 겔랑 색상 무슨일인가요ㅋㅋ 예전에 썼을때 색상이 너무 안맞아서 못썼었는데!!! 오늘도 발 빠르게 와주셔서 감사합니다 ️
언니 저 여름에 아르마니 파페+ 거의 정착템이다 생각들정도로 잘썼었는데 겔랑 메트랑 비교해서 어떤가요?? 
또 겨울이라 글로우는 계속 찾아 헤매고 있는데(수부지피부여서ㅠ) 겔랑으로 한번 가볼까요..?언니는 글로우 어떤 제품을 제일 좋아하세용??",2.0,10개월 전
18,Takeyoursenses,언니!! 저 지금 안나수이 크림파데팩트 잘 쓰고 있긴한데~ 갑자기 촉촉 파데 쓰고싶어서ㅎㅎㅎ 퓨처리스트 리뉴얼 된 거도 사고싶어졌는데 그것도 컬러 리뷰해주세요^^ 언니가 쓰는 파데 호수가 제 피부에도 찰떡이라 언니 리뷰가 저한텐 딱이더라구요♡♡♡,2.0,9개월 전
19,nohkme,파데 리뷰 감사합니다. 제가 겔랑 베이비글로우라는 제품 쭉썼었는데 단종되어서 페데 낭인이었는데 혹시 베이비 글로우도 써보신적있으면 그거랑 비교해서는어떤가요? 단종된제품에서 갑자기 어디로 가야 비슷한 제품인지 궁금한 사람도 많을 거 같아요… 베이비 글로우는 인기많았는데 대체 왜 단종이 된건지 ㅠㅠ 아르마니 써봤는데 그닥 정착을 못했어요,0.0,7개월 전
20,TViw3rn,겔랑 매트 진짜 깔끔하게 이쁘네요 다음에 꼭 사야겠어요,2.0,8개월 전
21,userbh1tr5bs6w,엘리님! 매트 0.5c 색상이랑 샤넬 울트라르뗑 bd01이랑 색상 비교했을 때 어떤게 더 밝나요?,23.0,10개월 전
22,yeah7066,겔랑 파데맛집 ㅠㅠㅠㅠ 엘리님 리뷰 보니까 더 사고싶어져요!,5.0,10개월 전
23,dkrkCHO,겔랑을 믿어요! 믿고쓰는 겔랑입니다.인스타보고 벌써쓰고있는데 역시는 역시입니다!엘리님 감사해요 ,2.0,10개월 전
24,zziyulluv,겔랑 로르베이스 지인짜 좋아하는데.. 새로 나온 파데 넘 써보고싶어요ㅠㅠㅠ!!!! 상품권 아껴놓은걸루 질러야겠어욥..,4.0,10개월 전
25,jyvf3oo,디올파데 진짜 조아하는데 디올이랑 비교 마니해주셔서 넘좋아요 겔랑 대학교때 쓰다가 노란끼가 많아서 갈아탔는데  노란끼 개선 무슨일 ㅜㅜ!! 저도 누런피부인데 넘 반가워요 바로 사야겠어요..,5.0,10개월 전
26,userjs4ek3ko3j,"엘리님~~다른영상보고 입생로랑 올아워파데 LC1구매 했는데용~ 화사한 느낌이
너무 뙇! 있어서~ 좀더 편하게
화장하고 싶은날~겔랑 골드랑 섞어서 쓰려고 하는데... 아님
단독으로 써도 좋구여! 그럼 어떤 색상이 괜찮을까요!?",0.0,9개월 전(수정됨)
27,viatachu1513,안녕하세요 혹시 겔랑의 메테오리트라인은 써보셨을까요? 파우더를 펄 없는 일반 파우더만 쓰시는 거 같길래 메테오리트 파우더는 별로일까요?,0.0,1개월 전
28,gracekb5xi,엘리님 자주 보지는 못하지만 그래도 파데선택할때는 꼭 엘리님 리뷰를 보고 쓰는편인데…버버리 파데도 한번 해주심 안될까요??? 부탁드려요~,1.0,9개월 전
29,youngrankim9278,언니 겔랑 매트랑 디올 매트 비교해주세요!,0.0,8개월 전
30,windnebula,파데 사려고 이것 저것 보고 있었는데 엘리님   덕분에 결정했어요,1.0,10개월 전
31,Purpleoo,"으악 쓰던 파데들 많아서 안그래도 괴로운데
ㅋㅋㅋㅋ 다음 파데는 무조건 겔랑 파데 써볼래요. 
🥹",2.0,10개월 전
32,userzv7hu5oe6r,"겔랑 란제리 00N을 쓴게 너무너무 좋았는데, 겔랑골드 매트 색상은 어떤게 가장 비슷할까요?ㅠㅠ(겔랑 리뉴얼 출시때 글로우 0.5C 구매는 해뒀는데 아직 개봉은 안했거든요~ 워낙 유분 뿜뿜한 피부라 매트를 다시 구매해야 할것 같은데,,,) 밝은 21호 피부세요? 매트0.5C와 글로우 0.5C 색상이 같을까요? 제게 핵심은 겔랑 란제리 00N색상과 똑같은 골드 매트 색상을 구매하고싶은거에요. 왠지 란제리도 써보셨을것 같아서, 조언부탁드려요^^",1.0,4개월 전(수정됨)
33,userqj4pc7cx5i,엘리님 그럼 올해 말고 전체삶을 통틀어 무슨 파데가 제일일까요? 디올비비 최근에 샀는데 약간 두꺼워보여서 하나 더 살까하구요️,0.0,10개월 전
34,miyou968,영상 엄청 기다렸어요♡♡♡,1.0,10개월 전
35,suji8648,매트.글로우 두개다 써보니 의외로 매트가 착붙! 구찌에서 겔랑으로 인생파데 바뀜ㅎ,2.0,9개월 전
36,serapy1507,퓨처리스트 리뉴얼 버전도 리뷰해주세요~,2.0,9개월 전
37,useryu3wr6xn1e,인생 쿠션도 해주세요ㅠㅠㅠ,0.0,9개월 전
38,elena0928,"겔랑 최고. 파데랑 컴팩 파우더쓰는데 정착했어요 파덴,ㅡ 커버도 잘되는데 너무나 자연스럽고 오래지속 지성에 딱",0.0,2주 전
39,userbh1tr5bs6w,색상 너무 고민이에요ㅠㅠㅠ 00c 색상이 디올 00호랑 비슷할까요ㅠㅠ 언니가 바르신 매트 0.5c 색상은 다른 파운데이션 어떤 색상과 가장 흡사한가요?,5.0,10개월 전
40,sukim5854,헐 겔랑 사볼까하고 유튜브 검색하던 찰나인데 너무 감사드려요ㅠㅠㅠ,4.0,10개월 전
41,userke7bs8lr6x,이야 ....... 내가 죽기 전에 내 피부색에 맞는 빠뤼르골드 파데를 발라볼 수 있다......? 이건 좀 귀하네....... 하 디올00만큼 밝은 건 없겠죠....,11.0,10개월 전
42,userxb9yo4yr4p,"엘리님, 컬러 조언구해요~
메이크업포에버 리부트파운데이션 218번과
겔랑 글로우 0.5C 비교하면
겔랑이 더 핑크빛인거죠?~
리부트 218은 제겐 꽤 누렁이 되더라고요ㅎ",0.0,10개월 전(수정됨)
43,usereh7ht4bj7s,엘리님 영상보고 구매한 울트라르뗑 bd01을 지금 넘 잘 쓰고 있는데요. 한겨울에는 건조해서.. 겔랑이 더 촉촉할까요? 색상 비교도 부탁드려요^^,0.0,9개월 전
44,Leehs4gb,"엘리님 요즘 피부 진짜 좋으셨었는데 오늘 영상에선 왠일로 살짝 오돌토돌하고 살짝 까매보이는데 어디 아프신건 아니죠?
그냥 좀 타신건가..?

저는 이상하게 겔랑 로르가 좋은지 잘 못 느끼겠더라구요..
그거 바르면 매트도 그렇고 촥 붙는다는데 그런 느낌이 없어요
저랑 안 맞나?

수블리마지 엄청 사고픈데 계속 품절이예요.. 이미 딴 거 사서 돈 없을때 잠깐 풀렸다가 그 뒤로 또 계속 품절 ㅠ..
사실 레베쥬 헬시글로우랑 비슷하대서 제가 레베쥬파데는 있어서 안 사려고 했는데 전 이상하게 레베쥬는 파우더를 해도 개기름처럼 번들거리더라구요 자꾸 ㅠ
수블리마지 샘플 써보면 그런거 없는거 같아서 사고싶어요

파데 이미 너무 많은데, 사고픈것도 아직 많아서 고민이었는데 겔랑은 어둡대서 쳐다보지도 않았었건만.. 이렇게 선택지 또 늘어나네요

디올 글로우 운좋게 최근 샘플 써보니 글로우인데도 믿기지 않을 정도로 매트하고 0N컬러 괜찮아서 쿠션은 샀는데 또 계속 써보니 이것도 파우더해도 광이 많이 올라와서 매트살까 했는데 매트는 마스크 끼면 뜬다길래 구매 자체가 고민이네요..
겔랑까지 고민이라 그냥 겔랑을 살까요?

그리고 나스 라이트 리플렉팅?이랑 스쿠 크림파데(혹은 리퀴드 파데)도 좋다 , 아니다 의견이 분분하던데 엘리님은 어떠셨는지 궁금해요~
저 입생 르땡이 너무 괜찮아서 밝은 컬러 최근 품절 풀렸을때 또 질렀는데 대체 이 많은 파데 언제 다 쓸라고 또 지를 생각만 하는지
이런 파데는 오래 쓰는데 ㅎㅎ",1.0,10개월 전
45,isabellaro1803,기다렸습니다… 유투브에 리뷰가 없어서 넘 힘들엇어여 ㅠㅠㅠㅠㅠㅠㅠ,1.0,9개월 전
46,YUdr2ii,"우와.....겔랑 뭔일이래요? ㅋㅋㅋㅋ
핑크베이스 만세!!!

잠깐..올해 써보신 파데 중에 제일 좋다고요? 수블리마지를 언제부터 쓰셨더라...


종종 사람들이 파데 뭐 쓰냐 물을 때 회사, 제품명 얘기하기 뭐할 때 있거든요. 물론 내가 쓰고 싶은 거 쓴다는데 누가 뭐라 하든 신경 쓰지 않는 게 좋죠. 하지만, 사회생활에 매번 그런 말과 시선에 답하기 싫을 때가 있어요. 
거기에 너무 고가 라인을 일찍 써서 나중에 소비욕구가 아쉬워질까 염려되기도 해요. 

그럴 때 적합하지 않나 싶어요. 


오늘도 발빠른 핑크베이스 소식! 엘리님, 감사합니다~복 받으셔요~♡♡",2.0,10개월 전
47,userns1mu1gg3z,"겔랑 빠뤼르 골드와
조르지오 디자이너리프터 중에
더 고급진 느낌은 어떤건가요!?
50대 건성입니다~",0.0,7개월 전
48,hueningkaiwife814,겔랑 쿠션.저 베이스 예전에 써보고 실망했었는데 저 리뉴얼 파데는 너무 사고싶어지네요~~!!!,1.0,10개월 전
49,clarek4716,엘리님 겨울 브랜드 립 특집 예정 없으실까요?? 겨울엔 립이잖아요♡♡,1.0,10개월 전
50,geunyoungpark300,매장가서 발라보고삼♡진짜조음!!!!!!!비싼거니까좋겟지머~햇는데ㅋㅋ맞음ㅋ조음ㅋㅋㅋㅋㅋㅋ영상늘잘보고있습니다~♡,0.0,9개월 전
51,rebeccamin7966,안녕하세여! 이거 저 구매하려는데 색상 여쭤보ㅏ도 될까요 ㅎㅎ 제가 검정색패키지 시절 겔랑 빠뤼르골드 00호 색상 너무 잘썼거든요. 제가 건성이여서 왠만한 세미매트들 다 당기는데 얘는 괜찮았어요. 그리구 색깔 누렁이라고 그러는데 저는 오히려 홍조 있는 웜톤이라서 아주 자연스러웠거든요~ 제형과 색상이 검정패키지시절 겔랑빠뤼르골드00호랑 뭐가 젤 비슷할까요??,0.0,9개월 전
52,jjj505,파운데이션 브러쉬 정보 부탁드려요,0.0,10개월 전
53,usersg8zo9pl6m,"저 겔랑 매트 파데 00호를 살까 고민중인데 제가 밝은 13호 쿨톤 피부거든요!! 저한테 어두울지, 다크닝은 없는지, 아니면 이거보다 밝은 파데가 있는지 너무너무 알고 싶습니다!!",0.0,7개월 전
54,useruk3dt6eg9e,이번에 겔랑 매트 샀읍니다.. 원래 더블웨어 썼고 문제 느끼지 못했는데... 엄청 끼고...엄청 더럽게 무너집니다 억장 와르르... 마스크에 아주 잘 묻어나요..흑흑 하지만 전혀 다크닝이 없습니다.,3.0,9개월 전
55,yunkchoi,샤넬 울트라르땡이랑 어떤게 더 커버력이 있나요,1.0,10개월 전
56,userxi9ut4cv6r,촉촉 05n도 뉴트럴인데 핑크톤 돌고 굿이네요.,2.0,10개월 전
57,usercd1qc3iy8y,헤라랑 겔랑중에 뭐가 더 좋앗어용??,0.0,9개월 전
58,kyhcbj9249,똑같은거 따라삽니다~~,1.0,10개월 전
59,runangierun,겔랑 빠뤼르 골드 인생파데 5년 넘게 쓰고있어요!,0.0,1개월 전
60,raphaella7391,겔랑을 사야할지 샤넬을 사야할지 아직도 결정을 못내렸어여 올어워도 괜찮은데 바꿔탈까해서…,1.0,9개월 전
61,pffffjin,언냐 빠뤼르 매트 컬러 문의 드려도 될까요?? 저 디올 0n 이 딱인고 같은데 아니면 입생 뉴트럴10호..?ㅜㅜ 구냥 언니 따라 사면 될고같긴 한데 어떨까요?? 허응 ㅠㅠ,0.0,8개월 전
62,hangeul4530,"디올 글로우 사려고 했는데.. 겔랑 살까요……? 오늘 디올 테스트도 하고 왔는데 
디올 쿠션 쓰면서 그 특유의 화장품냄새가 너무 심해서 싫긴했는데ㅠ 고민이에요….. 저 뭐사죠??!!!!",0.0,9개월 전
63,francois2727,와~~~~~일등^^^^^^^^^매트랑글 로우 섞어서 쓰면 어떨지 궁금해요,2.0,10개월 전(수정됨)
64,meaning9327,으아 퓨처리스트보다 좋을까요?,0.0,10개월 전
65,ellieveryday,https://www.youtube.com/watch?v=m0HDic9aiyY 겔랑 빠뤼르 골드 매트 겟레디윗미 + 겔랑 새로운 파데 브러쉬,0.0,8개월 전
