,youtube_id,comment,like_num,comment_date
0,usergc7fp2kb6u,언니 오랜만에 보러 왓는데 왜이렇게 예뻐졌어요!! 흠흠 부럽네요.. 전 고3이라 화장하고 꾸미는 제 모습이 너무나 먼 얘기처럼 느껴져서 가끔 언니 영상 보면서 대리만족하고 있는데 오늘 정말 레전드 내년부턴 꼼꼼히 챙겨볼게요 꼭꼭 ♡,7.0,11개월 전
1,userdu3xy9ju8j,언니 리플전 레드어쩌구 때부터 봤는데.. 요즘 미모 갱신인것 같아요 이런 자연스러운 모습이 너무 예쁘고 아름다워요…. 항상 좋은 영상 올려주셔서 감사합니다!,4.0,11개월 전
2,jinukim4317,"ㅋㅋㅋㅋㅋㅋㅋㅋㅋㅋㅋㅋ
편견을 싫어하는 속세의 미녀 진아팍
오늘도 올려줘서 코마워용~~~",22.0,11개월 전
3,ddaddunim,"우리 진아언니는 오늘도 미모 열일중 🫶 악플러들 진짜 다 손가락 뽑아버린다 ️ 악플 그만 달아라  그리고 팬밋업 ,, 언제 하더라도 좋습니다  팬밋업 정말 웬만한 일이 아니라면 꼬옥 ,,, 꼬옥 가고 싶네유  다음 영상도 너무너무 기대되네용 하객룩 추천 영상도 존버~! ",6.0,11개월 전
4,userom6un6nr6m,무슨 사람이 저렇게 예쁠 수가 있지… 언니 넘 예뻐요 팬밋업도 기대하고 있을께요 진짜 리플 때부터 보던 구독잔데 악플 다는 사람들이 나빠ㅠㅠ 우리 언니 악플 달게 뭐가 있다구ㅠㅠ 언니 영상 넘 잘봐썽용 사랑해요,0.0,11개월 전
5,usersy7jp2dh7f,"진아언니 좋은 댓글만 보고 힘내요
리플때부터 응원하는 구독자입니다️ 
더 더 잘 되길 바래요 ㅎㅎ 꼭 그럴거구요",22.0,11개월 전(수정됨)
6,usergu9fx4cu2t,진짜 매일매일 더 이뻐지시는 것 같아요,2.0,11개월 전
7,ameli8977,안녕하세요! 아멜리입니다. 정성껏 남겨주신 소중한 후기 정말 감사드립니다. :),4.0,11개월 전
8,userxv3ue2eu1s,"진아언니 매력에 빠져서 임프 구독하고 리플s도 구독하고 보고싶진아도 구독한 소심해서 댓글을 자주 달진 않았지만 아주 오랜 예ㅔㅔㅔㅔ전부터 언니를 봐왔던 구독자입니다
진아님 유튭 그만두신다 하고 다시 돌아왔을땐 소리까지 지르면서 좋아했어요!️
자세히 보면 예쁘고 오래보면 사랑스러운 진아언니︎ 단면적인 모습만 보고 생각없이 욕하는 사람 깔끔하게 무시하시고 언니 좋아하는 사람들 많으니까 언니 하고싶은거 다해요!!! 항상 응원하고 있습니다:)",1.0,11개월 전(수정됨)
9,sault9079,진아님 리플때부터..ㅊㅁㅌ님의 영상에 모델로 출연하실 때부터 아주 꾸준히 보고있습니다 ㅋㅋㅋ 그새 몇년이 지났는데 진아님 예쁜건 그대로군요..악플..다죽어..^^,1.0,11개월 전(수정됨)
10,usernj3vp4hn3f,오늘도 후광이 번쩍번쩍하시네요 공주님,11.0,11개월 전
11,userlt2em5bf4c,언니 진짜 너무너무 이뻐요 ,0.0,11개월 전
12,uservk7es5jd7r,와 진짜 옛날보다 훨씬 이쁘다,0.0,11개월 전
13,MojeongJ,어휴 퉤퉤 악플 꺼져~~~~~ 진짜 언니 영상에서 말한대로 생각만 해요 ㅎㅎㅎ 저는 언니 영상에 댓글 단지는 얼마 안되었지만 유튜브를 보기 시작한게 사실 언니 영상 보기 시작하면서 였어요 ! 그게 벌써 6년정도 된듯 하네요 ! 그만큼 오랫동안 언니를 보고있는 보고있는 사람들이 많다는 건 언니가 그만큼 멋진 사람이라는 뜻 아닐까요 ?!? 랜만에 메컵영상 넘 잘 볼게용 항상 응원해 박진아 !!🫶🫶️,2.0,11개월 전
14,mochi02,우리언니 타투가 얼마나 예쁜데 누구야 욕한사람 호온나 11:57 이거 완전 장원영아니냐며 점점 더 예뻐지면 전세계 사람들이 다 보는거 아니에요 우리언니 유명해지는거 좋은데 나만 알면 좋겠으면서 몰라 언니 최고,2.0,11개월 전
15,useryn8el7yw6k,"인스타 라방에서 댓글을 달아줬으면 좋겠다는 고런 고런 얘기를 듣구 왔기 때문에 제가 왓서요 정말 중학교 때부터 봐서 지금 고삼인데 언니와 함께 10대를 보내고 이제 10대가 끝나가요 앞으로 올 20대 30대도 잘 부탁하구 오래 오래 유튜브 해줘요 꼭 팬밋업 때 보길!! 진짜 이번엔 꼭 언니한테 마들렌 전해주겟서요,,",0.0,11개월 전
16,rb656,와 언니 오랜만에 봤는데 미모 무슨일이세요…. 진짜 예뻐요 ㅜㅠ꙼̈,0.0,11개월 전
17,userrw2ps3ny8z,허어어… 미친듯이 예뻐요,1.0,11개월 전
18,userdo8eg2db8q,진짜 최고입니다!!,0.0,11개월 전
19,userto1lq2ln2i,진짜 화장 잘하는거 같아요,2.0,11개월 전
20,userwi6yc5qn9s,12:05 아니 무슨 괴한이 친 거마냥 놀라시네요ㅋㅋㅋㅋ 이후에 웃는 게 너무 예뻐요,8.0,11개월 전(수정됨)
21,userwq8qj1gl4y,왜..난 언니 타투 너무 마음에 들고 매력있다고 생각하는데 ㅠㅠ,0.0,9개월 전
22,userst1zc4lz3j,언니 웃는거 너무 이뽀요ㅜㅜ천사,0.0,11개월 전
23,mojito249,"전 언니 타투 너무 예쁘고 언니에 어울리는 타투라고 생각했는데️
그리고 그사람은 자기가 뭐라고 그리 오지랖을 떨까요ㅡㅡ",4.0,11개월 전
24,apricity0426,언니 오늘도 넘 이뻠️️,2.0,11개월 전
25,KKooon5pi,너무 예뻐요,1.0,11개월 전
26,Leeoe5kl,개여신..,0.0,11개월 전
27,userqe6sp8ud4t,진아님 너무 예쁘십니다,1.0,11개월 전
28,userqp6nh5wu8d,우리 언니 화장 항상 볼때마다 느끼지만 본판 불변의 법칙으로 화장하는거 같은 너낌... 화장 해도 예쁘고 안해도 예쁜... 난 안하면 눈이 반이 줄어드는데...,0.0,11개월 전
29,userig6pf5fm2q,"어이쿠 누가 우리 진아 누이,,,,헌테 나쁜 말 했어!!@
진아누이 상처받지 마시고 무시해 주세요,, ㅠㅠ",0.0,11개월 전
30,usernl2vb2by1w,울언니 오늘도 미모가 미칫다....... 악플러... 걱정마 언니 미모에 눈 멀어서 앞으론 타자 못칠거야... 걱정하지말어...,0.0,11개월 전
31,useriz2fg6tp7e,ㅁㅊ 너무 예쁘자나요 당신이 언니해요예쁘면 다 언니야!!!!!!!,0.0,11개월 전
32,userfu2us8ud4k,됸나 예쁘다 곤주님..🫶,0.0,11개월 전
33,wandokong,울 엉니..사랑해요 ㅠㅠ,0.0,11개월 전
34,userts9vj4vh4j,악플러들 다 줘패버려 언니,0.0,10개월 전
35,uservvni,손예진이랑 자매라 해도 믿겠어요,1.0,11개월 전
36,useryn4lz6uh5m,"0:35 이것은 렌즈 왜곡이 원인 일수도 있습니다
보통 35mm가 가장 본인 모습과 흡사하죠
예를들자면 사용하시는 렌즈가 16~50mm다 하면 그대로 쓰지마시고 확대해서 35mm로 맞추시면 좀 더 본연의 아리따움을 담으실 수 있다 생각합니다 그럼20000 사랑해",3.0,11개월 전
37,userpx8cz1rt4z,"ㅋㅋㅋㅋㅋ셀프 어깨두드리기 뭔데요ㅋㅋㅋ짱 귀엽스,,",1.0,11개월 전
38,qlxm12,언니 박민영같아요 청순섹시프리티걸이에요 완저누ㅜㅠ,0.0,11개월 전
39,mscloudkim,아씨 예뻐요…,0.0,11개월 전
40,userdw4hg6lr1f,알흠다워요...맨날 질척대주세영,1.0,11개월 전
41,userrd2te7vx8e,언니 이 영상 헤어 스타일링 궁금해용…,0.0,11개월 전
42,userqg5qt3sx3i,"진아쓰,, 보고싶어유,,, 팬미팅하면 성인편일때도 참여하고 청소년편일때도 학생인척 참여하면 안될까유..",0.0,11개월 전
43,userzj4jt1pc6w,"나는 언니 좋아
싱처받지마 언니",0.0,11개월 전
44,userhm6er2vl7p,귀엽다.....,0.0,11개월 전
45,usernv9gu8ih7i,악플러들 진아님 건드면 알아서해라 ㅡㅡ,0.0,11개월 전
46,useryq6rr3pd4l,"남자지만 홀려서 들어왔슴다 누나,,,,,",0.0,11개월 전
47,usergo4rn4gi9p,공주.지나진나지나진아,0.0,11개월 전
48,usered1fq8ge1d,동생 예뻐요🫶,0.0,11개월 전
