,youtube_id,comment,like_num,comment_date
0,choi7897,안그래도 요새 이런 벨벳질감 틴트 찾고있었는데! 색감이랑 질감이 넘 이쁘네요 ㅜ 오드님도 짱예,4.0,11개월 전
1,harin0214,분위기 미쳤따아아ㅠㅠ 겨쿨 바로 영업당했습니다.. 사랑해요 오랑해요..️,2.0,11개월 전
2,userfm7br6sm2z,오늘 메컵 너무 예뻐요 ㅠㅠ 튜토리얼 올려주실 수 있으신가요?!️,3.0,11개월 전(수정됨)
3,usergc5zu3ej8h,오늘 영상 너무 예뻐요 그런데 혹시 어떻게 5만 원대에 구매하셨는지 알 수 있을까용??,0.0,11개월 전
4,userkd8tb1tj3p,"하.. 저 이미 립 샀는데 또 뽐뿌오자나요,,",0.0,11개월 전
5,dmajdu7853,오늘 입은 착장 궁금해요,3.0,11개월 전
6,princessnerd7266,You look like the korean actress from Save & It’s ok not to be ok. ,0.0,4개월 전
7,FPTL9903,우리 오드 님 키가 몇이에요?,4.0,11개월 전
