,youtube_id,comment,like_num,comment_date
0,Jessiehada,"출산 후 올리는 두 번째 영상입니다 제가 최대한 할 수 있는 선에서 열심히 노력  하고 있어요~ 예전처럼 패션, 뷰티 정보 가득한 컨텐츠도 조만간 들고 올게요 주제가 다양해진 제시의 인생 제 3막을 응원해주세요....",72.0,1개월 전
1,sooyeonlee6512,"패션,육아 콘텐츠 모두 재밌게 보고 있는 제리에요아기천사를 기다리면서 제리님 영상으로 예습 중요ㅎㅎㅎㅎ
지난번 영상보다 붓기가 많이 빠지신 것 같아 다행이에요!! 건강 챙기면서 육아하세요 제시팀 화이팅",7.0,1개월 전
2,milllala,"제시님 출산 너무 축하드려요!! 아이가 너무 이쁘고, 출산 이후에도 제시님 미모도 여전히 열활이시네요..",2.0,1개월 전
3,usersm1kn8gt2h,출산 정말 축하드립니다 갓태어난 아이 많이 봤지만 이렇게 태어나자마자 뚜렷한 이목구비 가지고 태어난 아이는 처음봤어요 역시 제시하다님 우월한 미모를 고대로 물려받은듯 하네요 ㅎㅎ,4.0,1개월 전
4,jinnyjenny4064,어 맛!! 세상에 이미 인스타로 귀여운 사진으로 눈이 호강 중인데 저는 아이는 없지만 육아 템에 진심으로 관심이 많아서 다음 영상도 너무 기다려져요 ^^ 제시님은 어째서 점점 더 아름다워지시는지 얼굴에 행복함이 보여서 영상에 정이 가요~ 폭염 조심하시고 영상 올려주셔서 정말 감사드려요,1.0,1개월 전
5,userpg8gc7je8k,언니 출산 축하해요 앞으로도 행복하고 언니답게 살아가길 응원해요,7.0,1개월 전
6,DEEPLYUU,언니 진심 너무 축하드려요 아기도 귀엽고 언니영상 앞으로 더더욱 기다려질듯해요,2.0,1개월 전
7,Aliciayoun,제시님 얼굴 많이 좋아보여요 영상으로 다시 만나니 반갑네용  육아관련 모든것은 애바애 라서 정답은 없는것 같아요. 국민템이라해도 우리아기한텐 안맞을수도 있고 ㅎ 힘들긴 해도 아기 보고있음 힐링되고 행복한건 분명한거같아요 그쵸 ㅎㅎ 강우도 똘망똘망 넘 이쁘구 ️ 앞으로 육아관련 영상도 마니 기대할께용 ,6.0,1개월 전
8,choigrace4076,아기키우면서 영상찍고 편집하는데 고생많았을거같아요.. 앞으로 더 다양해지는 영상들 기대할게요~ 스트레스 없이 지치지 마시길요^^,2.0,1개월 전
9,usergy4lx8ll2c,아이 순산하시느라 고생하셨어요~!~! 아기가 너무 귀여워요 행복하고 건강하게 크길,1.0,1개월 전
10,userjc9cu4gl5t,출산 축하합니다  아기 낳은 엄마같지 않고 미모가 빛나네요  저는 4살 9살 자매 키우는데 옛날 생각이 나네요. 아기가 엄마 많이 닮은 듯해요. 육아 파이팅하세요~,3.0,1개월 전
11,inestyle322,"출산 후에도 여전히 이쁘세요 제시님~
아기 넘 이뻐요  
똘망똘망 하네요 ",2.0,1개월 전
12,heesoo109,진짜 너무 고생하셨어요! 아기가 너무 사랑스러워요 결혼을 한 저도 아마도 조만간 임신 출산 육아를 해야하는데… 이렇게 제시님께서 올려주셔서 덜 걱정되네요! 저장 했어요 ㅋㅋㅋ축하드리고 힘내세요,1.0,1개월 전(수정됨)
13,usercy4gl1xh2r,신혼인 제리라 아기는 아직 없지만 이런 영상도 너무 재미나요  마치 어릴 때 결혼 전 내 미래의 남편은 누굴까 하는 설렘같이 겪어보지 못한 것에 대한 호기심과 미리 공부하는 기분이랄까요! ㅎㅎㅎ 앞으로도 기대할게용 ,3.0,1개월 전
14,dainlee4711,"패션유툽으로 알게되서 육아 꿀팁까지 얻어가고…정말 큰 도움이 되고 있어요 저도 11월 예비맘인데 언니 보면서 힘 얻어갑니당️ 
제눈엔 엄마 제시가 더 예뻐보이네용 ㅎㅎ 화이링🫶",1.0,1개월 전(수정됨)
15,favorsthebrave1013,"애기 너무 이쁘다.
유전자가 좋으니 애기 많이 낳으셔용~~!",2.0,1개월 전
16,kcarolina2540,출산하시고 더 예뻐지셨어요 아이도 넘 이쁘고~출산 축하드려요~,1.0,1개월 전
17,usergv7jn1gt5t,강우 넘 귀엽꼬 제시언니 미모 미쳣고 ... 아기체육관 백일때쯤되면 부실기세로 씬나게 놀아욤ㅋㅋ진짜 당근으로 사고 뽕뽑은 아이템 중 하나....기저귀 갈이대도 주변에서 뭐그런걸 사냐 했지만 없으면 진짜 후회했을 아이템 ㅜㅜ 내 허리지켱...,2.0,1개월 전
18,minji4037,"인스타로만 만나본 찰떡이
영상으로 보니 너무 귀엽사랑스럽
제시님 출산후 빨리 영상으로 만날수있어서 좋네요!",3.0,1개월 전
19,userhx1qp8ie8w,아기 너무 이쁘네요.. 축하드려요. 저도 몇달 뒤 둘째 낳아야 하는데 육아템 다 까먹어서 이 영상 도움 좀 받으려구요.ㅎㅎ,4.0,1개월 전
20,userhb2yn5th6j,육아 관련 내용두 넘 좋아요! 화이팅,3.0,1개월 전
21,userdb4th4qt1m,애기 진짜 이뻐용...!! 자주 올려주세용^^,4.0,1개월 전
22,soyeonpark2809,임신 16주차 산모로서 육아템 육아브이로그 대환영이요,2.0,1개월 전
23,genielove4900,미피수유등은 눈에띄면 꼭 사놓으세요...10살넘은아이방에 놔둬두 이쁘고 유치하지않고 좋더라구요^^,3.0,1개월 전
24,userye9qj9qy7h,"안그래도 기다리고 있었어요
꺄 강우 넘 귀요오요오
육아팅하세요!!",2.0,1개월 전
25,userwx2ij1jp2v,"우아 영상으로 찰떡이를 보다니!! 너무 귀여워요 먼저 제시님 건강이 우선이니 몸조리 꼭꼭 잘 하셔요 6개월까지는 조심해야 한대요 

그리고 점퍼루는 태워 볼 수 있다면 태워보고 구매하셔도 될 거예요 금액대가 저렴한 편은 아니라ㅎㅎㅎ 
저희 아가 7갤인데 다리 힘 장난 아니고 뛰는거 좋아해서 니모 점퍼루 사줬더니 안 타서 방구석에 고이모셔...뒀어요 흡... 심지어 매우매우 커서 자리 차지도 많이 해요 !!",2.0,1개월 전
26,userlh1fw5zb7g,출산 축하드려요 고생 많으셨어요 ^^ 근데 앞으로 더 고생많으실텐데 그래도 아기예뻐서 힘든줄 모르겠더라고요 그러니 엄마 자신의 건강을 더 살피시고 건강하시길 ^^ 아기도 건강하고 이쁘게 키우시길 ^^,4.0,1개월 전
27,uservc6qp8rf6h,얘기눈이 진짜 크네요. 엄마닮았나? 얘기너무너무귀엽네요. 건강하게출산하셔서 좋네요. 산후우울증 조심하시고 이쁜아가 잘 키우세요. 응원해요,2.0,1개월 전
28,honestlybtwforreal,아아악ㄱ 강우 넘 커여워요… 내 조카였으면 진짜 너ㅓㅓㅓㅓ무 좋겠다 언니 넘 고생하셨어요 ㅠㅠ 그래두 붓기도 전 영상보다 빠지고 회복 잘 하고 계신 것 같아서 다행이네요 앞으로도 찰떡이랑 쭈욱 건강하시길 바랄게요🩷,3.0,1개월 전
29,userqi4lf4df4d,"제시님 어떻게 출산하고 미모가 더 빛나시네요^^
육아템 너무재미있게 잘봤습니당^^~
강우 성장일기 기대되네요ㅎㅎ50일을 향하여~",1.0,1개월 전(수정됨)
30,drewlee7435,출산 전후 몸이랑 피부 관리 현실적 팁이나 시술 알려주시면 도움될 것 같아요 🩵,4.0,1개월 전(수정됨)
31,userdb5yp3nj3i,아기영상도 너무 조아요 같은 육아동지로써ㅋㅋㅋㅋㅋ엄마제시모습도 궁금하구여,1.0,1개월 전
32,userjt7rc8zd5i,애기 너무 이뻐요 ㅎㅎ,2.0,1개월 전
33,useroj6vy3sh5u,바운서는 베이비뵨이 최고ㅋㅋㅋ 그거랑 트립트랩 뉴본세트에 눕혀서 수유하면 양손이 자유롭죠ㅋㅋㅋ 제일 잘 산 아이템 top5에요ㅋㅋㅋ,2.0,1개월 전
34,h11250,진정인형이네요 제시님이 출산 육아템 올리시는게 낯설지만 ㅎㅎ 아 참고로 아기도 태어나서 백일 전엔 급성장하면서 얼굴이 좀 바뀌는데 쌍커풀은 주위에 봐도 백프로 돌아오더라구요 기다리시면 신생아때 백만불짜리 눈이 돌아올거에요 지금도 미남이지만유전자 어디안가,1.0,1개월 전(수정됨)
35,tigershu22,아ㅏㅏㅏ 너무 귀여우ㅏ요ㅜㅜㅜㅜㅜ 꼬물꼬물 제시님 넘 고생하셨어요 최근영상 올려줘서 감사해요,3.0,1개월 전
36,userzp3mn5rw5n,건강한 언니 보니 안심이 되네여ㅋㅋㅋㅋ 거기다 이쁜 찰떡이 실물까지!!!,2.0,1개월 전
37,yourgenius007,너무 귀엽고 사랑스러워요,3.0,1개월 전
38,usermp5vw3tc5f,남편분 뵌 적은 없지만 찰떡이 엄마 많이 닮은 걸요?ㅋㅋ 재시님 영상 늘 잘 보고 있었는데...찰떡이 보곤 댓을 안남길 수가 없네요 패션 뷰티 영상도 좋지만 재시님 라이프스타일 자체를 좋아하는 구독자도 많아요 앞으로 다양한 영상(찰떡이 슈돌 재질) 부탁드려요,2.0,1개월 전
39,hohoho7078,어머 넘 귀여워 ㅠㅠㅠㅠㅠ 세련으로 자랄 아기 ㅠㅠ,3.0,1개월 전
40,jhsy4ob,다담달에 출산예정인 동갑이라 그런지 강우 너무 이뻐요 다음에는 다이어트 영상도 올려주세욯ㅎ,1.0,1개월 전
41,userof2tn8zh7w,제시님 애기낳고 원래 회복하는데 이년 정도 걸리던데 제시님 너ㅓㅓㅓㅓㅓ무 아직도 이쁘고 ㅎㅎ 밝고 맑고 ㅎㅎㅎ 힘드실텐데 어쩌면 이렇게 이쁘게 또 찍우셧는지 ㅎㅎ 힘내시고 남편분 복받으셧어요 ㅎㅎ 너무 이쁘고 제주변 엄마들중에 젤이뿜 ㅎ,0.0,1개월 전
42,userlq8up6uh9g,얼굴이든 몸이든 다 돌아오신듯...부러워용,0.0,1개월 전
43,userfg5xp7sn6n,"️완전아기인데+참 똑똑하게 잘생겼네요엄마아빠의 멋짐에
(뇌+예술적) 영향이 큰가봐요
찰떡이 개구장이라도좋다+건강하게만 자라다오",3.0,1개월 전(수정됨)
44,withjung3197,애기 진짜 너무 예쁘고 귀여워요 ㅠㅠ 제시님 입고계신 원피스 정보좀 알려주세요,3.0,1개월 전
45,userbi4vr5if6n,"와~~~~~~아들 잘생겼어요^^*   신세대처럼생겼어요,추카~추카~너무이뽀여~~~",2.0,1개월 전
46,userkx5wd5fd5m,제시님 아이 낳고 더 이뻐졌어요~~,1.0,1개월 전
47,userqe6sp8ud4t,제시님 아기가 너무 귀여워요,3.0,1개월 전
48,asdfwag123,세상에..강우 너ㅓㅓㅓㅓㅓ무 귀여워요 ㅠㅠ!  다시 한번 축하드립니다~~,1.0,1개월 전
49,userou7vv1py5n,ㅣ번이네요~~ 출산 축하드립니다 ^^ 너무 귀엽네요 이목구비가 뚜렷 ~~,3.0,1개월 전
50,hyunkyooh6434,썸네일 너무 귀여워요 ㅎㅎㅎ,1.0,1개월 전
51,michellefo2lk,영상 항상잘보고있어요 애기넘이뻐요 꼬물이시절 넘힘들지만 넘작고이뿌고 소중하고 귀욥공 막 ㅋㅋ 다음 영상도기대할게용,0.0,1개월 전
52,usercm5fs2kd6l,완전꿀정보 ㅎㅎㅎ,2.0,1개월 전
53,doha7015,너므 귀엽다아  제시는 여전히 이쁘다아,3.0,1개월 전
54,SONto4ip,제시하다Jessihada님 갓난아기가 너무 귀엽네요.,4.0,1개월 전
55,gangmi,결혼도 안한 나... 왜이렇게 열심히 보게 되는걸까요 강우가 너무 귀여워서 그런가봐용,4.0,1개월 전(수정됨)
56,userlq8up6uh9g,아 진짜 너무 필요한 영상,0.0,1개월 전
57,useriw7vf2ul6l,아기.이뻐요.아기.자주보고싶으니.영상.업 많이 해주세요,0.0,1개월 전
58,userfr6nw7vp8q,강우가 왜캐 이뽀요.,3.0,1개월 전
59,uservu2qp8nh2h,바운서 앉힐때 묵직한 천? 수건을 얹어주면 좀 낫던데..저희 애도 바운서 싫어하는줄알고 안했다가 아기담요 덮어서 올리니 잘있었어요..바운서에 덩그라니 올라가면 손발이 마구 떠있어서 불안한지도 모르겠어요,2.0,1개월 전
60,userjc6zv5ze9u,애낳고도 이렇게 이쁠일입니까,1.0,1개월 전
61,sopsonji,에구 아기가 너무이뽀요! 저도 11월에 출산하는 제리입니당!! 육아템 소개 넘넘 좋아용!!! 저도 산후 도우미님의 도움을 빌리려고 하는데! 산후도우미님ㄱ허 아기두고 외출이 가능할까요?...ㅠㅠ요즘 세상이 워낙 흉흉하다보니 걱정이돼서용,1.0,1개월 전
62,yurihada,오머머 너무 이쁘네 제시님은 얼마전에 애 낳은 사람 맞아요?? 예뻐요️,3.0,1개월 전
63,userxk4kc9xd5v,감기조심하세요,3.0,1개월 전
64,userre8ud7dk8h,저도 출산하고 이모님 쓰고 있는데 안불편하실까요?!! 계속 쓰시는건지도 궁금해요!!,1.0,1개월 전
65,moontour3609,모유를  못먹이면  모뮤를  먹이는 것처럼 꼭 안고  얼굴피부를 엄마피부에 접촉시키고 피부 접촉하고 손도 잡아주고  먹여야 합나다.,1.0,1개월 전
66,userbi4vr5if6n,찰떡이^^*너무너무 잘생겼어요.,1.0,1개월 전
67,userpm9br4fz5n,"아이코 신생아 냄새 폴폴나요~~ 애기가 너무이뻐요ㅎㅎ 손톱은요... 저는 아기 9개월인데 못하고잇어요 이유식 직접 하거등요ㅠㅠㅋㅋ 포기했답니다...ㅎㅎㅎ  근데 손톱이 문제가아니라 물을 너무 많이 만지니 손이 새카매졌네용 ㅠㅠㅋㅋㅋ 몸조리 잘하시구, 손목보호대 안하셧는데 손목보호대 꼭하세요!! 가장 많이.망가지는곳이랍니다ㅠㅠ",1.0,1개월 전
68,minkyokim4258,신생아 엄마 맞네요  항상 초롱초롱한 눈빛이셨는데 살짝 졸린눈빛이 ,1.0,1개월 전
69,12syzab,애기가 눈이 짱 크네요,1.0,1개월 전
70,uservn6on4ee9u,안녕하세요!  너무 잘봤어요 ~뜬없지만 입고있는옷 정보좀 주세요,1.0,1개월 전
71,userbi4vr5if6n,언마닮아서 똑똑하겠네요^^*,3.0,1개월 전
72,uservu1cj6um2t,제시님 브라운체온계 왜 저모델로 하신건가욧? 혹시 제일 정확한가요?,1.0,1개월 전(수정됨)
73,userlq8up6uh9g,상떼...공규....바빠서 안되겠죠오오오...? ,0.0,1개월 전
