,youtube_id,comment,like_num,comment_date
0,lpdfashion,"뮤드 색조템 공구 (지금부터 단 5일!!!)


글리터 조합


 뮤드 글리터 1종 + 립 틴트 1종
정가: 31,000원  20,500원 (34% 할인!!!)
 뮤드 글리터 1종 + 라이너 1종
정가: 27,000원  18,000원 (33% 할인!!!)
 뮤드 글리터 1종 + 마스카라 1종
정가: 33,900원  22,500원 (32% 할인!!!)

아이라이너 조합

 뮤드 아이라이너 1종 + 마스카라 1종
정가: 32,000원  19,900원 (38% 할인)

 뮤드 아이라이너 1종 + 립 틴트 1종
정가 30,000원  19,900원 (34% 할인)


모두 온라인 단독 최저가입니다
오후 12시 이전 구매시 1~2일 안에 출고!
정말 공구 안 하는 브랜드고 이미 유명해서
인기 컬러, 조합은 바로 품절 예상이니 서둘러주세요!

 기간: 12월 19일(월) 오전 11시 ~ 12월 23일(일) 오후 23:59까지 단 5일
 배송비: 2,500원 (3만원 이상 구매시 무료)
 구매 링크: 

[글리터 조합] https://ltheland.co/3V92tri
[라이너 조합] https://ltheland.co/3Wq515F
ㄴ프로필 링크 클릭하세요!!


자세한 리뷰는 또 숏츠로 쪄올 예정이구
인스타 스토리에 계속 추가적으로 올라올 예정입니다:)
인스타에서 무물도 진행할 거니까
궁금한 거 있으신 분들은 팔로팔로미!!

 https://www.instagram.com/lyj.lpd/

내돈내산 하는 찐 추천 브랜드고
정말 고급지고 전체 상품 다 좋아요!!
이미 인스타에서는 너무 유명하고..
뷰티 업계 사람들은 모두 다 아는 브랜드입니다:)
공구, 세일 정말 안 하는 브랜드이니!! 꼭 이번 기회에 저렴하게 구매하세요!!",4.0,9개월 전
1,userus3go4pq2k,해석남녀때부터 보다가 엘피디 채널을만든 그 순간도 같이 했는데 저는 언니가 이 채널만들었을 때 너무 반가웠어요! 이런 비하인드들이 있었는지는 몰랐었지만 언니의 이런 도전들이 너무 좋아요 저는 언니와 다르게 도전보다는 안정된 상태를 더 좋아하는데 언니의 영상을 보면서 저도 조금씩 무언가를 도전해보려고 해요!! 앞으로도 언니가 무엇을하든 계속 응원할거니까 언니도 무너지지 마요 알았죠? 혹여나 힘든 순간이 오더라도 인스타든 커뮤니티든 그냥 쉬어간다는 말만 남겨줘요 얌전히 기다릴 수 있으니까요 우리 오래오래 봐야해요 언니 우리 꼭 행복 해요,14.0,9개월 전
2,sinsn105,전 언니 비빌 때부터 보다가 팬이 돼서 개인 채널도 구독하기 시작 했었는데 이런 이야기들이 있는지 정말 전혀 몰랐어요 놀랍기도 하면서 대단하기도 하구… 그 때도 지금도 어떤 모습이든 항상 응원해요 언니가 변화하는 모습을 지켜보면 저도 어느샌가 용기를 가지고 변화하게 되는 것 같고 용기를 얻어요 ㅎㅎ 언니 마인드는 정말 최고..  그리고 언니 겟레디윗미 컨텐츠 진짜 너무너무너무 기다렸어요 자주 해줬으면,14.0,9개월 전(수정됨)
3,jingenie,"저는 언니의 그런 도전적이고 스스로 에게 최선을 다하는 모습이 멋지다고 생각해요 
늘 영상으로 어떻게 자신을 사랑하는지 배우고 
그걸 통해서 저는 100%까지는 아니지만 어느 정도 오늘의 나, 그리고 내일 더 멋있을 나를 기대할 수 있게 되었거든요
이제까지처럼 언제나 언니의 발걸음을 응원할게요! 감사합니당! ",7.0,9개월 전
4,usernf6mk4ct5h,언니가 영상에서 하는 이야기들이 제가 지향하는 삶의 모습과 비슷한 것 같아요! 스스로를 사랑하고 천천히 성장하며 내가 하고 싶은 것을 하는 것! 그래서 항상 언니 영상에서 긍정적인 에너지를 많이 받고 갑니다,23.0,9개월 전
5,chaerny,"피디님 해석남녀 때부터 너무 잘 보고 있었는데 이렇게 겟레디윗미로 생각 전해주실 때마다 꼭꼭 챙겨본답니다 ㅎㅎㅎ 항상 재밌는 주제를 가지고 찍어주셔서 전 겟레디가 최애예요

운동하면서 현실의 힘들고 걱정되는 일들을 싹 잊고 몰두할 수 있다는 게 정말 큰 장점인 거 같아요

핏블리 대표님이랑 완벽한 사육때도 넘 재밌게 봤었는데!! 그게 터닝 포인트가 되셔서 운동에 빠지셨다니 저도 운동을 좋아하는 사람으로서 동질감 느껴지고 넘 좋아요

앞으로 다이어트 꾸준히 해나가실 엘피디님 모습도 기대됩니다🫶
내가 지금 못생겼든 뚱뚱하든!! 남 눈치 보지 말고 하고 싶은 거 하고 지금의 나를 아껴주자는 메시지가 넘 좋아서 약간 울컥... 🥹

내가 이런 옷 입긴 좀 그런가? 싶을 때마다 항상 피디님의 메시지를 마음에 새기면서 입고 싶은 거 당당하게 입으면서 살아갈래요

영상으로 이런 이야기 해주셔서 감사해요 앞으로도 조용히 지켜보면서 응원할게요! 피디님이 최고예요!! 화이팅",5.0,9개월 전
6,useryd3vk9vt1r,엘피디님의 긍정적인 마인드 때문에 더 빛나보여요! 오늘 코디 완전 골져스.. 엘피디님 언제나 늘 응원할게요! ,2.0,9개월 전
7,somsom4537,언니는 언제나 아름다웠습니다 올해도 고생 많으셨습니다,1.0,9개월 전
8,userjr4kd5nq1c,"영상에 댓글은 처음 남기는것 같아요..! 사실 저는 이전까지 패션 유튜브는 정말 전혀 관심이 없었고.. 살이 쪄서 늘 허벅지 가리는 펑퍼짐한 옷, 편한옷 그래서 맨날 남녀공용 니트 맨투맨 후드티만 입고다녔던 사람인데.. 우연한 계기로 이 채널을 알게되고나서! 처음으로 크롭기장의 옷들도 사게되고 치마도 입게되고.. 사실 아직 과감한 스타일링까지는 남들의 시선이 신경쓰여서 다 입지는 못하지만요.. 어떻게 입어야 더 자신감있게 다닐 수 있는지 알게되면서 점점 남의 시선보다 내가 입고싶은옷 예쁜옷 찾아가게 되는 것 같아요! 예쁜옷은 맞는게 하나두 없네 이런건 마른 사람들만 입는거지~ 하며 세상과 같은 편견속에 살던 제가 많이 바뀌는 중이랍니다 다 엘피디님 채널 덕분이라고 생각해요 앞으로도 많은 영상 기대하고 기다리겠습니다! 힘내주셨으면 좋겠고 그 과정이 즐거우시면 좋겠어요 날이 점점 추워지는데 따듯한 연말 보내세요~",112.0,9개월 전
9,ho4849,"비디오빌리지때 부터 계속 봐왔던 사람이에요!
항상 비빌 영상 보면 엘피디님 패션이 남달랐었고 모든 사람들, 저도 패션에 대해서 궁금했었는데 

엘피디님의 첫 패션영상, 쇼핑몰 런칭까지 많이 힘든 시간이였을텐데 함께 있어 정말 행복해요 앞으로도 화이팅입니다!!",3.0,9개월 전
10,userli5uf8kf4y,해석남녀때 너무 재밌게 보고 옷 채널 만드신거 알고 그때부터 개인 채널을 틈틈이 봤는데 운동이 꼭 살을 빼는 목적이 아니더라도 건강을 위해서 꼭 필요하다고 생각해요 !! 정신건강은 건강한 신체에서 나오기 때문에 엘피디님을 위해서라도 운동은 선택이 아니라 필수이구요! 살이 빠지더라도 빅사이즈 쇼핑몰을 운영했으니 다른 모델분이랑 엘피디님이랑 다른 핏 보여주면서 다양한 느낌 보여주셔도 좋을것 같구요 어쨌거나 엘피디님의 선택이 더 좋은 방향으로 흘러가실 수 있도록 항상 응원합니다!!,2.0,9개월 전(수정됨)
11,melodyk4960,"살이 찌든, 빠지든 엘피디님이라는 사실에는 변함이 없습니다 지금 하는 도전들이 또 어떠한 좋은걸과들을 불러올지도 모르는 일이지요 저는 실패투성이라 아예 도전자체를 잘 안하려고하는 겁쟁이인데 엘피디님은 직접 실천하는 그 행동력과 항상 자신을 위해 나아가려고 애쓰고 사랑하는 모습이 너무 멋집니다 항상 응원합니다",0.0,9개월 전
12,deepgreentea,멋진 사람 ㅠㅠㅠ 늘 응원할게요!!!️️️,21.0,9개월 전
13,useryi9sy2ts3p,나름 오랫동안 봐왔던거같은데 이런 겟레디윗미 되게 좋은거같아요 .. 그리고 저는 오히려 지금이 더 좋은거같아요 쇼핑몰 운영하는 방향이!! 지금까진 저랑 묘하게 다른 옷스타일이라 고민만 하다가 이번에 엘더랜드에서 옷을 사봤는데 생각보다 너무너무 마음에 들고 잘어울려서 너무 만족했어요 새로운 옷스타일을 도전해봤고 내생각뵤다 더 마음에 들어서.... 앞으로도 예쁜 옷 많이 가져와주세요!! 영상도 늘 챙겨보고 있어요,0.0,9개월 전
14,UnnMett,언니 넘 이뻐요 ㅜㅠㅜㅠㅜㅜㅠㅠ 제가 주위에 항상 진짜 마른 친구들 밖에 없어서 괜히 피해다니고 잼민이 패션으로만 다녔는데 언니 영상 접하면서 요즘 자신이 엄청 생겼어요!! 크롭룩도 과감하게 도전하고 미니스커트도 요즘 도전 중입니다!! 너무 감사드려요!!!,0.0,9개월 전
15,userdo9uo6zt4h,다이어트라는게 무조건 살을 빼기 위한것보단 나의 부정적인것들을 빼기 위한것도 있다는걸 엘피디님 영상을 통해 저와 많은 사람들이 알 수 있는 영상이였던 것 같아요 저도 이렇게 긍정적인것들을 더해가야 하는데도 자꾸만 스스로를 자책하고 못난 나 자신을 가로막힌 길로 몰아세우는 나날이 너무 많아 요즘 너무 힘든 시기를 보내고 있었는데 왜 이렇게까지 됐을까 생각을 해보니 운동을 안한지 몇달이 지났더라고요 현생이 바쁘다는 핑계로 저 자신을 방치해둔 것 같아 내일까지는 맘편하게 푹 쉬고 담주부터 다시 루틴을 짜보려고 해요 이런 속깊은 영상덕에 제 자신을 돌아볼 수 있었네요 감사합니다ㅜㅜ,8.0,9개월 전
16,usercx9qn7jc2r,"우왓 기다리던 겟레디윗미!! 엘피디님 지금까지 걸어온 길 너무너무 고생하셨구,, 앞으로 더 행복한 길만 걸으시길 바래요 !!!!!ㅎㅎ",4.0,9개월 전
17,jsd9352,엘피디님! 언니가 그런고민이 있는 줄 몰랐어요!!ㅠ근데 엘피디님이 어떤 컨텐츠에 영상을 올리던지 간에 그에 맞는 시청자랑 구독자가 또 생기고 팬들도 생길거라고 생각해용! 언니의 삶에서 자신만의 소신과 마인드가 있는게 너무 멋있어요! 그리고 오늘 머리 너무 연말느낌가득 예쁘고 여왕같은 머리예요 >< 오늘도 영상 잘보고갑니다~~ㅎㅎ,0.0,9개월 전
18,userft5nh8lk6f,쇼핑몰 영상이 메인처럼 되긴했지만 언니의 긍정적인 분위기 때문에 영상 자주 봐요 운동 시작하시고 나서 살이랑 상관없이 건강해지는게 보여서 더 보기 좋았어요 나도 운동해야겠다고 다짐하기도 하구요! 시간이 지나면 자연스레 변하는게 사람이니까요 캐릭터성 잃을 수도 있지만 또 다른 캐릭터를 얻을 수도 있다고 생각해요 항상 응원합니다,14.0,9개월 전
19,sophiarn,언니가 다이어트라는 이름이 등장하는 영상마다 조금씩 언니의 생각을 전해주셔서 이번 영상은 다듬어진 모든 마음이라는 느낌이에요! 그동안 많은 생각들에 깎인 마음들이 단단해져 다가오는 느낌이랄까요…ㅎㅎ 통통패션으로 처음 알게되었지만 언니의 그당시의 몸매와 패션만을 보고싶은 것이 아니라 그냥 언니의 모든것을 보고싶어하는 구독자로서 어떠한 도전도 항상 응원하고 있어요! 수많은 사람들이 보는만큼 부정적인 시각과 댓글도 많겠지만 언니가 하고자하는 모든 것들을 love your self하길 바라요!물론 저도 그렇구요ㅎㅎ 암튼 뭘하든 울언니가 체고!!!,3.0,9개월 전
20,userze2sm5rc8t,"댓글 잘 안쓰는데 씁니다,, 비빌 출연하실땨부터ㅜ 봤는데 이렇게 커져서 너무 기쁘고,,, ,,, 많은 용기가 필요할텐데 언니가 이렇게 용기내서 영상 찍어주시구 너무너무너무 좋아요 늘 함께,,,,",1.0,9개월 전
21,userms5dp7xc4i,이야기 너무 잘 들었어요 ㅎㅎ 감사해요!! 늘 응원하겠습니다!! 그리고 덕분에 저도 자신감 얻어서 가요!!!!,1.0,9개월 전
22,cs1993,항상 응원합니다! 오늘 영상 보면서 다시 저도 화이팅해야겠다는 마음이 드네요! 자신감 항상 멋져요!,0.0,9개월 전
23,usercd6oc4lv7p,이번 영상은 뭔가 아는언니 선배님한테서 이야기듣는느낌ㅎㅎ 궁금했던것도 알게되고 공감가는것도 많았어요 언제나 응원합니다!,0.0,9개월 전
24,userkd2dk2qp9f,단단하고 멋있는 분이신거 같아요~ 코디 항상 잘보고있습니다 ,0.0,9개월 전
25,usertl8nj8ub7j,"비빌… 진짜 추억이다 ㅎㅎ
걸스빌리지도 구독하고 귀 뚫는 영상 모 이런거 엄청 기억나는데 그때 언니가 댓글단거 보고 구독했는데 요새 언니가 룩북하시는지 몰랐어요 ㅎㅎ 저도 언니 스펙의 통통녀인데 너무 도움되고 짱이다 증말…",0.0,9개월 전
26,useros1oi6rj9y,그간 고민이 많으셨을 것 같은데 응원합니다 엘피디 님. 삶을 변화시키고 성장시킨다는 것이 정말 공감이 되네요.. 저도 요즘 드는 생각이었거든요.. 늘 긍정적인 기운을 주셔서 감사했는데 그저 영상을 보기만 하다가 댓글을 달아봅니다. 구독자 분들도 다 같은 마음일 거예요. 모두 다 같이 파이팅이에요..!!,2.0,9개월 전
27,userfu8kz3ch6r,"전 엘피디님 이런 변화 아주 긍정적인 변화 같아요!
요즘 트렌드도 그렇구  본인스스로 정신적 신체적 으로 균형잡힌 건강이 중요하다 생각되는데 그거에도 잘맞고, 무엇보다 엘피디님을 보는사람도 긍정적인 변화하는데 도움이 되는거 같아요~
안보는사람이생겨도 새롭게 유입되는사람도 있을거라 생각해요~! 응원합니다♡",0.0,9개월 전
28,siri80,"패션유튭 채널 보는거 유일해요~^^♡  멋져요 항상 당당모드! 코디도 너무 잘하시구!
오늘 룩 너무 아름다워요!!
늘 응원합니다",4.0,9개월 전(수정됨)
29,seulkim9135,언니멋있어요 응원할게요!!!,0.0,9개월 전
30,jhpkt539,여전히 응원해요 살이 빠져도 엘피디님은 계속 엘피디님이시잖아요~ 다이어트 성공하고 유지하는 것까지 끝까지 보여주세요~~~ 살빼면 더더더이쁜코디로 날라다니실듯ㅋㅋㅋ,0.0,8개월 전
31,ACCESSDOOR,"걸스빌리지 !! 오랜만이네요 ㅎㅎ 걸스빌리지로 엘피디님을 처음 알게되어, 지금까지 보고있는 구독자로써 늘 응원하고 있어용 !! 요즘 날이 많이 추운데 감기 조심하세용",1.0,9개월 전
32,mire153535,너무 예쁘고 대 서사시 잘 들었어요. ....언니야 넘 멋지고 나도 하고싶은거 다 하고살아야지...><,0.0,9개월 전
33,leesong7261,엘피디님은 정말 대단하고 멋진 사람이에요 엘피디님의 변화를 응원합니다! 오래 보며 저도 함께 변화하고 싶어요. 같이 하고싶은거 다 해요 우리,1.0,9개월 전
34,JRln4gs,"잘하고 있어요 엘피디님♡♡♡늘 응원해요..
일도 운동도 둘다 놓지 말고 해요..
일에 힘듬을 운동으로 해소 할 수 있다는것..
너무나 좋은거 같아요..
운동을 해서 살이 안 빠진다해도..
몸은 건강해지는거니까..
날이 찹니다..건강관리 잘해요~~",0.0,9개월 전
35,uservx9rl6vb1m,"구독은 채널초기에 햇는데 댓글은 2-3번 남겼나하는 구독자입니다. 제 건강도 이유였지만 살빠지시는 엘피디님 보면서 저도 자극받아서 건강하게 살을 빼고 인생처음으로 요요가 아직안오고 유지라는걸 해보고 있습니다. 살이찌니 옷도 사기 싫고 검은옷만입고 그렇게 살앗는데 엘피님을 통해 자신감과 나를 사랑하는법을 배우면서 남에게 이뻐보이기위한 다이어트가 아닌 나를 위한 다이어트를 시작햇고,지금도 누군가가 보기엔 여전히 통통족이지만 저는 만족하며 입고 싶은옷 예쁘게입고 살고있습니다️ 내년에도 좋은 콘텐츠로 만나요 엘피디님",1.0,9개월 전
36,eey9570,와 스타일링 역대급 ㅜㅜㅜㅜ넘 이뻐요 공주공주한 스타일도 넘 이쁨요 저의 패션 터닝포인트(?)가 엘피디님 영상이에요!!! 전에 비하면 정말 다양하고 도전적이게 입게 되었어요! 항상 응원해요!,0.0,9개월 전(수정됨)
37,lpdfashion,"크리에이터를 한지는 이제 2~3년 정도 되었지만
그 전엔 저는 5년차 유튜브 예능 피디였답니다!
아는 사람들은 다 아는 한 때 유명했던 프로그램을 많이 만들었고
회사 사정으로 인해 (거의 경제적인 이유) 프로그램이 폐지,
공들여 키운 채널이 문 닫는 과정도 여러번 보게 되면서
돈이 되지 않는 콘텐츠가 얼마나 힘든지를 깨닫게 되었어요.

또 다시 경제적인 이유로 독립을 하게 되면서
어쩔 수 없이 피디인 동시에 사장님이 되었고,
나름의 경제적 자유를 얻었지만 상업성과 콘텐츠 사이에서
제가 부족한 탓으로 매일 갈등하고 어려운 선택을 해나가던 와중
핏블리쌤과 덩어리들이라는 힐링 터닝 포인트를 만나게 되었어요.

운동을 하면서 너무 멀고 어려운 미래를 걱정하는 것보다
현재에 집중하며 살아있는 기분을 느낄 수 있었고,
나와 내 육체적 정신적 건강을 위해 꾸준히 지속하기로 했습니다.
물론 요요도 오고 실패도 하고 때론 하기 싫어서 울기도 하고
살이 찌신 분들의 지난한 다이어트 과정을 저도 똑같이 겪고 있습니다.
다만 제가 어디까지 어떻게 갈 수 있을지 시작한 이 여정의 끝을 보고 싶어요.
제가 포기하지 않고 넘어져도 일어서는 과정을
어떤 누군가는 또 새롭게 지켜봐주실 수 있다고 생각합니다.

저는 영원한 건 절대 없다는 말이 얼마나 아프고 아쉬운 말인지 알아요.
지금까지 너무 많은 이별과 내가 원하지 않는 변화를 등 떠밀리듯 겪었습니다.
지금 당장의 제 변화가 너무 아쉽고 속상하신 분들도 있겠지만,
멀리 놓고 보면 언젠가 모두 바뀔 수 밖에 없는 지점일 거예요.

트렌드가 변하고, 상황이 변하고,
작년의 저와 올해의 제가 가지는 생각이 변하고,
또 저를 지켜봐주시는 저와 함께 성장하시는 분들도 변화할 수 밖에 없다고 생각합니다.

미쳤다고 뜯어 말리는 분들이 있었습니다.

캐릭터 잃으면 어떡하냐,
돈 잘 벌고 있는데 쇼핑몰은 어떡하냐,
너만 보는 구독자들 배신하는 거 아니냐?

황금알을 낳는 거위의 배를 가른다는 분들도 있었고
몇년을 쌓아올린 브랜딩인데 지 복을 걷어찬다는 말들,
살 빼면 누리던 모든 것을 잃을 거라는 말들,
평범한 너가 왜 떴는지 모르냐는 이야기들,

사실 상업성만 생각하면 미친 짓이라는 걸 알아요.
앞으로 어떻게 될지 두렵기도 합니다.
채널이 망하면, 제가 하던 쇼핑몰이 망하면,
지금까지 저를 지켜봐주시던 공주님들이 실망하고 하루아침에 떠나면 어떡하지, 라는 걱정은 수억번 하고 아직도 하고 있습니다.
잠도 못 자며 불안에 떨던 날들을 기억해요.

하지만 빈 바 드는 것도 버거워서 후들거리던 제가 이젠 ~100lb까지 들게 됐고,
한 달에 한 번도 운동하기 싫어서 몸서리 치던 제가 크로스핏을 꾸준히 나가고,
등산이 너무 싫어서 죽을 때까지 등산하는 사람들을 이해 못할 것 같던 제가
스스로 친구들과 등산 약속을 잡고 장비를 사게 되었습니다.
운동한 칼로리가 아깝고 더 건강한 제 모습을 보고 싶어서 식단도 같이 하게 되었습니다.

제가 지향하는 다이어트는
단순히 살을 빼서 예뻐지겠다가 아니라
내가 할 수 없다고 생각했던 것들을 하나씩 깨나가고
매일 느리더라도 조금씩 성장하고
저와의 약속을 지키는 모습을 지켜보는 것입니다.

긍정적인 모습으로 변화한다고 믿고 있고
그 과정이 힘들더라도 즐겁고 재미있어요.
처음 이 채널을 시작했을 때 피디였던 제가
사람들에게 전달하고 싶었던 메시지는

남이 뭐라 하든 너가 하고 싶은 걸 해,
한 살이라도 젊을 때 널 사랑하는 방법을 깨닫고
오늘이 아니면 못 입을 예쁜 옷을 입어줘 였습니다.

그건 단순히 체중의 문제가 아니라,
타인의 시선과 검열에 길들여진 사람들에게
혹은 그런 잣대로 저를 바라보는 사람들에게
제가 온 인생 내내 하고 싶었던 이야기였어요.

공주님들이 행복했으면 좋겠고, 누구보다 자신이 행복한 일을 했으면 좋겠다고 이야기하는 크리에이터가
본인이 하고 싶은 일은 정작 내 위치나 상황에 안주하여 하지 않는다면
그것이야말로 모순이라고 느껴졌습니다.

그렇기에 몸무게 변화가 더뎌도, 요요가 오더라도 아랑곳하지 않고 포기하지 않고
제가 드리고 싶은 메시지의 본질을 보여드리는 것에 집중하고 있습니다.

그래서 살을 뺍니다.
정확하게는 살을 빼는 것이 아니라 제 삶을 변화시켜나가는 과정에서 부산물처럼 자연스럽게 빠지고 있는 것이지만요.

삶은 변화하고 계속 흐릅니다.
돌이켜보면 변화를 두려워하고 현재에 안주하는 것 만큼
저를 힘들게 하는 것은 없었어요.

저는 계속 성장하고 싶고, 더 좋은 모습으로 오늘보다 더 나은 내일을 만들고 싶습니다.
이런 저의 선택이 어떤 내일을 만들지 알 수 없지만
매일 누구보다 열심히, 최선을 다해 제 인생을 제련하고 있으니 
모든 것이 달라지더라도 다시 새롭게 시작할 수 있을 것이라 믿습니다.

많이 부족해서 매번 궤도를 수정하고
누군가는 한 번에 할 수 있는 일도 여러번 시도해야 성공하는 저지만
제가 용기있게 먼저 한 발 내딛어볼게요.

늘 감사합니다.
 

INSTA https://www.instagram.com/lyj.lpd/
EMAILimmunej0504@gmail.com",184.0,9개월 전
38,userpp8bm5iu4c,피디님 혼자만 예뻐지고있어서 배아프고 질투남 흥!!,0.0,9개월 전
39,userss6vo4id6s,늘예뻐요 ♡엘피디언니 앞으로도 자신감 잃지마세요 제가항상응원합니다♡,0.0,9개월 전
40,useruu9up7de6o,볼수록 멋진 분이세요,0.0,6개월 전
41,userho4uy2rt7t,엘피디님의 옷 나중에 사 볼게용 ㅎㅎ 옷 자체가 너무 이뻐용 ㅎㅎ 그리고 살빼든 안 빼든 엘피디님 자체가 너무 이뻐용 ㅎㅎ,0.0,9개월 전
42,haroooo7610,엘피디님 이전부터 영상 너무 잘 챙겨보고 있고 꾸준히 보고있으며 엘더랜드에서 옷도 자주 구매하는 구독자입니다ㅠ 다이어트 하면서 이뻐지시고 건강해보이고 너무 좋은데 최근 쇼핑몰에 올라오는 사진에 보정이 너무 심한거같아요ㅠㅠ 이전처럼 무보정 사진으로 제품을 보고싶어요! ,1.0,9개월 전
43,userfi3nc7nc6n,"저 걸스빌리지 초창기 구독자였어요! 대학생 때 진짜 즐겨보고 엘피디님 중간중간 목소리나 모습 나오시는 거 보면서 되게 익숙했었요. 

영상도 넘 재밌었는데 어느 순간부터 잘 안올라오더라구요. 왜 이렇게 잘나가는 채널 관리를 안하지?라고 단순하게 생각했는데 여러가지 사정이 있었네요.

비디오빌리지, 현재 유툽 하시는 거 모두 전 트렌드에 맞게 잘 변화하고 계시다고 생각해요. 트렌드에 맞게 자기만의 길을 걸어가는 모습이 엄청 멋있어요.

통통한 여자 컨셉이어도 살을 빼서 날씬해지고 건강도 자신감도 자존감도 챙기는 모습과 과정을 보여주는 게 이 채널의 정체성 같아요. 물론 다시 찔 수도 있겠지만 그게 곧 저희들의 모습이어서 더 친근하게 느껴지는 것 같아요.

항상 새롭고 다채로운 영상 잘 보고 있어요! 전 개인적으로 엘피디님 피디로서, 크리에이터로서, 프리랜서 로서 등등 넘 멋있다고 생각해요.",0.0,9개월 전
44,sikayour,마인드가 정말 멋있으세요!!! 그리고 착장이 너무너무 섹시해요...! 영상이 늘 보기 편해요 그래서 계속 보게됩니다 감사해요!,1.0,9개월 전
45,ayoungim3997,엘피디님 제 눈에는 멋있기만 하네요. 솔직한 말씀 잘 들었습니다. 엘피디님에게서 반짝반짝 빛이 나네요...이런 모습을 사람들은 아름답다고 하던데... 아름답네요,1.0,9개월 전
46,sheryly3547,살 빼는 거쯤 엘피디님은 뭐든지 척척 해내실 거 같아요 항상 응원합니당️,0.0,9개월 전
47,e1066jz,"엘피디님이 고정댓글/더보기에 쓰시는 긴 글들을 읽다보면 마음이 울렁거려요. 패션도, 영상 만드시는일도 잘 하시지만 언젠가 기회가 되신다면 책을 써보시는건 어떨까 생각해봅니다. 엘피디님이 쓰신 글로 이루어진 책은 찬찬히 읽고 또 읽는 그런 책이 될것같아요.",3.0,9개월 전
48,hiimjoojooim,썸네일 보고 진짜 어…?! 했어요… 너무 예뻐 진짜…. ,0.0,9개월 전
