,youtube_id,comment,like_num,comment_date
0,whykikibf8hm,흐어어어엉 또 장바구니가 이렇게 늘어갑늬댜.. 새얀님 올 한해도 유익한 영상 올려주셔서 넘 감사해여 내년엔 더어 복 많이 받고 영상도 마니마니 올려주세횽,1.0,8개월 전
1,userny1ik1ox7m,"새얀님의 진정템들 넘나 궁금했는데 올려주셔서 넘 재밌게봤어요 기존꺼는 다 있는거였고
클렌징이랑 샴푸 속옷들 당장 사러가려고요
메리크리스마스 입니당^^
오늘따라 겁나 브이라인이세요^^",1.0,8개월 전
2,alexiell2,새얀님 쿨톤이라 손민수 많이 했어요 내년에도 꿀템 많이 보여주세요,2.0,8개월 전
3,ueong2,바이애콤 진정앰플 오래전에 새얀님 덕에 알게돼서 한 5통은 비운 거 같아요 그리고 쟁여둔 것도 4통정도 있어요 ㅎㅎ 좋은 제품 추천해주셔서 감사해여🩵,1.0,8개월 전
4,userbt8qe4ry2x,"언니 메디큐브 두개중에 머가 더 효과좋아요?
피부가 얇고 피부과가면 볼쪽 턱쪽 전부 살이래요
최근에 다이어트 급격하게 하면서 다들 해골같다고 쳐지는것같다고 해서 유쎄라 살까했는데 유쎄라는 30대부터 효과본다하고.. 더마샷은 근육에효과본다하고 고민이네요ㅜㅜ 팔자주름,눈가주름,살쳐짐,턱살관리,붓기관리  하고싶어요",1.0,8개월 전
5,userbj8qc9te1v,새얀님 너무 예쁘십니다,1.0,8개월 전(수정됨)
6,S0745,"저는 에이지알 효과가 너무좋아서 매일했더니 볼패임이 생겼어요ㅜㅜ
저도 샷을 사야겠어요....
하나만 사용하시는분은 시간조절 꼭 하세요..",1.0,8개월 전(수정됨)
7,SONto4ip,새얀 SAEYAN님 아주예쁘군요.,2.0,8개월 전
8,userbz9kg6fj6y,모자 정보 부탁드려요-!,2.0,8개월 전
