,youtube_id,comment,like_num,comment_date
328,yyho24761,노매뉴얼은 진짜 바지맛집에 그래픽 맛집입니다 애착 바지가 노매뉴얼 바지인데 색이 바랠정도로 입었습니다,0.0,10개월 전
329,userji5vd5cq7h,저번에 더현대 갔었는데 이벤트중인 팬츠를 너무나도 사고싶었는데 다른 팬츠와 옷에 눈이가서 못샀습니당ㅠㅠ 이번 기회에 이벤트 중인 팬츠까제 겟하면 기분이 너무 좋겠네영ㅎㅎ,0.0,10개월 전(수정됨)
330,useryz8vt5dg3e,무신사 노매뉴얼 무한새로고침하면서 뭐사지했는데 송필드님이 추천해주시는걸로 보면 되겠어용>_<,0.0,10개월 전
331,userxx4xh9dm1m,당첨 되기를 기대해봅니다 ㅠㅠㅠㅠ,0.0,10개월 전
332,uservm6tu3pd5g,진짜 솔직히 개예쁘네.... 노매듀얼X송필드 믿고 봐요 진짜 ㅠㅠ,0.0,10개월 전(수정됨)
333,userqm4do5ne2i,노매뉴얼은 시즌마다 사면서 실패한 옷이 없슘...... 노매뉴얼 체고,0.0,10개월 전
334,userdr8qt1nf9t,미친듯이 이쁘네여ㅠ,0.0,10개월 전
335,minhobakgoguma,"이번시즌 진짜 미치긴했다,,,",0.0,10개월 전
336,sexyguy5611,노매뉴얼 니트 진짜 예쁘고 보들보들해요 꼭 사시길..! 근데 12월 30일 예약배송 ㅠ,0.0,10개월 전
337,can0108,눈나 노메뉴얼은 사랑이자나 ,0.0,10개월 전
338,uservo6vo9cq2l,더현대에서 트라이벌 즈켓 입어봤는데 넘 이뻐더랍시라요 ️️,0.0,10개월 전
339,gaseongl,진짜 노매뉴얼 최고 송필드 최고,0.0,10개월 전
340,userlf1pl1io3c,송필드 노매뉴얼 폼 미쳤다…,0.0,10개월 전
341,mieu923,ㅋㅋㅋ 블프 이미 지르고 와서 정말 살 생각 없었는데 ㅜㅜㅜ 영상 보자마자 무신사 켰음.........ㅎ,0.0,10개월 전
342,depp078,"학생으로써 사기 좀 비싼감이 있지만 너무 이뻐서 구매를 해버릴 수 밖에.,들이가 세상을 구해",0.0,10개월 전
343,userpm5zy7kw6q,웅니… 웅니 구독자 이벤트 봤는데 바지는 이미 웅니가 추천해 줘서 냅다 사버린 거엿어  웅니영원히사랑해…,0.0,10개월 전
344,userhx4rs1mx8l,"송필드와 노매뉴얼 세상을 구했다,,",0.0,10개월 전
345,redaechan,"홈쇼핑으로 3 행시 해보겠습니다
홈ㅁㅁㅁㅁㅁ매뉴얼rrrrr
쇼~~~오오오옹
핑드님이 접수 했다!!! !! ",2.0,10개월 전
346,usertt5dr3mz9o,이전 송필드님 추천 영상 보고 노매뉴얼 팬츠 구매했어요 다음은 아우터로 가야지,0.0,10개월 전
347,guava6844,안그래도 헤어리 니트 오늘 사고 바지 뭐입을까 했는데 입으신 바지랑 너무 이뻐요!,0.0,10개월 전(수정됨)
348,useryy7wv4wm4u,필드언니는......신이다...,0.0,10개월 전
349,userys7km5qx8x,필드 누나 스타일 좋아하는사람 피로님 안좋아할수가 없지 역시 사람들 생각하는건 다똑같아~,0.0,10개월 전
350,seoliis2,진짜 ㅜㅜㅜㅜㅜㅜㅜㅜ 대박 이뿌다 그리구 영상 넘 ㅁ잼있구 언니도 멋있구 예브구 다 한다...... 진짜 맛있다.. 맛집이다...... 지금 영상 보자마자 헐레벌떡 살려고 들어갔는데 몇장 안남아 있어서 댓글 빨리 남기구 달려감!!!!!!!! !! 텅장 가보자고 ㅠㅁ ㅠ  영상 올려조서 고마워요!!! 소ㅇ필드 장짱짱 갓갓갓 ,1.0,10개월 전
351,userkw7yt9dt4v,너무 최고에용옹,0.0,10개월 전
352,hookaoo,진짜 농협은행…. 노매뉴얼 탐나요,0.0,10개월 전
353,uservz7fw4tt7s,"송필드가 키운 노매뉴얼,, 블프 전에 이미 몇 개 샀지만 이 틈을 타 나머지도 다 사버린다,,",0.0,10개월 전
354,userfu5xx3qq3f,"이번에 매장 가서 노매뉴얼 22fw 다 입어봤는데 ,,, 진짜 예스매뉴얼 그는 신인가 ...??",0.0,10개월 전
355,userpy7sr6vv8m,믿고보는 송필드,1.0,10개월 전
356,userjb6bb7uz1l,헐 노메뉴얼 데님 자켓 짱 이쁘다...,0.0,10개월 전
357,tigerljk3955,이젠  노매뉴얼하면 송필드가 먼저 떠오른다 그만큼 읏된다는거지,0.0,10개월 전
358,userbk6un3xg2v,요즘 송필드님 폼 미쳤다,0.0,10개월 전
