,youtube_id,comment,like_num,comment_date
0,evalet,반지 공방 : 아워가르텐(@ourgarten),19.0,10개월 전
1,userzo3vy3wk4y,와..수인이언니 부산여행이랑 에바언니 부모님 과수원 가서 둥이랑 노는거본게 엊그제같은데 이제는 각자 위치에서 삶을 살아가는모습이 너무 멋지고 저 우정이 참으로 부럽네요ㅜㅜ.,87.0,10개월 전
2,usergh9ru4zm9t,현생 너무 힘들어서 요 몇달동안 에바님 영상 못봤는데 오늘만큼은 간만에 쉬면서 보궁 다시 힘내야지ㅠㅠㅠㅠㅠ 진짜 언니 영상보고나면 ㄹㅇ 힐링되고 다시 에너지(?) 생겨용,66.0,10개월 전
3,sooo966,이런거 보면 연애고 뭐고 그냥 마음 잘맞는 친구랑 재미지게 노는 게 더 인생에 낙일 것 같기도,228.0,10개월 전
4,userpc7hd7pk5i,에바님 용기내 계속 실천하시는 거 너무 보기 좋아요!  같이 하는 입장에서 큰 힘이 됩니다 우리 화이팅~!,42.0,10개월 전
5,alska3,"구독자로서 마음까지 따수워지는 우정 ,,  친구 분 걱정하신 일 없이 2년동안 건강히 하고자 하시는 일 다 이루시길 !! 에바님도 항상 건강히 🫶 두 분 호주 븨로그에서 뵙겠습니다 (양심없이 맡겨둠) 막이래",29.0,10개월 전
6,userhs7hi2wy7k,수인님 호주가서 건강하게 행복하게 2년 잘 지내다가 멋진모습으로 다시 한국 오세욤 한국집밥이 그리울것같은데 가서도 식사 꼭 챙겨드세요~!!! 이제 수인님 에바언니 모습을 볼수없다니.. 섭섭하지만 응원하겠습니다:),33.0,10개월 전
7,userll5mg8vj8c,수인님께는 공항까지 바래다주는 친구가 있고… 애바님께는 공항까지 바래다주고픈.. 친구가 있네요..  너무 예쁘다!!!!!,196.0,10개월 전
8,yuseyu11,2년... 안에 에바님이 호주가서 수인님과 호주여행하는 영상 올라올거라고 믿습니다.......🫠🫠,253.0,10개월 전
9,gsw34,"옷정리하시는데 너무나도 자연스럽게 한자리 차지하고 누워있는 봄양,,",114.0,10개월 전
10,kgnj3kb,세상에...내가 워홀가눈데 남은 기간동안 집에서 같이 지내고 추억 만들어주고 선물도 주는 친구가 있다면 정말 행복할 것같아요ㅠㅠㅠㅠ🥹,76.0,10개월 전
11,userne3gj2ry4l,아 언니 오늘 영상 너무 힐링돼요🥹 그림게임 웃겨서 기절 ㅠㅠㅋㅋㅋㅋㅋㅋ 마지막 아웃트로 보면서 제가 다 감동이고.. 언니랑 수인님 호주에서 만나는 모습도 얼른 볼 수 있으면 좋겠네요! 오늘 영상도 너무 잘 봤어요 에바짱최고,11.0,10개월 전
12,userqs8cz9qk1v,"일요일 오후에 보기에 너무 포근했던 영상입니다🥹세상에는 연인과의 관계가 아니더라도 다양한 형태의 사랑이 존재하는 거 같아요. 반려동물을 향한 사랑, 친구와의 사랑처럼요! 오늘 뭔가 쓸쓸하기도 하고 괜히 외로워지기도 했었는데 왠지는 구체적으로 말 못하겠지만 마음이 따뜻해졌어요️",53.0,10개월 전
13,userfh8zx5yy2l,"항상 언니 영상 보면서 게으른 몸 일으켜요,, ",25.0,10개월 전
14,userrf2ul4uh3z,"아 뭔가 나까지 위로되는 힐링영상,, 특히 게임할때 나도 현웃터짐ㅋㅋㅋㅋ 옛날부터 느꼈지만 이 친구분들이랑 케미가 넘 편하구 재밌어용 ㅎㅎ 수인님 웃는모습이 참 이뿌시네요 조심히 잘 다녀와요~~!",7.0,10개월 전
15,deepika9204,"Love to watch your videos
Please add English subtitles if possible it would be very helpful ",5.0,10개월 전
16,userno6dv8bm4w,친구분은 매력적이시고 에바님은 너무 멋지시네요 둘의 우정이 아름답고 찬란하게 영원했으면 해요,11.0,10개월 전
17,nanakg5fu6nr3o,"마지막 수인님 들어가실때 울컥했던 구독자 1인 ,, 뭔가 영상에서 자주 봤던 에바님 친구셔서 랜선친구 된 거 같고 막 친근감이 느껴지고 (나만그래 ?) 두분의 우정이 너무 멋있는 거 같아요 ㅠ 에바님 빨리 호주가서 데이또 해주라줘 ~~! 수인님 호주 잘 도착하셨다면 당근을 흔들어주세요 ~~! 🫶",12.0,10개월 전
18,khus9652,저도 지금 호주에 사는 한국인 친구가 있는데 영상 보니 더 보고 싶어지네요 저는 배웅을 못해줘서 비자 기간 끝나기 전에 호주 꼭 가야지 마음 먹고 있는데 ㅋㅋ 에바님도 호주에서 수인님 만나주세요,4.0,10개월 전
19,eunseoekt,"두 분 정말 멋지세요 
수인님의 워홀을 응원하고 두 분의 우정 항상 변치 않으시길! 두 분 행복하세욤~~! 영상 완전 힐링입니다",3.0,10개월 전
20,SYzy8mg,두 분 같이 요리하실 때 햇살이랑 너무 따뜻해 보이네요,7.0,10개월 전
21,yummmmz,마지막 선곡도 에바 웅니가 수인님한테 해주는 말 같아서 나까지 괜히 눈물 ㅜㅜ 수인님의 워홀 생활을 응원합니다 ! 🫶,14.0,10개월 전
22,edan,"오늘 영상은 친구분을 위한 영상인거 같기도 해서 더 따뜻하네요 ️
친구분도 열심히 하시길 바랄게요 !! ",36.0,10개월 전
23,myztyo3o,여자들의 우정은 언제나 봐도 미소짓게 만들어요 너무 보기 좋네요~!,7.0,10개월 전
24,userrx3vq4iy4c,영상 올라왔길래 완전 행복해하면서 볼 준비 완료…🫶 진짜 언니 영상만 구독해놓고 스킵 없이 다 봐요 ㅠㅠ,8.0,10개월 전
25,qkrthgus456,"용기 들고 가서 포장하는 거 넘 멋있어요,, 저도 도전,,!",3.0,10개월 전
26,lemonandmandarin,"에바넴 같은 친구 있음 넘 든든할 것 같아요 ,, 🥹 동거 븨로그 넘 재밌는걸요?! 수인님이랑 호주에서 만나는 븨로그 숨참고 존버합니다 ••",3.0,10개월 전
27,uservw3hg8oh8n,이번 영상두 힐링 그 잡채...️‍ 에바릠 칭구들이랑 케미 진짴ㅋㅋㅋㅋㅋㅋ너무ㅜ웃겨욬ㅋㅋㅋㅋㅋㅋㅋㅋㅋㅋ,9.0,10개월 전
28,nomusicnolife3045,재미도 있지만 뭉클해지는 영상이네요….몸 조심히 잘 다녀오시길!!,4.0,10개월 전
29,userul1mc9yi2p,여기 완전 콘텐츠 맛집이네용ㅋㅋㅋ짧고 굵게 친구랑 동거하면 넘넘 재밌을 것 같아요! 진자 부럽당,2.0,10개월 전
30,Yesterday256,에바님 이번 영상 너무 웃기고 재밌고 따뜻하고 뭉클하고 …,2.0,10개월 전
31,woohwa1212,아 진짜 친구들 보고싶다... ㅠㅠ 너무 보기좋은 영상이었어요..🥹,3.0,10개월 전
32,userdd3vl4uw9u,에바님 같은 친구가 있어서 수인님은 정말 좋았을 거 같아요!!!♡♡♡ 부러워요>_<,13.0,10개월 전
33,cherriestwinnies,10:01 이 각도 도 괜찮네요! 우리 영상 찍을때 이런 가고 생각 못 했지만 해보고싶네용! 오늘 연성도 조금 늦게 봤더라도 잘 봤습니다!,2.0,10개월 전
34,userry5tb1gd1r,너무 재밌어요 친구분 넘 매력이따 ㅎㅎㅎㅎ 물론 에바님도 사랑 ,2.0,10개월 전(수정됨)
35,ncc7162,i wish i could have a friend like you in real life,1.0,10개월 전
36,userdx1rq9yo8z,환연을 포기하고 언니 영상을 보면서 준비합니다 ㅎㅎㅎ 동거븨로그 기대된다리~~🫶🫶,3.0,10개월 전
37,userrl4kp7gi6t,이번 영상은 친구분을 응원하는 마음으로 만드신거 같아용️,1.0,10개월 전
38,userxe6kh1tq7j,친구 분 너무너무 귀여우서요 그리고 잘다녀오세용,2.0,10개월 전
39,usergb7nc6vn6k,이번 영상 왤케 포근하고 힐링이죵,3.0,10개월 전
40,userkt7ze7wi5i,친구분의 미래를 응원해요!!,0.0,10개월 전
41,Danicf4yv,신랑이 런데이로 가끔? 뛰는데ㅋ 런총각이라니 넘 신박하네용ㅎㅎ 저도 몇번 해봤는데 힘들더라구요ㅎㅎ,1.0,10개월 전
42,onurmark3821,"너무 행복하게 웃었닼ㅋㅋㅋㅋㅋㅋㅋㅋㅋㅋㅋㅋㅋㅋㅋㅋㅋㅋㅋㅋ진짜 행벅 영상 탑파이브될듯

어ㅐ내가 눈물나지",0.0,10개월 전(수정됨)
43,yeejuse9io,언니들...살앙해요...친구분도...넘...예뿌고...귀여워요....️‍,0.0,10개월 전
44,userkn5vd3bt1k,"하 봄이,, 진짜 너무 사랑스러워 ;; 뚠뚠 강아지 ;;",8.0,10개월 전
45,pansy3044,"당사자도 안 우는데 와엠아쿠라잉....
마지막에 사진이랑 음악이랑 너무나 감동적....",6.0,10개월 전
46,cho826680,에바…여러가지로 내게 감동준다…… 중학교 친구도 생각나고….. 어째뜬 사랑해 에바… ,1.0,10개월 전
47,useres3jm3cb8w,"삭막한 세상 속,,,,,,,아름다운 영상,,,,,,,, 에바님 사랑할수밖에 없는이유,,,,",0.0,10개월 전
48,sarahsekar3908,finally English sub. Love u Eva ,0.0,10개월 전
49,userdh2ot7iz9u,허얼 양상보다 생각난건데 에바님이랑 같은 학교 같은 수업에서 보면 너무 좋을거같네요,0.0,10개월 전
50,userhq4tj7jh9t,"내친구가 워홀가는것처럼 내가 왜 눈물이 나는지~~ㅜㅜ힝.. 저랑 제친구는 다른지역에 살아서 자주 못 보는데 보고 헤어질때마다 둘다 눈물이 그렁그렁해요..;;바보같이;; 15분달리고5분걷는 운동도 한번 해봐야겠어요!
저도 에바님 영상보고 오래걷기운동 시작했어요~~^^v ㅎㅎㅎ",3.0,10개월 전
51,ElizabetJulie,눈싸움에 시간 가는 줄 모른닼ㅋㅋㅋㅋㅋㅋ 개웃곀ㅋㅋㅋ,0.0,10개월 전
52,honeyn2297,What song were you singing at the noraebang? Your voice sounds so good there ,1.0,10개월 전
53,nowshintabassum8779,You're friend is so cute️,0.0,10개월 전
54,userxk4kc9xd5v,에바님 10월달도 건강 하세요,0.0,10개월 전
55,usertn9xg5mu3t,언니 영상 기다렸어요,4.0,10개월 전
56,boreumdal,"15:18 루미큐브 좋아용
친한 친구가 멀리가서 마음이 문득 울적할 수 있어요 그럴 땐 언제든지 저 찾아욧! 즐겁게 해드릴게용 에바님 응원합뉘다아아",1.0,10개월 전(수정됨)
57,useruc4ei8wh4d,앜ㅋㅋㅋㅋㅋ진짴 텔레스테션 왜이리 웃겨욬ㅋㅋㅋ낄낄낄 겁나 웃었어욬ㅋㅋㅋㅋㅋ,3.0,10개월 전
58,haechan9090,영상 보니까 제 친구들 생각도 많이 나고 제가 괜히 코가 찡 ~~,4.0,10개월 전
59,usermd3gf7yw6u,"마지막에 친구 떠나고 카메라에 대고 친구한테 하고 싶은 말 하는데 왜 눈물이 날까요,, 엉엉 울었내요,,,",0.0,9개월 전
60,usernl2jf7pw9p,"에바님의 친구지만 친구 한테 잘 해 줘서 고마워요.. 나는 에바씨 만큼 젊은 시절에 친구 한테 그렇게 잘 한 기억이 없네요.. 내 인생에 찌덜어서.. 떠나는 친구는 나름 만감이 교차 할거거든요. 아직인생은 길지만 그때는 길이 보이지가 않아요. 여유라는 것이 없죠. 지금도 한치 앞은 알 수 없지만 이제는"" 어떻게 되겠지 뭐 ""이런 정도의 살아온 경력이랄까...여튼 워홀가는 친구의 뒷 모습이 그냥 편하지가 않네요...............",0.0,10개월 전
61,abcdfy1di,Let's wait for 2 years later with Sooin again!,0.0,10개월 전
62,fieldgreen7874,텔레스트레이션 넘 웃겨요ㅋㅋㅋㅋㅋ 마약 나올때 죽을뻔ㅠㅋㅋ,0.0,10개월 전
63,uservn7xl8gm9l,8시간 아르바이트.. 에바님으로 버텨봅니다,1.0,10개월 전
64,userbp9kp2kw8e,에바님덕분에 친구분이 든든하셨을 것 같아요오 에바님도 오래된 친구랑 헤어지셔서 슬프실듯요ㅠㅠ 두 분 우정 변치 않고 오래 가시면 좋겠어용️,1.0,10개월 전
65,boreumdal,뉴트럴톤 화장 많이 많이 부탁드려요~ 밝고 소프트한 느낌으로 하면 좋대요! (이제껏 여름뮤트 가을뮤트로 살았는데 큰일이에요 ㅠㅠㅠㅠ),0.0,10개월 전
66,barley1120,에바님 공항에서 헤어질때 덤덤한게 신기해요ㅎ저라면 울었을텐데ㅋㅋㅋ,1.0,10개월 전(수정됨)
67,babe8836,따뜻한영상이요피자집 후라이팬 몬가 웃교요 용기내챌린지 넘 머싯구요 저도 해보겠어요,0.0,10개월 전
68,usercx7mv7oe2o,운동복 추천영상도 찍어주세요 !!,2.0,10개월 전
69,userxm6rh8jd8g,그림 맞추는 게임 너무 웃겨서 오열했어요ㅠㅠㅠㅠㅠㅠㅠㅠㅠ,1.0,10개월 전
70,uung0512,우앗 브이로그 잘볼게요오오!!!!,0.0,10개월 전
71,mera6647,"에바님 영상만 보면 홍라면 먹고싶어요오오,, ",0.0,10개월 전
72,minng3747,헐 롬곡 방이샤브샤브 필수죠ㅠㅠㅠ 언니 졸업하기 전에 학교에서 지나가다 만날 수 있겠죠…?  ,0.0,10개월 전
73,useroq2ii9lt3x,에바언닝 영상고마워요,4.0,10개월 전
74,userey8fh6ge7b,"에바님 ! 첫 장면 렌즈정보 알고싶어요 넘나 눈부시는 부분쓰,,",5.0,10개월 전
75,zezzz9071,아 ㅋㅋㅋㅋㅋㅋㅋ 눈싸움 진짜 웃기다,0.0,10개월 전
76,ele4321,마지막 비지엠이랑 미쳐따.. 눈물 찔끔 나는데요?,0.0,9개월 전
77,Minguuuu,이것만 보고 공부한다!!!!!!,2.0,10개월 전
78,issuesummer4819,친구분 성격 엄청 좋아보임,8.0,10개월 전
79,userpn7sy3lj1y,너뮤 예쁘다..,1.0,10개월 전
80,userus6ye5el6k,반지 개ㅡㅡㅡ예뻐요,1.0,10개월 전
81,itissotastyyum,오늘도 영상 잘 볼게요 미리 댓글 달고 영상 시청하러 사라집니다.. 갓에바 븨로그 사랑해.. 🫶,0.0,10개월 전
82,kdy123142,"마지막에 깔리는 노래 실화냐고ㅠㅠ
진짜 바로 플리로 저장,,,",1.0,10개월 전
83,jiwon35,"멀까 수인님 잘다녀와요 아프지말구 ....(같은 성씨, 같은과,,,라서 )내적친분 쌓여있었는지  왜 제 친구 보내는것같고ㅜ.. 잘다뇨유ㅓ요ㅠ,,..",3.0,10개월 전
84,HSvn3ng,영상이 인생네컷으로 끝나는게 왜 제가 다 슬픈거조..?  근데 에바님 케이스 정보 알려줘요 알려주라 줘..요..,2.0,10개월 전
85,useruh7np9sg2o,ㅋㅋㅋㅋㅋㅋㅋㅋㅋㅋㅋㅋㅋ아 그림게임 웃겨죽겠어요 ㅋㅋㅋㅋㅋㅋㅋㅋㅋㅋㅋ 눈싸움ㅋㅋㅋ,0.0,10개월 전
86,useroc1hi6fc8i,역시 친구가 최고,1.0,10개월 전
87,userkz6lm8ny7q,후반부로 갈수록 애틋하고 슬픈 것 같아욧ㅠㅠ,1.0,10개월 전
88,blinkuwu2273,I feel so emotional ,0.0,7개월 전
89,jaelog5928,"친구 마지막으로 보내드릴때 제가 눈물이 나면 어떡하죠 ,, ㅠ",0.0,10개월 전
90,usertx2om3ii6n,아싸 나갈 준비하면서 봐야징,29.0,10개월 전
91,ddda1126,나 두사람의 우정에 왜 내가 눈물나고 난리 .. 주책 .. 증말 ..,0.0,10개월 전
92,jslululala658,에바님! 반지 만드신 곳은 어딘가요? 너무 예뻐요..!,1.0,10개월 전
93,userjc5rx4sx1i,에바님 친구분이랑 가신 반지공방 정보 알 수 있을까용???,6.0,10개월 전
94,bora,18:40 모자 넘나 귀여버요…. 어디껀지 알 수 있을까요🥹,1.0,10개월 전
95,docavoaa,에바님... 처음 오프닝에서 끼신 렌즈 뭘까요..?🥹 넘 예뻐요...,0.0,10개월 전
96,userfq9ke1xr7e,누나가 좋아하는 노래들 컨텐츠로 만들어 주세요^^,0.0,10개월 전
97,userwy5nr3xz5d,"언니 크림색 볼캡 어디껀지 알려주실 수 있나요ㅠㅜ 너무 이뻐요ㅠㅠ 
항상 영상 잘보고 있습니다ㅎㅎ!!",1.0,10개월 전
98,heavenpraha,"아웃트로 최고당 .,,,,,",0.0,10개월 전
99,uservw6cw2it3s,에바님ㅁ 친구분 쏘 큐트..,1.0,10개월 전
100,Leeleevq7hw,07:11 고영희 울음소리가 들려서 깜좍 놀랬어효 ㅋㅋㅋㅋㅋㅋㅋㅋㅋㅋㅋ 므앟아아아앙,0.0,10개월 전
101,userdu3zx1xs5q,"첫번쨰 나오는 하얀 미색 자켓정보알고싶어요^^
늘 응원하고갑니다~~~",0.0,10개월 전
102,useryz7yl6nu7t,댓 먼저 달고 재밌게 영상 봐야겠다…,0.0,10개월 전
103,leedarong913,"12:20
12:20
개빡쳐보인다는거 개웃갸요ㅜㅠㅋㅋㅋㅋ",1.0,10개월 전
104,Slr851,홍라면 가격 1700원 된 거 실화냐구요...,3.0,10개월 전
105,userqz6gm7wv8w,반지 공방 어디인지 궁금해요!!,10.0,10개월 전
106,userkb8ir3qt3h,에바님 혹시 무릎보호대 제품 뭔지 알 수 있을까요??,1.0,10개월 전
107,duckkkwak,친구분이 쓰시는 텀블러 넘 궁금해여!,1.0,10개월 전
108,10maerr,수인씨도... 에바씨도 안우는데... 왜... 내가 욺.....?,2.0,10개월 전
109,serenesurin,봄이 넘 귀여워서 입에 넣고 싶어요,0.0,10개월 전
110,22arete21,"런데이어플깔았습니돠.....

하지만 언니 스토리 보고 런데이나이키클럽으로...ㅎ",1.0,10개월 전(수정됨)
111,userff4eh7si1y,엽떡 미쳤다..,0.0,10개월 전
112,useryf3ff6cp7g,축하드려요,0.0,10개월 전
113,one7890,23:22 아 미친거같다ㅜㅠㅠㅠㅋㅋㅋㅋㅋㅋㅋㅋㅋㅋㅋㅋㅋㅋㅋㅋㅋㅋㅋㅋㅋㅋㅋㅋㅋㅋㅋ,2.0,10개월 전
114,userok8gy7wz9x,영상에 나오는 마스크 어디꺼인지 알려주실 수 있나용!!,0.0,10개월 전
115,Ddolmenge,27:06 갑분맹구.,4.0,10개월 전(수정됨)
116,moolpeach,웅니ㅠㅠㅠ 혹시 중단발하고 겟레디윗미 찍으신 영상 삭제하신 건가요?ㅜㅜㅜㅜㅜ 저 그 영상 진짜 좋아했었는데ㅠㅠㅠㅠ,0.0,10개월 전
117,zyhy,전에 오리고기크림파스타 알려주신 분인가요 ㅋㅋㅋㅋㅋ,6.0,10개월 전
118,useruh8ou3xr2j,0:55 에 나오는 보라색 텀블러 정보 아시는 분 있으신가요? 넘나 제 스타일이라 꼭 찾고싶어요 🥹🥹,0.0,10개월 전
119,userdh2jx9kb3y,텔레스트레이션 재밌어보이네요 ㅋㅋㅋㅋ ㅎㅅㅎ,0.0,10개월 전
120,userrs9eh5tw8x,웅니 사랑해 🫶,0.0,10개월 전
121,userzo3vy3wk4y,"에바씨,, 하얀색 덴탈마스크 제품명 궁금해요",1.0,10개월 전
122,userzi3rt1mw8o,홍라면 어디서 구매하셨어요? GS에 안보여서요ㅠ,0.0,10개월 전
123,jjerry6000,마스크 추천 영상 올려주세요!!,0.0,10개월 전
124,sarameakie,와우 일요일 오후이라니?,1.0,10개월 전(수정됨)
125,userbj8qc9te1v,에바님 너무 예쁘십니다,0.0,10개월 전
126,userhn3bl5pm2h,반지 공방 정보 알 수 있을까요??,9.0,10개월 전
127,userbh3gy6ph4u,웅니...동생분이랑 같이 사는 거 아니셨어요!?,0.0,10개월 전
128,AsandaMahlangu,Can you go back to the way the old eng sub used to be,0.0,10개월 전
129,usereo2hv6mz3y,에바릠~~!~~~~~ 반지공방 정보 제발!!! 알려주세요!!!!!! 저도 친구랑 반지 만들구싶어요!!!!!!제발ㄹ여!!!!!,0.0,10개월 전
130,qkrthgus456,아놔 마약 ㅠㅠㅠㅋㅋㅋㅋㅋ큐ㅠㅠㅠㅠㅠㅠㅠㅠㅠㅠㅠ,1.0,10개월 전
131,userpe1qv2qu3b,7:48 언니 가방 어디꺼에여 ,0.0,10개월 전
132,userbo3ij2gs6f,4:59 아니 여기 자연스럽게 섞여있는 솜뭉치는 뭐죠,1.0,10개월 전
133,usergs6kr1fm8c,에바넴 혹시 예전에 목걸이 관련 영상 제작했던거 삭제하셨나요...?! ㅠㅠ,1.0,10개월 전
134,userxe8oe9nw1n,새기신 타투 의미가 뭐에요??,1.0,10개월 전
135,Slr851,유진상?,0.0,10개월 전
136,MJnk9wm,오마이갓…,0.0,10개월 전
137,yveedl3qt,에바님 마스크 머 쓰세요??!,0.0,10개월 전
138,scentbeen,반지 공방 어디인가요?,0.0,10개월 전
139,pink1822,26:00,0.0,9개월 전(수정됨)
140,dear4073,1등,0.0,10개월 전
141,useryf3ff6cp7g,같은 들끼리 성관계 좋와요?,0.0,10개월 전
142,jslululala658,에바님! 반지 만드신 곳은 어딘가요? 너무 예뻐요..!,1.0,10개월 전
