,youtube_id,comment,like_num,comment_date
0,userrn9kb7lt2v,언니 영상 보면서 저도 저번 겨울에 유럽 여행 갔던게 새록새록 떠올라서 그립고 너무 좋았어요!! 언니 여행 영상 너무 재밌어요 ㅎㅎ 이 영상으로 진짜 꼭꼭 다시 유럽 여행도 가고 교환 학생도 가야겠다는 다짐을 하게 되었어요🩵🩵 고마워요 언니,3.0,1개월 전
1,Ddolmenge,"역시,,수많은 여행영상중 정말 그 나라의 그자체와 매력을 담백하게 담는 분은 only 에바공주님,,",3.0,1개월 전
2,userun5fl2jn6b,에바 당신 영상 분위기 너무 좋아.. 영상마다 뒤에 깔리는 비지엠도 넘 잘어울리고 에바만의 편안해지는 분위기가 있어.. 항상 잘 보고있어요 에바님🫶,25.0,1개월 전
3,usercu3mv7yj1j,에바님이 영국 다녀오시구 며칠 뒤에 영국에 2주정도 있옸어요 ! 반갑구 예쁜 영국 추억하기 좋아서 1일 1시청하구 있네영 ㅋㅋㅋ ㅎㅎㅎ 덕분입니다 제 사진만으론 예쁜 영국을 완전 가억해내기 어려울 걸 같앗거등여 영상 감사해용 ,1.0,2주 전
4,userly9rc7ye7t,루브르에서 바이올린 공연할때 갑자기 눈물이 나왔어요.. 꼭 직접 들으러 가야겠어요! 원래 파리는 가고싶다는 생각이 안났었는데 에바님 덕분에 가고싶은 여행지 하나더 생성!! 감사합니다,0.0,1개월 전
5,userhd8ks1qs6e,"미친..언니내가저번에 언니
영국가줬음좋겠다고장문의편지를남겼는데
우연히 이렇게다녀오셨네요 ㅠㅠ
아너무감동이다 몇년만에 영국풍경 보나몰라요
저진짜너무행복해요",2.0,1개월 전(수정됨)
6,userhz5iz6pj9k,런던에서도 예쁜 에바 언냐...>< 완젼 힐링이에요ㅜㅜ 아프지 말구 더위 조심하세용!! 다음 영상 또 기다리구 있겠숩니다ㅎㅎㅎ,1.0,1개월 전
7,nanakg5fu6nr3o,하 언니 이렇게 자꾸 세계일주 해주면 감사합니다 ️,63.0,1개월 전
8,useruq8cz5jj4j,"언니 여행하는거 대리만족 미텼다…🩵
산 자켓도 너무 찰떡콩떡이고 역시 나의 연예인이잖아..!!!",1.0,1개월 전
9,Danidanidan10,여행 영상 특유의 비지엠과 아름다운 분위기는 정말 사랑합니다 ,2.0,1개월 전
10,hyeinhyns,파워J 에바씨의 영상은 언제나 제 마음이 편안해지게 해요.. 영국 요즘 많이들 가네요 ㅠㅠ 저도 언젠간 아이가 크면 해리포터 셜록 주입해서 꼭 가고싶네여 ㅎㅎ,2.0,1개월 전
11,userjj5gj3mp3h,"3:16 이런 구조(?) 방 구할 때 봤어요 ㅋㅋㅋㅋ
오피스텔이었는데 주방이 따로 없고 저렇게 옷장 안에 빌트인 세탁기랑 같이 있더라구요
공간이 제한적이라 협소해서 답답하긴 하나 닫아 놓으면 깔끔하고 나름 괜찮더라구요",1.0,1개월 전
12,madams5ne,What a lovely chance to be able to see Florence Pugh and Emily Blunt at the movie premiere! So lucky!! Glad you enjoyed your trip! Did you go there with family?🫶,1.0,1개월 전(수정됨)
13,uservr6tm8le6i,헐.. 8월에 여행가려고 파리랑 런던 계획짜는 중인데~~!!! 언니 영상이라니!! 넘 좋아용️️,3.0,1개월 전
14,unge2254,런던 너무 가보고 싶고 좋아하는데 에바님이 가시다니...두 배로 좋아 ,0.0,1개월 전
15,singoyah,런던까지 섭렵하신 에바님 세계일주 해주세요..!!,0.0,1개월 전
16,useriy9wg4hx3m,저도 최애 여행지가 런던인데 다시 보게되니 설레네요,1.0,1개월 전
17,ig2094,진쨔 요즘 에바님 브이로그 폼 미쳤어요..,2.0,1개월 전
18,Cucumberhater,역시.. 해외여행 브이로그 맛집은 에바뿐.. 내겐 에바밖에 업슴… 혹시 영상 색감은 편집하실 때 보정하시나요 아니면 카메라 설정을 손보신건가요!??,16.0,1개월 전
19,Blue1204,안 그래도 요즘 너무 힘들어서 거의 매일을 울다 싶이 했었는데 마치 그런 저를 위로해주듯 에바님의 영상이 올라왔네요 감사해요 보는 동안은 다른 생각이 안 날거 같아요,3.0,1개월 전
20,jymoon2696,사랑해요 에바님 🩷 알림 뜨자마자 달려왔어요  오랜만에 올라온 여행 브이로그 잘 볼게요 :),2.0,1개월 전
21,woous767,"에바님~ 항상 영상 잘 보고있습니다! 제가 최근에 파리 여행다녀와서 더 재밌게 봤네요ㅋㅋ 호옥시 캐리어짐챙기는 영상?같은 건 생각 없으실까요?ㅠㅠ최근에 캐리어 싸면서 고민도 많이 하고, 캐리어 무게때문에 짐빼고 난리가 났더니 급 에바님의 캐리어가 궁금해서요~ 에바님은 여행 많이 다녀보셔서 왠지 고수이실 것 같아요!",0.0,4주 전
22,userju3nn9mk6e,에바 웅니 영상만 보면 행복해져서 너무 좋아요 ,1.0,1개월 전
23,cherrygrloiveof777,나도 런던여행가고싶다️,0.0,1개월 전
24,Romtoyou,"너무 잘 보고 갑니다..! 다른 분들은
어떻게 프랑스를 담고 계신지 궁금했어요 (편집자로써..) 예쁜 영상이네요",0.0,1개월 전
25,JJzc3zv,"You know, London is much more than Covent Garden and Soho. You missed on such gems such as Hampstead, Richmond, Sloane Sq, Marylebone, Parsons Green",1.0,1개월 전
26,userhyeon12,진짜 도라버려따 ~ 당신 때문에 난 이미 세계일주 다하고 있어  다음은 어디로 보내줄건데~ ️,7.0,1개월 전
27,nana120,"요영상 보니 영국에 다시 가고 싶은 느낌이
스물스물",0.0,1개월 전
28,Bominimini,"런던이라니 덕분에 대리
힐링해용",0.0,1개월 전
29,userej7de7si8p,언니 여행 브이로그 사랑한다고..ㅠㅠ,2.0,1개월 전
30,userdc4gm4cp4d,"에바 일상영상 너어어무 재밌고..
예나 지금이나 언제나 내 롤모델이심미더..♡",1.0,1개월 전
31,watson9410schannel,I feel like that cool English guy should of had more of a feature. He seems soo cool and interesting.,3.0,1개월 전
32,useroq2ii9lt3x,에바언닝 여행 브이로그 너무 좋아요,1.0,1개월 전
33,eunji2013,에바님 그롬 인생여행지가 어디인가요??! 멜버른이 제2의 인생여행지라고 제목봤는데 그것두 이젠 바뀌었나요?!! 영상 잘 보겠습니다!,9.0,1개월 전(수정됨)
34,uservc6yy5eh7d,"에바님+영국이라니 넘 재밌게 잘 봤어요!! 19:30 에도 나오는데 영상 때 많이 착용하신 십자가(?) 목걸이 넘 옙버서 ,,, 어디 제품인지 여쭤보고 싶아요..",0.0,1개월 전
35,Sunflower4,대리만족감 드네요~ 마지막에 사진들도 넘예뻐요,3.0,1개월 전
36,luminiuu11,에바웅니.. 오늘두 영상넘넘잘봤어요!!! 분량최고 ㅠㅠ ,1.0,1개월 전
37,cho826680,하..런던.. 잘 다녀왔다 ..~~,0.0,1개월 전(수정됨)
38,iis94,1등🫶 에바님 영상 보고있었는데 영상이 똭!! 이건 행운인가 ㅋㅋ,0.0,1개월 전(수정됨)
39,userbj8qc9te1v,에바님 파리 브이로그를 잘 볼게요,2.0,1개월 전
40,summer3,앗싸 내 힐링 올라왔다 영상 업로드 감사해요ㅜㅡㅜ,1.0,1개월 전
41,mins4397,다음은 스위스 여행 브이로그 기대합니당,1.0,1개월 전
42,Iovej,"나의 넷플릭스 같은 소중한 영상이 왔다 .. 
우리 겅쥬님…. 오늘두 이쁘시다뇨 ",1.0,1개월 전
43,Pillloveya,혹시 숙소 어디인지 알 수 있을까요? 영국 갔다왔던 작년 떠올리면서 완전 추억에 젖고있어요..🥹,0.0,1개월 전
44,leesr846,아 대리만족 쩌러요ヾ(＠⌒ー⌒＠)ノ,0.0,1개월 전
45,userkc4fi9hj7v,감사합니다 아주길게 영상만들어주세요,3.0,1개월 전
46,userpi4jq3th4b,영상분위기 대박조타 ........,1.0,1개월 전
47,uservw6cw2it3s,"자켓 진짜 박박 이뻐요 ,,!<<,!!<,,,,",0.0,1개월 전
48,dmf6004,자켓 산 거 지존 킹예뻐요,0.0,1개월 전
49,deapopova7296,Will there be english sub?️,1.0,1개월 전
50,Edie,wished i met up with you! next time you come i’ll show you around,1.0,1개월 전
51,calm7567,사랑하는 에바씨 영국 뷔로그에서 입은 옷 정보좀 공유해주면 안대영!?!부디 플리즈 제발~!~!~!~!~! 바지 정보 넘 귱금해요오오,0.0,1개월 전
52,userhd1dd4zd9w,정말 사랑해요 당신은 너무 아름답고 훌륭해요,1.0,1개월 전
53,tosunshine,30:30 이때 옷이랑 반지 둘 다 너무 궁금ㅎㅐ요…… 찰떡……,0.0,1개월 전
54,userqy8mb4uu8k,마지막 사진 모음 영상 너무 예쁜데요..?ㅜㅜ,1.0,1개월 전
55,user12346shwuabf,헐... 오펜하이머 부럽다.,0.0,1개월 전
56,yoojayoo,27:09 언니 여기서 입은 회색 나시랑 잠옷바지 정보 알 수 있을까요옹?!🩷🩶,0.0,1개월 전
57,userph3oq8hs4w,온니 근데 런던에서 어떻게 기차타고 파리를 가요..? 런던은 영국이라 섬 아녜여…?,1.0,1개월 전
58,useryr7ui4zz9n,에바 구독자 하면 방구석 세계 일주 어렵지 않다 이 말이야~~!~!~!,0.0,1개월 전
59,SONto4ip,에바EVA님 런던여행 재밌있었나요.,3.0,1개월 전
60,userws6xs7vt4y,혹시 숙소정보를 알 수 있을까요?!,0.0,1개월 전
61,userjp6nm6bq6v,우왕 가족들이랑 가신건가요?,0.0,1개월 전
62,userbj8qc9te1v,에바 EVA님 파리여행이 재미있었나요.,1.0,1개월 전
63,soyhello4708,캐리어 정보 궁금해요 이탈리아에서도 같은거 쓰신거죠??,1.0,1개월 전
64,roporo2847,43:22 웅ㄴㅣ.. 미모 무슨 일이신쥐..️,0.0,1개월 전
65,userhu5qs9dh9t,출국할 때 신으신 노란색 슬리퍼 정보 알 수 있을까용??,0.0,1개월 전
66,inseon5,"엉니 저 자켓은 얼마정도했나요옵,,,",0.0,1개월 전
67,ssoowon,언니 12일 그린셔츠 어디꺼죠 ㅠㅠㅠㅠㅠ 으악,0.0,1개월 전
68,yayahi3248,와악 런던🥹🥹🥹 혹시 선글라스 안흘러내리시나요?? 저는 왜캐 흘러내리는지 ㅜㅜ,1.0,1개월 전
69,newjinss,에바님 너무 이뻐요ㅎㅎ혹시 이 영상에서의 머리색 알 수 있나요? 탈색두 하셨을까요?,0.0,2주 전
70,hykim6219,18:30 지나가는 사람 디립다 찍는 줄 알았잖아요;;,2.0,1개월 전
71,JJyw9fr,안녕하세요~~ 숙소 공유 부탁드려요~,0.0,1개월 전
72,akinuakinu2087,,1.0,1개월 전
73,zeelee1775,자켓 어디 브랜드 인지알수있읆가용???,0.0,1개월 전
74,daji7187,미텻다,1.0,1개월 전
75,userxk4kc9xd5v,에바님 안녕하세요.,0.0,1개월 전
76,usernw6bn1xb9h,언니언니 그럼 저 투쿨 쿠션 추천하시나요??,0.0,1개월 전
77,lovvong,우롸,1.0,1개월 전
78,cosmemaiamaia3666,Olá Eva I love you yes..................,1.0,1개월 전
79,usercy7pu9gx9m,에바님 에바님,1.0,1개월 전
80,userhh7qv5wz7h,하얀 원피스 어디껀지 알 수 있을까요,0.0,1개월 전
81,RamGoy6bz,6:04,0.0,1개월 전
82,sjk697,여행유투버 왜 보냐고~에바보면 되는데,0.0,1개월 전(수정됨)
