,youtube_id,comment,like_num,comment_date
108,daenggi83,"저는 온 몸 전체에 각질이 잘 일어나서 때를 자주 밀었더니 예민한 피부가 되어서 이제는 때수건에도 상처가 나더라구요. 그래서 스크럽제 쓰는데 진짜 입자가 거칠어서 아프고 건조하더라구요. 
오늘 소개해주신 플루 프루티 바디 스크럽은 직접 사용하신걸 보니 각질 제거도 잘 되고 부드럽게 발리면서 촉촉한 피부까지 보장해주니 너무 마음에 쏙 드네요ㅎㅎ 각질제거 후 따가움은 이별하고 싶어서 플루 프루티 스크럽 꼭 사용해보고 싶네요.
또 제가 향도 민감한데 플루 프루티 스크럽은 상큼한 향과 빨래향이 좋다니 불면증에도 목욕 후에 자면 도움이 될 거 같네요^^",0.0,2개월 전
109,userop2gg1qs3v,스크럽 사용하고 난 후 건조한 제품들이 너무 많았는데 이건 뭐 바른 것마냥 촉촉하다고 하니깐 사용해보고싶네욧,0.0,2개월 전
110,hyunseo459,유명한 스크럽이라는 스크럽은 다 사용해봤는데 샤워 직후에만 부드럽고 별 효과를 못봤는데 이 상품은 꼭 사용해보고 싶네요 ㅠㅠㅠ,0.0,2개월 전
111,Sweetpotatopizzaa,N년째 브라질리언 왁싱하고 있는데 정착했던 스크럽이 없어지면서 마땅히 쓸 제품을 찾지 못했습니당ㅠㅠ한번 써보고 싶습니당,0.0,2개월 전
112,ddumni1209,"오콜없ㅋㅋㅋㅋㅋ큐ㅠㅠㅠ 진짜 정떨어져요 
저는 전 남자친구가 매번 뷔페가면 꼭 비닐봉지 가져가서 음식 챙겨오더라구요.. 진짜 경악했어요",3.0,2개월 전
113,sujenny4026,스크럽은 거의  겨울에만 조금씩 썼는데 이번 여름에 수영장 놀러가는데 각질 나오면 민망하니 사용해보고 놀러가고 싶네요 향도 여성스럽고 귀염깜찍한 분홍이로 사용해보고 싶네요 후기도 올려드릴께염️️,0.0,2개월 전
114,userll3xd6fv4y,요즘 바디스크럽 계속 찾았는데 플루 바디 스크럽은 자극이 덜 하다고 추천 해주셔서 한 번 사용해보고 싶어요!!🫶,0.0,2개월 전
115,userry7is2mw1n,"아 언니 진짜 귀엽다.!!! 오늘도 영상 너무 재밌어 아주 야무지게 혼자 수영도하고 룸서비스도 시켜먹고ㅋㅋㅋㅋ 언니가 추천하는 건 다 사고싶어.. 나 꽃게야도 야무지게 먹고,, 리프랩으로 기초제품 다 바꿨는데 이번에 스크럽도 사야하나봐!! 나 각질 제거해야하는데 어떻게 알고 이렇게 딱 해주는고양 ㅎ 이왕이면 당첨되면 좋겠다리 항상 디엠 보내면 읽어주고 조언해주고 관심가져줘서 고맙구 영상 많이 올려됴",0.0,2개월 전
116,userbl2zb1oz3l,"스크럽을 한번도 사용해본적이없었는데요 솔직히 여름이고 겨울이고 생각보다 각질때문에 난감했던적이 많아요 
 그리고 늘 얼굴피부만 신경썼었는데 최근에는 몸 피부도 관리를 해야겠구나 생각이 들더라고요 그중 첫번째가 각질관리라고 생각하고 있었는데 좋은 스크럽 제품 추천해 주신것같아서 써보고 싶단 생각을 하게되었습니다 ㅎㅎ 당첨 됐으면 좋겠어요!!!",0.0,2개월 전
117,usersl3xw7vk6k,플루바디스크럽 올영에서 언니얼굴보고 바로 구매해서 사용하고있는데 남자친구도 선물해주고 시퍼요.. 넘 좋더라구요 🩵,1.0,2개월 전
118,js2ua,요즘 피부 고민이 많아서 여러가지 사용중인데 딱히 맞는 제품에 아직 못 만나서 언니가 좋다고 하니 사용해보고싶어요!!!!,0.0,2개월 전
119,userpv7mv5bj8k,"헉 스크럽 유목민인데 저렇게 이쁜 패키지의 스크럽은 처음봐요... 학생때는 그냥 지냈지만 성인이 되고 나니까 피부 관리가 중요하다는걸 깨닫고 얼굴은 물론 몸도 관리를 해주려고 하고있는데 제가 바디 트러블이 심해서 알아보다가 스크럽이 좋다는걸 알게됐서요 그래서 스크럽 이것저것 쓰고있었는데 플루 스크럽 넘후 탐나네요.., (인스타 보면서 언니 피부에 감탄한사람) 저도 트러블 없는 매끈 촉촉한 피부를 가지거 싶어요...🥹🥹",0.0,2개월 전
120,Dayminkyoung,왁싱을 즐겨하는 편이라 스크럽 무조건인데 항상 피치 향만 써봐서 청순한 그린 몽 코튼 향 궁금하네요 ㅎㅎㅎㅎ 청순녀가 되고 싶어요 ㅋㅋㅋㅋㅋㅋㅋ저도 피부 건조한 편인데 보습감도 좋다니!!!!기대해봐야겠어요,0.0,2개월 전
121,userjv6ol7ox1d,온니 오늘도 영상 넘넘 재밌었어용,0.0,2개월 전
122,usercm6jp1gt5h,"오늘은 콜라가 없네용~~^^*ㅋㅋㅋㅋㅋ 빵터졌어요!!ㅋㅋㅋㅋ 임산부라 목욕탕을 못가서 팔다리 각질대박입니다.. ㅠㅠ
집에서 쓸수있는 스크럽제 찾아보는중이였어요~ 이벤트 신청해봅니당️️",1.0,2개월 전
123,userjw2on6xq1z,요즘 스크럽 관심갖고 있었는데 딱 언니가 이벤트를  스크럽 이벤트 열어줘서 감사해요,0.0,2개월 전
124,Youujiin,저도 언니 처럼 피부가 건조한편이라 항상 로션을 안발라주면 뱀 피부처럼 갈라지는게 고민이에요ㅠㅠ 그리고 다리엔 모공각화증까지 있어서 뭔가 여름에도 반바지를 잘 안입게되는게 있는데 바디스크럽제품 한번도 안써본 사람으로서 한번 써보고싶어졌어요 ! 여름이니까 브라질리언 왁싱도 해보려하는데 언니 후기도 듣고나니까 바디스크럽 효과가 중요한거같다고 느껴져서 사용해보고싶어요  그나저나 브이로그 많이 올려줘요 언니 브이로그가 제일 재밌다.. ♡,0.0,2개월 전
125,userup2ul9ix7t,반바지 입었더니 칭구가 뱀 같다고 그러고ㅋㅋㅋㅋ심각하다고 매일 그래욬ㅋ 나도 각질 관리를 해줘야겠구나..생각해써오.. 스크럽 살라고 했는데! 엉니가 추천해주신거 써보고 시퍼요 ㅎㅎ! 보습까지 해준다고 하니까 더 솔깃해요ㅠㅠ 매일 씻고 나오면 팔쪽이 특히 건조해서ㅜㅠ 히히,0.0,2개월 전
126,jea78,"언니 썰 들을 때 개개웃긴데 내 경우였어도 진짜 개정뚝,, 
인그로운헤어 관리되는 스크럽템 찐이야..? 언니 나 샤워할 때마다 스크럽하는데도 인그로운헤어 생겨서 이제 그냥 집순이로만 살기로 했어요,,(물론 원래 집순이지만..) 하지만 포기하지 않고 있잖아요,, 진정한 스크럽을 찾아서~",0.0,2개월 전
127,zajn9vd,왁싱하고 스크럽 보드라운거 해줘여하는데 ㅎ 프루티 스크럽 궁금하댜🩷 자주쓰던거랑 느낌 비슷할듯! 왁싱한지 얼마안됐응 때 플루 씨솔트 사해소금 샘플.. 굵은지 모르고 썼다가 깜짝놀람 ㅠ. 부드러운거 신상 써보고싶어효,0.0,2개월 전
128,hyezy,혼캉스 너무 부럽자너 휴가때 혼자 하러 가야지 안되게쑤ㅏ..🥹🥹 그때 프루티 스크럽 가져가면 언니 일정 손민수 쌉가넝 ㅎ 이벤트 참여하고 갑니다 총총총,0.0,2개월 전
129,userrb8kz9lw3y,아름송이 언니 짱짱 ,0.0,2개월 전
130,Babyjye,ㅋㅋㅋㅋ콧물ㅋㅋㅋㅋㅋㅋ언니진짜 솔직하고 귀엽다ㅜㅋㅋㅋㅋㅋㅋㅋㅋㅋㅋㅋ,2.0,2개월 전(수정됨)
131,zenffpp,여름에 스크럽 무조건이지!! 저두 지금 화장실에 플루 스크럽이 조금 남아있는데 향까지 좋아졌다..?이건 못참치…아름송이님 픽 향 체험해보고싶어요!!ㅎㅎㅎ,1.0,2개월 전
132,uservh1rk1ln8d,평소에 바디스크럽은 귀찮아서 안쓰는데... 이제 여름 오니까 슬슬 신경쓰이기 시작하더라구요ㅠㅜ) 힝 앎웅니 쓰는거 보니까 저도 써보고싶어졌어요 넘 궁금하네용,0.0,2개월 전
133,runtoast,일단 오늘 스크럽 보는데 색상이 예쁜것부터 쓰고싶은 느낌이 뿜뿜들었어융 자극도 엄청 안큰것같아서 한번 써보고싶네요,0.0,2개월 전
134,cookiecoo7784,다리를 면도기로 제모하는데 인그로운 헤어가 많이 걱정이에요 플루 신제품 프루티 바디스크럽은 인테리어 오브제처럼 패키지도 예쁘고 성능은 말해뭐해 너무 좋아서 각질탈락용 스크럽으로 목욕 중에 간편하게 힐링하면서 사용할 수 있을 것 같아요 ㅎ,0.0,2개월 전
135,uservm6tu3pd5g,"저도 얼굴 뿐만 아니라 피부 전체가 건조한 타입이라 스크럽제는 항상 쓰고 나면 몸이 너무 건조해지고 거칠어지는 느낌 탓에 잘 사용해 보지 않았는데, 건조함이 없는 바디스크럽은 처음이라 너무 기대가 돼요 ️️
피부가 약하고 예민해서 스크럽 알갱이가 너무 크거나 거친 제품은 오히려 독이 되기도 했는데, 이건 너무 마일드하고 연해서 정말 마음에 들어요. 
부드럽고 향기도 좋고... 몸에 각질이 많은 편이라 샤워할 때 스크럽하는 걸 좋아하기는 하는데 평소 스크럽의 단점이라고 생각했던 요소들도 싹 다 잡아준 제품이라니..!! 아름 언니 추천 템은 진짜로 믿고 봐요  비포 에프터 보니까 효과도 확실한 찐템인 듯요 ㅎㅎ",0.0,2개월 전(수정됨)
136,daeunda,처음 브왁하고 집에 있는 아무 스크럽 썼는데 순간 넘 따갑고 자극적이어서 무음으로 소리질렀어효.... 근데 플루는 각질 제거 효과도 좋으면서 저자극에 향까지 좋다니 ... 요즘 같은 때에 안 쓸 이유가 없잖아요???? 얇은 옹니 다리처럼 되고 싶지만 그거슨 불가능하니 스크럽으로 맨들맨들 다리라도 손민수 해야겠어요 죤 제품 알려주셔서 감사해용 🫶,0.0,2개월 전
137,HAPPYcho389,"지금 바디스크럽 유목민이었는데 똭 언니가 추천해주다니,,,진짜 써보고싶어요",0.0,2개월 전
138,userug5mj4dg7x,"아개웃겨.... 어른버전 정떨썰 듣고싶다 애들은 가라,,,",0.0,2개월 전(수정됨)
139,userbc9zt5lw3t,지금 타사 바디스크럽사서 몇번 쓴상태인데 알갱이가 너무 자극적이여서ㅠㅠ돈날렸다생각했는데 언니가쓰는거보고 정말 써보고싶네요~ 얼굴이랑 몸피부랑 다 건성이라 바디로션도 365일 달고사는 인간인데 꼭 플루제품으로 촉촉맨들 피부로 거듭나고시퍼요ㅠㅠ,0.0,2개월 전
140,usermr3fu2tg1y,플루 바디스크럽을 사용해본분들은 다 아실거에요 정말 좋아요 ㅎㅎㅎ 사용 후에 피부가 보들보들하고 부드럽고 바디로션을 바르지 않았는데 바른느낌까지드는 바디스크럽제품인데 제가 사용해본 바디스크럽 중에 1위가 아닐까 싶어요 그정도로 저는 사용하면서 정말 마음에 들었고 향기도 너무좋았답니다 ㅎㅎㅎㅎ 이번을 계기로 플루 바디스크럽이 많이 유명해졌으면 좋겠어용 너무 좋은제품이에요,0.0,2개월 전
141,chocosicbbang,ㅋㅋㅋㅋㅋㅋㅋ진짜 언니썰은 내용도 웃긴데 언니가 말하는 말투가 ㅋㅋㅋㅋ너무 욱겨요ㅜㅜ 콧물이 맛보기 직전까지 흘럿대 ㅜㅜ 에웅 ㅜㅜ,0.0,2개월 전
142,userqp8ud6zt8g,반팔 반바지입고싶지만... 모공각화증때문에 바디스크럽을 꾸준히 하면 사라진다고해서 찾아보고있는데 뭐가뭔지 하나도 모르겠고..... 나이스 타이밍으로 딱 스크럽 이벤트라니!! 이건 못참지!!!!!!!!!🫶,0.0,2개월 전
143,userxg4ke7ov4u,제가 중학생때 제모 한 번 잘못하고 그 다음부터 다리에 인그로운헤어가 생겨서 타사 제품 바디스크럽도 해보고 인그로운헤어에 효과 좋다는 바디미스트도 써봤지만 다 소용이 없었어요ㅠ 그래서 3-4년동안 여름에도 반바지를 입지 않고 긴바지만 고집해서 입고다녔던 기억이 지금은 대학생인데 제가 학과 특성상 준정장을 입어야하는데 그럼 치마도 입어야하고 살도 보여야하고 깔끔해 보여야하는데 자꾸 신경쓰여서 어떻게든 가리려고 스트레스를 받았어요 ㅠㅠ 플루 프루티 바디스크럽으로 꼭 전에 안 좋았던 스트럽 경험을 잊고싶어요🫶🫶,0.0,2개월 전
144,usersq6oq4di4v,아놔 나도 언니처럼 각질 제거하고 싶어요!!!! 스크럽도 웃끼게 하네요 ㅋㅋㅋ,0.0,2개월 전
145,usercz2md7mu4e,"브이로그 보다가 넘 놀랬어요
저도 모공각화증 때문에 학생 때 부터 고민이였거든요 
피부과 가도 약간 이상한 냄새나는 바디로션..? 만 사라 하시고 발라도 효과도 없어서 포기하고 지냈는데 ㅠㅠ
얘기 들으니 다시 희망이 생기네요 
인그로운 헤어에도 효과좋다니..! 저처럼 제모 하시는 분들 ㅋㅋㅋ 솔깃하실 것 같아용
이번 기회에 한번 체험해보고 싶습니당!
송충이들을 위해 좋은 이벤트 열어주셔서 넘 감사해요
한아름송이 최공 ",0.0,2개월 전
146,hannahhx6fs,여름이라 스크럽 한창 찾아보고 있었는데 넘 조아보여요!!!! 써보구 싶습니댜,0.0,2개월 전
147,userxi4rw6ng8k,언니 혼자 편의점 야간 알바할 때 언니 유튜브 틀어놓고 하면 인생이 조금은 살만해진답니다.. 살앙해요.. 저 어제 인생 첫 브라질리언왁싱했는데.. 수딩젤만 사고 스크럽을 못 샀어요.. 인그로운헤어.. 무서어..,0.0,2개월 전
148,userjn8rj4xm2i,오늘도 좋은 제품 소개 감사합니당 저눈 신기하게 얼굴은 기름이 생기는데 몸은 건조해서 참 답답한 몸이라 이제품 한번 사서 써바야겠군요항상 좋은 제품 가르쳐 주셔서 감사합니다 오늘도 화이팅 하세요,0.0,2개월 전
149,userkr5lx6mt2m,등드름이 많아서.....ㅠㅜㅜㅜ꼭 한 번 사용해보고 싶어요!!! 뭘 해도 등드름이 사라지지 않아서 걱정이 많아요ㅠㅠ예쁜 여름 보내고 셒어여ㅠㅠ,0.0,2개월 전
150,useryi4fs7lf7f,저두 언니처럼 뱀살피부여서 겨울엔 심해지고 여름에도 보습크림 안발라주면 하얗게 뜨는데 얼굴만 스크럽해보고 바디스크럽은 해본적이 없어요 언니의 추천템으로 올해 여름 빤딱빤딱한   맨살피부로 예쁜옷 입구싶어용,0.0,2개월 전
151,allham,"식탐진짜.. 최고의 정뚝떨 포인트 같아요..ㅠ
진짜 좋아하면 모르겠는데 약간 식었을 때 그래서 그런가..
전남자친구랑 친구들이랑 같이 찜닭먹는데 친구들 인원이 훨씬 많았는데 거의 찜닭의 반정도를 나랑 둘이 먹겠다고 가져오고.. 애들이 너무 많이 가져갔다고 하니까 아닌척 은근 투덜거리면서 아닌데..~
애도 아니고.. 근데 옆에서 나 일하는동안 그많은 찜닭에 고기만 다 건져먹고 진심 고기 두점인가 남아있고 당면약간에? 양파만......
개빡쳐서 난 양파좋아하니까 좋네~~ 이랬더니 진짜 눈치없는지
“넌 양파랑 당면만 남아있으니까 오히려 좋겠네~~”
먹다남은 양파랑 당면만 건져먹으면서 헤어질결심을..",2.0,2개월 전
152,hwyvly22,저도 몸이 많이 건조한 편이라서 각질 스크럽을 쓰는 편인데.... 각질 스크럽 치고 너무 예쁘네요..써보고 싶을 정도로 너무 패키지가 예뻐욤,0.0,2개월 전
153,userxj3li6vu2g,언니 처럼 매끈한 피부 넘 갖구 싶다 ... 심하진 않는데 군데 군데 건조하게 하얗게 뜰 때가 있더라구요? 때를 밀기엔 애매하구 .. ㅎ 바디스크럽 사용하면 딱 좋을듯 해요!! 꼭 제가 이 제품 쓰고 언니처럼 이쁜 피부 갖고 싶네용!! 언니 영상 항상 잘 보고 있어요 ~ 우리 오래 보아요 ️️,0.0,2개월 전
154,userfh7pu8wz6u,"브라질리언 왁싱받으면서 인그로운헤어가 생겨서 고민이 많았는데 이제껏 써본 스크럽들은 자극이 많이 가서 순하게 쓸 수 있는 스크럽 찾고 있었어용 
비건제품이라하니 너무 궁금해서 쓰고 싶어용 항상 영상 잘보고있습니다 🫶🫶",0.0,2개월 전
155,usertz2rk4wu6w,운니 나 예전에 플루 바디스크럽 써봤는데 넘 좋더라고~근데 그거는 튜브형이었어서 이번 기회에 단지형 써보고 싶다!! 플루 진짜 좋음… 문질문질해주고 물로 씻는 순간 보들함과 촉촉 매끈함이 느껴짐 진짜임;,0.0,2개월 전
156,userdb5bk8hl2m,어렸을때부터 모공각화증에 닭살피부라 굉장히 스트레스를 받았어요 그래서 보이기싫어서 여름에도 긴옷 위주로입고다녔답니다 그래도 관리를조금했더니 지금은 조금 좋아졌어요 언니처럼 관리를 해주면 괜찮은데 관리에 소홀해지면 금새 또 올라와요 ㅠㅠ아직 바디스크럽제를 정착할 인생스크럽을 만나지못해서 플루 스크럽사용해보고싶어요~~,0.0,2개월 전
157,goeunk,"오콜업 뭐야.. ㅋㅋㅋㅋㅋㅋ 심지어 안 채워두는 부분도,, 하얀 각질 완전 제 얘긴데 바디케어에 신경 좀 써야겠어용  스크럽 당장 구입해야지 ",0.0,2개월 전
158,userxf3ls7yi8g,아름송이님 추천 믿고 써요!!!! 근데 플루하면 스크럽인걸로 알고있는데 ㅎㅎ 역시 꿀 정보만 주시네요,0.0,2개월 전
159,byungjunmun2864,"급 혼캉스 떠나구 싶네요 ㅠ
재밌게 잘보고 또 좋은제품도 사러갑니다",0.0,2개월 전
160,sakik3663,오늘도 재미있게 봤습니다제가 남자친구한테 정 떨어진 순간은…남친 집에 처음에 놀러갔을 때 화장실에 휴지심의 피라미드가 있는 걸 본 순간이었어요. 휴지심을 쓰레기통에 버리는 것이 귀찮대요….,0.0,2개월 전(수정됨)
161,userwv3zh6tc4b,ㅋㅋㅋㅋㅋㅋㅋㅋㅋㅋㅋ전남친썰 넘웃겨용 ㅜㅜㅜㅋㅋㅋㅋㅋ 콧물 ㅋㅋㅋ,2.0,2개월 전
162,jeolmi7210,"개꿀잼 어카지 ㅋㅋㅋㅋ정뚝떨 썰 너무재밋숴여ㅠ
엉니 저도ㅜ겨드랭제모 하는데 먼가 착색잇구 칙칙해서 너무 거슬려요ㅠㅠ 팔뚝도 제모하는데ㅡ뾰루지올라옴 언능 플루 스크럽으로 조져보리고시퍼여><",0.0,2개월 전
163,ryhhha,너무 재밌당..︎,0.0,2개월 전
164,userbj4ym4ut5o,플루 쓰고 매끈 광채 피부 되고 시퍼요 !!!!!! 아름송이 짱짱 최고 ,0.0,2개월 전
165,ariel2484,"제가 작년?부터 바디스크럽을 필수로 쓰기 시작했는데 아직 플루는 안써봐서 궁금해요!
그리고 패키지가 갬성,, 받아보고싶어요",0.0,2개월 전
166,usernx9nu7hz4t,메말라인간그잡채 써보고싶슴당 바디스크럽 입문템으로 써볼래요오,0.0,2개월 전
167,uservx9zh3bn1v,안그래도 바디 스크럽 뭐 살지 고민중이었는데 마췸 이렇게 또..~ my body는요.. 쩍쩍 갈라지는 건성 중 건성이란 말이조 보습도 중요한데 향도 신경쓰는 민감한 뇨자 바로 접니다 호호 but 언니가 쓰는 제품? 고냥 바로 결제 갈겨 🩶,0.0,2개월 전
168,kimminson315,플루 프루티 바디스크럽 사용해보고싶어요.입자도 안 거칠고 색소도 안 들어가서 안심됩니다! 비건제품이라서 좋고 매끈하고 부드러운피부를 만들고싶어요 ,0.0,2개월 전
169,useryy3ry6lz6y,"아웅 진짜,, 지금 내 고민덩어리에 가장 적합한 광고🥹
어릴 적부터 늘 달고 지낸 모공각화증..
팔뚝 손목 종아리… 진짜 지긋지긋
좋은 스크럽 사용해서 모공과 싸우고 올 여름 뿌수고 싶댜요!!!!
글고,, 오늘도 당신 말빨.에. 실실.쪼개며 감.",0.0,2개월 전
170,userqv7hn9fq9s,"제모도 안 한 다리와 팔에 인그로운헤어가 자꾸 올라와 바디스크럽을 이것저것 써봤는데 딱히 효과가 없는 와중에 
플루를 안 써봤지 뭐에여~!
리얼슈가와 aha성분이 들어 있어 각질케어에 효과적이며 유럽산 오일 6종과 히알루론산 8종이 들어있어 보습도 잡은 플루 바디스크럽! 탐난다 탐나",0.0,2개월 전
171,userks1xx5wh7t,이언니 진짜~ 내가 필요한것만 쏙쏙 가져와버리네 나 미쳐벌여ㅜㅜ 다리에 인그로운헤어 잘생겨서 맨날 박박 밀고다니는데ㅜㅜㅜ 그러면 살갓너무 아파서 잘 하지도 못하고 못하면 생기고 생겨서 하면 아프고…ㅜ 이럴수업어~~~~ 그리고 정뚝떨 모먼트가…너무 비슷해서 감짝 놀랬어요~~ 미친다..이언니 너무 좋아,0.0,2개월 전
172,eay0950,"언니 저 얼마전에 헤어졌는데 상대가  계산적이고 이기적인게 눈에 보여서 너무 정뚝떨이라 헤어졌어요,, 만난지 얼마안되어서 데이트통장을 하자더니 만나는데 모든 비용을 데통으로 해결하려하더라구요 저랑 가치관 너무 안맞고 만나고있는 순간이 행복하지않아서 헤어지자했어요!! 이제는 솔로ㅎㅎ 다음엔 있는 그대로의 저를 좋아해주고 하나라도 더 챙겨주려 하는 남자 만나고싶어요",0.0,2개월 전
173,usersj5tg3ww3e,"요즘 바디스크럽에 관심이
너무 많아서 이것저것 찾아보는중인데 영상보니까 플루꺼 조아보이네요 …? 🫧",0.0,2개월 전
174,userju5nz3tc7y,"언니 제 정뚝떨 썰은,,
전 맞춤법 정떨어져요,, 콧털 튀어나와있을때, 인중만 털 잘 못 깎았을때, 발톱 긴 사람, 손톱 더러운사람, 목이나 어깨 등쪽에 뭐가 우둘투둘 나있을때,, 저는 사람한테 실망을 잘 하지 않는 것 같긴 한데 신체적으로 정뚝떨이 있는 거 같아요... 그래서 자기 관리 잘하는 사람이 좋아요!!",0.0,2개월 전
175,userko6sw3hm7d,제 몸이 왜그런지 모르겠는데 바디로션도 바르고 해도 각질이 잘 사라지지 않더라고요 제가 지금  각질 사라지게 만드는 걸 찾고 있거든요 언니가 추천해주신 제품 꼭 한번 써보고 싶어요 오늘도 영상 올려주시고 이벤트까지 들고와주셔서 감사해용,0.0,2개월 전
176,userwf3ez2cl2m,모공각화증있어서 스크럽필수인데 스크럽고질병인 건조해지고 자극적인게 늘고민이었는데 플루스크럽은 그렇지않은거같아서 써보고싶어요~~,0.0,2개월 전
177,HJnf7oh,"와 저도 뱀살다리&모공각화증 유저로써 스크럽 없이 못살아여,, 자두향 러버인디 피치플럼 향 궁굼하네여 아 글고 ㄹㅇ 마음에 차이인게 콧털에 콧물 맺혀있는 애가있었는데 ㄹㅇ 넘 정뚝떨이었는데 지금 남친은 콧털나와도 귀여움 ,,ㅋㅋ",1.0,2개월 전
178,,저는 아직까지 어떤방식으로 제모를해도 무조건 인그로운헤어가 생기더라구요ㅠㅜ 이번에 플루 바디 스크럽써보고 인그로운헤어 벗어나서 광명찾고 정착템으로 만들고싶어요!!! ,0.0,2개월 전
179,gjjghjjj3836,콧물 개웃겨요 ㅠ 귀여움,2.0,2개월 전
180,uservs3lw4mo8d,저도 모공각화증도 있고 여름이라 제모를 하다보니까 인그로운헤어도 고민인데 특히 겨.....착색...도.....신경쓰이고ㅠㅠ 피부가 민감한편이라 다른 스크럽제들도 써봣는데 올영에잇는것도ㅠㅠ 하고나면 건조하고 하면서 아파서 뭐 어떻게 해야될지모르겟더라구요ㅠㅠ마침 8월에 수영복 입을일이잇는데 사용해보고싶네용,0.0,2개월 전
181,usermx9ts6xe5q,제가 악건성이라 아토피도 있고 피부가 굉장히 예민해서 스크럽 쓰기가 힘들었는데 영상 보고 좋을 거 같아서 써보고 싶습니당,0.0,2개월 전
182,deepgreentea,"아우.. 당연하다는 듯이 계속 먹고 채워놓지도 않고 그러면 화날 거 같아요,,",1.0,2개월 전
183,userju1ue8sn4b,플루 튜브형 너무너무 좋하는데 아름송이 추천템 꼭써보고싶어요~~,0.0,2개월 전
184,useryq6db2gm5g,플루 바디스크럽 진짜 좋아요!!,0.0,2개월 전
185,jinius506,"씻으러 들어가기만 하면 각질땜에 손으로 벅벅 밀어내느라 샤워만 1시간 하는데 오히려 더 자극되고 안 그래도 건조한데 너무 오래 씻으니까 악순환이 반복되는 느낌이에옵.. 바디로션을 바르자니 외출하면 땀이랑 섞여서 더 찝찝해지고ㅠㅠ 팔꿈치 보이는 날이면 허옇게 각질있을까봐 중간에 핸드크림이라도 발라주고..그래서 6월부터 올영 스크럽 제품들 눈여겨보고 있었는데 나이스 타이밍입니다 이번 기회에 좋은 제품 만나서 제발 당당히 팔꿈치, 뒷꿈치 드러내고 화장실에서도 일찍 나올 수 있게 도와주십쇼",0.0,2개월 전(수정됨)
186,hyuxxis,왁싱하고 있는데 스크럽은 딱히 필요성을 못 느껴서 해본적 없는데 인그로운 생기는거 첨 알아서 한번 해보고싶어욥:),0.0,2개월 전
187,userkp8de1zu4u,"가드름 등드름으로 꽤나 스트레스 받고있는 저인데요•• 노출의 계절 여름이 아니더라도 앞으로도 촉촉하고 매끈한 피부를 가지고 싶어 신청합니다! 얼굴 피부 만큼이나 바디도 중요하니까요,, 갑자기 올해부터 바디 스크럽 관심이 생겨 제품 찾아보고 있었는데 사용했던 제품은 스크럽이 약한 느낌이 들기도 하더라구요옷..? 그래서 스크럽 새로운 도전을 하기가 주저스러웠는데 이렇게 좋은 이벤또를 해주신다니 주저말고 바아로 신청하게 되었슴돠 - ! 좋은 이벤트 열어주셔서 감사하궁 .. 아름송이님의 매번 올라오는 썰 잼게 듣고 있구 브이로그도 애정하구 앞으로의 영상도 기대할게요 히히 저희 엄마랑도 애정하며 챙겨본답니다 ..? 은근 살림꾼이시고 야무지시고 재미난 입담 덕분에 힐링해요",1.0,2개월 전
