,youtube_id,comment,like_num,comment_date
0,soosooha,"여러분 안녕하십니까~!~!
또 즐거운 주말이 찾아왔네요.
요번 주말도 대체공휴일이 껴서 연휴가 되었네용!
역시 한글은 위대해(?) 
모든 언어 중에서 솔직히 한글이 넘사라고 생각함
뭔 소리든 한글로 다 쓰기 쌉가넝;; 맞다 아닌가요
 
제가 요즘 생각할 것들이 많아서 영상 촬영을 자주 안했더니 
텀이라도 짧게 업로드 했어야 했는데 죄송해요. 흑흑
 
추석때 커뮤니티로 올린 구구절절문(ㅋㅋ) 내용처럼
제가 오랜 기간 채널명 변경에 대해 고민해왔는데
이제,, 결정을 내릴 타이밍인 것 같습니다,, ㅋ
 
조만간 짧은 정리 영상으로 다시 말씀드릴게요!
 
날씨가 엄청 추워져서 저 어제 수면바지랑 수면양말 신고 잤어요.
ㅋㅋㅋㅋㅋㅋㅋ
이렇게 추워지니까 미역국 더 맛나게 먹은듯
고소한거 좋아하시면 미역국에 체다치즈 한장 넣어서 츄라이 해보세yo
난 넘 맛나게 먹었음!! 
 
요번 주말도 행복한 일들로만 가득하시길 바라면서 
저는 이만,, 총총 
 
오늘도 끝까지 봐주셔서 감사합니다!
Thank you for watching my video!",2.0,11개월 전(수정됨)
1,userje3gw8je5p,헉 미역국에 치즈 먹는게 나 뿐인게 아니었다니!!!!!!!!!전 치즈 젓가락으로 슉슉 등분해서 밥+국 위에 하나 올리고 먹어요 지금도 먹구 있음,0.0,10개월 전
2,useruc4gc3tf9n,수하님! 영상 잘 보고 있어요! 혹시 곤약밥 반 덜어드시고 남은건 어떻게 보관하시나요??,0.0,11개월 전
3,hyeminson8593,인스턴트 국이랑 반찬들 괜찮나요? 저는 살면서 단무지 말고는 사먹어본적이 없.... 몸에 안좋을거 같다는 선입견 ㅋㅋㅋ 채널명 기대할게용 궁그미궁그미,0.0,11개월 전
4,userbn7id7ro2s,키랑 몸무게가 어떻게 되시나용 ??,0.0,11개월 전
