,youtube_id,comment,like_num,comment_date
0,happycomeout,"저도 딱 일주일전에! 입꼬리 보톡스랑 필러 맞고왔는데 한창 고민하다가 언니영상 보구 결심하고 예약하고 맞았는데 너무 과하지 않게 되서 완전 만족중이에요! 너무 쀼- , 뜌- 하게 되면 후회할 거 같았는데 다행히 잘 받고 왔습니다ㅎㅎ 멍도 생각보다 많이 안들어서 다행이에요️ 양치 할때 조금 거슬리긴 했는데 지금은 전혀 그러지 않아서 만족스럽습니다ㅎㅎ 언니 영상보고 필러 맞은게 아니라!! 그냥 언니 영상이 도움이 되었어요ㅎㅎ 사실 입술필러 후기가 없는 병원이라 고민했는데 다행히 섬세하고 잘해주시더라구요ㅎㅎ but,,, 시술이라도 신중히 고민하고 해야합니다 여러분… 저두 입꼬리 내려가있는게 고민이라 엉청 고민하고 했답니다…️ 영상 잘보구가요 알럽뿅",0.0,4개월 전
1,heesonghee,입술 필러 요즘 계속 하고 싶어서 언니영상 다시 보러 왔어여 ,5.0,8개월 전
2,usertz6sl2we6v,안녕하세요! 얼마전에 렌즈 검색하다 윰님 렌즈 후기영상보고 두눈이랑 하파에서 렌즈구입 했었어요!  오늘도 우연히 이 영상이 뜨길래 봤는데 영상도 너무 재밌고 좋은 팁이 많아서 구독했습니당!!! 그리고 같은 대구분이라 뭔가 더 정이가요..♡ 원래입술도 예쁘셨는데 이번에 하신건 진짜 너무너무 예쁜거같아요ㅜㅜㅜ 정보 디엠드려도 될까요!?,7.0,10개월 전
3,cookiejj2go,"입술 얼굴에 조화롭고 넘 이뻐요 ㅎㅎ 항상 시술 정보 꼼꼼히 알려주셔서 유용해요 
혹시 이번 영상에 나오는 렌즈 정보 알 수 있을까요??",8.0,10개월 전
4,userte4bj2cj1r,헐 저도 슈링크 마취도 안하고했는데 하나도 안아파써요...효과도 없었곸ㅋㅋㅋ 3D코어리프팅은 적당히 찌릿하고 효과는 좋아서 만족중ㅋㅋㅋ아언니보니까 입술필러 하고싶어요ㅠㅠㅠㅠ,6.0,9개월 전
5,syk6353,"입술 완전 이쁘게 잘되셨어요!!
눈가 관리는 어떻게 하고 계신가요?ㅠ눈가주름고민입니다",0.0,3개월 전
6,sys9078,증말 말도 예쁘게 하시고 얼굴도 예쁘셔유 ㅎㅎ,3.0,10개월 전
7,userde1gg6jv7e,"입술필러에 요새 관심 많은데 딱 떴네요..!! 그런데 여기에 입으신 옷들 .... 너무 잘어울리시고.. 매번 댓글로 어디꺼냐고 묻는거같은데..... 또 여쭙네요 ㅠㅠ ㅠㅠㅠㅠ 
4:29 파란색 니트... 
7:29 하얀색 비니... 
3:50 검은색 맴투맨..? 
13:06 다크그레이 휴드티....
어디껀지 너무 궁금해요...🥹",8.0,10개월 전
8,uservc8sb6bk9m,윰언니 오늘도 잘생쁨🫶 언니영상보고 백옥주사 맞기시작해ㅛ는데 술도 더 잘먹..아니 얼굴도 화사해지고 술자리도 무섭지않아여 입술필라도 뽐뿌와예..,4.0,10개월 전
9,sujeongkim4936,언니ㅠㅠㅠㅠ저도 병원+원장님 정보 좀 부탁드려요ㅠㅠ 필러 생각중인데 딱 언니 입술!! 너무 이뻐요,0.0,4개월 전
10,Hrong,"언니 원래 예쁜데 이번에 진짜 입쯀 예뿌게대쏘,,,,",4.0,10개월 전
11,usersn4pk4kq5n,저는 필러한지 5년전에 한게 아직 좀남아있는데 오히려 좋더라구요! ㅎㅎ또하고싶기도한데 엄마가 극구반대를하셔서ㅠㅠ,5.0,10개월 전
12,userul1wv5mr1l,혹시 입술 필러 맞으신 병원에서 녹이고 같은 병원에서 다시 맞으셨나용ㅠㅠ? 녹인 비용도 궁금해요!,2.0,7개월 전
13,geniefarm6542,저두 유행했던 입술이라 싹 녹이고 자연스럽게 다시 맞았어요ㅠㅠ 그기분 너무너무 암…!!!,3.0,10개월 전
14,usergm5fy4rf8e,입술필러는 얼마에 한번 맞나요?,0.0,3개월 전
15,Vivianatelier,정말 잘생쁨의 정석..🫶,40.0,10개월 전
16,userwv8mz9lv6j,슈링크유니버스 받고 나서 홈케어 기기는 언제부터하는게 나을까요,0.0,3개월 전
17,userly4zj8cn7j,자반증 보이시면 피검사 한번 해보세요! 면역력 떨어지면서 혈소판 문제 있을수도있어요!!!,2.0,9개월 전
18,userce9rz6ve9b,ㅋㅋㅋㅋㅋㅋㅋㅋㅋㅋ 귀여운 구름이 셀룰라이트 구름이었어 ㅋㅋㅋㅋㅋㅋㅋ 평생 못잊어 ㅋㅋㅋㅋㅋㅋㅋㅋㅋㅋㅋ️️,2.0,9개월 전
19,userxn8js7nh5k,"시술 후에 에이지알 써도 괜찮나요?
보톡스나 필러가 빨리 빠진다거나 그런건 앖나용?",2.0,10개월 전
20,eunhyelee2069,슈링크 유니버스는 몇샷 맞으셨나욥?!,2.0,9개월 전
21,userqy4fv3mc5b,시간 지나면 원래 자기 입술로 돌아오나요?,0.0,6개월 전
22,userpz6gk6lj3j,입술필러 문의 메일보냈어요^^ 너무이뻐요,0.0,7개월 전
23,hyejinkim2252,"팔자보톡스 하지마셔요
나중에 앞광대 진짜 다 사라져요 완전 평평한 얼굴되어서 완전 스트레스 받았던적있었어요
보톡스가 풀리고 계속 앞광대 운동해줬더니 어느정도 회복되긴햇지만 ㅠㅠ 절대비추요ㅜ",4.0,9개월 전
24,userdq4tp9gr5m,언니.. 어디서 시술하셨는지 지금 어쭤보면 너무 늦었을까요??ㅜㅜ 대구사는데 입 비대칭이 너무 심해서 언니 영상보고 결심하게됬고 받고싶은데 병원 정보가 너무 궁금해요,0.0,2개월 전
25,userxp5xb7lb4k,언니 미간보톡스 맞으시고 쌍꺼풀 안얇아지셧나여?? 그런 부작용 빈번하다해서 못하고 잇는즁 ㅠ,1.0,3개월 전
26,userfjo871djqo,"언니 혹시 팔자보톡스? 또 맞으실 생각 있으신가요? ㅠ ㅠ,, 저는 오늘 입술필러 맞았는데 팔자주름 필러도 맞아야 한다해서 맞았는데,, 효과를 잘 모르겠던데 혹시 지금 좀 달라지셨나요 ? ? ,, ㅎ",1.0,9개월 전
27,nnancy5767,전 입술 만지고 뜯는 습관 있어서 1년도 안돼서 입술필러 다 빠진것 같아요,0.0,6개월 전
28,userpz8mj9th9k,와 눈이 진짜 이쁘다,1.0,4개월 전
29,userbf3zc6ik6d,"토닝50번 실화인가여 ㅜ..ㅡ  피코는조금더 짧은지요 (시술기간)
좋은말씀 감사해요 ♡♡",0.0,3주 전
30,userni9mj8kw4b,"코 수술하시고 피어싱은 다시 뚫으신 건가요? 저도 8월에 코수술 했는데 피어싱 하고 싶어서요~! 염증 난다고 하지 말라는 사람들도 있규,,, 무섭규요,, 괜찮으신가윰?",1.0,10개월 전
31,qkrwn7500,안녕하세요 대구 사는데 입술필러 병원 정보 알 수 있을까요?,1.0,10개월 전
32,hyeonskim4321,입술필러 병원 정보 부탁드립니다,1.0,5개월 전
33,hyeric8754,저도 입필발품파는중인데 혹시 병원정보 디엠으로 문의드려도될까용?,2.0,9개월 전
34,jeesunkim2200,입술필러 병원 알려주실 수 있나요?,1.0,6개월 전
35,brebrebre9054,입술필러 국산인지 수입인지 알 수 있을까요?! 필러명을 자세히 알고파용 ㅠㅠ,3.0,9개월 전
36,userin8mc4ck8u,혹시 디엠으로 정보 물어봐도 되나용?,0.0,7개월 전
37,useriy6vr5it6s,입술필러 병원정보좀부탁드릴게요~~~,0.0,2개월 전
38,lazymint363,입술필러 병원 여쭤봐도 될까요? 몇년전에 한번 망하고 안했는데 다시 시도해보고싶어서요,2.0,10개월 전
39,userci9dj8su2y,입술필러병원궁금해요^^,0.0,6개월 전
40,userjk3og3dw5p,윰님 혹시 지방제거하는건... 슈링크보단 인모드겠죺,3.0,10개월 전
41,tinechris6241,구치온 백옥주사는 원래 생리식염수에 섞어서 맞아요ㅋㅋㅋㅋㅋㅋ 물을탄다고 하는 구독자는 뭔소리를 하는건가..가루를 맞을셈인가...ㅠ 지나가던 간호사 의아해서 댓글달아요,4.0,7개월 전
42,usertq7qb6gj8k,5:50초 목걸이 정보 알수있을까요?!,1.0,9개월 전
43,chohyek,필라 정보 얻고 싶어서 디엠드렸는데 부탁드립니다,0.0,7개월 전
44,journey5211,음...? 전 후 차이가 없는데 원래 이쁘신데요????,5.0,6개월 전
45,userrm5ti2po3k,14:39 포토샵 앱 무슨 앱 인가용?,1.0,8개월 전
46,useriy8dg6ts6x,렌즈 너무 궁그매용... ㅜ,2.0,1개월 전
47,usertc7lp5zo3g,헉수 넘 예뻐요 병원 서울쪽에 잇나용?,5.0,10개월 전
48,jinmk7fp,사량헤요……,1.0,10개월 전
49,userru5xc8ul7h,메일이나 디엠 확인 부탁드려요🫶,0.0,9개월 전
50,myjju5026,실례지만  혹시 디엠이나 메일로  정보 여쭤봐도 될까요???,3.0,10개월 전
51,userfr4dr2xi1p,디엠 확인 부탁드려요ㅠ,0.0,2개월 전
52,Ponypunny,언니 소바 .. 어디인가용 넘 마싯써 보야요,2.0,6개월 전
53,userru5xc8ul7h,디엠 확인 부탁드려욥 ㅠㅠ,4.0,9개월 전
54,usermo3ne5ki1l,0:16 같은 사람 맞아요??,2.0,9개월 전
