,youtube_id,comment,like_num,comment_date
0,RYUSPENNA,"한국 돌아오자마자 한 일 = 빈티지 쇼핑!! ㅋㅋㅋ 
왕창 부어있는 날 신나서 구제 쇼핑 하고 왔어요 많이 건진 거 같죠?!!",37.0,1년 전
1,dewrain,"언니 빈티지 투어는 넘나 환영인,,,
딱 빈티지 스러운 예쁜 것만 집는 것도 대리만족️‍",13.0,1년 전
2,orangep,거의 소화제 수준으로 옷을 소화해 버리는 류스펜나님~ 다 이쁘고 다 잘 어울려요 빈티지 샵인데 깔끔하게 정리되어 있어서 구경하는 재미가 있을것 같아요~,4.0,1년 전
3,uservp3cu7ie1i,마음에 드신 옷을 발견하셨을 때 눈이 반짝반짝하시네요ㅋㅋㅋㅋ  기회가 된다면 창고형 빈티지샵 꼭 방문하고 싶어요 !!  성격때문에 직원분이 계속 붙으시는 곳가면 혼자 눈치보는 타입인데 넓고 쾌적해서 좋은 것 같아요,7.0,1년 전
4,userty1jz8nv9c,진짜 고르는 족족마다 다 너무 이쁜옷ㅠㅠㅠㅠ 대리만족 하거 갑니당,35.0,1년 전
5,misaki6735,I really like vintage style too but I don't have so much ideas in my mind but when I came to your channel you really give me the inspiration thank you so much for that  ,3.0,1년 전
6,userwy8nl2il4s,언니 쇼핑영상 너무 힐링이에요.. 자주 해주세요!!,2.0,1년 전
7,usermm6fi2gu7b,하…대리만족 빈티지 쇼핑 시리즈 넘 재밌어요! 서울 빈티지숍도 한번 가주세요,2.0,1년 전
8,osm884,언니가 입으니까 다 이뻐요…,2.0,1년 전
9,usersf4ui4qz3u,"여기 같은 건물 위층에 있는 슈퍼식스라는 빈티지샵도 재밌더라구요ㅎㅎㅎ
비바무역만 아는 분들 많은데 간 김에 둘다 둘러보세요!",3.0,1년 전
10,lisajinkim1991,빈티지 제품들 너무 잘어울려요 경아언니,1.0,1년 전
11,day3420,"언니하면 빈티지죠 역시,,, 빈티지 사면 수선할 생각해야하는거 너무 인정이에요ㅎㅁㅎ 예쁜데 크거나 기장이 애매한게 많아요,,, 근데 막상 사면 귀찮아서 그냥 입는 것도 많아용ㅋㅋㅋㅋㅋ",2.0,1년 전
12,nicknamesky97,펜나님이 입으면 다 예뻐요~펜나님 당당한 모습 항상 부럽고 존경스러워요~,1.0,1년 전
13,userrg5kv7lz1z,완져니 핫걸 이잖아유…ㅠㅠ 예뻐요 언니ㅜ 저도 빈티지 가끔 사는데 비니버스 앱 에서 보면 빈티지 제품 다 모아놔서 좋더라구요! 추천추천! 거기 제품들도 리뷰해주세요..!,3.0,1년 전
14,userbi9ln8mu1r,언니 특유의 말투가 너무 귀엽고 조아요️,1.0,1년 전
15,userud6tx5nl7e,벨트 고를때 '이것도 찜..ㅎㅎ' 하는거 진짜 귀여워요 언니ㅠㅠ 열번돌려봐따,1.0,1년 전
16,userek2hv6jm1n,요즘 언니 영상만 기다리고 있어여ㅠㅠ 언니 태풍 조심하고 항상 행복해야대용,4.0,1년 전
17,lemaire4775,기다렸던 빈티지 브이로그 !! 아껴봐야겠어요,1.0,1년 전
18,userfp4ko6ki2m,노란색 져지 귀요미인 언니랑 너무 잘어울리고 깜찍해요,4.0,1년 전
19,userdr6ue5sv7j,와 그냥 류스펜나님 팬이어서 영상보고있는데 나도 가보고싶어서 찾아보니 저희 동네 있는곳이었네요 ㅋㅋ 별내동 나와서 신기,0.0,11개월 전
20,enfj9891,입을때마다 저로써는 ??? 이 끊이지 않는 쇼핑이었으나 얼굴이 대유잼이여서 모든게 상관없어졌어요…,0.0,11개월 전
21,userxk4zb9kb4f,펜나님 인사할때 안녕하세요 여러분이 아니라 안녕하세요 여러븐~ 이럼ㅋㅋㅋㅋㅋ 넘 웃기고 첨엔 왜지? 했는데 중독된 ㅋㅋ 미역색 니트는 보아 넘버원 시절이 생각나는 의상이네요 예뻐요!,1.0,1년 전(수정됨)
22,usernk8cj6nf3f,요즘 빈티지와.. 나나 스타일에 빠져버렸어요ㅠㅜㅠㅜㅠ 영상 너무 재밌어요,1.0,1년 전
23,useryf2zi1vu4b,이쁘고 여성스럽고 멋지시네요,1.0,1년 전
24,summer8189,이 빈티지샵 요즘 생긴 곳인가요?! 다른 분들 유튜브에서도 봤었는데 요즘 핫한 곳인가봐요!!ㅋㅋㅋㅋ,1.0,1년 전
25,urcsr3,헉... 진짜 가보고싶었던 곳인데..!,1.0,1년 전
26,userrn8dd7zw8p,뭘 입어도 다 예뻐요,0.0,10개월 전
27,Joghurt24,다 잘 어울리세요..정말 날씬하시네요 ,1.0,1년 전
28,MrDragonviet,An nyeong ha se yo beautiful Ryu Penna♡ fascinating visit to this beautiful Vintage shop a Shopping which is a pleasure for the heart in finding and we can guess a great saving   magnificent vlog  Gam sa hab ni da ♡,1.0,1년 전
29,heenalee,"중간에 바람막이는 IPFU라고 미군 체육복입니다
별내주민으로써 비바무역 반갑네요",2.0,1년 전(수정됨)
30,usergu9yt1tu7v,언니 회색 박시한 집업 너무 잘어울리는데 긴가민가할때 제발사라고.. 속으로외쳤는데 최종픽에 있어서 내가다ㅈ행복🫶🫶,1.0,1년 전
31,JENTOP0908,5:02 뭔가 하라주쿠 가면일을법한 누나 패션 ㅎㅎㅎ 짱잘어울리신다,1.0,1년 전
32,bestofbest6144,집순이에 운동복차림이 다인데 대리만족 최강입니다아,1.0,1년 전
33,userdu6gk8lr2r,빈티지샵…생각보다 엄청 넓네요 선택장애가 심한 저는 가면 큰일날거같아여 빈티지는 입문이 좀 빡셀까요…? 예쁜 옷이 많은데 머리에서는 매치가 생각이 안나옄ㅋㅋㅋㅋㅋ 패션은 역시 어렵네여.. 빈티지의 장점이라면 가격이 괜찮은거 같아여 카메라 감독님의 끄덕끄덕ㅋㅋㅋㅋ귀여우셬ㅋㅋㅋㅋ,1.0,1년 전
34,userbf2bo9qe9b,위치 공유 좀 해주세용,2.0,1년 전
35,peterlorenceurtola3256,wowyour so beautiful and you are so amazing in shopping..,1.0,1년 전
36,userbj8qc9te1v,류스펜나님 브이로그를 잘 볼게요,1.0,1년 전
37,akinuakinu2087,,1.0,1년 전
38,son7092,류스펜나 (RYU.S PENNA)님 명품옷이 너무 많네요,2.0,1년 전
39,userxu9uz1cp3g,7:00미디한 기장감 좋은데여?짧치만 좋아하시는건가유,1.0,1년 전
40,userym2wb6sy6r,패션은 어려워 ~~,1.0,1년 전
41,useryk4ym7ou6m,"빈티지 느낌보단 캐쥬얼한 느낌이 더 드는데 난.. 저게 어떻게 빈티지.. 옷이 너무 화려해서 빈티지냐 아니면 빈티나게 입어서 빈티지냐 내가 생각하는 빈티지는
진짜 존잘이나 엄청 미모가 출중한 사람들이 되게 없어보이는 옷을 입었을때 그 얼굴이 돋보이기 때문에 고른다 생각됨
내가 가장 좋아하는옷은 남에눈에 잘 튀지도 않고 옷은 단정하며 남이봐도 오 준수하네 이런 느낌에 옷이 최고의 명품이라 생각함
옷이란 다른 사람들을 배려하기 위해 태어난거 아니냐 라고 생각도 한다 배가 나왔으면 배를 커버해줄수 있는 티셔츠 허벅지가 굵다면 허벅지를 커버해줄수 있는 바지
옷이란 이런거라고 생각함 아 글고 빈티지 샵인데 엄청나게 화려한것 보니 빈티지가 맞는것같기도 함 너무 화려하니까 
그런데 또 다시 생각해보면 빈티지 샾에서 캐쥬얼한 옷만 짚은 그런 느낌도 강하긴 하고.. 약간 그런 매장을 복합매장이라 하잖아 
그리고 모든 청바지에 완성은 리바이스 신발은 나이키 티셔츠는 그냥 자기한테 어울리는 보세 ㅋㅋ 요즘 보세는 원단을 상~최상으로 하는곳들 꽤 있고 
브랜드가 하도 많다보니 보세옷에 원단 상~최상으로 가격대 비싼거 사는게 대세 자기한테 맞는걸로 스타일은 자기한테 맞게 맞춰입어야함
그리고 에르메스 발렌시아가 샤넬 뭐 여러명품옷 이야기도 많이하는데 그냥 다 쌉쏘리다 명품 입는다고 자기 자신이 달라지진 않음
그냥 남들눈에 튀고싶다 그럼 입어도됨 그리고 동내에서 명품옷 보이잖아 그냥 다 짭으로 보임 근데 짭을 강남에서 입잖아 그건 또 명품으로 보이고
근데 보세옷을 강남에서 입잖아 좀 그래 그래서 그런말이 있지 때와 장소를 구분해라",1.0,1년 전
42,userdz2po5ep5v,저 혹시 저번에 가신 맥주축제 브이로그는 안올라오낭요??ㅠ,3.0,1년 전
43,usernx5in4bm2s,샵 들어가는 부분에 차 번호판 ……,1.0,1년 전
44,userit2en2nn3w,허리 뒤 문신 메-모,0.0,7개월 전
