,youtube_id,comment,like_num,comment_date
0,happa,"안녕하세요 하빠입니다.
이 콘텐츠 처럼 다른 사람의 옷장 공개 콘텐츠를 좋아해주시는 분들이 많습니다.
보통 출연자들은 제가 부탁을해서 용기를 내서 나와주시는 감사한분들 입니다.
앞으로도 다양한 분들에 옷장을 공개하는 콘텐츠를 진행 하려고 합니다.
하지만, 영상과는 전혀 상관 없는 출연자들에 대한 악플로 힘듭니다.

여러분들 앞으로도 엄청난 분들과 합방 콘텐츠가 준비가 되어 있습니다.
제발 클린한 댓글들 부탁 드리겠습니다.

본인과 다르다고 틀린게 아닙니다!",16.0,5개월 전
1,reborn6568,대리만족도 되고 구경도 하고 너무 좋았어요 ,4.0,5개월 전
2,ramoss4,"인스타에서 자주 봤던 분이네요ㅋㅋㅋㅋ
매번 대리만족하면서 잘 보고 있습니다
발렌스타일 정말 잘살리시는듯",2.0,4개월 전
3,Mintothesu,"와,,, 진짜 아이템들이 다 ... 착샷도 있었으면 더 좋았을 거 같았는데 ㅠㅠ 그래도 옴총나네요!!",4.0,5개월 전
4,jaktoh5827,옷 진짜 스타일이 넘사네요..!!!! 멋집니다 소화하는게 더 대단합니다,3.0,5개월 전
5,userne5ne9ox1r,역시 희영님 이뻐요~~,1.0,4개월 전
6,userop4xo7ly8x,진짜 옷사랑하는사람들 대화라 보기좋음 수준높기도하고 ㅋ 악플은 어딜가나잇음,0.0,4개월 전
7,relrelrelrel2284,와 항상 궁금햇던분인데 소개 감사합니다 ㅎㅎ,4.0,5개월 전
8,userqd3pn2vw7d,세콤출동직인데 700만원짜리입고 출동해보고 싶네요 ㅎㅎ;;,0.0,2개월 전
9,usersn6gg9kr2n,"와!!!!! 희영님!!!!
진짜 최고 ㅎㅎㅎ 멋집니다!!",2.0,5개월 전
10,usereq6xn1gu2e,하빠님 예전 라이브때는 발렌시아가 논란때문에 안사신다고 하셨는데 갑자기 생각이 바뀌신 이유가 있나요?,0.0,4개월 전
11,YPKorea,"아니 ㅋㅋㅋ 진짜 롤렉스 사겠네요? ㄷㄷ 

옷도 이렇게 비쌀수가있구낭",0.0,5개월 전
12,nari2506,와 넘 멋져요!!!,3.0,5개월 전
13,usertq6md4ne4h,쇼핑으로만 일년에 1억5천을쓰는 회사원이 면 도대체 연봉이 얼마야?,4.0,5개월 전
14,eastsky4378,인생은 불공평하다는걸 다시 한 번 일깨워주는 영상이네요 허허 저도 회사원이지만 옷 살 때 50만 넘어가도 열려있던 지갑도 저절로 닫힙니다,0.0,5개월 전
15,userbs9bn3vv3h,회사원인데 1년에 1억5천을 쇼핑에...개부럽 ㅋㅋㅋ,9.0,5개월 전
16,k22dfashion,진짜 걍 다이쁘네,8.0,5개월 전
17,alexscene5116,준지에 이어 발렌까지.. 최곱니다!ㅋㅋㅋ 2편도 기다릴게용,7.0,5개월 전
18,userkw1iu3si9m,세상은 매니아가 움직인다,7.0,5개월 전
19,planetbang9753,여성분에 >> 여성분의,2.0,4개월 전
20,leeminta,크.. 죽이네요! 영상 재밌게 잘 봤습니다~,4.0,5개월 전
21,rafsimons1565,영상보고 인스타 팔로우했습니다 옷들이 정말 이쁘네요!,4.0,5개월 전
22,usersi8jo9kq3e,희영님 진짜 최고에요 언제 나오시나 했는데 드디어 나오시다니,11.0,5개월 전
23,jungedsh,한국은 발렌 논란 아예 1도 신경 안쓰는거 같네ㅋㅋㅋ,10.0,5개월 전
24,seinpapa486,와 세상엔 대단하신분들이 넘 많네요~ 근데 이분 직업은 뭔가요? 1년에 1.5억 쇼핑하실수있는 능력이면 대단하신분일들^^,6.0,5개월 전
25,UNDERTAKERkk3ti,크으 걸어다니는 발렌시아가 그 자체입니다 !!,4.0,5개월 전
26,righteous9872,상대적인 박탈감에 빠져 있는 사람들 한심 하네 ㅋㅋ .. 자기 능력 되면 명품도 입고 다니고 하는거지 .... 부러우면 지는거다 이것들아 ㅋㅋㅋ,16.0,5개월 전
27,userop2cw2uw9p,역시 이런게 꿀잼이지,4.0,5개월 전
28,joon5968,뎀나 여자친구가아니라 남자친구 아니에요...? 그 뮤지션분.. 잘못알고있었나,1.0,5개월 전
29,gusdaniel6727,와 발렌시아가 옷 지린다…,8.0,5개월 전
30,Halalala4749,발렌시아가를 좋아하먄 희영님 모를수가없죠!! ,11.0,5개월 전
31,lilwoopig6170,여기 재 헬스장근처인데 ㅋㅋㅋㅋㅋㅋㅋㅋㅋ,0.0,3개월 전
32,usertr8jy9gr8h,희영님!! 말 잘하시네요 ,4.0,5개월 전
33,yinnn2,와.. 제가 젤 좋아하는 두 분이 ,4.0,5개월 전
34,userfl4wd6py6d,11:57  2편 갈려있는 신발만봐도 웅장해집니다. 크으,2.0,5개월 전
35,userrm9ex2hl9g,"다음분들은 진짜 나오기 싫겠다
물론 사전에 맨탈강한분만 모시겠지만
자유민주국가이니 이래라저래라 하진못하지만
부디 책임질만한 댓글 다시길바랍니다
스스로 바라보았을때 부끄럽지않길",7.0,5개월 전
36,xijinpingCAONIMA,"여기는 없네 로고플레이 하는거 꼭 못입는 사람 특징이다 여기 컬렉션도 전부다
나 발렌시아가요 하는데 1300만원 이런 옷이니 로고플레이 한다 이런말 안나오네 ㅋㅋ",0.0,1개월 전
37,Hommeplisse,우와 저 흰색우주복은 진짜 장난없네요 너무이뻐요,3.0,5개월 전
38,useryo4mv8lp2u,대단하고 멋지기만한디 부러움에 가득찬 댓글수준,8.0,5개월 전
39,userhf4mh5wb1w,트래비스 스캇도 잘만 입고 나오는데 뭘 ㅋㅋ 살사람은 사고 안살 사람은 안사는거지,5.0,5개월 전
40,TVio3fi,"발렌시아가는 잘못했다고 사과글에 기부 프로그램 참여등등 하지만 욕하는애들은 그런거 모름 일단 트집 잡으면 죽어라욕함 어차피 안사던사람들이거 앞으로도 안살거면서 사고안사고는 개인의자유인데 
그리고 외국에서 안그런데 이러는애들 한국살면서 외국 비교 왜이리하냐 불만있으면 이민가 
그리고 외국애들도 발렌 잘입고 다님 인스타만 봐도 그만인데",6.0,5개월 전
41,kornhub9183,"로리타 아이유는 사과도 안하고 잘먹고 잘사는데 2번사과하고 광고 바로 삭제한 발렌만 욕하는건 도대체 무슨 기준? 

왜케들 착한척하고 난리임? 그럴꺼면 마약 밀수입 삼성도 손절하고 욱일기 슈프림 손설 욱일시 나이키 손절해야지?",7.0,5개월 전
42,usergj2vn4ik8c,ㅋㅋㅋ줜나 우낀다,0.0,4개월 전
43,tvby6tm,이분 직업이 세무사인걸로 아는데 버시는만큼 쓰시는거죠.ㅎ 방구석 백수분들 부러우면 지는겁니다.,2.0,5개월 전
44,userps2zs2rw7y,미국선 나락갓다던데 한국은 별로 신경안쓰는듯,48.0,5개월 전
45,phj8146,"이렇게 악플달면..누가 나오겠냐...
내돈도 아닌데 다들 왜이렇게 화나있냐 
저래살게 냅두자",16.0,5개월 전
46,bull5046,멋지다,2.0,5개월 전
47,userqp2sx7id3f,와 힙쟁이다~~,3.0,5개월 전
48,foxxkim,멋있다 - 부럽다~~~~~~ 굿~~,2.0,5개월 전
49,36normallife,"인스타보다 유튜브영상, 실물이 더 이쁘시네요!!",5.0,5개월 전
50,userzm6gk5il4e,발렌시아가 ,1.0,5개월 전
51,userzk2oy4wn2k,앉아서 하는것보다 서서하는게 낫지,0.0,5개월 전
52,dickimchi,발렌시아가 ,3.0,5개월 전
53,apetown245,희영님!!,3.0,5개월 전
54,userht2pd4yi3j,이분은 너무 유명한분이라서 ㅋㅋㅋㅋ,4.0,5개월 전
