,youtube_id,comment,like_num,comment_date
0,userdd7gw6ii2q,"오 연탄불 라면이라닛! 어머니 가게에서 끓여주시는 라면이 생각 나네요^^️ 생각만 해도 따뜻해지는 기분에 맛있을 것 같네요! 정말 특이한 마을 이름이네요^^ ㅎㅎ 박서울님, 새해 복 많이 받으시고 항상 긍정 넘치는 하루하루 되세요! 남은 연휴 잘 보내시고 항상 사랑합니다!!️",1.0,8개월 전
1,ryu1017,"연탄불 진짜 오랜만이네요 ㅎㅎ 
완전 추억 감성 최고입니다 
진짜 할머니 집 생각이 많이 납니다
연탄불에 끓인 라면이라니
그 맛은 먹어 본 사람만 알 수 있어요",1.0,7개월 전
2,uservi9li6lx5w,연탄 오랜만에 보네요 옛날 기억이 새록새록나요 군침이 도네요 아삭아삭소리 영상 잘보고 갑니다 서울님 넘 맛나게 드세요~,2.0,8개월 전
3,vannoona7200,"This makes me smile.
He is so polite and well mannered.
He looks so happy when he eats, it was very nice to watch.
Thank you.",0.0,7개월 전
4,userjr4nt3gf4i,"와와 넘 추억속에 빠져들게끔
너무좋은 풍경과 추억이네요.
너무 이런곳들이 정겹고 그립네요
너무 좋아요
이런곳들, 아직도 이런곳이 잇다는게
너무 좋네요^^
영상 잘 시청할게요^^",2.0,8개월 전
5,Heogaengs,"어릴때 할머니댁가면 새뱃돈 받아서 꼭  찾아갔던 슈퍼가 떠오르네요
짜파게티도 촉촉하게 넘 잘 끓이신거 같아요
할머니 할아버지 목소리만 나왔지만 뭔가 푸근하니 따뜻해지네요",2.0,8개월 전
6,usertd9gh3tc7i,"연탄을 보니까
그옛날이 떠오릅니다.
정겨운 마을에서 
정말 맛난 라면 드셨네요!",2.0,8개월 전
7,userfy3jc6zb1v,이형 너무 스윗하고 착해 무조건 잘될겁니다 꾸준하게 업로드 ㄱㄱ,7.0,8개월 전
8,msg8534,"나이들수록 저런 가맥집이 좋터라구요^^
따뜻해보이구 좋은 영상 잘봤어요♡",3.0,8개월 전
9,Hhhjasssss67348,옛날 감상 가게가 아직도 있다는게 신기방기 하네요~ ️️,2.0,8개월 전
10,manlilovevenus,"이곳. 당나귀귀에서 나온곳인뎅 ㅎㅎ
TV나가기 전이라 편히 촬영 하신거같아요^^
과거와 현재가 공존하는곳이군요...
추억돋는 영상이었어요♡^___^♡",3.0,7개월 전(수정됨)
11,usercm4yf9mw6c,우와. 마을이 넘 예쁘네요. 근데 라면을 연탄불로 끓여주시는건 저도 처음봤네요. 함 가보고싶네요.,2.0,8개월 전
12,Gakgungtv,오 분위기 있고 따뜻하게 느껴지네요 가는 길은 힘들어도 슈퍼 감성도 좋고 맛나보이네요,2.0,8개월 전
13,usernj5en2pd5s,"인정있고 자상하게 보여요
앞으로도 건강한 먹방 많이 보여주세요 ^^",1.0,8개월 전
14,useroo2me3hy5n,"처가가 홍은동인데 이번 설에 한번 가봐야겠네요.
가서 정을 느껴보고 와야겠네요.
추위를 녹여주는 따뜻함이 이것이겠죠.",2.0,8개월 전
15,userfo3bl4lg5j,"와 할머니 할아버지 인격이 보입니다. 게다가 라면은 세상에서 젤 맛있는 라면이구요. 
화면 꺼져서  짜파게티 두 봉 재촬영하나 했어요 ㅋㅋ
저도 어렸을때 외할머니가 연탄불에 올려놓고 끓여주신 뚝배기 달걀찜 . 잊을 수가 없다.",5.0,8개월 전(수정됨)
16,userqe4mh2ip7v,옛날 어릴때 슈퍼감성 ㅠㅠ추억여행간 느낌이네영,1.0,8개월 전
17,userls8pc4bg7h,응답하라 1988같네요 ㅎㅎ 옛감성이 남아있는 정감가는 마을이네요 ㅋㅋ  연탄불에 끓인 라면  정말 맛있겠어요 ㅎㅎ,4.0,8개월 전
18,uservj9hj2kn5i,"블랙죠를 아시다니
이런곳 진짜 드문데 너무 좋아요
추억도생기고ㅎ",3.0,8개월 전
19,lucypark0117,ㅋㅋㅋㅋ라면 때리러 가고싶네요 ㅋㅋㅋㅋ귀여우심,2.0,8개월 전
20,usertv9ui2dl5x,분위기가 차분하고 잔잔한 영상 좋네요,2.0,8개월 전
21,kuy9090,오늘도 잘보고 갑니다ㅎ 응원해요 팬이에요ㅋㄷ,2.0,8개월 전
22,userbd6ec7nm7z,"휴.. 퇴근길에 
편의점 들려서 짜파게티 1개 진라면 매운맛 1개 삼요....ㅋㅋ",2.0,8개월 전
23,usermv7cy5jz9e,역시 우리의 감동원,3.0,8개월 전
24,useroi1up6di5d,구독자 2.5만명 축하 드립니다,2.0,8개월 전
25,userge3lf5ln3p,오늘처음 착한초밥영상접하고 10가지 영상을 다보게되엇내요~^^  앞으로 구독하여 매일찾아뵐께요 좋은영상 더부탁드려요♡♡,1.0,7개월 전
26,uservx5ry1mj3g,"외모가 서울서울 하시네요
정릉 산동내 소개도 부탁드립니다ㅋ",2.0,8개월 전
27,piieta845,"수고하셨습니다.
영상에서 가격이 나왔나요?
못봤는데 제가 놓친 건지...
궁금하네요.",1.0,8개월 전
28,usersr4gt2hu3c,연탄 라면은 냄비채 뚜겅으로먹어야 제맛 그릇은 아님..,1.0,7개월 전
29,userlp1hg5fe3r,앗 저희동네 오셨네요 ㅋ 산넘어지만,2.0,8개월 전
30,usergh1it4un1t,안녕하세요  설날잘보내세요ㅎ,1.0,8개월 전
31,usercr3fi7xd9q,상해기님  단골가겐데ㅋㅋ,2.0,8개월 전
32,userht1zq7vu4y,아직도 달동네가 있나 봐요 여러분 아기공룡 둘리에 라면송에 나오는 라면은 구공탄에 끓여야 제 맛이라고 하거든요? 연탄불에 끓이면 진짜 맛있어요 왜 맛있는지 모르겠는데 맛있었어요 추억 완전 엄청 살아나는 가게네요 블랙죠 말고 매치매치바 있었어요 그게 좀 더 맛있었고 땅콩이 많이 들었었어요 죠죠~ 블랙죠는 롯데고 매치매치바가 해태였을 거에요 그거 초코바 하나랑 고래밥 하나랑 천하장사 쏘세지 하나랑 깐돌이 하나 사면 100원 200원 50원 50원 해서 400원 그러면 500원에서 100원 남으니까 과자 다 먹고 오락실 가면 두판하고 왔었죠 이게 몇년 전이야 도대체 ㅋㅋㅋ 너무 정겹다 증말 가게도 진짜 옛날 그 가게 모습이야 방은 작았는데 우리도 네식구가 한방에서 살았었어요 지금 생각해 보면 어려웠어도 더 많이 웃었던 거 같은데 지금은 옛날에 한번만 먹어봤으면 하는 것들 쌓아놓고 썩어도 안 먹는 나이가 됐는데도 웃을 일이 많지가 않네요 서울님 방송보고 훈훈하게 웃고 가야지 ㅋ,7.0,8개월 전(수정됨)
