,youtube_id,comment,like_num,comment_date
0,userql5wl3cd9x,"감사합니다. 요즘 빡치는 일이 있어서..

젊은 나이에 다크서클이 너무나도 심합니다.
그래서 큰 결심하고 피부과를 다니고 있는데 실장이 본인이랑 상담만 하고 시술을 권하네요.
그 분도 경력이 있으시겠지만 정작 시술 들어가면 원장님들이 더 정확하게 진단 내리는 경우가 많더라구요. 
문제는 한 분이 고정되는게 아니라 갈 때 마다 원장님은 랜덤입니다..

눈밑 콜라겐주사 거의 다 맞았는데 평평하기는 무슨 눈밑지방 툭 튀어나온거처럼 오히려 더 퀭해보이네요 ㅜㅜ 
불 지르고 싶은데 너무 화가나서 어떻게 해야할지 모르겠어요..

콜라겐이랑 토닝 레이저 병행 중에이에요. 근데 시술 받은 직후는 괜찮은데 붓기 빠지고 나니까 약간 차오른 정도이고 여전히 눈밑 고랑 모형이 있으며 피부도 차오른 상태로 어둡네요.
색소침착인게 맞는지 혹여나 혈관형 다크서클은 아닌지 의심됩니다.


끝나는대로 알려주신 방법 참고해서 다른 곳으로 옮겨야겠어요..",1.0,4개월 전
1,LineSmile,"영상 잘봤습니다. 제가 가는 병원이 있는데 이 사이트에선 전문의 마크가 없더라구요. 그런데 실제 해당 병원에는 전문의 마크와 다른 조건들이 다 갖춰져있던데, 단순 사이트에 반영이 안된걸까요?",1.0,4개월 전
2,Gongsyl,"안녕하십니까 선생님

혹시 자기전 바파를 바르고 다음날 아침에 자외선 노출되는건 지장이 없을까요??",1.0,4개월 전
3,userbh1hr4sb3l,"안녕하십니까 우연히 영상을 보다 궁금해서 댓글 달아봅니다^^
메ㅇ큐브 제품 레드라인이나 제로라인? 제품 효과가 있는지 궁금합니다!
이것도 알려주실수 있나요?",1.0,4개월 전
