,youtube_id,comment,like_num,comment_date
128,userim5or2qu2k,"선생님 영상 전부터 구독해서 너무 잘봤습니다 전부터 디오디너리 제품은 알고있었지만 워낙 종류가많아 뭐부터 시작해야할지 몰랐는데..  솔직히 제 피부가 엉망인 이유가 시작을 망설이는 제일 큰 이유겠지요..  어릴때부터 화농성 여드름을 달고 살았지만 부모님은 어른되면 없어진다 이렇게 얘기하시면서 피부과에 한번도 데려가주시지 않았어요 그 예민한 사춘기에 일어나자마자 거울보면 여드름을 짜다보니 성인이 되니 패인흉터로 남더군요..

성인이 되고나서는 어릴때만큼은 나지않지만 자궁이 안좋다보니 턱 쪽에 올라오는데 얕은 지식으로 아는 남자들에게 생식기가 안좋아서 그렇다 성병있는거아니냐 이런 치욕적인말을 들은적도 있습니다..  프락셀. 아그니스. 아쿠아필. 리쥬란 안해본 시술이 없지만 그때뿐이고 다시 되돌아오더군요 심지어 피부가 하얀편도 아니고 한살한살 먹다보니 색소침착과  함께 칙칙해지는 피부톤도 같이있다보니 요즘 아무리 메이크업 제품이 잘 나와도  늘 피곤해보이는 얼굴입니다 사람만날때 혹시나 화장이떴을까 피부더러워보이지않을까 늘 신경쓰고있고 피부화장이 잘 먹어본적도 단한번도 없다보니 사람들이 제 피부만보는듯하고 자신감도 없었습니다

아무리 타고난 피부는 이기지 못한다하더라도 선생님 영상보면서 그래도 제품정보들알면서 하나하나 새롭게 알게되고 운이좋게 당첨이되면 사용하면서 나도 피부좋아보일 수 있구나라는걸 느끼면서 일상을 지내보고싶습니다
 앞으로도 저같은 사람들을 위해서 이런 유익한 영상 많이 부탁드립니다
늘 건강하시고 적게 일하고 많이버세요",0.0,11개월 전(수정됨)
129,mindy201,오 드디어 광고받으셨네요!!! 축하드리고요 양질의 영상 올려주셔서 넘 감사합니당 ㅎㅎ 목소리도 차분하셔서 잘때도 가끔 asmr로 듣고있어요...ㅋㅋㅋ 일주일루틴 영상찍기 귀찮으셨을텐데 참 부지런하시네요 .. 예전영상보다가 나이아신아마이드10퍼 소개해주신 이솔꺼랑 원씽꺼 써봤는데 사용감이 좋았어요 ㅎㅎ 요즘에는 코이앰플 쓰고있는데 디오디너리꺼도 궁금하네용... 광고다시한번 축하드리고요 10월도 화이팅입니다 !!! ,1.0,11개월 전
130,mylifefucksme,"안녕하세요, 20대 중반 대학원생입니다. 지현님 유튜브 구독한지 이제 대략 6개월 이상 된 거 같은데요, 광고 진행하시게 되어 축하드립니다. 저는 대전에서 평생 지내다가 이번에 대학원 입학으로 인해 서울에서 지내게 되었어요! 평생 자취를 해보는 게 소원이었는데, 막상 20대 중반에 처음 자취를 해보려니 이것저것 돈도 많이 들고 신경 쓸 게 많습니다. 나이아신아마이드는 저도 평소에 즐겨 쓰던 제품인데요, 디오디너리의 다른 제품들도 항상 궁금했던 찰나에 기존에 사용하던 나이아신아마이드가 다 떨어져서 이벤트에 응모해봅니다!",0.0,11개월 전
131,nyj6525,와.. 지현님 피부 진짜 좋으세요!,0.0,11개월 전
132,GREECEBOOBOO,"세포라에서 비슷한 제품 라인으로 나온 인키리스트 제품을 써보았는데, 디오디너리 제품도 꼭 써보고 싶네요. 저는 그리스 거주중인데, 햇빛이 너무 강하다보니 광노화를 무시하지 못하는구나.. 를 정말 많이 느끼고 있습니다. 개인적으로 이런저런 제품들 조합하며 피부 상태에 맞게 하루 이틀씩 제품을 바꿔가며 사용하는걸 선호 하는데요, 디오디너리 제품들은 각각 피부가 필요로 하는 걸 섞어서 쓸수 있을 것 같아 너무 좋아보입니다~ 궁금했던 제품 라인 꼭 써보고 싶어요~^^",0.0,11개월 전
133,useryp7gj5fb6h,"광고 정말 축하드려요~!!
늘 영상 감사히보고있어요~
디오디너리 5종 써보고싶네요^^
지난번 추천해주셨던 썬크림 넘 만족하며 잘 쓰고있고, 매트릭실10%도  장바구니에 아직 담겨있는데 ㅋ
폐경이 코앞이라 그런지 작년이랑 올해 피부차이가 엄청나게 달라졌네요ㅠ탄력 수분 다떨어져서 이젠 뭔가 기능을 고려해서 사야만하는 때가 진짜 온것같아요. 하얀피부에 잡티도 많지않은편이라 자만했었.. 나이엔 장사가없네요ㅜㅜ",0.0,11개월 전(수정됨)
134,userib9hm4mu5v,"저는 40대 초반 여성인데 대학시절부터 스트레스로 얼굴(눈가, 코주변, 입가)에 아토피가 생겼어요
피부타입은 대체로 건성이고 겨울엔  악건성모드로 돌입합니다ㅜㅜ
나이아징크는 2병 써본 경험이 있는데 유투버님처럼 다양하게 믹스해보지 않았고 단독으로만 썼는데 거품나고 하얗게 밀리는 일이 많았어요
왜 그런가 했는데 이번 영상보고 완전 이해되었답니다^^
유투버님처럼 믹스해서 써보고 화장품유목민에서 해방되고 싶네용^^
언제나 유익한 영상 감사합니다~",0.0,11개월 전
135,userlunacyan,"관심 갖고 있던 화장품인데 일주일 사용법 보면서 토닝솔루션이랑 뷔페가 가장 땡기네요 ㅎㅎ 지금 쓰는 세럼 다 끝나면 써보는걸루다가.. 
지금은 나이아신아마이드 가루를 토너 같은데다가 섞어 쓰고 있거든요. 칙칙한 피부 언제쯤 좋아지려나..
그리고 광고 축하드려욤 ㅋㅋ",0.0,11개월 전(수정됨)
136,userwj5zu7ww1e,"선생님의 목소리는 모이스춰라이저 처럼 수분감이 느껴집니다. 50이 넘으니까 참  많은 화장품들을 썼고 광고를 믿지 않은지는 오래지만 그래도 또 새로운 제품을 알게 되면  기대치가 생깁니다. 디오디너리 제품이 그렇네요.
푸석푸석,울긋불긋,자글거리는 저의 얼굴피부는 가을단풍도 아닌데 아주 난리도 아니네요ㅎㅎ
디오디너리에 희망을 가져볼게요^^",0.0,11개월 전
137,userjs9fx2ud3y,화장품을 좋아해서 여러 유투버들을 통해 디오디너리 제품을 접해봐서 브랜드는 알고 있었고 꼭 써보고 싶던 제품이였어요! 한가지 성분에 집중되어 있는 제품이다 보니 사실 기존에 사용하던 화장품들과 어떻게 조합을 해야하는지 내가 사용하는 화장품과 중복되는건 없는지 사용하기가 어려웠어요 오늘 지현님 덕분에 다양한 루틴들을 알게 되어 감사드립니다 지금 저에게 꼭 필요한 성분인 나이아신아마이드! 꼭 사용해보고 싶네요,0.0,11개월 전
138,uservh8ro9og3i,"헉 좋아하는 브랜드와 좋아하는 유튜버라니... 넘 좋아요ㅋㅋㅋㅋ 항상 이런저런 정보를 정말 많이 얻어가요! 요즘에는 지성피부라고는 해도 보통은 지성피부용 보습 크림이나 로션을 마무리로 꼭 바르던데 지현님이 오늘 보여주신 스킨케어 루틴에서는 보습크림이나 로션으로 마무리하지 않고 앰플/에센스 제형의 기초제품으로 단순하게 마무리하시는 것을 보고 아 마무리 보습제를 ""무조건"" 발라야하는 것도 좁은 생각이었구나 싶더라구요ㅋㅋㅋㅎㅎ 역시 본인의 피부타입에 맞추는게 제일 중요하구나 다시금 되새겨요.  유튜브로 접하고 블로그에 쓰신 글들도 정말 재밌게 정독했어요! 나이아징크는 꾸준히 써왔는데, 뷔페는 말로만 들어보고 실제로 포뮬러의 색상을 보니까 궁금증이 확!!! 솟네요ㅎㅎㅎ",0.0,11개월 전
139,useruu8fm9dq2t,안녕하세요^^ 기존에 쓰던 화장품들이 잘 안맞는것같고 이제 겨울도 되어 피부컨디션이 달라지는데 마스크도 오래끼다보니얼굴도 따갑고 아주 총체적 난국 수준이라 화장품을 바꿔야 하는데 어떤걸로 바꿔야하나... 원료성분들을 배합해서 직접 만들어야 하나 검색하다가 이렇게 구독까지 하게 되었습니다~!! 단일성분 화장품들 검색하면서 디오디너리를 알게 되었는데요~ 이런 이벤트 한번 도전해서 저에게 맞는지 좋은지 사용해보고 싶습니다!! 좋은 제품 소개해주셔서 감사해요~!!,0.0,11개월 전(수정됨)
140,kuytgjkha3944,아 저렇게 섞어서 발라야 되는거였군요ㅜ 전 첨 부터 단독으로 발랐더니 너무 당기고 따갑고 하더라구요~~그래서 발랐다 안발랐다 했는데 정보 감사해요 일단 히알루론산 원액있는데 섞어 발라도 될까요?,0.0,11개월 전
141,userds8uo7ey6p,68세 여성입니다. 여성이기에 얼굴에 관심이 많을 수밖에 없는데 최지현 화장품비평가님의 유튜뷰를 구독하게 되면서 화장품에 대한 상식을 너무 쉅고 재미있게 얻고있습니다. 예전에 썬크림에 대한 영상도 너무 도움이 되었고 이번 영상 또한 많은 도움이 되었습니다.  앞으로 많은 여성분들이 이곳을 통해 화장품에 대한 지식을 얻고 좋은 피부를 가꾸어 가기를 바랍니다. 화장품에 대한 지식을 알려주셔서 감사합니다.,0.0,11개월 전
142,userqe4wg5kk4y,디오디너리 나아아신아마이드를 바르고 싶어서 예전에 샀지만 따갑고 가지러워 적응하지 못하고 실패하다가.  이채널을 보고 구독하게되었고 영상에서 처럼 발라보아야 겠습니다. 저에게도 기회를 ~~,1.0,11개월 전(수정됨)
143,usermg2vs5yy9q,"예전엔 브랜드 또는 홈쇼핑에서 구매쌨는데   성분을 알고  가성비 좋은  제품을 알게되서 좋습니다 환절기라 그런지 피부도 칙칙하고 화장이 들뜨네요
디오디너리 는  처음이라 사용해보고 싶네요   진심  계속 방송해주세요",0.0,11개월 전
144,userrh7lr5wi4e,2~3년전부터 디오리디너  제품  사용중입니다 ^^,0.0,11개월 전
145,userel2tq1td2k,"한때 디오디너리 제품을 한참 애용하였습니다. 이번 영상에 나왔던 제품은 다써봤습니다. 하지만 말씀해주셨다시피 막이 생기고 때처럼 밀리는 현상때문에 사용을 중단했어요. 비타민C제품과 같이 썼는데 특히 비타민C30%+실리콘과 같이사용하면 때처럼 밀리는 것 뿐만아니라 얼굴전체가 비타민C의 산화로 노래지고 심하면 옷에까지 묻어나오는  경험도 하였는데 그땐 그게 왜그런지 모르고 이 브랜드 사용 자체를 중단했습니다. 그런데 말씀들어보니 나이아신아마이드 제품때문에 그런게 아닌가 생각이 드네요,  이벤트에 당첨된다면 나이아신아마이드 제품을 최지현님 말씀대로 사용하면 그런 부작용?이 없어지지 않을까 궁금하여 이벤트 신청해봅니다.",2.0,11개월 전(수정됨)
146,useryp8fj6np1r,중간중간 나오는 화장한 모습이 예쁘세요! ^^,0.0,11개월 전
147,soyoungkim4977,"안녕하세요 화장품 연구원인 친구가 인정한 세상 코덕입니다. 여드름, 아토피, 습진 등 온갖 피부 질환이란 질환을 가지고 살며 신박한 기초 화장품만 보면 냅다 구입하며 돈을 날렸습니다. 피부 고민은 30대가 된 지금도 진행중입니다. 천연카페 가입해서 직접 화장품도 원료사고.. 미국에서 허브 직구해서 인퓨즈하고ㅠㅠㅠ 별에 별걸 다 만들다가 결국 다시 시중에서 구입하고 있습니다. 이제 다시 성분에 대해 공부하고 현명한 소비하고 싶습니다. 적게 일하고 많이 버세요",0.0,11개월 전(수정됨)
148,useriw8zw8fk9l,"잘봤습니다 저는70대로
2년전부터 집에서 화장품을 만들어 쓰는데요
피부에 잘하는걸까요?
그런데로 피부좋다는 소리는 듣곤합니다 가끔은 사서도 쓰고싶지만. 망서려지곤하네요~~~
(속마음) 받고싶어서요^^",0.0,11개월 전
149,sonnyfan,와!! 일주일마다 사용법 알려주셔서 참고하기 쉬워요. 앞으로 추천제품 알려주실때 일주일까진 아니더라도 하루정도만 해주셔도 좋아요. 수분크림을 안바르시는거 보고 보습이 짱짱한 제품이구나 생각했어용 처음들어본 브랜드인데 올영에 판다니 좋아요! 부모님이랑 같이살아서 같은화장품으로 셋이 같이쓰는데 5병받으면 든든할것같아요. 제가 여드름전용화장품만 써서 트러블없는 엄마아빠까지 병풀만 주구장창 쓰고있어요ㅋㅋ,0.0,11개월 전
150,uservm6tu3pd5g,"디오니너리 피부 하얗게 만드는 백옥 제품으로 유명하고 동안 피부이신 분들은 다 극찬을 하시길래 얼마나 명성이 자자한지 직접 써보고 싶다는 생각만 수십번 했던 것 같아요 첫 광고를 디오디너리로...!!! 이 무슨 운명인가요 너무 축하드리고 또 좋은 이벤트까지 들고 와주셔서 또 너무 감사드립니다  일주일 동안 써보고 말씀해주시는 솔직 담백 찐후기라서 더욱 믿고 볼 수 있는 것 같아요 항상 신뢰합니다 디오디너리 나이아신아마이드가 홈케어와 화이트링으로 유명한 만큼, 피부 노화에 시달리는 제게 꼭 필요합니다 원래도 낯빛이 좋지 않은데 이 제품으로 젊은 생기를 불어넣어주고 싶어요 "") 항상 주위에서 나이 먹어 보인다는 얘기를 해대서... 스트레스를 많이 받거든요 지현님의 찐평가를 듣자  더욱 한 번 꼭 써보고 싶다는 생각이 듭니다 광고 받으신 거 진심으로 축하드립니다 ",0.0,11개월 전(수정됨)
151,userie3ls7vq4e,"제  나이 오십중반대  여권사진을  찍으려고  보니   선크림도  잘 바르지 안고  다녀서  그런가 땀구멍은  넓고  혈색도  칙칙하고 
우울한 마음에  이제부터라도  열심히  관리해야겠다고 마음먹고  유튜부  영상찾다가  쌤님 영상보고 공부하게  됐는데 
성분에  대해서  차분한  톤으로 자세히  설명해 주셔서  잘  알아듣기  편했습니다  저희 나이때는 보편적으로  다  아는 화장품만  알지  나머지는  알지  못 했는데  좋은성분도  많고  가격도  저렴하고  꾀 괜찬은 화장품이  많더라고요  
고물가 시대에  저에게 딱! 맞은 좋은  제품이네요~  한결같이  화장품성분에  대해서 설명해주시고  
늘  감사합니다  항상  행복하세용~~^^",1.0,11개월 전
152,nam8847,"역시 정확한 정보를 전달하고 정직하게 리뷰하니까 좋은 브랜드에서 광고가 들어오네요! 축하드립니다. (유튜브 광고도 건너뛰지 않고 보고 있습니다. 좋은 영상 올려주시는 지현님 부부, 커피라도 사드시라고...)

저는 최근에 거울을 보다가 눈 밑, 광대뼈쪽에 색소가 올라온 걸 보고 ㅠㅠ 레이저 치료를 알아보고 있는 중인데, 나이아신아마이드가 미백에 효과가 있다고 해서 응모해봅니다 ㅠㅠ
피부가 예민하지 않아서 고함량이여도 괜찮고, 영상에서 지현님이 잘 흡수시킬 수 있는 사용법까지 알려주셔서 잘 쓸 수 있을 것 같아요^^",0.0,11개월 전(수정됨)
153,skyqm1fn,"갱년기가 오면서  몸다음으로 힘든것이 얼굴이였습니다,,, 이것저것 발라봐도 소용없고,     탄력이 떨어져 늘어지고 커가는 얼굴과  주름,기미.잡티들을  매일보며  한숨과 우울감으로 하루하루
보내고 있는 1인입니다... 단독으로된 전문성분 화장품은 사용해보기가 망설여졌는데  영상에서   일주일동안 과정을 보여주시면서 설명해주시니  이해가 빠르게되네요. 사용 기회를 주신다면 
꼭  후기를 작성해  올리도록 하겠습니다. 그리고 광고받으신거 정말 축하드립니다~진작에 받으셨어야헸는데~ㅎㅎ",0.0,11개월 전(수정됨)
154,useryq1zr2kq1p,"디오디너리 관심이 많았어요 
어떻게 사용하나 좀 헤메고 있었는데
아침 저녁으로  상황에 맞게 알려주시니 
저도 사용해 보고싶네요
화장을해도 칙칙해보이고 요철이 두드러져보이는것같아 고민이었어요
기회가 된다면 효과있는 화장품을 써볼기회가 있었으면 합니다
앞으로의 영상도 기대됩니다 
편안한 저녁 되세요 ~",0.0,11개월 전(수정됨)
155,userlv6wo4tw7m,매트릭실과 같이발라도 될까요?된다면순서는어떻게하면되나요,2.0,11개월 전
156,dearjune1682,가을 들어서니 피부가 점점 더 건조해지기 시작했어요 늦은 나이에 아기를 낳아서인지 출산 후 2년차에 들어서니 탄력이 더 확 떨어지는 것 같아요. 백화점 비싼 화장품들 을 써봐도 뚜렷하게 좋다는 느낌을 받지 못해서 대체 어떻게 화장품을 써야할지가 정말 고민이에요. 요즘 지현 유투버님 방송 보며 공부는 하고 있는데 쉽지 않네요. 저렇게 한 가지 포뮬러를 주로 한 제품은 써보지 않았는데 이번 기회에 꼭 써보고 싶어요!,0.0,11개월 전
157,uservk1ef1cv6r,"안녕하세요~^^
차분하고 섬세한 영상,,
늘 감사하게 보고 있어요~~
정말 축하드려요!!
1년전 여름, 자외선에 피부속 화상 입고
그후 피부가 얼룩덜룩 칙칙해지고ㅠ
모공 부각,탄력저하에 좌절하고 있어요ㅠ
50대라 함량 높은걸 써야 효과가 나타나는거 같아요^^;;
부디 제게도 기회를 주신다면 
최지현님 처럼 열심히 관리하고 싶어요",0.0,11개월 전
158,uservk1ef1cv6r,"안녕하세요~^^
차분하고 섬세한 영상,,
늘 감사하게 보고 있어요~~
정말 축하드려요!!
1년전 여름, 자외선에 피부속 화상 입고
그후 피부가 얼룩덜룩 칙칙해지고ㅠ
모공 부각,탄력저하에 좌절하고 있어요ㅠ
50대라 함량 높은걸 써야 효과가 나타나는거 같아요^^;;
부디 제게도 기회를 주신다면 
최지현님 처럼 열심히 관리하고 싶어요",0.0,11개월 전
159,usertq4lr7nx4i,"화장품에 진정성있는 마음을느낍니다
외국에살지만 꼭 사용해보고싶네요",1.0,11개월 전
160,siniminimo,헐 나이아신아마이드 저에게 꼭 필요했던 내용이었어여 ㅠㅠ  감사합니당 ,1.0,11개월 전
161,userpo2xm3ws3f,여드름피부로 굉장히 고생하고 있는 중학생 입니다. 이전부터 디오디너리에 관심이 있었는데 이렇게 다뤄주시니 감사합니다. 화장품 성분 관련영상부터 꾸준히 봐왔는데 이벤트 하신다니 꼭 당첨되고 싶습니다!,0.0,11개월 전
162,userje6cp8vs7q,"안녕하세요~ 피부관리에 관심 많은 체육교사입니다^^
일단 너무 축하드려요!!  나이아신마이드 성분을 알고는 있는데 디오디너리 제품으로 한 번 사용해보고싶어서 이벤트 참여해봅니다~!
직업 특성상 자외선 노출, 각종 야외 환경 요소들 때문에 피부관리에 더 힘쓰고 있는데요! 피부가 얇고 예민하여 요즘 제일 고민이 잔주름, 기미, 보습이네요올려주시는 영상 잘 참고하겠습니다",0.0,11개월 전(수정됨)
163,smilemd7yx,"저는 해외 거주 중인데 가을 겨울 길목에 들어서면 얼굴이 늘 건조하시다는 어머니께 화장품을 나름대로 구매 후기 중심으로 조사해서 선물로 보내 드렸었는데, 이번 영상 많이 도움 되었습니다. 이벤트 응모 당첨되면 시골계신 어머니께 보내드리고 싶네요. ^^ 저를 뽑아주시면 넘 감사하겠지만, 혹여 당첨이 되지 않더라도 몇가지 눈여겨 본 제품들 구입해 볼까합니다. 보습에 관한 과학적인 좋은 정보 많이 얻어갑니다. 감사드려요.",0.0,11개월 전(수정됨)
164,userfy1mz2ch7s,"우연히 보게된 유튜브인데 말씀에 진정성이 느껴져 좋습니다 유익한 정보 감사해요
환절기가 되니 유난히 건조한것 같아요
저도 이벤트 참여해 보아요 감사합니다 ~^^",0.0,11개월 전
165,usertr4zc1xe3q,나이아신아마이드 관련으로 찾아보다가 선생님댁으로 찾아오게됐네요^^ 어렸을때부터 잡티가 많았는데 나이먹으니 주름이 추가되네요... 디오디너리는 처음이지만 내 컨디션에 맞춰 조제(?)하며 바르는 재미도 쏠쏠할것 같네요. 선생님께서 조합해주신대로 써보면서 피부가 어떻게 변하는지 알아보고 싶어요~,0.0,11개월 전
166,userqo7zu3zx5s,축하드려요 선생님!!,0.0,11개월 전
167,solpong287,와….화해같은 사이트도 없던 20여년 전 ‘나 없이 화장품 사러 가지 마라’를 읽고 엄청난 충격을 받았던 사람입니다. 그 작가님을 이렇게 유튜브에서 뵙다니!!!너무너무 반갑고 영광이에요 저는 외국에 살아서 이벤트는 참여 못하지만 꼭 사용해보고 싶은 성분입니다.,0.0,11개월 전(수정됨)
168,userkf1em7xw3q,"우와~~~ 광고 받으셨네요~~~^^
이 채널을 접한지 얼마 되지 않았지만..
몇몇 영상을 보며.. 화장품에 대해서 이렇게 전문적으로 알려주는 채널도 있구나.. 생각했고.... 스스로도 화장품 선택의 기준이 바뀌게 되었습니다..
계속 딸아이가 쓰고 남은 화장품을 사용해 왔는데.. 나이가 50가까워지니..제게 맞는 화장품을 써보고 싶어서.. 이렇게 이벤트 신청도 드리네요..ㅎㅎ
화장품 사본지가 오래되서..뭘 사야할지 몰랐는데... 도움주셔서 감사합니다~~~^^♡",0.0,11개월 전
169,userlu8rt4yu1b,"안녕하세요? 40대에 들어서 눈에 띄는 주름과 기미를 보고 좌절에 빠진 아줌마입니다. 연년생 애기 둘을 키우고 정신차려보니 이 상태네요. 이것저것 찾아보고, 비타민씨 파우더로 앰플을 만들어서 발라봤는데, 저에게는 자극이 강해서 대안을 찾던 중 나이아신아마이드가 좋다는 것을 알게되었습니다. 펩타이드도 자극이 적어서 주름에 도움이 된다는 것을 알게 된 차에 코퍼펩타이드에도 관심을 갖게 되었습니다. 알부틴까지는 써볼 생각을 전혀 못했는데, 함께 사용하면 확실히 도움이 될까요? 
화장품 성분을 이리저리 찾아보고 공부하면 할 수록 더 많은 것이 있다는 것을 깨달으며 최지현 선생님의 책도 이북으로 사서 보고 있습니다. 선생님을 따라서 디오디너리를 써보고싶네요. 저는 지성피부인데 나이아신아마이드가 피지조절도 해주는거 맞죠? 기미, 주름에 충격 받아서 화장품 공부에 빠진 아줌마에게 기회를 주세요♡",0.0,11개월 전
170,juagold3,화장품은 진짜 개인마다 다 다르게 써야한다고 느낍니다. 전 49세이고 작년부터 생리가 끊기고 올해 폐경진단 받았어요. 폐경 후 두통과 식은땀이 힘들어 호르몬 처방 받으며 공부해보니 호르몬약이 부작용도 있지만 장점도 많더라구요. 콜라겐도 생성시키도록 돕고  골밀도도 높이고요. 폐경으로 깊은주름과 잔주름이 심하게 생기니 화장품만으론 안되더라구요. 그래도 비슷한 시기에 구독하면서 디오디너리 알게 되었네요. 저렴하고 효과좋은 화장품 소개해주셔서 감사해요,1.0,11개월 전
171,userhv8td7ku9n,"어머 너무 좋은 이벤트네요.
당첨이 되면 더할나위 없겠지만 별로 운이 없더라구요.,
하지만 참여해봅니다!ㅎㅎ",0.0,11개월 전
172,jungsookpark9120,ㅁㅣ국이여서 참여 못하네요,0.0,11개월 전
173,usergs1qz6rt4e,"구독 좋아요 완료입니다 제 피부는 모공과 잡티가 넘쳐나는 딱 40대 아줌마들의 대표 피부랍니다. 요즘은 피부 좋은 사람들이 제일 부러운거 있죠 ~ 그러다 어찌 어찌 타고 알게된 지현님의 매트릭실 영상을 보고 바로 구독했는데 ~ 다음 영상에 구독자 이벤트라니 ~ 
제 복이네요 ~ 아 걸리면요 ! 여튼 매트릭실도 관심이 가져져서 나이아신과 매트릭실 조합도 궁금 하고 위에 5가지도 너무 갖고 싶네요 ~^^! 응원하고 다음 영상도 기다리겠습니다 
한달에 두번 약속 안잊으셨죠? ~^^",2.0,11개월 전
174,Mintchoco0509,"지난번에 디오디너리 영상보고 혼자 끙끙대며 
어떤조합으로 구매해야할지 고민했는데,,,마침 이런 해답 같은 영상이라뇨 ㅠㅠ
알려주신대로 매일 피부컨디션에 맞춰서 사용해보고싶어요!! 이벤트 아니어도 이렇게 조합만 알려주셔도 정말 성은이 망극이에용~~^_^",2.0,11개월 전
175,youngjinlee387,"안녕하세요, 피부에 관심이 생기고 나서부터는 계속 구독 중이었는데 동영상이 드문드문 올라와서 오늘 아주 반갑게 영상 클릭해봤습니다! 아주 좋은 소식과 함께 영상이 올라와서 더욱 반가웠네요 :) 저는 원래 디오디너리의 나이아신아마이드는 쓰고 있었는데요, 좋다고 생각해서 다른 제품도 궁금하던 찰나였어요 사용하신 알부틴이나 뷔페 제품들도 궁금합니다!",0.0,11개월 전
176,usertn7tj4mo7q,"30대후반 여자입니다. 애 둘 낳고, 키우고 이제 회사 복직을 앞두고 있는데 예쁜 피부로 복직하고 싶어요. 광고 받으신거 축하드려요. 앞으로 더 좋은 제품 광고 받아서 사용법 많이 많이 알려주세요.^^",12.0,11개월 전(수정됨)
