,youtube_id,comment,like_num,comment_date
177,useryn4uk5fn3k,"먼저 광고 축하드립니다
나이아신아마이드 편을 보고 고함량 다른제품 구매해서 사용하고있는데 사용 이전 이후가 확연히 차이를 느껴요
성분이 피부에 정확히 어떤 도움이 되는지 알고 사용하니 피부상태에 따라 화장품을 컨트롤 할 수 있으니 너무좋고 많은 도움이 됩니다
여러 제품들중 디오디너리에 대한 후기가 많았는데 저는 브랜드가 생소해서 타제품을 구매하긴했지만 후기가 많아 사용해보고싶긴하네요
앞으로 계속해서 좋은정보 공유 부탁드립니다!!",1.0,11개월 전
178,jeh6455,"안녕하세요!
성인여드름으로 고생하다가 민감성피부가 되어 기능성은 생각도 못하고 트러블만 안나도 감사하다는 마음으로 단순한 성분 조합의 수분크림+오일로보습만 하며 지내다보니 피부에 결점이 많습니다. 이번기회에 디오너리 제품 경험에 보고 싶습니다!",0.0,11개월 전
179,userjg4dx5kc1e,"저도 몇년전에 디오디너리 알게되어서 나이아신 마이드 파우더와 비타민c파우더를 다른 화장품에 섞어쓰고있는데 괜찮더라고요.
소개해 주신 다른 제품도 사용해 보고싶네요.
항상 유익한 정보 감사합니다^^",1.0,11개월 전
180,glesprin3507,설명듣고   이쁜 피부를 원해요  저도   발라 보고  건강한  피부가 됐으면요 ㅎㅎ,0.0,11개월 전
181,oliviakang3859,선생님 영상보고 나이아신아마이드  구입해서 일주일째 사용중입니다.(올리브영에 있는줄 몰라서 직구로 구입했답니다.)사용후기는 피부결이 개선되었고 속건조도 없어졌어요.톤도 맑아졌구요.제가구입한것과 다른네가지 제품들도 사용하보고싶네요.,0.0,11개월 전
182,usergm6ky1gh4x,"어려서부터 주근깨가 큰컴플렉스였어요
60세가된 지금도 깨끗한피부가 부러운1인 입니다 효과있는제품을 꼭써보고 싶어요",0.0,11개월 전
183,userjm4ol5so3v,30대 초반 직장인입니다. 피부때문에 항상 고민이 많고 피부과 약도 복용하고 있지만 또 너무 건조해지는 느낌도 있어요. 나에게 맞는 제품에 정착해서 약 없이도 꾸준히 관리할 수 있었으면 좋겠어요. 항상 유익한 영상 감사합니다 ^^,1.0,11개월 전
184,eun5054,역시 찐은 결국에 사람들이 알아보나봐요. 왜 여기에는 광고가 없나 그동안 의아했는데 드디어! 축하드려요. 20대 때 최지현님 블로그 글들 보면서 화장품에 대한 생각이 많이 바뀌었거든요. 화장품의 굴레에서 해방된 느낌이었어요. 저번에 다른 영상에서 소개한 나이아신아마이드 정보로 디오디너리는 아니지만 나이아신아마이드 쭉 쓰고 있어요. 편하게 피부 관리하기에 딱인 성분 같아요. 디오디너리의 나이아신아마이드는 어떻게 다른지 궁금하긴 하네요. 앞으로도 객관적인 정보 꾸준히 부탁드려요.,2.0,11개월 전(수정됨)
185,hhhgyyu6203,"광고 넘 축하드려요! 그간 정확한 정보만을 전달하셨기때문이지 않았나 싶네요.

저는 기름산유국 30대 남자로 이미 디오디너리 나이아신아마이드는 제 애정템이기도 합니다. (시코르에서 구매하고있어요) 이 외 펩타이드 앰플등은 도전해보지 않은 영역인데, 이번 기회에 한번 써보고싶네요. 다시한번 축하드리고 계속 좋은 정보 많이많이 부탁드려요!",0.0,11개월 전
186,lavendersy2073,요즘 디오디너리에 관심이 생겨 유튜브서 매일 찾아 보고 있었는데  마침 지현님 영상 떠서 공부 꼼꼼히 하고 이벤트 신청해 봅니다.  50대 여성이지만 피부에 관심이 많아 영상 많이 찾아보고 구입해보고 있어요. 화학첨가물이 들어 있지 않은 비건 제품에 젤 관심이 가고요… 이벤트 당첨되서 꼭 써보고 싶습니다.,5.0,11개월 전
187,SHyu9of,오디너리 관심이 생기네요! 감사합니다!!!  기획중이신 다른 영상들도 너무 기대 됩니다 ,0.0,11개월 전
188,userss4uu6dc9z,피부가 칙칙하고 푸석푸석해서 예전부터 관심있어던 제품인데.. 이벤트 응모 해봅니다~^^,0.0,11개월 전
189,usersu2nl3sp2s,기미 잡티 주름에 좋은성분이니  사용해보고싶네요 나이가 들수록 잡티가 늘어나네요^^,0.0,11개월 전
190,yeomkun,드디어!!! ㅠㅠ ,0.0,11개월 전
191,userwl5pl4el9b,"안녕하세요.  집필하신'나 없이 화장품 사러 가지 마라' 라는 책을 읽고 신뢰가 생겼었는데 유튜브  하시는걸 알고 반가웠습니다.  미니멀한 정직한 성분의 화장품에 관심이 많은데 이 채널을 통해 디 오디너리에 대해 알게되었습니다. 피부 목적에 집중한 심플한 제품이고 추천하신다니 꼭 구입해보리라 계획했었는데요, 설명해주신 단점대로 순수한 성분이다보니 공부할것도 조합을 어떻게 해야하나 고민도 많았어요. 오늘 올려주신 영상이 큰 도움이 될것 같습니다. 마침 이벤트도 있으니 참여해보고 싶습니다.  솔직하고 담백한 영상 감사드립니다.",2.0,11개월 전(수정됨)
192,usermx3wb5fg7d,"안녕하세요
영상 너무 잘 보고있어요
디오디너리 제품에 관심이 생기던차에 이런 리뷰영상을 친절히 해주셔서 더욱 써보고싶은 마음이 생겼어요
좋은 성분들을 정확히 이용하여 쓸수있을것같아요
혹시 이벤트에  당첨된다면 더 없이 좋을것같아용ㅎㅎ
곧 성년이 되는 딸과 함께 써보고 싶습니다~!ㅎㅎ",0.0,11개월 전
193,userqx4mo2rs6m,"47세 여자입니다  10년전부터 얼굴에홍조가생긴후  건조해지고  멀발라도 건조하고 티존부위는 블랙헤드와 지성피부로 , ,얼굴이복합성피부라 화장품고민을하다  이분영상을보고  나이아신을 구매하려고망설이던중에 이벤트하신대서 주문안했습니다 제발~~",0.0,11개월 전
194,Matwx1zp,"첫 광고 축하드려요!! 정직하고 유익한 영상 잘 보고 있어요 앞으로도 응원할게요^^ 최지현님이 전에 올리신 디오디너리 영상 보고 브랜드 취지가 맘에 들어서 디오디너리 제품 중에서 나이아신아마이드와  아스코빌 글루코사이드 12%를 구매해서 지금까지 계속 쓰고 있었어요! 그런데 마침 다 떨어져서 새로 구매하려고 했던 참이었는데 이벤트라니!!  ㅎㅎ 지금까지 각질제거는 bha만 사용해서 했었거든요, 글리코릭 애시드로도 각질제거를 해보고 싶어요!! 디오디너리 제품이 다섯가지나 있다면 이 영상에서 알려주신 것처럼 그 날에 맞춰 조합해서 쓰는 재미가 쏠쏠할 것 같네요 다시 한번 광고 축하드려요!",1.0,11개월 전(수정됨)
195,jumpintochanges,"안녕하세요! 최지현님의 영상을 구독하면서, 화장품 바로 사용하기가 가능해진 1인입니다(거의 매일 들어와 시청하는 거 같아요 ). 
최지현님 채널 덕에 더이상 고가의 광고비 마케팅비를 떠안고 과장광고에 속아 화장품을 쓰지 않는 1인이 되어 진심 기뻐요, 그리고 덕분에 ‘디오디너리’라는 제품도 알게 됐구요! 선물 이벤트에도 꼭 참여해서 받고 싶습니다. 현재 안그래도 너무 사용해보고 싶었던 참인데, 최지현님 픽의 디오디너리 조합 화장품세트 증정 이벤트라뇨… 꼭 참여하고 꼭 저도 써보고 후기를 남겨보고 싶네요 이미 이 브랜드와 지현님의 팬이 된 제게 그 기회를 주시길  간절히 기도해봅니다. 감사합니다!
p.s. 화장품 성분따지기를 처음 시작하게 된 계기는 ‘나없이 화장품 사러가지 마라’ 폴라의 책이었어요. 그런데 번역가가 최지현 연구원님이셨더라고요!(깜짝 놀라고 반갑고 그랬네요️) 그 이후 계속 까다롭게 고르고 싶었지만 전문가가 아니라 너무 어렵고, 폴라스초이스는 고가라 거의 포기했었어요. 그런데 이렇게 지현님 만나고 디오디너리를 알게돼 합리적 가격에 고기능성 화장품 쓰는게 가능하게 돼 눈물나게 감사해요! 계속 활동 잘 해주세요  응원합니다!",3.0,11개월 전(수정됨)
196,userrd5vx4iu8y,광고 받으신거 축하드립니다~~~ ㅎㅎㅎ 항상 잘보고 있어요 감사합니당!,0.0,11개월 전
197,userru5tr1in7j,"헐 진짜  쌤이랑 너무 잘 맞는 광고네요! 저도 쌤 영상들 보고 디오디너리 알게 됐거든요 유튜브에서 디오디너리가 추구하는 방향성과 올바르게 사용하는 방법, 장단점 등을 가장 정확히 이해하고 있는 유튜버는 사실 지현샘이라 해도 과언이 아니라는 걸 구독자들은 다들 알고 있죠 안그래도 요즘 미백 때문에 고민이 많아서 나이아신아마이드 제품을 써보려 했는데 워낙 브랜드가 많다보니 고민이 됐는데 이 기회에 저도 선생님 일주일 루틴처럼 써보면서 제 첫 나이아신아마이드 앰플을 사용해보고 싶네요! 근데 사실 이벤트 당첨이 안 돼도 구매할 거긴 합니다ㅎ 워낙 가성비 좋은데다 선생님의 추천 목록에 자주 등장하는 브랜드이니 이미 신뢰 만땅이거든요 마지막으로 첫 광고 너무 축하드려요 앞으로도 유튜브 더 잘 됐으면 좋겠네요ㅠㅜ",17.0,11개월 전
198,userpr4rj6cz6r,"모공각화증이 있어서 아하 바디로션을 꾸준히 써 주고 있었는데 이제 로션제품으로는 만족이 안되더라구요 ! 그래서 아하 스킨으로 된 제품을 찾고 있었는데 선생님 영상을 보다가 디오디너리에 아하 에센스가 있다는 걸 처음 알게 되었습니다 !
사러 가려 했는데 영상 끝부분에 구독자 이벤트를 발견하고 댓글을 써보네요 ㅎㅎ 나이아신아마이드는 지금 사용중인데 다리에 여드름 자국이 많아서 다리에 바르고 있어요. 확실히 사용하기 전보다 훨씬 흔적이 연해졌어요!!! 굳이 얼굴에만 바를 필요 없다는 거 알려드리고 싶구요 꾸준히 사용하고 있는데 당첨되면 너무 행복할 것 같아요ㅎㅎ 섞어 바르는 팁도 감사합니다 ^^",1.0,11개월 전
199,jieunpark4617,나이아신아마이드 밤에 쓰고 있는데 아침에 광나서 좋아요 ㅎㅎ 피지 조절에 좋음!!!,0.0,11개월 전
200,chaehaxx,30중반의 여성인데요 수부지 민감성피부예요  디오디너리는 사용해본적은 없는데 기능성을 사용하고는 싶은데 트러블 걱정 때문에 접해보지를 못했어요~ 사용해보고 싶어요~!,1.0,11개월 전
201,meby8923,안녕하세요. 오래전부터 구독하며 신뢰하고 있습니다. 기초가 똑하고 떨어졌는데 어떤 제품들로 써볼지 매우 고민중이던 참이예요. 그냥 마구잡이 브랜드 구매를 피하고 싶어서요. 추천해주신 제품들은 개인 피부 상태에따라 믹싱이 가능하다고 하니 꼭 사용해보고 싶습니다. 제 피부가 변화가 많아서요. 이벤트 좋은 소식 있었으면 합니다. 감사합니다.,1.0,11개월 전
202,userji1hr5kg1g,축하 드려요 지금 디오디너리 나이아신아마이드 사용중이에요 다쓰고 또사야겠어요,1.0,11개월 전
