,youtube_id,comment,like_num,comment_date
0,userwi8zm1rr2z,"언니도 어퓨를 알아보셨군요ㅠㅠ!!! 진짜 어퓨 나만 알기 아까운 갓성비.. 마침 올영세일이라 바로 줍줍하고왔어여
뒤집어질때 진정 효과 한번 경험하면 딴거 못써여.. 진짜 어퓨마데카 마이페이보릿...️",56.0,1년 전
1,usergr1rb9fh4g,"회사원님 항상 재밌게 보고있어요!
파이팅 ",1.0,1년 전
2,userch1tv1yt4l,아니 이집 장사 잘하네.. 멍한 표정으로 보다가 할인보고 마음 흔들림......,143.0,1년 전
3,Joghurt24,"어퓨 색조 이쁘고 가성비 좋아서 선물도 많이 주고 줄곧 잘 샀는데, 이렇게 스킨라인 까지 나왔군요....한옥호텔이 있는 줄 몰랐어요..은근 힐링될듯 ~ ",4.0,1년 전
4,hailieahn,경원재 앰배서더네요! 외국에서 귀한 분들 오셨을 때나 어르신들 모시고 투숙할 때 실패없는 곳...이라고만 생각했는데 그냥...그냥 좋은 곳 같아요,20.0,1년 전
5,762,"한옥호텔에 편백나무탕+사우나+안마의자라뇨..
옵션 지리네요",37.0,1년 전
6,userng2lf5ml2s,대학생때 피부 개좋은 룸메언니가 마데카소사이드 크림이 인생템라 그랬었는뎈ㅋㅋ 한 4년쯤 전에 마데카소사이드 저 시리즈 되게 핫했던것같은데ㅋㅋㅋ,32.0,1년 전
7,il6190,어퓨... 처음 나와서 은색깔 껍질(?) 다 묻고 난리나고 사자마자 마스킹테이프 감아서 쓰던게 얻그제같은데 튜브바뀌고 대용량 나오더니 종류도 많아지고.. 아주 좋네요...,3.0,1년 전
8,baby10105,경원재와 많이 비슷하다 생각했는데 경원재네요ㅋ 저희 남편이 이 호텔 오픈멤버였고 연애하고 결혼 후까지 일했던 곳이라 저 또한 정이 많이 든 호텔이에요 로열 스위트는 사우나까지 더해져 더 좋네요 가족들과 가기에 더할나위 없이 좋고 돈이 아깝지 않은 호텔이에요 편백 나무 욕조는 아이들이 놀기도 너무 좋아요어퓨 마데카소사이드2X  올영은 매진이네요 효과가 너무 궁금해서 어퓨스마트스토어 구매하러갑니다,2.0,1년 전(수정됨)
9,useruu6il9di4l,진짜 가격이 사기다…. 안살수가없어…,10.0,1년 전
10,usergx2ei9vf1b,저는 여드름때문에 마데카소사이드 앰플 사서 벌써 2통 비웠는데 효과가 있나...? 싶다가도 쓴 후부터 크게 여드름 신경써본 적이 없어서 진짜 괜찮다 싶었어요,4.0,1년 전
11,usernz1ri9cn6y,헐 여기 센트럴파크 산책갔을때 가끔 봒는데 호텔이었군욬ㅋㅋㅋㅋㅋㅋㅋㅋㅋ 카페인줄 알았어욬ㅋㅋㅋㅋ,23.0,1년 전
12,userce5sh2dl3x,"아니 오늘 센팤다녀왔는데, 이렇게 회사원a에서 또 볼 줄이야 ㅋㅋㅋㅋㅋㅋ",8.0,1년 전
13,ithing,"와 어퓨 저거 크림 초창기에 겁나싼데 여드름 다 들어가서 잘썼었는데.. 매장 없어지고 그대로 사라진줄 알았..️ 살아있었군아... 댑악

악... 크림이랑 앰플 품절이네요",2.0,1년 전(수정됨)
14,userio6eg4qo6x,저도 어퓨 마데카소사이드 크림 쓰고 있어서 보자마자 반가워서 바로 들어왔어요 송도 경원재 옆 할리스커피뷰도 진짜 좋쥬!! 나도 경원재에서 묵어보고 싶다ㅠㅠ,1.0,1년 전
15,ninon4865,궁 신채경ㅋㅋㅋㅋㅋ 진짜 오랜만ㅋㅋㅋㅋ 어퓨 기초 장인인데 2x라니 기대해봅니다,7.0,1년 전(수정됨)
16,insoppyday5654,드레스 너무 이뻐요ㅠㅠ,0.0,1년 전
17,userhi4bf2zq1z,우와~한옥호텔 사우나 어퓨~언니 이거 무슨 할링여행코스인디요!! 오늘 영상에서 나온거 다 해보고 싶어요~ 우선 바로 가능한 어퓨부터 도오전!!,4.0,1년 전
18,juyeonpark7383,어퓨 저 크림 진짜 좋져 목에도 바르고 팔에도 바르고 다 발라여 안끈적거리고 순해서 진짜 좋음,1.0,1년 전
19,taengwei6905,"마데카소사이드 크림 대용량 사서 몸에도 바르세요.. 특히 스타킹 각질에 걸려서 아따거 하시는 분들, 하루 종일 촠촠하고 편안한 종아리를 경험하실겝니다,,",1.0,1년 전
20,yenny,"언니 헐리웃 스타들이 하는 피부관리 기기가 하이드라페이셜? 한국 들어왔다는데 리뷰 좀 해주세요 ㅠ!!
가격대가 좀 있어서 효과 좋은지 궁금해요",0.0,11개월 전
21,seyoungv,"어퓨 마데카소사이드 크림이랑 앰플쓰고 여드름 민감성 피부 광명 찾았습니다... 사용한지 1년넘었어요ㅠ
크림2x랑 시카겔이랑 둘이 같이쓰는데 시카겔 살짝 건조하다 싶으면 크림2x 위에 발라줍니다! 수부지한테도 딱인거같아요..
트러블도 안나고 순해서 너무 좋아요.. 어퓨 마데카소사이드 이벤트 많이 오래해주세요ㅠㅠ",1.0,1년 전
22,moungmi,어퓨 좋아용☆♡☆♡ 컨텐츠 늘 감사드리구 푹쉬셧기를 바라며..,4.0,1년 전
23,userny6ye5ue9h,진짜 계량한복 입고 가고싶다ㅠ,1.0,1년 전
24,mymelody0118,"언니 철릭 원피스 정보 좀 알 수 있을까용???ㅎㅎㅎㅎㅎ
그리고 어퓨 정말 오랜만에 들어 보는 것 같아요ㅎㅎㅎㅎㅎㅎㅎ
학생 때 저렴해서 정말 많이 가서 샀었거든요ㅎㅎㅎㅎㅎㅎㅎㅎ",1.0,1년 전(수정됨)
25,userqw4gt4wd8q,"아니 어제 자기전에 베르사이유 시리즈랑 핀란드 이탈리아 사우나 보고 잤는데 이거시 똭!
요즘 토지 읽고 있는데 최참판댁 서희이~? 
로션 크림 떨어져서 올영 세일까지 버텼는데 어퓨우~?
뭐영뭐영 뇌트워크영? 싱기방기하다",9.0,1년 전
26,usernu3sd7lf5x,근데 어퓨마데카는 걍 ㅇㅈ임..,7.0,1년 전
27,usergz6xg2md2r,"회사원님 진짜 살 많이 빠지셨네요오
음메 부러운거어어어",0.0,1년 전
28,userom9rf8li7r,언니 눈을 왜 그렇게 떠..?,0.0,9개월 전
29,chooni,"의상이랑 장소 너무 잘 어울려요 귀여워
의상 어디제품인지 알고싶어요!",2.0,1년 전
30,dandelionlily,진짜 내 집이면 좋겠다,3.0,1년 전
31,ddobbipark,로얄 스위트룸이네요ㅎㅎ  좋긴 좋네요 ㅎㅎ,1.0,1년 전
32,maranatha65,어퓨 구매했습니다^^,3.0,1년 전
33,cherry4551,이거 엄청 잘 썻엇는데... 품절 풀어줘요ㅠㅠ,1.0,1년 전
34,userjh9gi7rj5z,근데지금구매하려들어갔는데 올리브영에 품절떠있네요.... 담당자님 수량좀올려주셔용,1.0,1년 전
35,userjh9gi7rj5z,이양반땜에 자꾸영업되서 자꾸사게되는데 사는것마다 자꾸좋아서 또 자꾸사게되는...어쩌구저쩌구....,1.0,1년 전
36,conan1780,한복정보 알려주세요!!,3.0,1년 전
37,sophiejung,우아아앙 언니 보고싶었엉,2.0,1년 전
38,costarica144,않이; 올영은 벌써 품절됐네ㅠㅠ,0.0,1년 전
39,userxl7wl6no5j,아니야 저거 안좋아 좁쌀 여드름이 얼굴을 뒤집어서 ㅠㅠㅠㅠ 개고생했어요,2.0,1년 전
40,jjkim4555,다 품절이네요 한발 늦었다… 또 나만 몰랐네,1.0,1년 전
41,Nariel111,경원재인가봐요 ㅎㅎ 가 보고 싶다.,7.0,1년 전
42,JungHam,한복 하플리 오얏꽃원피스입니다!!,2.0,1년 전
43,orangeblue7169,궁 신채경ㅋㅋㅋㅋㅋ,2.0,1년 전
44,uservx7ml2pt4f,ㅋㅋ옼 원피스도 예쁘그만요,2.0,1년 전
45,dundun4283,원피스... 어디꺼죠.... 아시는분 제발 알려주셈....,3.0,1년 전
46,useroy6zs5lp7z,언닝.. 꽃게요리 저기 어디인가용..,0.0,1년 전
47,userkz9yn3un1m,여기 티비 프로그램 에서 본적있는데,0.0,11개월 전
48,cheram2,언니 옷 어디꺼예요...ㅠㅠ,0.0,1년 전
49,useruw5ge2qt1v,원피스 어디꺼여 ㅠㅠ 알려주고가세요,0.0,1년 전
50,cocococcococo,우와아아앙ㅇ 3!!,2.0,1년 전
51,userbp6hf5jb6d,숙소에서 엄청 카메라 의식하는 눈치라 숙소 광고인줄 알고봤어요ㅋㅋㅋㅋ근데 갑자기 어퓨 나와서 아차 했네요,0.0,1년 전
