,youtube_id,comment,like_num,comment_date
0,userkc9ir5dr1m,"비타민C 세럼 관심 있었는데 오늘 영상보고 
옅은 기미나 기미를 예방하고 피부진정과 미백에
도움이 되는 퍼스트C 세럼 정보 감사합니다",0.0,9개월 전(수정됨)
1,janelee9911,안그래도 기미때문에 요즘 신경쓰였는데 저도 효과 있었으면 좋겠어요 ,0.0,9개월 전
2,usertc5dr6xn3d,"요즘 기미 잡티 너무 관심 많은데 요거 한번 구매해서 사용해봐야겠어용! 
지금은 그냥 비타민세럼 사용하는데, 주로 아무아갈바닉 디바이스랑 같이 관리중이에용!
디바이스가 세럼 흡수가 좋아서 그런지 안색이 맑아진것같은데! 최근에 다 사용해서 다른제품도 구매하고싶어서 요거 구매해봐야겠어용ㅎㅎ",0.0,1개월 전
3,userxq1lf1sn5z,피부 깔끔하셔요 ㅎㅎ,0.0,9개월 전
4,lovelala11,담쓰님 이 영상에서 착용하신 렌즈뭔가요?? 너무 초롱초롱하고 이뻐요!!!!!,0.0,9개월 전
5,userou9cf8nd3c,실내마스크 벗는다던데 ㅠㅠ 저도 도전해봅니다,1.0,9개월 전
6,userwv3qv9yt4p,헉... 이게 기미였군요......,2.0,9개월 전
7,JHJkh4mg,찐 눈동자색이 너무이쁘세요...영롱하다,0.0,8개월 전
8,userpg4ht8iy3i,"코가유난히흔들리는
코밑과 입움직임이어색. 
유연함이없어보이는 코밑과 인중바닥움직임이",1.0,9개월 전(수정됨)
